2021202019200,Marché,Travaux,Travaux de construction de maisons,13/01/2021,150885.0,Révisable,TROYES AUBE HABITAT,48.2968506353,4.07801333034,PME,0.0,48.2968506353,4.07801333034,012021
201923802,Marché,Travaux,Travaux de menuiserie,08/01/2021,150952.02,Ferme et actualisable,BUDGET PRINCIPAL,48.7640654352,5.16324051275,PME,97.20608148310264,48.9882966238,6.01306642075,012021
202120S0212L0600,Marché,Fournitures,Compresseurs d'air,29/01/2021,151000.0,Ferme,Conseil Départemental AM - BP,43.7123384529,7.23750191149,PME,0.0,43.7123384529,7.23750191149,012021
20212020T2190500,Marché,Travaux,Travaux de construction de bâtiments,04/01/2021,151018.09,Révisable,Ministère des armées - Service hydrographique et océanographique de la Marine,48.3999000994,-4.5027702561,PME,0.0,48.3999000994,-4.5027702561,012021
20212020F2264900,Marché,Fournitures,"Livres, brochures et dépliants imprimés",21/01/2021,151120.0,Ferme,Ministère de la Culture - Bibliothèque publique d'information,48.8542874923,2.35759608215,PME,2.5539120467367673,48.8591103086,2.38017728226,012021
202108600,Marché,Fournitures,Livres imprimés,15/01/2021,15120.0,Révisable,Mairie de Perpignan,42.6966171788,2.89890986886,PME,0.0,42.6966171788,2.89890986886,012021
20180148b6700100,Marché,Services,Services de conseil en matériel informatique,26/01/2021,151200.0,Ferme,Groupe CDC Habitat  GIE SYSTEMES D'INFORMATION ET NUMERIQUE,43.6131750772,3.86941278925,NC,9.308280602027775,43.650557395,3.79407409109,012021
201911402,Marché,Travaux,Travaux de construction,27/01/2021,151385.07,Révisable,BUDGET PRINCIPAL,43.3201640732,-0.3496692279,NC,6.9112354560172795,43.3798878648,-0.366745709313,012021
20212021T0496200,Marché,Travaux,Travaux de restructuration,08/01/2021,151500.0,Ferme,CHU ANGERS,47.4766284713,-0.556089456786,NC,0.0,47.4766284713,-0.556089456786,012021
2021202012000,Marché,Services,Réalisation et entretien d'espaces verts,15/01/2021,151503.12,Révisable,OPH Var Habitat,43.1502669043,5.99218742111,PME,50.02103939670021,43.2936269646,5.56325220466,012021
2020CAA00100,Marché,Services,Services d'exploitation d'aéroport,07/01/2021,151666.67,Ferme et actualisable,REGIE.AUTO.FINAN.AERODROME,45.6681611919,6.40403320604,PME,135.09421523085894,46.2145292033,5.31178343312,012021
20212020T0011200,Marché,Travaux,Travaux de cloisonnement,11/01/2021,151774.82,Révisable,CC LAMBALLE TERRE ET MER,48.4686646437,-2.49512909288,NC,,,,012021
202010401,Marché,Travaux,Travaux de plâtrerie,12/01/2021,151787.46,Révisable,BUDGET PRINCIPAL,43.3201640732,-0.3496692279,NC,84.24734148496151,43.7981497271,-0.940408317328,012021
2020xCRcsj23M700,Marché,Travaux,Travaux de réfection,18/01/2021,15184.0,Ferme et actualisable,CAF DES PYRENEES-ATLANTIQUES,43.4922603626,-1.46624377766,PME,18.70058437465901,43.3979989186,-1.3262363752,012021
2021MUL202017600,Marché,Services,Réalisation et entretien d'espaces verts,21/01/2021,151860.0,Révisable,THONON AGGLOMERATION,46.3713202371,6.48296533168,PME,4.626554445884198,46.3334519465,6.46520146477,012021
20212020190100,Marché,Services,Services d'entretien de parcs,08/01/2021,151902.18,Révisable,VILLE DE CHATEAUBRIANT,47.7220962122,-1.38697766124,NC,0.0,47.7220962122,-1.38697766124,012021
2020Niybcfx13f00,Marché,Services,Services de nettoyage,22/01/2021,1519290.0,Révisable,Société Immobilière de la Réunion-SIDR,-20.9331856391,55.4471055195,PME,0.0,-20.9331856391,55.4471055195,012021
2021130016091500,Marché,Fournitures,Pièces détachées et accessoires pour véhicules et moteurs de véhicules,06/01/2021,15200.0,Révisable,Ministère de l'Intérieur - SGAMI EST - Metz - DAGF- Marchés Publics,48.8348302792,2.42102904428,ETI,408.1568531139007,48.9313590331,6.11078539713,012021
2020BeQQajjJ5400,Marché,Travaux,Travaux de construction,14/01/2021,152000.0,Révisable,Territoire30,43.8445331544,4.34760475323,PME,175.20094067982345,44.9384420942,3.20617651618,012021
202030030201,Marché,Services,Services de contrôle et d'essais techniques,20/01/2021,152000.0,Révisable,Département du Doubs,47.2551269927,6.0192810348,PME,113.4067651506429,47.3391772539,4.99722409136,012021
2021202001800100,Marché,Fournitures,Fournitures jetables pour restauration,12/01/2021,152000.0,Révisable,Ville de Caluire et Cuire,45.7972241073,4.85165588558,ETI,79.77566494272214,45.3942743477,5.44932710872,012021
20212020_21_800,Marché,Fournitures,"Fruits, légumes et produits connexes",18/01/2021,152000.0,Révisable,Ville de Saint-Leu,-21.1659546177,55.333466602,PME,35.46863393667579,-21.3061462696,55.6419447038,012021
20212020S2293000,Marché,Services,Services de comptabilité et d'audit,20/01/2021,152000.0,Révisable,Ministères sociaux,45.7533230296,4.86924368009,PME,7.406997674798162,45.782504698,4.8089966572,012021
202130242600,Marché,Services,Services spécialisés de transport routier de passagers,11/01/2021,1520000.0,Révisable,BUDGET PRINCIPAL,-20.9331856391,55.4471055195,PME,15.591879774643358,-21.0446108504,55.3222448792,012021
2020GAAp-WLMZN00,Marché,Services,Services de préparation de repas,25/01/2021,1520000.0,Révisable,Commune de Soisy Sur Seine,48.6604271635,2.4630736007,GE,31.591545063343307,48.8365394869,2.2389245247,012021
2020o-aN6Zhafe00,Marché,Services,Services liés aux déchets et aux ordures,20/01/2021,152017.0,Révisable,Communauté de Communes Rives de Moselle,49.2081956345,6.15700583856,NC,353.8395337006918,50.1423626986,3.09754530183,012021
2021100015074300,Marché,Travaux,Travaux de terrassement,26/01/2021,1520568.4,Révisable,Ministère des armées - Etablissement du service d'infrastructure de la défense de Lyon - ESID Lyon,,,GE,,44.580393647,6.06471167343,012021
2021100015077500,Marché,Fournitures,Bâtiments modulaires préfabriqués,15/01/2021,152148.0,Ferme et actualisable,Ministère des armées - Etablissement du service d'infrastructure de la défense de BREST - ESID Brest,,,PME,,45.8448431471,4.9408752362,012021
2020w4XnpD1BIY00,Marché,Travaux,Travaux de maçonnerie,07/01/2021,15224.66,Ferme,VIALIS SAEM,48.1100979739,7.3849252282,PME,0.0,48.1100979739,7.3849252282,012021
2021004100,Marché,Fournitures,Pièces détachées diverses,22/01/2021,15234.0,Révisable,DEPARTEMENT DE LA HAUTE-SAVOIE,45.8900209706,6.12570413482,PME,565.4877129460792,47.6267715984,1.31849348356,012021
20212020T0010500,Marché,Travaux,"Travaux de construction de bâtiments destinés aux loisirs, aux sports, à la culture, à l'hébergement et de restaurants",13/01/2021,15241.0,Révisable,CC LAMBALLE TERRE ET MER,48.4686646437,-2.49512909288,NC,,,,012021
20211913600,Marché,Travaux,Travaux de construction de gymnases,27/01/2021,152583.5,Révisable,Communauté d'Agglomération Roissy Pays de France,49.0063195602,2.51384011982,NC,18.992466685435453,49.0605021101,2.35095635227,012021
20212021S0171000,Marché,Services,Services de courrier,27/01/2021,1526988.0,Révisable,CHU NANTES,47.2321613301,-1.54797539458,PME,9.554093038775335,47.2744152089,-1.62319145717,012021
202120FC0100100,Marché,Services,Services d'assurance,27/01/2021,15270.96,Révisable,CCAS ANTIBES,43.587619807,7.10541287744,PME,940.1237861956236,50.64429422,2.39513141872,012021
2021100015090000,Marché,Services,Services d'ingénierie,04/01/2021,152715.0,Révisable,Ministère des armées - Etablissement du service d'infrastructure de la défense de Toulon - ESID Toulon,,,PME,,47.3999451713,-0.483996437211,012021
2021130016209900,Marché,Fournitures,Appareils d'endoscopie et d'endochirurgie,29/01/2021,15280.0,Révisable,Ministère des armées - Direction des Approvisionnements en produits de santé des armées,,,PME,,48.8873739998,2.30681348993,012021
2020IQKIaO1M5H00,Marché,Services,Services de gestion de blanchisserie,04/01/2021,152951.0,Ferme,Siège,48.8282706469,2.362358986,ETI,522.5536918615763,45.8837868159,6.04943659322,012021
2020PNKDAhZXd-00,Marché,Travaux,Travaux de plâtrerie,08/01/2021,152980.16,Révisable,Ardèche Habitat,45.2462974654,4.65115146795,PME,0.0,45.2462974654,4.65115146795,012021
202120M2800,Marché,Services,Services de crèches et garderies d'enfants,28/01/2021,153124.86,Révisable,Ville de Cesson-Sévigné,48.1205469701,-1.59697171557,NC,9.420378248712924,48.111571436,-1.68168588816,012021
2020Gfxl6sEA6Q00,Marché,Travaux,Travaux de terrassement,06/01/2021,1531465.97,Révisable,ETABLISSEMENT PUBLIC D'AMENAGEMENT DE BORDEAUX - EURATLANTIQUE,44.8578964782,-0.57357535767,NC,28.48805771979699,44.8238197617,-0.318232369819,012021
2021100014991500,Marché,Services,Services de conseil en matière de santé et de sécurité,14/01/2021,1532.5,Révisable,Ministère des armées - Etablissement du service d'infrastructure de la défense de Metz - ESID Metz,,,NC,,45.8900209706,6.12570413482,012021
2020U39KvXj45Z00,Marché,Services,Réalisation et entretien d'espaces verts,06/01/2021,153261.8,Ferme,OPHEOR,46.0450564645,4.08007309055,NC,5.025134234296378,46.0434285551,4.03465900698,012021
202030159000,Marché,Fournitures,Modules solaires photovoltaïques,28/01/2021,153316.14,Révisable,BUDGET PRINCIPAL,-20.9331856391,55.4471055195,PME,9.348796893665254,-20.946812748,55.5307201448,012021
2021M2022600,Marché,Travaux,Travaux de construction d'immeubles collectifs et de maisons individuelles,06/01/2021,153499.0,Révisable,ACM HABITAT - OPH Montpellier Méditerranée Métropole,43.6131750772,3.86941278925,NC,8.185101792815896,43.6244752697,3.7962679963,012021
20208EqcPNq0zz00,Marché,Services,Services liés aux déchets et aux ordures,21/01/2021,153504.0,Révisable,Communauté de Communes Rives de Moselle,49.2081956345,6.15700583856,NC,11.885877400584107,49.1081027833,6.19595351042,012021
202140600,Marché,Travaux,Travaux de transformation de bâtiments,12/01/2021,15358.0,Révisable,Mairie de Perpignan,42.6966171788,2.89890986886,PME,29.530175633967357,42.4746052174,2.75232984649,012021
20212020528500,Marché,Services,Services de formation du personnel,05/01/2021,153600.0,Révisable,Caisse des dépôts et consignations,48.8562037309,2.3121193117,PME,1.8448613856586162,48.8727847696,2.31253091684,012021
20212021S0111400,Marché,Services,Services d'assurance,20/01/2021,153640.6,Révisable,CH VALENCIENNES,50.3591232468,3.51599087764,PME,16.96167083585227,50.2507083459,3.62398443538,012021
2020sEMbqcuwaN00,Marché,Services,Services horticoles,13/01/2021,153678.2,Révisable,Brest Métropole Habitat,48.3999000994,-4.5027702561,PME,13.711942142146649,48.4258947716,-4.62399409096,012021
2021151044269300,Marché,Travaux,Travaux de plomberie,08/01/2021,153814.89,Révisable,Ministère de l'Intérieur - SGAMI ILE DE FRANCE - Préfecture de Police Paris,48.8542874923,2.35759608215,PME,16.339045694992155,48.7987986059,2.49441281984,012021
20212021T0296300,Marché,Travaux,Travaux de pose de revêtement de sols et de murs et pose de papiers peints,04/01/2021,153895.0,Révisable,Mairie de Suresnes,48.8699520558,2.21968010802,NC,,,,012021
20212020F2033300,Marché,Fournitures,Produits pharmaceutiques,26/01/2021,153900.0,Révisable,CENTRE HOSPITALIER BRETAGNE ATLANTIQUE,47.6599029362,-2.75681901002,ETI,570.8010610985144,48.8604673342,2.26190318372,012021
20212021F0164000,Marché,Fournitures,Immunosuppresseurs,21/01/2021,1539000.0,Révisable,CHU NICE,43.7123384529,7.23750191149,ETI,792.91772669681,48.8604673342,2.26190318372,012021
2020fAwU7630uK00,Marché,Fournitures,"Produits alimentaires, boissons, tabac et produits connexes",07/01/2021,15391.0,Révisable,Commune de Briançon,44.8996168364,6.64897322193,NC,60.16287028414562,44.6475955183,6.16689026141,012021
2020HcYaD1x-MO00,Marché,Services,Services d'assurance,20/01/2021,153980.0,Révisable,Commune de Soisy Sur Seine,48.6604271635,2.4630736007,ETI,414.93163711386495,46.3286026496,-0.464927924553,012021
2020MSPLOT500,Marché,Travaux,,27/01/2021,154000.0,Révisable,CCVO GESTION GENERALE,49.7916619324,3.38827759913,PME,13.678395765573462,49.8472686643,3.27792244404,012021
20212020_21_900,Marché,Fournitures,"Fruits, légumes et produits connexes",18/01/2021,154000.0,Révisable,Ville de Saint-Leu,-21.1659546177,55.333466602,PME,35.46863393667579,-21.3061462696,55.6419447038,012021
20212021T0343700,Marché,Fournitures,Menuiserie pour la construction,12/01/2021,15424.09,Révisable,Ministère des armées - Accord-Cadre Mandat de Maîtrise d'Ouvrage au profit du SID,48.8282706469,2.362358986,NC,251.3118734712702,49.5135576191,0.196757656264,012021
20201202081800,Marché,Services,"Services d'architecture, services de construction, services d'ingénierie et services d'inspection",21/01/2021,154260.0,Révisable,BUDGET PRINCIPAL,47.2801589313,-2.25106183059,PME,538.8724008830912,48.8542874923,2.35759608215,012021
20201451700,Marché,Travaux,Travaux de remise à neuf de conduites d'eau,12/01/2021,154294.0,Ferme et actualisable,EAU POTABLE REGIE,46.1631302569,1.87113488144,PME,44.47097792956141,46.236865249,1.47586036492,012021
20212020F1817500,Marché,Fournitures,Consommables médicaux autres que chimiques à usage unique et consommables hématologiques,01/01/2021,154320.0,Ferme,CHU RENNES,48.111571436,-1.68168588816,PME,616.8371428580958,43.5439301138,1.47732357418,012021
2020BAT20181700,Marché,Travaux,Travaux de terrassement,14/01/2021,154350.0,Révisable,COMMUNE DE LE PONT DE CLAIX,45.1256913332,5.70166045833,PME,46.68075303980217,45.1401024338,5.27977988349,012021
2020KrEv2zbyDY00,Marché,Fournitures,Kits de diagnostic,28/01/2021,154368.0,Révisable,GIP LABÉO,49.2152313192,-0.40138132268,PME,306.93058705309966,48.9296428406,2.35946866986,012021
2020VEoUs7lBDn00,Marché,Fournitures,Consommables dentaires,15/01/2021,1543980.7,Révisable,CPAM du Bas Rhin,48.5716343863,7.76783353204,PME,288.82345239581196,48.7640654352,5.16324051275,012021
20210015100,Marché,Services,Services de réparation et d'entretien d'installations de bâtiments,18/01/2021,154450.0,Révisable,GH Portes de Provence,44.5538701101,4.74888787641,PME,44.723542343089456,44.9223144503,4.91311704006,012021
20212020M10200,Marché,Services,Services d'action sociale et services connexes,28/01/2021,154500.0,Ferme,LAVAL AGGLOMERATION,48.0610922073,-0.766055300559,ETI,0.0,48.0610922073,-0.766055300559,012021
202100050400,Marché,Travaux,Travaux de terrassement,08/01/2021,1545373.0,Révisable,Département de la Drôme,44.9223144503,4.91311704006,PME,13.259527238560231,44.9823817604,5.0167912864,012021
20209Nex0_6Eqj00,Marché,Services,Systèmes d'information et serveurs,14/01/2021,154560.0,Révisable,Société Immobilière de la Réunion-SIDR,-20.9331856391,55.4471055195,ETI,0.0,-20.9331856391,55.4471055195,012021
2020WGDbQPIOqY00,Marché,Services,Services informatiques,22/01/2021,1545930.0,Révisable,09,48.8869811827,2.38492060382,NC,6.9903902794619555,48.8282706469,2.362358986,012021
2021AO20059200,Marché,Services,Services de télécommunications,11/01/2021,15463.0,Révisable,Communauté de Communes du Golfe de Saint-Tropez,43.2467642876,6.52122069597,NC,128.24277611912422,43.3127155398,5.36343891881,012021
2021REHA01832000,Marché,Travaux,Travaux de construction complète ou partielle et travaux de génie civil,20/01/2021,15480.0,Ferme,SEMCODA,46.2047217001,5.24553216043,PME,61.50802519600124,45.6964259959,5.02272814847,012021
2021151045354600,Marché,Travaux,Travaux de plomberie,13/01/2021,15500.0,Ferme et actualisable,Ministère de l'Intérieur - SGAMI EST - Metz - DAGF- Marchés Publics,48.8348302792,2.42102904428,NC,589.3581521217967,48.6117085666,7.74585158102,012021
2021151044997100,Marché,Services,Services d'études,04/01/2021,155000.0,Ferme,"Ministère de l'Économie, des Finances et de la Relance - Direction Générale des Entreprises",48.8123578699,2.3878497256,PME,471.9442884262133,47.1765537278,-1.54989963253,012021
20212020T2270300,Marché,Travaux,Travaux d'installations électriques,25/01/2021,155000.0,Révisable,"Etablissements et organismes de l'enseignement supérieur, de la recherche et de l'innovation - UNIVERSITE DE POITIERS",46.5834165499,0.359436087058,PME,119.97584490520678,45.5501492957,0.0508668276839,012021
2020fyNk2d13JJ00,Marché,Services,Services de télécommunications,20/01/2021,155000.0,Ferme et actualisable,COMMUNE D'USSEL,45.5501002764,2.30483831309,PME,233.13653724564588,45.6638862561,0.199547474269,012021
20212021S0159200,Marché,Services,Services d'assistance technique informatique,28/01/2021,1550000.0,Révisable,CHU NANTES,47.2321613301,-1.54797539458,GE,0.0,47.2321613301,-1.54797539458,012021
2021-0010402,Marché,Travaux,Travaux de gros œuvre,20/01/2021,155046.15,Ferme et actualisable,VILLE DE NOEUX LES MINES,50.4751350834,2.66246093706,NC,18.0617606357945,50.4372553549,2.82129881832,012021
2021100015065100,Marché,Services,Services de conseil en matière de santé et de sécurité,15/01/2021,1551.0,Ferme,Ministère des armées - Etablissement du service d'infrastructure de la défense de BREST - ESID Brest,,,NC,,48.4462931537,-4.46262342285,012021
202020WG1880100,Marché,Services,Exploitation de l'alimentation en eau,19/01/2021,155125.65,Ferme,CA VICHY COMMUNAUTE,46.1299186639,3.42407178016,NC,105.61862611618471,45.6361810993,4.24036866467,012021
20212020S0001000,Marché,Services,Services de gestion d'installations,19/01/2021,155160.0,Révisable,CC Bresse Louhannaise Intercom',46.6354116737,5.23759807152,PME,63.491262142712905,46.2835486718,5.690711839,012021
20209Kv-yoQGYt00,Marché,Fournitures,"Équipement de commande et de contrôle, de sécurité ou de signalisation d'installations portuaires",13/01/2021,155187.0,Ferme et actualisable,Ports de Normandie,49.2152313192,-0.40138132268,GE,306.93058705309966,48.9296428406,2.35946866986,012021
20212021S0268100,Marché,Services,Services de réparation et d'entretien de chauffage central,21/01/2021,155192.17,Révisable,"Etablissements et organismes de l'enseignement supérieur, de la recherche et de l'innovation - UNIVERSITE LYON 3 JEAN MOULIN",45.7333494426,4.83733100241,PME,112.60763857545335,45.2198746489,5.71597377571,012021
2019Iea9TtKJ9n00,Marché,Travaux,Travaux de construction,22/01/2021,155299.67,Révisable,Société Immobilière de la Réunion-SIDR,-20.9331856391,55.4471055195,PME,0.0,-20.9331856391,55.4471055195,012021
2021VILMI20S0100,Marché,Services,Services de conseil en ingénierie de la construction,15/01/2021,15533.0,Ferme et actualisable,Ville de Manosque,43.8351382402,5.79123589103,ETI,54.63817550996224,43.5360639608,5.39837823449,012021
2020A12201,Marché,Services,Services d'assurance de véhicules à moteur,08/01/2021,155372.49,Ferme,VILLE DE DUNKERQUE - PRINCIPAL,51.030563712,2.33703738753,NC,90.16339288363902,50.6317671102,3.04699299406,012021
2021M20076M00,Marché,Services,Services d'architecte pour les bâtiments,15/01/2021,155376.0,Révisable,LOGELIA CHARENTE,45.6475513407,0.144999112457,PME,105.80905458686297,46.5859101335,0.297494406027,012021
2021200000000800,Marché,Fournitures,Pièces détachées et accessoires pour véhicules et moteurs de véhicules,21/01/2021,1554.32,Révisable,Communauté d'agglomeration de Châlons en Champagne,48.9641633923,4.37882582203,PME,60.089708133799775,49.39999541,4.70129529432,012021
202120VTA70300,Marché,Travaux,Travaux de revêtement de routes,25/01/2021,15543.5,Ferme et actualisable,Mairie de Tarbes,43.2347953943,0.0657136709174,PME,85.8864739619788,43.4623303655,-0.676472641069,012021
20212020F2077500,Marché,Fournitures,Distributeurs automatiques,11/01/2021,1554560.0,Révisable,HOSPICES CIVILS DE LYON,45.7480493184,4.82567584415,PME,641.7904908653059,47.0082266104,-0.83830291087,012021
2020000002191600,Marché,Services,Logiciels utilitaires,07/01/2021,155483.38,Ferme,Collectivité Territoriale de Guyane,5.03107464278,-52.5193923736,PME,7330.508639066806,48.8682182328,2.34268958704,012021
202119S0116500,Marché,Travaux,Travaux de construction de bâtiments,07/01/2021,155601.27,Révisable,OPAC Saône & Loire,46.320613267,4.81834086547,PME,79.25332252984667,46.4424212226,4.11214515718,012021
20212021T0295600,Marché,Travaux,Travaux de câblage et d'installations électriques,04/01/2021,155658.44,Révisable,Mairie de Suresnes,48.8699520558,2.21968010802,PME,18.843401527037564,48.9128078947,2.38454842862,012021
202100050900,Marché,Travaux,Travaux de terrassement,08/01/2021,1558693.4,Révisable,Département de la Drôme,44.9223144503,4.91311704006,ETI,88.72899733947186,44.1289689475,4.81041508178,012021
202100461400,Marché,Travaux,Travaux d'isolation thermique,12/01/2021,155894.46,Ferme et actualisable,Société du Canal de Provence et d'Aménagement de la Région Provençale,,,PME,,43.6136444839,5.30691774205,012021
20212021S0069300,Marché,Services,Services de réparation et d'entretien de moteurs électriques,25/01/2021,155895.0,Révisable,Ministères sociaux,48.8123578699,2.3878497256,ETI,8.023636584074907,48.7495659946,2.35212808495,012021
2019lcRmq2v6gv00,Marché,Travaux,Travaux de fouille et de terrassement,25/01/2021,155948.0,Ferme et actualisable,SEMDAS,46.1619512738,-1.1749922971,ETI,270.2029511863933,45.8544262114,1.24894834225,012021
2019jBMkKuPE-s00,Marché,Services,Services de conseil en développement des entreprises,04/01/2021,15595.0,Ferme,Colombes Habitat Public,48.9228776124,2.24687029827,PME,455.65238582120605,45.7333494426,4.83733100241,012021
2020e93uGUL9Ch00,Marché,Travaux,Travaux de construction de bâtiments industriels,13/01/2021,155995.0,Révisable,Tours Métropole Val de Loire,47.3980773574,0.696151819266,PME,43.04407199673943,47.1231914473,0.422363617881,012021
2020s7bDqEiKBm00,Marché,Services,Services de gardiennage,15/01/2021,1560.0,Révisable,CARSAT NORD EST,48.6900671002,6.17594832427,GE,434.18023097953085,48.8983675206,2.25515424076,012021
2020Hqb1slzm0D00,Marché,Services,Services de gardiennage,15/01/2021,1560.0,Révisable,CARSAT NORD EST,48.6900671002,6.17594832427,GE,434.18023097953085,48.8983675206,2.25515424076,012021
20212021S0073600,Marché,Services,Services de réparation et d'entretien,18/01/2021,15600.0,Ferme et actualisable,CH DU MANS,47.9889433531,0.20002401353,PME,199.24117095129242,48.1205469701,-1.59697171557,012021
