2019150933568303,Marché,Services,Services de réparation et d'entretien de bateaux,18/03/2019,19469.0,Ferme,Ministère de la Transition écologique et solidaire - Ministère de la Cohésion des Territoires - D...,49.4965847516,0.140273146733,ETI,481.69111545359215,47.8961667158,-3.90749863443,032019
2019300313SI02,Marché,Fournitures,Fournitures informatiques,06/03/2019,195000.0,Révisable,BUDGET PRINCIPAL,43.9352959178,4.84131733764,ETI,618.9974725155832,48.9296428406,2.35946866986,032019
2019M19037R02,Marché,Services,Réalisation et entretien d'espaces verts,11/03/2019,195000.0,Révisable,ORLEANS METROPOLE,47.8824665066,1.91660961834,NC,7.377766882765813,47.9177164808,1.97312389077,032019
2018M16ctUSbdE00,Marché,Services,,02/03/2019,19520.0,Révisable,Mairie de Wittenheim,47.8107034161,7.31248086177,PME,34.01354296503234,48.1100979739,7.3849252282,032019
201962028600,Marché,Travaux,Ouvrages en bois,21/03/2019,195279.0,Ferme et actualisable,Ville de Malakoff,48.8164012464,2.29603611202,PME,83.53289829046358,49.0349493228,3.01878834957,032019
2018J129800,Marché,Travaux,Travaux de charpente et de couverture et travaux connexes,12/03/2019,195389.6,Révisable,Ville de Lyon,45.7700265344,4.82839245881,PME,107.43171721965338,45.391788332,3.93412320145,032019
2019150934796400,Marché,Travaux,Travaux de construction,27/03/2019,19545.0,Révisable,Ministère de la Justice  - Antenne régionale de l'équipement de Toulouse,43.5959710776,1.43229743595,PME,249.19557493099921,44.5293451476,3.48107867578,032019
2018DTASP0810000,Marché,Fournitures,Gaz industriels,27/03/2019,195568.0,Révisable,CIRAD,48.8604673342,2.26190318372,ETI,459.81905384324284,45.7016140067,4.94900275462,032019
20192019T0765800,Marché,Travaux,Installations électrotechniques,26/03/2019,196000.0,Ferme et actualisable,CHRU CAEN,49.1850685346,-0.370026383608,PME,119.4569097738499,49.0574199771,-1.44268684604,032019
2018_EejEGJlNh00,Marché,Travaux,Travaux de plomberie,02/03/2019,196011.3,Ferme et actualisable,OPH DE L'ANGOUMOIS,45.6475513407,0.144999112457,ETI,4.192491943913902,45.6792389437,0.165490996541,032019
20192019S0937900,Marché,Services,Services de nettoyage de bâtiments,08/03/2019,197233.0,Ferme,Chambres de Commerce et d'Industrie,47.2551269927,6.0192810348,ETI,311.35397230025166,49.2517771432,4.03968745396,032019
20192019T0768400,Marché,Travaux,Mise en place de plafonds suspendus,06/03/2019,197470.0,Révisable,CHU NIMES,43.8445331544,4.34760475323,PME,66.84058832065865,43.995554072,4.93274816859,032019
201962171500,Marché,Fournitures,Canalisations d'eau,26/03/2019,197716.0,Ferme et actualisable,Sisteron,44.2007645004,5.93069752054,PME,0.0,44.2007645004,5.93069752054,032019
2019130014249600,Marché,Fournitures,Glissières de sécurité,29/03/2019,197935.93,Révisable,Ministère de la Transition écologique et solidaire - Ministère de la Cohésion des Territoires - D...,49.4415068863,1.09373273216,GE,152.63437476712542,49.2760553449,2.46402126163,032019
2018SER300,Marché,Services,Services d'assurance,01/03/2019,1980.0,Révisable,Commune de La Bresse,48.018369081,6.92551863367,PME,19.318189152818157,47.8878806084,7.04177147633,032019
20192019S0776800,Marché,Services,Services d'ingénierie,11/03/2019,19800.0,Ferme et actualisable,"Etablissements et organismes de l'enseignement supérieur, de la recherche et de l'innovation - Ce...",50.6317671102,3.04699299406,PME,117.21817841454418,49.5780137041,3.00844124973,032019
2019150929085600,Marché,Services,"Services d'architecture, services de construction, services d'ingénierie et services d'inspection",14/03/2019,19800.0,Ferme,Ministère de la Culture - MISSION ACHATS,48.8625262113,2.33630086089,PME,11.967963619802495,48.7960818608,2.42143357065,032019
20192019S0753400,Marché,Services,Maintenance et réparation de matériel informatique,22/03/2019,198000.0,Révisable,CHI TOULON LA SEYNE,43.1364847512,5.93276630299,NC,841.4963567068688,49.8413842833,2.38263504965,032019
2018750518TX00,Marché,Travaux,Travaux de revêtement de chemins piétonniers,01/03/2019,198259.0,Ferme et actualisable,Mairie de Harnes,50.4520424431,2.90382635657,GE,0.0,50.4520424431,2.90382635657,032019
20192019F0763900,Marché,Fournitures,Systèmes de positionnement à capacité globale (GPS ou équivalent),26/03/2019,19840.0,Ferme,"Etablissements et organismes de l'enseignement supérieur, de la recherche et de l'innovation - CN...",43.5959710776,1.43229743595,PME,795.4998117789884,48.7847692121,-3.5169414541,032019
20192019F0609200,Marché,Fournitures,Préparations alimentaires,01/03/2019,19877.81,Ferme et actualisable,CHU BESANCON,47.2551269927,6.0192810348,NC,158.1459283884007,48.6830554055,5.98162347002,032019
2018OdKhfw8U0x00,Marché,Services,Services d'assurance de biens,01/03/2019,198940.0,Révisable,Ville de Montrouge,48.8152248222,2.31722185184,GE,11.593163968446856,48.8836186061,2.23810959636,032019
20192019F1741400,Marché,Fournitures,Dispositifs de ponction veineuse et de prélèvement sanguin,11/03/2019,199.2,Révisable,Ministères sociaux,45.8391553925,4.99733131758,PME,14.961639494108526,45.7345274274,4.91192378092,032019
20192019S0563800,Marché,Services,Services d'études de marchés,20/03/2019,19900.0,Ferme,Ministère de l'agriculture et de l'alimentation - FranceAgriMer,48.8631652232,2.4482059517,NC,23.34276535081301,48.8836186061,2.23810959636,032019
2019150929649700,Marché,Fournitures,Produits chimiques variés,08/03/2019,1992.0,Ferme,Ministère des armées - Structure Spécialisée d'achat et de Mandatement 33 504,,,PME,,44.7934650068,-0.819175449287,032019
2019150931208500,Marché,Travaux,Travaux de construction,11/03/2019,1993000.0,Révisable,Etablissement du service d'infrastructure de la défense de Rennes - ESID Rennes,,,PME,,49.1155352385,-1.12951508533,032019
201817VILL067000,Marché,Travaux,Travaux de construction complète ou partielle et travaux de génie civil,07/03/2019,1994.0,Ferme,Commune de Villelaure,43.7073932284,5.43131360909,PME,0.0,43.7073932284,5.43131360909,032019
20192019T0713600,Marché,Travaux,Travaux de construction,12/03/2019,199653.12,Ferme,ASSISTANCE PUBLIQUE DES HOPITAUX DE MARSEILLE,43.2924013477,5.39786536432,PME,15.295582641604835,43.403180825,5.31538372107,032019
2019MAPFO0000200,Marché,Fournitures,Système de surveillance vidéo,01/03/2019,199999.0,Révisable,Mairie de ROGNONAS,43.8999923319,4.79900062183,NC,98.1016066384583,43.2753571972,5.42728465241,032019
20192019S0967800,Marché,Fournitures,Matériel d'interphonie,08/03/2019,2000.0,Révisable,CHU ANGERS,47.4766284713,-0.556089456786,PME,120.1216738838593,47.2744152089,-1.62319145717,032019
20181900,Marché,Fournitures,Systèmes d'alarme,01/03/2019,20000.0,Révisable,Commune d'Irigny,45.6749007819,4.81741808117,PME,41.07131205145666,45.7347422005,5.183945673,032019
20192019S0717700,Marché,Services,Services de maintenance de systèmes,18/03/2019,20000.0,Révisable,CHU ANGERS,47.4766284713,-0.556089456786,PME,342.05996616103903,48.7081120718,2.27819702132,032019
2018oktWJVz9Nc00,Marché,Services,"Services récréatifs, culturels et sportifs",02/03/2019,20000.0,Ferme,VILLE,48.9784393812,2.55500199053,PME,26.562017814913343,48.8769868607,2.33753841595,032019
2018iP0k4vzIrY00,Marché,Fournitures,"Meubles (y compris les meubles de bureau), aménagements, appareils électroménagers (à l'exclusion de l'éclairage) et produits de nettoyage",02/03/2019,20000.0,Révisable,Mairie de Chevilly Larue,48.7667116171,2.35261812092,PME,74.76219338232104,48.7793646886,1.67661998954,032019
20192019S0863200,Marché,Services,Services d'organisation d'événements,18/03/2019,20000.0,Révisable,"Etablissements et organismes de l'enseignement supérieur, de la recherche et de l'innovation - So...",48.8491121687,2.33284677548,NC,11.654695812056978,48.7498603402,2.29906093692,032019
20192019S0795100,Marché,Services,Services de réparation et d'entretien,29/03/2019,20000.0,Révisable,CHI TOULON LA SEYNE,43.1364847512,5.93276630299,PME,750.4030271815351,48.8231210367,2.26445901319,032019
20192019S0721500,Marché,Fournitures,Machines et appareils à usage spécifique,17/03/2019,20000.0,Ferme et actualisable,ASSISTANCE PUBLIQUE DES HOPITAUX DE MARSEILLE,43.2924013477,5.39786536432,PME,284.78976538732684,45.8185058503,4.93093438203,032019
2019220118061200,Marché,Fournitures,Téléphones pour malentendants,13/03/2019,20000.0,Ferme et actualisable,Ministère de l'agriculture et de l'alimentation - Bureau de la commande publique et des achats,48.8562037309,2.3121193117,ETI,31.40908994678327,48.8481450572,2.59605262949,032019
20192020S0512300,Marché,Fournitures,"Équipements de laboratoire, d'optique et de précision (excepté les lunettes)",25/03/2019,20000.0,Révisable,CH VALENCIENNES,50.3591232468,3.51599087764,PME,50.33798842198821,50.6322610395,3.15284231203,032019
2019170009216000,Marché,Services,Services de formation,07/03/2019,20000.0,Révisable,"Ministère de l'éducation nationale et de la jeunesse et Ministère de l'enseignement supérieur, de...",48.8562037309,2.3121193117,PME,2.8015276154530535,48.840040811,2.29268840406,032019
2019COMPACT00,Marché,Fournitures,Eau potable,27/03/2019,20000.0,Ferme et actualisable,Syndicat des Eaux Durance-Ventoux,43.7887235207,5.1243956195,PME,59.49088625625516,43.3497071897,5.43382677797,032019
2018ACFDAJM01100,Marché,Fournitures,Écrans et consoles d'ordinateurs,13/03/2019,20000.0,Ferme,Martinique Transport,14.6408734458,-61.069176472,NC,8.472233380404282,14.6246455763,-60.9935529523,032019
20192019S0549000,Marché,Services,Services de formation de personnel,06/03/2019,20000.0,Révisable,"Institut national de recherche pour l’agriculture, l’alimentation et l’environnement",48.8562037309,2.3121193117,PME,352.7721692736965,45.7859001722,3.11559551839,032019
20192020F0454300,Marché,Fournitures,Films vidéo,28/03/2019,20000.0,Ferme,Office national d'études et de recherches aérospatiales,48.8030644645,2.28639478919,PME,9.645776321088547,48.8873739998,2.30681348993,032019
20192019S0664800,Marché,Services,Services de réparation et d'entretien de matériel médical,11/03/2019,20000.0,Révisable,CHRU CAEN,49.1850685346,-0.370026383608,NC,288.0724332366644,48.6811729227,2.1853558178,032019
2018MV1811900,Marché,Services,Services topographiques,28/03/2019,20000.0,Révisable,Ville d'Ajaccio,41.9349194014,8.70135284615,PME,0.0,41.9349194014,8.70135284615,032019
2018FCS02400,Marché,Services,Services d'assurance,05/03/2019,20000.0,Révisable,MOSELIS,49.1081027833,6.19595351042,ETI,0.0,49.1081027833,6.19595351042,032019
20192019S1043000,Marché,Services,Services de manutention de cargaisons,20/03/2019,20000.0,Révisable,CHRU TOURS,47.3314668694,0.715972131571,NC,221.26424838184786,48.6811729227,2.1853558178,032019
20192019F0000800,Marché,Fournitures,Mobilier scolaire,12/03/2019,200000.0,Révisable,Commune de suresnes,48.8699520558,2.21968010802,NC,,,,032019
2018MF1-L3-MS100,Marché,Fournitures,Équipement d'éclairage public,26/03/2019,200000.0,Ferme,SYNDICAT DEPARTEMENTAL D'ENERGIE 35,48.1563323417,-1.58374267826,PME,877.6366454772207,45.1752846004,5.76552012882,032019
20192019S0000901,Marché,Services,Services de centres de vacances,05/03/2019,200000.0,,Commune de Montmorency,48.9919061028,2.32087713345,ETI,199.24268525481372,50.6317671102,3.04699299406,032019
20192019S0001301,Marché,Services,Services de centres de vacances,05/03/2019,200000.0,,Commune de Montmorency,48.9919061028,2.32087713345,PME,12.9143410190371,48.8769868607,2.33753841595,032019
20192019F1948700,Marché,Fournitures,"Machines, appareils, équipements et consommables électriques; éclairage",05/03/2019,200000.0,Révisable,"Etablissements et organismes de l'enseignement supérieur, de la recherche et de l'innovation - UN...",48.9296428406,2.35946866986,GE,7.483597645632608,48.8873739998,2.30681348993,032019
2019130014261400,Marché,Fournitures,"Machines, matériel et fourniture informatique et de bureau, excepté les meubles et logiciels",08/03/2019,200000.0,Révisable,Ministère de l'Intérieur - SGAMI EST - Metz - DAGF- Marchés Publics,48.8348302792,2.42102904428,ETI,17.30236686462259,48.9862889229,2.45676363518,032019
20192019S0009300,Marché,Services,Services de recherche de la pollution,28/03/2019,200000.0,Révisable,CD77 - Conseil départemental de Seine-et-Marne,48.5447982823,2.65777855027,ETI,41.54156301357853,48.8348302792,2.42102904428,032019
20192019S0001701,Marché,Services,Services de centres de vacances,05/03/2019,200000.0,,Commune de Montmorency,48.9919061028,2.32087713345,PME,220.3097922213834,50.9694535628,2.43449754478,032019
20191904800,Marché,Fournitures,Revêtements de sol,26/03/2019,200000.0,Révisable,Budget principal,47.9889433531,0.20002401353,GE,567.2335294343189,45.7790342353,4.82355716114,032019
2019K1260A00,Marché,Fournitures,"Vêtements, articles chaussants, bagages et accessoires",13/03/2019,200000.0,Révisable,Ville de Lyon,45.7700265344,4.82839245881,PME,13.568289458893155,45.6491373458,4.80970905869,032019
2019A1906200,Marché,Travaux,Travaux de dragage et de pompage,27/03/2019,200000.0,Ferme,VILLE 02700,43.4718555069,6.76374233833,PME,9.42552770088656,43.4577247159,6.84779339614,032019
20192019S0669300,Marché,Services,Services de traitement et d'élimination des ordures ménagères et des déchets non dangereux,15/03/2019,200000.0,,Ministère des armées - Plate-forme commissariat Ile-de-France,,,NC,,48.9325906584,2.3996121008,032019
20191904700,Marché,Fournitures,Peintures et revêtements muraux,26/03/2019,200000.0,Révisable,Budget principal,47.9889433531,0.20002401353,ETI,184.97617943022763,47.9119659657,1.8710901779,032019
20192019S0791200,Marché,Services,Services de nettoyage de bâtiments,15/03/2019,200000.0,Révisable,Chambres de Commerce et d'Industrie,41.9349194014,8.70135284615,PME,71.72027152027455,41.5929038931,9.25349975364,032019
2018MS8WdkARaE00,Marché,Fournitures,Équipement de transport et produits auxiliaires pour le transport,06/03/2019,200000.0,Révisable,FLERS AGGLO,48.7400079375,-0.562173805455,PME,0.0,48.7400079375,-0.562173805455,032019
20192019F0941400,Marché,Fournitures,Systèmes d'enregistrement et appareils d'exploration,18/03/2019,200000.0,Révisable,Union des Groupements d'Achats Publics - Département des Achats Internes,48.8481450572,2.59605262949,ETI,631.8158565040313,47.7826309879,-3.01634101761,032019
2018ACSDSI01900,Marché,Services,Fournisseur de services internet (ISP),12/03/2019,200000.0,Révisable,Martinique Transport,14.6408734458,-61.069176472,NC,104.08842529599912,16.2515819199,-61.5922344723,032019
2019170009242400,Marché,Services,Services de lutte contre les animaux nuisibles de la forêt,15/03/2019,200000.0,Révisable,Ministère des armées - Direction d'infrastructure de la défense de Fort de France - DID Fort de F...,,,NC,,14.5778958668,-60.9674898168,032019
20185B9r3TURiu00,Marché,Fournitures,Mobilier urbain,05/03/2019,200000.0,Révisable,Mairie de Flers,48.7400079375,-0.562173805455,GE,60.694552441080404,48.732261757,-0.0133263777725,032019
201920231802300,Marché,Services,Services de curage des égouts,05/03/2019,200000.0,Ferme et actualisable,COMMUNAUTE DES COMMUNES GIENNOISES,47.7121662255,2.66542721165,PME,9.65455968609494,47.6608848758,2.59497464873,032019
2018l_554WEC9C00,Marché,Travaux,Travaux de gros œuvre,14/03/2019,200000.0,Révisable,Mairie Sainte Genevi�ve des Bois,47.811532321,2.79284800253,PME,106.12003171605481,48.6699707249,2.37370903358,032019
2019130014009300,Marché,Services,Services de conseil en matière de santé et de sécurité,01/03/2019,200000.0,Révisable,Ministère des armées - Etablissement du service d'infrastructure de la défense de BREST - ESID Br...,,,ETI,,48.8426287239,2.20839539221,032019
20192019S2929000,Marché,Fournitures,Photocopieurs,08/03/2019,200000.0,Révisable,"Etablissements et organismes de l'enseignement supérieur, de la recherche et de l'innovation - UNIVERSITE RENNES  II  HAUTE BRETAGNE",48.111571436,-1.68168588816,ETI,449.3999294292194,48.8873739998,2.30681348993,032019
2019180000003500,Marché,Travaux,Travaux de marquage routier,19/03/2019,200000.0,Révisable,EPAGNY METZ TESSY - BUDGET PRINCIPAL,45.9442828312,6.08207297872,NC,18.484585524265324,45.8554272729,5.94055923177,032019
20192019S1038500,Marché,Services,Études de marché et recherche économique; sondages et statistiques,01/03/2019,200000.0,Ferme,Ministères sociaux,48.8869811827,2.38492060382,PME,681.2826590603074,43.5360639608,5.39837823449,032019
2019K1275A00,Marché,Fournitures,Peintures,21/03/2019,200000.0,Révisable,Ville de Lyon,45.7700265344,4.82839245881,PME,6.727756449635475,45.7708803723,4.88922582274,032019
20191906900,Marché,Services,Services de conception graphique,25/03/2019,200000.0,Révisable,Budget principal,47.9889433531,0.20002401353,NC,631.3543996418897,43.5849270471,3.80193171172,032019
20192019S0679900,Marché,Services,Services de conseil et d'évaluation,22/03/2019,200000.0,Ferme,CHU GRENOBLE,45.2097006413,5.74400008015,PME,551.626765524128,48.8292048923,2.3267445538,032019
2018PGuepRxxy800,Marché,Fournitures,Photocopieurs,01/03/2019,200000.0,Ferme,Mairie Sucy-en-Brie,48.7656350255,2.53363576939,ETI,42.501017048191486,48.9118842497,2.17854217414,032019
20192019S0658902,Marché,Services,Services de taxi,05/03/2019,200000.0,Ferme et actualisable,CHR ORLEANS,47.8824665066,1.91660961834,PME,0.0,47.8824665066,1.91660961834,032019
20192019S0009400,Marché,Services,Services de recherche de la pollution,28/03/2019,200000.0,Révisable,CD77 - Conseil départemental de Seine-et-Marne,48.5447982823,2.65777855027,ETI,41.54156301357853,48.8348302792,2.42102904428,032019
2018MAPA20181101,Marché,Services,Logiciels médicaux,07/03/2019,200000.0,Révisable,LASAT,46.4799268707,-0.382737638251,PME,561.9046804807225,45.7296761685,4.64252373926,032019
20192019S0665200,Marché,Services,Services de formation de personnel,20/03/2019,200000.0,Révisable,Union des Groupements d'Achats Publics -,48.8481450572,2.59605262949,PME,409.5876167034075,45.5401557588,4.2300100063,032019
2019130014203800,Marché,Services,Services de conditionnement,14/03/2019,200000.0,Ferme et actualisable,Ministère de l'Intérieur - Provence-Alpes-Côte d'Azur,43.2868669832,5.38037571899,NC,691.0239308163765,48.7072075139,2.31164655792,032019
2019V19099R02,Marché,Services,Services de gardiennage,29/03/2019,200000.0,Révisable,VILLE D'ORLEANS,47.8824665066,1.91660961834,PME,29.93416361109877,47.8421764212,1.64894977201,032019
2018A30500,Marché,Services,Services de fourniture de logiciels,05/03/2019,200000.0,Ferme,VILLE DE DUNKERQUE - PRINCIPAL,51.030563712,2.33703738753,PME,508.7108803469553,47.4766284713,-0.556089456786,032019
20192020S0512800,Marché,Services,Services de réparation et d'entretien,26/03/2019,200000.0,Révisable,CH VALENCIENNES,50.3591232468,3.51599087764,PME,8.693430378075861,50.3339014213,3.44157028913,032019
2019M1906000,Marché,Travaux,Travaux de restructuration,29/03/2019,2000000.0,Révisable,ORLEANS METROPOLE,47.8824665066,1.91660961834,GE,0.0,47.8824665066,1.91660961834,032019
20192021S0204700,Marché,Services,Services de laboratoire,25/03/2019,2000000.0,Révisable,"Ministère de la Transition Écologique, Ministère de la Cohésion des Territoires, Ministère de la Mer - Agence de l'Eau Rhin Meuse",49.1184064983,6.0525395136,NC,15.90066639791569,49.1081027833,6.19595351042,032019
20192019F0941600,Marché,Fournitures,Systèmes d'enregistrement et appareils d'exploration,18/03/2019,2000000.0,Révisable,Union des Groupements d'Achats Publics -,48.8481450572,2.59605262949,NC,,,,032019
20192019S0640000,Marché,Services,Services de transport (à l'exclusion du transport des déchets),01/03/2019,2000000.0,Ferme,Agence De l'Environnement et de la Maitrise de l'Energie,47.4766284713,-0.556089456786,PME,277.63269475252,48.8188635079,1.5601836586,032019
2019130014209700,Marché,Services,Services d'impression et de livraison,19/03/2019,2000000.0,Ferme et actualisable,Ministère de l'Intérieur - Préfecture Ile de France 1,48.840040811,2.29268840406,ETI,110.70358232417851,49.1331724153,1.33596387688,032019
2019130014244700,Marché,Services,Services des pouvoirs publics,13/03/2019,2000000.0,Révisable,Ministère de l'Intérieur - SGAMI EST - Metz - DAGF- Marchés Publics,48.8348302792,2.42102904428,PME,7.340434754573784,48.8542874923,2.35759608215,032019
2019M1905803,Marché,Travaux,Travaux de restructuration,29/03/2019,2000000.0,Révisable,ORLEANS METROPOLE,47.8824665066,1.91660961834,GE,0.0,47.8824665066,1.91660961834,032019
2019M1905900,Marché,Travaux,Travaux de restructuration,29/03/2019,2000000.0,Révisable,ORLEANS METROPOLE,47.8824665066,1.91660961834,PME,24.63995557198291,47.8394749942,1.69801497261,032019
2019M1906103,Marché,Travaux,Travaux de restructuration,29/03/2019,2000000.0,Révisable,ORLEANS METROPOLE,47.8824665066,1.91660961834,PME,0.0,47.8824665066,1.91660961834,032019
2019M1906300,Marché,Travaux,Travaux de restructuration,29/03/2019,2000000.0,Révisable,ORLEANS METROPOLE,47.8824665066,1.91660961834,PME,14.217818511344094,47.9475616949,1.8059625162,032019
2019M1905609,Marché,Travaux,Travaux de restructuration,29/03/2019,2000000.0,Révisable,ORLEANS METROPOLE,47.8824665066,1.91660961834,PME,7.377766882765813,47.9177164808,1.97312389077,032019
2019M1906201,Marché,Travaux,Travaux de restructuration,29/03/2019,2000000.0,Révisable,ORLEANS METROPOLE,47.8824665066,1.91660961834,NC,0.0,47.8824665066,1.91660961834,032019
2019M1905503,Marché,Travaux,Travaux de restructuration,29/03/2019,2000000.0,Révisable,ORLEANS METROPOLE,47.8824665066,1.91660961834,PME,8.947791855198764,47.8145464971,1.95994524646,032019
2019M1905700,Marché,Travaux,Travaux de restructuration,29/03/2019,2000000.0,Révisable,ORLEANS METROPOLE,47.8824665066,1.91660961834,PME,91.82568646864091,48.0185110829,2.73568624779,032019
201962164800,Marché,Travaux,Travaux de construction,26/03/2019,2.0E7,Ferme et actualisable,MAIRIE DU PERRAY-EN-YVELINES,48.6962812628,1.84344970164,GE,256.54018214990873,50.6546146137,3.06940961222,032019
201962164900,Marché,Travaux,Travaux de construction,26/03/2019,2.0E7,Ferme et actualisable,MAIRIE DU PERRAY-EN-YVELINES,48.6962812628,1.84344970164,PME,69.40047403286826,48.8631652232,2.4482059517,032019
