2018RjCwmp_sDN00,Marché,Fournitures,Aménagements intérieurs de bâtiment,24/06/2019,32023.0,Ferme et actualisable,Centre Hospitalier de l'Estran,48.5688153061,-1.48703619198,PME,53.28597655791546,49.038448741,-1.58111199773,062019
2018TY-a5aM-NR00,Marché,Travaux,"Travaux d'installation de matériel de chauffage, de ventilation et de climatisation",24/06/2019,32024.26,Ferme et actualisable,MANCHE HABITAT,49.1097135871,-1.07754504719,PME,81.08284961444235,49.0863887676,-0.344633752804,062019
201806WHY4650O00,Marché,Services,Services de contrôle légal des comptes,18/06/2019,320400.0,Révisable,2D2I - Direction du dévelopement de l'ingienerie et de l'innovation,46.0739029681,6.40835573143,ETI,171.314162971972,45.7708803723,4.88922582274,062019
2019000012315100,Marché,Travaux,Travaux de construction complète ou partielle et travaux de génie civil,03/06/2019,320446.53,Ferme et actualisable,COMMUNE D'AIGLUN,44.0635555536,6.13859689716,PME,0.0,44.0635555536,6.13859689716,062019
2019ENV05M00,Marché,Travaux,Travaux de construction,27/06/2019,320486.8,Ferme et actualisable,BUDGET ANNEXE ASSAINISSEMENT,48.5138195823,2.62907483295,GE,38.891707942221785,48.7960818608,2.42143357065,062019
20192019F1952200,Marché,Fournitures,Médicaments du système respiratoire,21/06/2019,3208426.17,Révisable,HOSPICES CIVILS DE LYON,45.7480493184,4.82567584415,GE,575.5641212606504,50.6089544032,3.02026471497,062019
2019AG001401,Marché,Travaux,Travaux de menuiserie,04/06/2019,32086.0,Ferme et actualisable,DEPARTEMENT DE L'ISERE,45.1821782198,5.72099089704,PME,49.171553528080544,45.5563842678,5.96031433409,062019
2019MsDoOwRvyA00,Marché,Services,"Études de faisabilité, service de conseil, analyse",21/06/2019,32095.0,Ferme et actualisable,DEL - Direction de l éducation et des lycées,45.7480493184,4.82567584415,NC,114.54611643236572,45.2198746489,5.71597377571,062019
2019iYcFBbeuVE00,Marché,Services,Services de réalisation d'enquêtes,11/06/2019,32095.0,Révisable,SYNDICAT DES MOBILITES DE TOURAINE,47.3980773574,0.696151819266,PME,490.60628504747586,45.6945569252,4.78905050427,062019
2018jKcrbsHBPF00,Marché,Travaux,Travaux de menuiserie,28/06/2019,32100.0,Révisable,VOSGELIS,48.162954598,6.47953209434,PME,36.27421642180696,48.0356979199,6.78185378398,062019
2019K170500,Marché,Travaux,Travaux de désamiantage,12/06/2019,321528.0,Révisable,Ville de Lyon,45.7700265344,4.82839245881,PME,15.23806884613823,45.7380869696,4.96241516988,062019
20192019T2560300,Marché,Travaux,Travaux de câblage et d'installations électriques,14/06/2019,321619.0,Ferme et actualisable,Ministère de la Transition écologique et solidaire - Ministère de la Cohésion des Territoires - S...,48.840040811,2.29268840406,GE,591.1608776609664,43.5959710776,1.43229743595,062019
20192019T1192800,Marché,Travaux,Travaux de câblage et d'installations électriques,07/06/2019,32166.58,Ferme,Ministère de la Culture - THEATRE NATIONAL DE L'ODEON,48.8491121687,2.33284677548,NC,34.37648732551634,48.7796502574,2.02991602442,062019
20194EBFftCWNB00,Marché,Travaux,Travaux de charpente et de couverture et travaux connexes,25/06/2019,321705.0,Ferme et actualisable,MANCHE HABITAT,49.1097135871,-1.07754504719,PME,17.864719714174296,49.1917106718,-0.938656058555,062019
201826Fr8HFN3C00,Marché,Travaux,Travaux de construction de maisons,11/06/2019,32212.49,Ferme,COOP LOGIS,48.0610922073,-0.766055300559,PME,0.0,48.0610922073,-0.766055300559,062019
2018RdpA9p2KHT00,Marché,Fournitures,Détecteurs de fumée,24/06/2019,32221.0,Ferme et actualisable,MANCHE HABITAT,49.1097135871,-1.07754504719,NC,84.69324133854688,49.6330980885,-1.63358524312,062019
2019fd58L5DWkA00,Marché,Travaux,Travaux d'installation d'ascenseurs,28/06/2019,32300.0,Révisable,VOSGELIS,48.162954598,6.47953209434,PME,78.83915479290532,48.7730693611,6.11133951491,062019
2019220119550200,Marché,Fournitures,Articles de papeterie et autres articles en papier,20/06/2019,323000.0,Ferme,Ministère de la Culture - MISSION ACHATS,48.8625262113,2.33630086089,ETI,28.76689644270699,48.8481450572,2.59605262949,062019
2018w08PV88rpd00,Marché,Travaux,Travaux de peinture,13/06/2019,32320.8,Révisable,Terres de Loire Habitat,47.5814306941,1.30596722868,PME,93.37339368998788,46.8405744553,1.70241320085,062019
20192019T1683200,Marché,Travaux,Travaux de fondation,13/06/2019,32380.0,Ferme,"Etablissements et organismes de l'enseignement supérieur, de la recherche et de l'innovation - UN...",49.4965847516,0.140273146733,NC,254.69739795655204,47.2582068323,-0.336825795051,062019
2019150953930600,Marché,Travaux,Travaux d'équipement du bâtiment,28/06/2019,32391.8,Ferme et actualisable,Ministère de la Justice  - Mission Achat,48.8625262113,2.33630086089,PME,116.26665020175496,49.9029435561,2.43824776015,062019
2018sW0t_6SVQM00,Marché,Fournitures,Serrurerie,11/06/2019,324050.0,Ferme et actualisable,Vannes Golfe Habitat,47.6599029362,-2.75681901002,PME,93.43893137837054,48.2378648052,-2.14352673246,062019
20192019F1952300,Marché,Fournitures,Médicaments du système respiratoire,12/06/2019,3246575.8,Révisable,HOSPICES CIVILS DE LYON,45.7480493184,4.82567584415,GE,453.8695174828487,48.8695044166,2.17789004853,062019
20192020F0720400,Marché,Fournitures,Produits pharmaceutiques,01/06/2019,324986.8,Révisable,CH VALENCIENNES,50.3591232468,3.51599087764,ETI,222.8885772387202,48.5447982823,2.65777855027,062019
2019ST02600,Marché,Fournitures,Serrurerie,07/06/2019,32500.0,Ferme et actualisable,1-BUDGET PRINCIPAL,44.8833318393,-0.784280122922,PME,29.618144976132058,44.8336874273,-0.521126433343,062019
20194638140000,Marché,Fournitures,,13/06/2019,325000.0,Révisable,LE GRAND NARBONNE COMMUNAUTE D'AGGLOMERATION,43.1651014685,3.02005317318,PME,0.0,43.1651014685,3.02005317318,062019
2018zkEWYoWwjz00,Marché,Travaux,Travaux de construction de maisons,11/06/2019,32506.71,Ferme,COOP LOGIS,48.0610922073,-0.766055300559,PME,15.263023452873478,47.9279589477,-0.799109303126,062019
2019050005,Marché,Fournitures,Équipement de plomberie,25/06/2019,32525.0,Ferme,Office Public Habitat du Jura,46.6867240732,5.51948208724,PME,26.753963325987165,46.9148692013,5.59871920068,062019
20192019T0092900,Marché,Travaux,Travaux de menuiserie et de charpenterie,24/06/2019,32547.0,Ferme et actualisable,Ville de Maisons Laffitte,48.9523319493,2.15274949447,PME,45.85647663846508,48.9943943417,1.74020742825,062019
2019_76Ym5npbR00,Marché,Services,,03/06/2019,32579.0,Ferme,,48.8182517632,2.43673908537,GE,23.13578650614145,48.8836186061,2.23810959636,062019
2019ncAwQr0wsO00,Marché,Travaux,Travaux de plomberie,25/06/2019,325878.0,Révisable,Département de l Indre Direction des Routes des Transports du Patrimoine et de l Education,46.8031778361,1.69389403678,NC,0.0,46.8031778361,1.69389403678,062019
2018T4rlJsQ16M00,Marché,Travaux,Travaux de façade,12/06/2019,32593.08,Ferme et actualisable,DSIUD - Direction des systèmes d information et des usages digitaux,45.7480493184,4.82567584415,PME,126.43937869320759,45.046430608,3.92488857329,062019
2018AOO0412/0400,Marché,Fournitures,Produits alimentaires divers,12/06/2019,32600.0,Révisable,IMES PROISY,49.889947594,3.75359976993,NC,193.89255119234747,48.8282706469,2.362358986,062019
20192019T1299300,Marché,Travaux,Travaux de menuiserie,03/06/2019,32621.41,Révisable,CHD VENDEE,46.6676055556,-1.4078581699,PME,0.0,46.6676055556,-1.4078581699,062019
20192019S1251500,Marché,Services,Maintenance de matériel de réseau informatique,17/06/2019,32629.12,Révisable,CH DU MANS,47.9889433531,0.20002401353,NC,559.4911522414965,45.8310057435,4.77089761479,062019
2018brtRZrZm7800,Marché,Services,Services de nettoyage,13/06/2019,32639.0,Révisable,Département de la Haute-Saône,47.631875925,6.15550489936,ETI,39.138954130558595,47.2814813056,6.1079529062,062019
20191421300,Marché,Travaux,Travaux d'installation de chauffage électrique et d'autres équipements électriques de bâtiment,14/06/2019,326451.44,Révisable,CHU NANTES,47.2321613301,-1.54797539458,NC,8.648538118903327,47.2533982505,-1.47273793378,062019
201801297d100300,Marché,Travaux,Travaux de chantier,24/06/2019,3265.0,Ferme,Commune VIERZON,47.2370821272,2.07892537933,PME,0.0,47.2370821272,2.07892537933,062019
2019160005259100,Marché,Travaux,Maçonnerie de pierres,20/06/2019,326755.55,Révisable,Ministère de la Culture - Direction Régionale des Affaires Culturelles Auvergne - Rhône Alpes,45.7700265344,4.82839245881,PME,94.05551959560435,45.0452470935,5.2702021475,062019
2019000012315200,Marché,Travaux,Travaux d'irrigation,03/06/2019,32716.7,Ferme et actualisable,COMMUNE D'AIGLUN,44.0635555536,6.13859689716,PME,36.881893499403375,44.220492632,5.84441395497,062019
2019170009427200,Marché,Services,Services d'entretien de matériel de télécommunications,19/06/2019,328.24,Révisable,Rectorat Académie BORDEAUX,44.8578964782,-0.57357535767,NC,12.331911084172813,44.8323242505,-0.682089528902,062019
20188MUGHMTQp800,Marché,Services,Services de comptabilité et d'audit,18/06/2019,32800.0,Ferme,Territoire Habitat 90,47.6463850599,6.84549855352,ETI,101.10285388545455,47.2551269927,6.0192810348,062019
2019150948241400,Marché,Fournitures,,05/06/2019,32818.0,Ferme,Ministère de la Justice  - Direction interrégionale des services pénitentiaires de Toulouse,43.5959710776,1.43229743595,PME,810.8865693465053,48.1599523594,7.15928871185,062019
201918BEB16300,Marché,Fournitures,Menuiserie pour la construction,12/06/2019,328226.0,Révisable,MAIRIE - ANNEMASSE,46.1912999721,6.24426921929,PME,154.35829765071955,45.820656077,4.8987353728,062019
20190cC_7Oo2yg00,Marché,Fournitures,Mobilier de bibliothèque,20/06/2019,32825.0,Révisable,VT / Animation jeunesse loisirs et sports,43.5959710776,1.43229743595,PME,0.0,43.5959710776,1.43229743595,062019
20192019T1177400,Marché,Travaux,Travaux de pose de revêtements de sols souples,05/06/2019,32848.0,Ferme,"Etablissements et organismes de l'enseignement supérieur, de la recherche et de l'innovation - UN...",49.2517771432,4.03968745396,PME,108.10754973851513,48.2782654212,4.04888937878,062019
2018IyHCn-KTaN00,Marché,Services,Logiciels de gestion des temps de travail et des ressources humaines,19/06/2019,328497.0,Révisable,AGEFIPH,48.7987242503,2.30977129909,PME,13.241399166481857,48.9157198373,2.28764873642,062019
20192019S1246600,Marché,Services,Services de nettoyage de vitres,17/06/2019,32853.56,Révisable,"Etablissements et organismes de l'enseignement supérieur, de la recherche et de l'innovation - UN...",50.2899236486,2.76642705397,ETI,50.770502546513455,50.5897868634,3.11272084202,062019
201964509600,Marché,Services,Services d'ingénierie,24/06/2019,328959.0,Révisable,Atlantic'eau,47.2321613301,-1.54797539458,NC,9.577530771797647,47.2246985502,-1.63426478543,062019
2018012d14400100,Marché,Services,Services de réparation et d'entretien de matériel de restauration,25/06/2019,329.13,Ferme,Commune VIERZON,47.2370821272,2.07892537933,PME,28.825076379307987,47.1698787883,2.33068767079,062019
2019dR-baWPfrj00,Marché,Travaux,Travaux d'équipement du bâtiment,12/06/2019,32906.0,Ferme et actualisable,Département de l Indre Direction des Routes des Transports du Patrimoine et de l Education,46.8031778361,1.69389403678,PME,4.266450983809258,46.8405744553,1.70241320085,062019
201919S0017L3B00,Marché,Travaux,Travaux de plomberie,11/06/2019,32943.7,Ferme et actualisable,Conseil Départemental AM - BP,43.7123384529,7.23750191149,PME,24.868162259440687,43.5768868378,7.05788914167,062019
20191379300,Marché,Travaux,Travaux de câblage et d'installations électriques,14/06/2019,329970.0,Révisable,Ministère de la Transition écologique et solidaire - Ministère de la Cohésion des Territoires - S...,14.6246455763,-60.9935529523,PME,109.80191133829851,16.2515819199,-61.5922344723,062019
2018EG4kclO1A_00,Marché,Fournitures,Produits pharmaceutiques,06/06/2019,330.0,Ferme,Centre Hospitalier Emile Roux,45.02773512,3.89608931701,GE,138.38504254585942,45.7016140067,4.94900275462,062019
2019ZjiUntM3aP00,Marché,Fournitures,Barrières de sécurité,12/06/2019,3300.0,Ferme,Mairie de Foix,42.9653610948,1.61016305727,PME,756.6067149440843,49.7390469766,1.0257092641,062019
2017012504800100,Marché,Services,Prestations de services pour la collectivité,28/06/2019,3300.0,Révisable,VOSGELIS,48.162954598,6.47953209434,ETI,0.0,48.162954598,6.47953209434,062019
2019100013728200,Marché,Services,"Services d'architecture, d'ingénierie et de planification",12/06/2019,33000.0,Révisable,Ministère des armées - Etablissement du service d'infrastructure de la défense de Bordeaux - ESID...,,,PME,,45.7696760236,0.205747066838,062019
20192019F1182300,Marché,Fournitures,"Équipements de laboratoire, d'optique et de précision (excepté les lunettes)",06/06/2019,33000.0,Ferme,"Etablissements et organismes de l'enseignement supérieur, de la recherche et de l'innovation - CN...",44.8056323294,-0.59098965786,NC,,,,062019
20192019S1155300,Marché,Services,Services d'analyse de données,03/06/2019,33000.0,Ferme,"Etablissements et organismes de l'enseignement supérieur, de la recherche et de l'innovation - CN...",48.111571436,-1.68168588816,NC,,,,062019
20192019F1255100,Marché,Fournitures,"Meubles (y compris les meubles de bureau), aménagements, appareils électroménagers (à l'exclusion de l'éclairage) et produits de nettoyage",20/06/2019,330000.0,Révisable,"Etablissements et organismes de l'enseignement supérieur, de la recherche et de l'innovation - UN...",45.7708803723,4.88922582274,NC,,,,062019
2019150948018800,Marché,Services,"Services d'architecture, services de construction, services d'ingénierie et services d'inspection",06/06/2019,33004.0,Révisable,Ministère des armées - Direction d'infrastructure de la défense de Saint-Denis - DID Saint Denis,,,PME,,-21.2232456927,55.5586013062,062019
2018012e13800100,Marché,Services,Services de réparation et d'entretien de matériel de restauration,26/06/2019,33068.07,Ferme,Commune VIERZON,47.2370821272,2.07892537933,PME,0.0,47.2370821272,2.07892537933,062019
2018012b2fa00100,Marché,Travaux,Travaux de chantier,25/06/2019,33068.07,Ferme,Commune VIERZON,47.2370821272,2.07892537933,PME,0.0,47.2370821272,2.07892537933,062019
2019sfTDUvE0ms00,Marché,Travaux,Travaux de construction de bâtiments,05/06/2019,33069.0,Ferme et actualisable,SODINEUF HABITAT NORMAND - SERVICE CONSTRUCTION,49.8824206014,1.0784245204,PME,67.3422106634675,49.2781454635,1.04763570328,062019
2018HgrSOKjUN500,Marché,Travaux,Travaux de construction de maisons,11/06/2019,33102.47,Ferme,COOP LOGIS,48.0610922073,-0.766055300559,NC,40.042825875866505,47.9657787874,-1.11524885736,062019
20192020F0729000,Marché,Fournitures,Produits pharmaceutiques,01/06/2019,33118.89,Révisable,CH VALENCIENNES,50.3591232468,3.51599087764,ETI,214.03836616786575,48.8983675206,2.25515424076,062019
2019120006287300,Marché,Services,Services de réparation et d'entretien d'installations de bâtiments,27/06/2019,331270.72,Révisable,"Ministères de l'Économie et des Finances, de l'Action et des Comptes publics - Autorité de Régula...",48.840040811,2.29268840406,NC,7.740720382165391,48.8836186061,2.23810959636,062019
2019125D1901,Marché,Services,Services de nettoyage,12/06/2019,33132.0,Révisable,DPT17 BUDGET PRINCIPAL,46.1619512738,-1.1749922971,NC,15.11717308016841,46.1026801433,-1.05198147918,062019
201701258f700100,Marché,Services,Prestations de services pour la collectivité,28/06/2019,3315.0,Révisable,VOSGELIS,48.162954598,6.47953209434,PME,86.32034778424266,48.3367171447,5.71859029021,062019
2017011a08c00100,Marché,Services,Prestations de services pour la collectivité,28/06/2019,3315.0,Révisable,VOSGELIS,48.162954598,6.47953209434,PME,86.32034778424266,48.3367171447,5.71859029021,062019
20170119e6200100,Marché,Services,Prestations de services pour la collectivité,28/06/2019,3315.0,Révisable,VOSGELIS,48.162954598,6.47953209434,PME,86.32034778424266,48.3367171447,5.71859029021,062019
2018YTp21GcRxB00,Marché,Services,"Études de faisabilité, service de conseil, analyse",17/06/2019,33150.0,Ferme et actualisable,Communauté d' Agglomération de Lens Lievin,50.4372553549,2.82129881832,NC,,,,062019
2019130014561500,Marché,Services,Services de réparation et d'entretien,19/06/2019,33173.78,Ferme,Ministère de l'Intérieur - SGAMI SUD OUEST- Bordeaux - DAGF - BCP,44.8578964782,-0.57357535767,NC,155.48737393661642,46.1578937747,-1.08822293978,062019
20190008700,Marché,Travaux,Ouvrages d'art et de génie civil,20/06/2019,331820.5,Révisable,VILLE DE MELUN,48.5447982823,2.65777855027,PME,4.270730522976036,48.5064229626,2.65931408171,062019
20192019F0923400,Marché,Fournitures,Produits alimentaires divers,21/06/2019,33199.0,Ferme et actualisable,Ministère de l'agriculture et de l'alimentation - FranceAgriMer,48.8631652232,2.4482059517,ETI,16.50774603293746,48.7495659946,2.35212808495,062019
20192019F1259900,Marché,Fournitures,Articles textiles divers,19/06/2019,33200.0,Révisable,ASSISTANCE PUBLIQUE DES HOPITAUX DE MARSEILLE,43.2924013477,5.39786536432,ETI,131.29767636244839,43.8445331544,4.34760475323,062019
2019080305,Marché,Travaux,Travaux de menuiserie,26/06/2019,33200.71,Ferme,Commune de TINCHEBRAY BOCAGE,48.7332586806,-0.730484453871,PME,31.0509116180639,48.6378346187,-0.466611367556,062019
2019M48XXvJzHV00,Marché,Travaux,Travaux de réfection,21/06/2019,33217.84,Ferme,CDC Habitat Social DIR Nord-Est (SHB Dijon2),47.3230744087,5.03738286925,PME,16.287870718812584,47.2149851644,5.13712083199,062019
2019120006256000,Marché,Fournitures,Système de surveillance des patients,13/06/2019,33280.0,Ferme,Ministère des armées - Direction des Approvisionnements en produits de santé des armées,,,PME,,48.4899083083,7.41053224895,062019
2019hqgsbudvru00,Marché,Travaux,Travaux d'équipement du bâtiment,05/06/2019,33289.59,Révisable,Département de l Indre Direction des Routes des Transports du Patrimoine et de l Education,46.8031778361,1.69389403678,PME,71.69635287420336,46.8667947556,2.33911901419,062019
2019130015443500,Marché,Fournitures,"Matériels médicaux, pharmaceutiques et produits de soins personnnels",01/06/2019,333.33,Révisable,Ministère des armées - Direction des Approvisionnements en produits de santé des armées,,,PME,,45.8558270771,4.52975194828,062019
2019130015440400,Marché,Fournitures,"Matériels médicaux, pharmaceutiques et produits de soins personnnels",01/06/2019,333.33,Révisable,Ministère des armées - Direction des Approvisionnements en produits de santé des armées,,,ETI,,48.9595327185,2.53641870202,062019
2019150958776100,Marché,Services,Services d'études,28/06/2019,33300.0,Ferme,Ministère de la Transition écologique et solidaire - Ministère de la Cohésion des Territoires - C...,48.8727847696,2.31253091684,ETI,14.892516853419583,48.8695044166,2.17789004853,062019
20192019T1231000,Marché,Travaux,Travaux d'équipement électrique,17/06/2019,33300.0,Ferme et actualisable,"Etablissements et organismes de l'enseignement supérieur, de la recherche et de l'innovation - UN...",45.7708803723,4.88922582274,PME,50.46716862849319,45.8915674641,5.32926324571,062019
2018M180800,Marché,Fournitures,Pelles mécaniques,11/06/2019,33300.0,Ferme,Mairie de MORZINE-AVORIAZ,46.17291352,6.74243517506,ETI,218.16274843844718,45.7020266839,4.82683638203,062019
2018cV7uqvS9tt00,Marché,Services,Services de maintenance des systèmes et services d'assistance,06/06/2019,333000.0,Ferme,Soci�t� d'Exploitation de la Tour Eiffel,48.840040811,2.29268840406,PME,9.903971067699288,48.8591103086,2.38017728226,062019
20182018093000,Marché,Services,Services d'ingénierie géotechnique,25/06/2019,33303.0,Révisable,DEPARTEMENT DE LA HAUTE-SAVOIE,45.8900209706,6.12570413482,NC,41.21567960071634,45.5563842678,5.96031433409,062019
2018NBeUDnRkhy00,Marché,Services,"Services de technologies de l'information, conseil, développement de logiciels, internet et appui",03/06/2019,33333.0,Révisable,,48.8964004469,2.15330952483,PME,560.103086563946,47.6599029362,-2.75681901002,062019
201919S0125L0000,Marché,Services,Services artistiques,28/06/2019,33340.0,Ferme,Conseil Départemental AM - BP,43.7123384529,7.23750191149,PME,29.848517298251643,43.5729226443,7.00630335301,062019
20192019T1190200,Marché,Travaux,Travaux d'assemblage d'ossatures métalliques,11/06/2019,33344.0,Ferme,Ministère de la Transition écologique et solidaire - Ministère de la Cohésion des Territoires - V...,50.5291112881,2.64320584341,PME,620.929287199024,47.6619892133,7.46685112175,062019
20191367400,Marché,Services,Services sociaux pour les personnes handicapées,14/06/2019,333560.0,Révisable,"Etablissements et organismes de l'enseignement supérieur, de la recherche et de l'innovation - CN...",48.8604673342,2.26190318372,PME,26.548231267379432,48.657035519,2.38747793366,062019
20192019T1194200,Marché,Travaux,Travaux de pose de revêtements de sols,04/06/2019,33385.97,Révisable,CHU DIJON,47.3230744087,5.03738286925,NC,,,,062019
2019130014546400,Marché,Fournitures,Produits pharmaceutiques,13/06/2019,3341.0,Révisable,Ministère des armées - Direction des Approvisionnements en produits de santé des armées,,,ETI,,49.207357405,-0.330362469163,062019
2018DDzwJe7jFv00,Marché,Travaux,Travaux de construction d'immeubles collectifs et de maisons individuelles,12/06/2019,334332.0,Ferme,Emeraude Habitation,48.6397466972,-1.98082436999,PME,18.60209607737543,48.5595945376,-2.12846717412,062019
20192019F1287800,Marché,Fournitures,"Instruments et matériels de télémétrie, d'hydrographie, d'océanographie et d'hydrologie",24/06/2019,334814.0,Révisable,Ministère des armées - Service hydrographique et océanographique de la Marine,48.3999000994,-4.5027702561,ETI,732.5159016352037,48.9412040612,2.09935987202,062019
20182018077100,Marché,Travaux,Travaux d'isolation thermique,25/06/2019,334838.0,Révisable,DEPARTEMENT DE LA HAUTE-SAVOIE,45.8900209706,6.12570413482,PME,28.02254415769747,45.7241809976,5.93426738228,062019
2019AO1iSCW_yt00,Marché,Travaux,Travaux de couverture,18/06/2019,33502.1,Ferme et actualisable,Sèvre Loire Habitat,47.0458179875,-0.877097655444,PME,0.0,47.0458179875,-0.877097655444,062019
20192019F0922200,Marché,Fournitures,Produits alimentaires divers,24/06/2019,33506.0,Ferme et actualisable,Ministère de l'agriculture et de l'alimentation - FranceAgriMer,48.8631652232,2.4482059517,PME,571.8077427300155,48.5001396568,-2.71009143445,062019
201964007000,Marché,Services,Services de nettoyage,05/06/2019,3354.0,Ferme et actualisable,Ville de Malakoff,48.8164012464,2.29603611202,GE,437.3795425657731,48.1205469701,-1.59697171557,062019
2019L030001,Marché,Services,Services de développement de logiciels de gestion d'internet et d'intranet,26/06/2019,33575.0,Ferme,MAIRIE ANNECY BUDGET PRINCIPAL,45.8900209706,6.12570413482,PME,563.5362849989175,43.5507622637,1.6031492213,062019
20192020F0758400,Marché,Fournitures,"Matériels médicaux, pharmaceutiques et produits de soins personnnels",11/06/2019,335826.46,Révisable,CH VALENCIENNES,50.3591232468,3.51599087764,ETI,223.84839979329757,48.8212450479,2.20940635474,062019
