2019YMHcMoZaj100,Marché,Travaux,Travaux d'équipement du bâtiment,06/06/2019,17474.68,Ferme et actualisable,MAIRIE DE CHENOVE,47.2927181449,5.00524547066,PME,8.838136877962222,47.3709183927,5.02066299696,062019
2019012d1e300100,Marché,Services,,25/06/2019,1747871.22,Ferme,Côte d'Azur Habitat (OPAM de Nice),43.7123384529,7.23750191149,GE,793.7875461571095,48.8951908356,2.28680331405,062019
20192019T1250000,Marché,Travaux,Travaux de menuiserie,15/06/2019,17485.4,Ferme et actualisable,Ministère de la Culture - CENTRE DES MONUMENTS NATIONAUX,48.8542874923,2.35759608215,PME,642.3743174038874,43.5468109054,4.6617387917,062019
2019JYf_ZkHV-o00,Marché,Travaux,Travaux de charpente et de couverture et travaux connexes,25/06/2019,174981.84,Ferme et actualisable,MANCHE HABITAT,49.1097135871,-1.07754504719,PME,17.864719714174296,49.1917106718,-0.938656058555,062019
201919410200,Marché,Travaux,Travaux de plomberie,24/06/2019,17500.0,Ferme et actualisable,VILLE DE BOUGUENAIS,47.170656178,-1.61651705517,PME,18.372164008717387,47.2533982505,-1.47273793378,062019
20192019S1272200,Marché,Services,Services de reprographie,19/06/2019,175000.0,Révisable,Ministère de la Transition écologique et solidaire - Ministère de la Cohésion des Territoires - A...,47.8824665066,1.91660961834,PME,75.37446169585776,47.5814306941,1.30596722868,062019
2019LIZxNDLXL300,Marché,Travaux,Installation de câblage informatique,17/06/2019,175000.0,Ferme et actualisable,DSIUD - Direction des systèmes d information et des usages digitaux,45.7480493184,4.82567584415,NC,2.0784656444565397,45.7333494426,4.83733100241,062019
2018619600,Marché,Travaux,Travaux de construction de bâtiments scolaires,06/06/2019,175000.0,Révisable,Ville de Villeurbanne,45.7708803723,4.88922582274,ETI,11.600655970768152,45.6680469522,4.9083713349,062019
2019Tmr4X-IWqU00,Marché,Fournitures,Canalisations,12/06/2019,1750000.0,Révisable,13 HABITAT,43.3066947635,5.4011177563,NC,11.755340013923472,43.3654982005,5.31265000369,062019
20182zYzLAXirs00,Marché,Fournitures,Articles de quincaillerie,04/06/2019,17503.0,Révisable,Mairie de L'Hay les Roses,48.776029777,2.33737630174,GE,14.642814288857862,48.9038810507,2.30581093912,062019
2019130014588400,Marché,Fournitures,Produits pharmaceutiques,28/06/2019,17524.0,Révisable,Ministère des armées - Direction des Approvisionnements en produits de santé des armées,,,ETI,,48.8282706469,2.362358986,062019
20192019T1266500,Marché,Travaux,Travaux d'installations électriques,18/06/2019,17556.42,Révisable,Union des Groupements d'Achats Publics - Département des Achats Internes,48.8481450572,2.59605262949,ETI,29.11536919655849,48.7495659946,2.35212808495,062019
2019TGR00600,Marché,Travaux,Travaux d'installation de ventilation,05/06/2019,175567.83,Révisable,DEPARTEMENT DE L'ISERE,45.1821782198,5.72099089704,ETI,71.4327882939073,45.7899368483,5.93731889614,062019
20194607530100,Marché,Fournitures,"Matériels médicaux, pharmaceutiques et produits de soins personnnels",03/06/2019,175752.0,Révisable,Centre Hospitalier d Ajaccio,41.9349194014,8.70135284615,ETI,582.808569839003,45.7541566032,5.06691649154,062019
2019jphQ8_1LTf00,Marché,Fournitures,Serrurerie,28/06/2019,175756.0,Révisable,VOSGELIS,48.162954598,6.47953209434,PME,29.079511289407943,48.2426549449,6.73011468197,062019
2019150947692700,Marché,Fournitures,,03/06/2019,17600.0,Ferme et actualisable,Ministère de la Justice  - Direction interrégionale des services pénitentiaires de Lyon,45.7533230296,4.86924368009,NC,116.482631518888,45.5837038917,5.90877548323,062019
20188aWz15YpxW00,Marché,Travaux,Travaux d'installations électriques,26/06/2019,176000.0,Ferme,FDI HABITAT,43.6131750772,3.86941278925,PME,83.55996343959997,43.3704237827,3.15420084349,062019
20192019F0002500,Marché,Fournitures,Matériel électrique,20/06/2019,17604.32,Ferme,Ministère des armées - Atelier Industriel de l'Aéronautique d'Ambérieu en Bugey - AIA Ambérieu,,,PME,,48.8855642403,2.26624582625,062019
20192019T1342900,Marché,Travaux,Travaux d'installation de dispositifs d'extinction d'incendie,28/06/2019,176051.0,Ferme et actualisable,"Etablissements et organismes de l'enseignement supérieur, de la recherche et de l'innovation - UN...",43.2801495369,5.34144579658,PME,24.536461915501295,43.4527920234,5.48035081509,062019
20192019T1112200,Marché,Travaux,Travaux d'équipement électrique,19/06/2019,176092.0,Ferme,ANDRA - Agence Nationale pour la gestion des Déchets Radioactifs,48.7682137464,2.26375687994,GE,297.3509152730031,48.6281535418,4.94911214889,062019
2019130014525200,Marché,Services,Services immobiliers,04/06/2019,176128.0,Révisable,"Ministères de l'Économie et des Finances, de l'Action et des Comptes publics - Direction des Acha...",48.8282706469,2.362358986,GE,3.939476949684155,48.8292048923,2.3267445538,062019
20192019F1304600,Marché,Fournitures,"Dispositifs de stérilisation, de désinfection et d'hygiène",18/06/2019,176148.4,Ferme et actualisable,CHU NICE,43.7123384529,7.23750191149,NC,896.1280662108687,50.6317671102,3.04699299406,062019
20192019T0978500,Marché,Travaux,Travaux de peinture,05/06/2019,1762.0,Révisable,CHU ROUEN,49.4415068863,1.09373273216,PME,5.326553097248209,49.4046172521,1.12442102183,062019
201857900,Marché,Travaux,Travaux de construction de bâtiments,05/06/2019,176281.05,Ferme,NEOTOA,48.111571436,-1.68168588816,PME,75.90182600571191,47.6396182888,-2.17735512251,062019
2019120006249600,Marché,Services,"Services de nettoyage de logements, de bâtiments et de vitres",24/06/2019,1764866.0,Ferme,Ministère des armées - Plate-forme commissariat Sud-Ouest,,,NC,,43.5390131127,1.52156442051,062019
2019jyDWsYLD6g00,Marché,Fournitures,Couches en papier,19/06/2019,17662.4,Révisable,,45.7333494426,4.83733100241,ETI,561.2609921431829,50.4391004456,2.98628860417,062019
20191395900,Marché,Services,Services de technologies de l'information,24/06/2019,1767113.0,Révisable,Chambres de Commerce et d'Industrie,43.64120757,1.38004602326,PME,435.9390816387641,43.3654982005,5.31265000369,062019
2019150951581900,Marché,Travaux,Travaux de transformation de bâtiments,26/06/2019,17693.65,Ferme,Ministère des armées - Etablissement du service d'infrastructure de la défense de Metz - ESID Metz,,,NC,,50.4449552439,2.71950153563,062019
20192020T0003800,Marché,Fournitures,Câbles à fibres optiques pour la transmission de données,21/06/2019,17695.0,Ferme et actualisable,Redon Agglomeration,47.6613041495,-2.08022201303,PME,107.78294071859497,47.8755250475,-3.03085047543,062019
201918BEB164a00,Marché,Travaux,Mise en place de plafonds suspendus,12/06/2019,176951.37,Révisable,MAIRIE - ANNEMASSE,46.1912999721,6.24426921929,PME,152.45859902526664,45.7860240236,4.92675965549,062019
20192019F1223100,Marché,Fournitures,"Matériel d'imagerie à usages médical, dentaire et vétérinaire",13/06/2019,176990.0,Ferme,"Etablissements et organismes de l'enseignement supérieur, de la recherche et de l'innovation - Di...",48.6900671002,6.17594832427,NC,,,,062019
20184o9YkZxpqE00,Marché,Services,Services d'assurance,13/06/2019,1770.0,Révisable,Département de la Haute-Saône,47.631875925,6.15550489936,PME,157.155980066357,48.7384501677,7.04716136958,062019
2018FeF2rIwAlE00,Marché,Travaux,Travaux d'installations électriques,27/06/2019,17715.42,Révisable,VOSGELIS,48.162954598,6.47953209434,PME,7.516374847447788,48.1078867384,6.43971415144,062019
2019q4SHRfk2TS00,Marché,Travaux,Travaux de construction,19/06/2019,17770.57,Ferme et actualisable,Brest Métropole Habitat,48.3999000994,-4.5027702561,NC,12.21796338178398,48.430342276,-4.39658995598,062019
20192019T1681700,Marché,Travaux,Travaux de démolition de bâtiments et travaux de terrassement,03/06/2019,17770.82,Ferme,"Etablissements et organismes de l'enseignement supérieur, de la recherche et de l'innovation - UN...",49.4965847516,0.140273146733,PME,51.804304565536434,49.5847692045,0.600287190694,062019
2018012abd400100,Marché,Travaux,Travaux de chantier,25/06/2019,17787.5,Ferme,Commune VIERZON,47.2370821272,2.07892537933,PME,89.84791786405607,47.5017754527,2.84661559682,062019
20192019S1134400,Marché,Services,Services d'exploitation forestière,18/06/2019,177880.0,,Ministère de l'agriculture et de l'alimentation - Direction territoriale Grand Est,48.5716343863,7.76783353204,NC,,,,062019
2019160005263000,Marché,Services,"Services d'architecture, services de construction, services d'ingénierie et services d'inspection",03/06/2019,17800.0,Ferme et actualisable,Ministère de la Justice  - Antenne régionale de l'équipement de Toulouse,43.5959710776,1.43229743595,PME,399.2445961439308,46.718831795,-0.343730585387,062019
2019170009411100,Marché,Fournitures,Batteries,24/06/2019,17822.5,Ferme,Ministère de l'Intérieur - Région de Gendarmerie - RGPACA Marseille,,,PME,,48.6930512744,2.15808376919,062019
2019oaIUDafP5800,Marché,Travaux,Travaux de couverture métallique,13/06/2019,178681.5,Ferme et actualisable,VT / Animation jeunesse loisirs et sports,43.5959710776,1.43229743595,PME,12.242867870567064,43.5261488406,1.34673571001,062019
2018012f3cc00100,Marché,Services,Services de réparation et d'entretien de matériel de restauration,25/06/2019,1787.5,Ferme,Commune VIERZON,47.2370821272,2.07892537933,PME,89.84791786405607,47.5017754527,2.84661559682,062019
2019Q9fx8m7BQH00,Marché,Travaux,Travaux d'isolation,28/06/2019,17874.6,Révisable,VOSGELIS,48.162954598,6.47953209434,NC,443.27452082486457,44.5538701101,4.74888787641,062019
20195LMJn7R6q400,Marché,Travaux,Travaux de construction,19/06/2019,179000.0,Ferme et actualisable,Brest Métropole Habitat,48.3999000994,-4.5027702561,NC,13.98616799824214,48.3602014502,-4.38273127749,062019
20191917300,Marché,Travaux,Travaux de menuiserie,12/06/2019,179048.64,Ferme,CA HAGUENAU,48.8420959686,7.83005981715,PME,10.40521271356241,48.8173467797,7.73927118379,062019
201918130400,Marché,Travaux,Travaux d'assainissement,24/06/2019,179106.0,Ferme et actualisable,S.I.A.V,50.3453304924,3.54897300193,NC,5.886593943445139,50.3971676028,3.53797169959,062019
20192019F0921200,Marché,Fournitures,Produits alimentaires divers,24/06/2019,1791469.0,Ferme et actualisable,Ministère de l'agriculture et de l'alimentation - FranceAgriMer,48.8631652232,2.4482059517,NC,342.44885394944214,45.8390114783,3.03417698254,062019
20192019T1335300,Marché,Travaux,Travaux de menuiserie,12/06/2019,179207.0,Ferme et actualisable,CCI Territoriale de la Marne,48.9641633923,4.37882582203,PME,3.8752697635810507,48.9920919296,4.35779662259,062019
20190004702,Marché,Services,Services spécialisés de transport routier de passagers,03/06/2019,1796000.0,Révisable,CD77 - Conseil départemental de Seine-et-Marne,48.5447982823,2.65777855027,PME,61.90825858267077,48.9228776124,2.24687029827,062019
20192019S1237000,Marché,Services,Services de recherche et développement et services de conseil connexes,17/06/2019,17965.0,Ferme,Institut national de recherche en sciences et technologies pour l'environnement et l'agriculture,48.7498603402,2.29906093692,PME,550.2866812079354,45.2122837184,5.78450878403,062019
20192019T1250300,Marché,Travaux,Travaux de pose de sols,19/06/2019,17996.0,Ferme,"Etablissements et organismes de l'enseignement supérieur, de la recherche et de l'innovation - UN...",49.4965847516,0.140273146733,PME,66.5774710777231,49.6014149721,0.733058350241,062019
20192019S1886800,Marché,Services,Pollution des sols,14/06/2019,17997.0,Révisable,CHRU TOURS,47.3314668694,0.715972131571,NC,448.6065387695414,50.6317671102,3.04699299406,062019
20192019-6804,Marché,Travaux,Travaux de plomberie,20/06/2019,179974.69,Ferme,DEPARTEMENT DE LA MARNE,48.9641633923,4.37882582203,NC,61.29133980900111,49.2540901675,3.9071552187,062019
2019epA0gPglja00,Marché,Services,Réalisation et entretien d'espaces verts,20/06/2019,18000.0,Révisable,Ville de Puteaux,48.8836186061,2.23810959636,NC,1097.387870386431,42.0437878573,9.4225495473,062019
20192019S1224600,Marché,Services,"Services d'essais techniques, services d'analyses et services de conseil",06/06/2019,18000.0,Révisable,"Etablissements et organismes de l'enseignement supérieur, de la recherche et de l'innovation - Université de Caen Normandie",49.1850685346,-0.370026383608,NC,740.465937235326,46.2384403409,5.63563832955,062019
2019ZSAzhNdjTd00,Marché,Travaux,Travaux de désamiantage,25/06/2019,18000.0,Révisable,Mairie de Niort (Service marchés publics),46.3286026496,-0.464927924553,PME,206.74460358983583,45.8054489888,1.32910309246,062019
20192019S1224300,Marché,Services,"Services d'essais techniques, services d'analyses et services de conseil",06/06/2019,18000.0,Révisable,"Etablissements et organismes de l'enseignement supérieur, de la recherche et de l'innovation - Université de Caen Normandie",49.1850685346,-0.370026383608,NC,740.465937235326,46.2384403409,5.63563832955,062019
20192019S1224700,Marché,Services,"Services d'essais techniques, services d'analyses et services de conseil",06/06/2019,18000.0,Révisable,"Etablissements et organismes de l'enseignement supérieur, de la recherche et de l'innovation - Université de Caen Normandie",49.1850685346,-0.370026383608,NC,740.465937235326,46.2384403409,5.63563832955,062019
20191419300,Marché,Fournitures,Rideaux,17/06/2019,18000.0,Ferme et actualisable,"Etablissements et organismes de l'enseignement supérieur, de la recherche et de l'innovation - Ce...",50.6317671102,3.04699299406,NC,0.0,50.6317671102,3.04699299406,062019
20192019S1229100,Marché,Services,Services de traduction,17/06/2019,18000.0,Révisable,CHU AMIENS PICARDIE,49.9002814748,2.29072265357,PME,116.15717637441642,48.8562037309,2.3121193117,062019
20192019S1224500,Marché,Services,"Services d'essais techniques, services d'analyses et services de conseil",06/06/2019,18000.0,Révisable,"Etablissements et organismes de l'enseignement supérieur, de la recherche et de l'innovation - Université de Caen Normandie",49.1850685346,-0.370026383608,NC,740.465937235326,46.2384403409,5.63563832955,062019
20192019S1283200,Marché,Fournitures,Machines de traitement des eaux usées,25/06/2019,18000.0,Ferme,CHR ORLEANS,47.8824665066,1.91660961834,NC,4.310737462497047,47.854897242,1.88921777468,062019
20193OCYV3qYYT00,Marché,Travaux,Travaux d'installation de chauffage central,14/06/2019,180000.0,Ferme et actualisable,VT / Animation jeunesse loisirs et sports,43.5959710776,1.43229743595,ETI,69.5930899517126,44.1257908601,1.09800782288,062019
2019Dp0tBklbiK00,Marché,Fournitures,"Vêtements, articles chaussants, bagages et accessoires",24/06/2019,180000.0,Révisable,Mairie de Romainville,48.8845546351,2.43800840946,PME,2.3948678085778683,48.8694561887,2.42256669613,062019
20192021S0030201,Marché,Services,Services de formation professionnelle,21/06/2019,180000.0,Révisable,CD91 - Conseil départemental de l'Essonne,48.6293513055,2.44049035394,PME,22.954465106973252,48.8348302792,2.42102904428,062019
20192019F2849000,Marché,Fournitures,Thermomètres,20/06/2019,180000.0,Révisable,CH VALENCIENNES,50.3591232468,3.51599087764,ETI,777.1179236175209,47.7826309879,-3.01634101761,062019
2019XLfcHuie7Y00,Marché,Services,Services d'installation de matériel électrique,26/06/2019,180000.0,Révisable,Mairie de Drancy,48.9233704771,2.44422453567,NC,31.48174731923356,48.819930904,2.70924343454,062019
2019Snf3kOUw-j00,Marché,Travaux,Réparation et entretien de toiture,28/06/2019,180000.0,Révisable,Mairie de Villeneuve le roi,48.7321607291,2.41097949757,PME,391.92031314057283,49.1354922767,-1.11008733763,062019
2019fHOfoNilKZ00,Marché,Services,"Services de technologies de l'information, conseil, développement de logiciels, internet et appui",05/06/2019,180000.0,Révisable,MAIRIE DE TALANT,47.3391772539,4.99722409136,PME,165.84453542874155,45.8448431471,4.9408752362,062019
2019K1255A00,Marché,Fournitures,Jeux,12/06/2019,180000.0,Révisable,Ville de Lyon,45.7700265344,4.82839245881,NC,55.18995908325166,45.4787027055,4.42386888678,062019
20192020F0306400,Marché,Fournitures,Filtres à air,17/06/2019,180000.0,Révisable,RESEAUX DES ACHETEURS HOSPITALIERS,48.8591103086,2.38017728226,PME,214.87292796038125,50.6322610395,3.15284231203,062019
2018k64IDV5q5O00,Marché,Travaux,Travaux de plomberie,28/06/2019,180000.0,Révisable,VOSGELIS,48.162954598,6.47953209434,PME,36.72683588922837,48.1274714151,6.80973312862,062019
2018ycu_SI32km00,Marché,Fournitures,Cartes pour l'achat de carburant,20/06/2019,180000.0,Révisable,Ville de Puteaux,48.8836186061,2.23810959636,GE,3.7245396122756462,48.8963161116,2.20694242609,062019
2018AE5lL03DXa00,Marché,Travaux,Travaux d'installations électriques,26/06/2019,180000.0,Ferme,FDI HABITAT,43.6131750772,3.86941278925,PME,83.55996343959997,43.3704237827,3.15420084349,062019
201919S000100,Marché,Fournitures,Matériel pédagogique,07/06/2019,180000.0,Révisable,BUDGET PRINCIPAL 2019,48.8983675206,2.25515424076,PME,12.047843737539257,48.9296428406,2.35946866986,062019
20192019F1156700,Marché,Fournitures,Capteurs,03/06/2019,1800000.0,Ferme,"Etablissements et organismes de l'enseignement supérieur, de la recherche et de l'innovation - CN...",43.6276961423,7.02943470458,NC,,,,062019
2018Wu9cvqVmBi00,Marché,Travaux,Travaux de revêtement,13/06/2019,1800000.0,Révisable,VT / Animation jeunesse loisirs et sports,43.5959710776,1.43229743595,NC,0.0,43.5959710776,1.43229743595,062019
2019MzCWMZJ1Ke00,Marché,Travaux,Travaux de menuiserie,27/06/2019,1800000.0,Révisable,Val d'Europe agglom�ration,48.8726903987,2.77025918382,PME,48.95516101901399,48.499927866,2.53471510547,062019
2018ojDrBRfVNn00,Marché,Travaux,Travaux de revêtement,13/06/2019,1800000.0,Révisable,VT / Animation jeunesse loisirs et sports,43.5959710776,1.43229743595,GE,11.337096341354068,43.5447123439,1.34369319092,062019
2019M03600,Marché,Services,Services de préparation de repas,24/06/2019,1.8E7,Révisable,2019-BUDGET PRINCIPAL,48.8983675206,2.25515424076,GE,0.0,48.8983675206,2.25515424076,062019
20192019T1299100,Marché,Travaux,Travaux de maçonnerie,03/06/2019,18016.72,Révisable,CHD VENDEE,46.6676055556,-1.4078581699,PME,110.88159591277562,46.3286026496,-0.464927924553,062019
2019170009365100,Marché,Services,Services de crèches et garderies d'enfants,11/06/2019,1802000.0,Ferme,Ministère de l'Intérieur - Préfecture Ile de France 1,48.840040811,2.29268840406,NC,7.7017830425065315,48.8983675206,2.25515424076,062019
20192019S1247000,Marché,Services,Services de nettoyage de vitres,17/06/2019,18023.4,Révisable,"Etablissements et organismes de l'enseignement supérieur, de la recherche et de l'innovation - UN...",50.2899236486,2.76642705397,ETI,50.770502546513455,50.5897868634,3.11272084202,062019
2018hLKuRFvq1q00,Marché,Services,Services d'entretien d'ascenseurs,13/06/2019,180425.0,Révisable,Les Foyers de Seine et Marne,48.5447982823,2.65777855027,NC,58.11058833414192,48.9157198373,2.28764873642,062019
2018s1j0SC5eDa00,Marché,Travaux,Travaux de construction,06/06/2019,180488.32,Ferme,SDIS 80 Somme,49.9002814748,2.29072265357,PME,54.47541109124398,50.2054381572,2.67608434885,062019
2019R7T14nxTUL00,Marché,Travaux,Travaux d'installation de ventilation,06/06/2019,180693.78,Ferme et actualisable,Mairie Sucy-en-Brie,48.7656350255,2.53363576939,PME,0.0,48.7656350255,2.53363576939,062019
20192019S2904300,Marché,Services,Services d'organisation de séminaires,21/06/2019,18081.57,Ferme,"Etablissements et organismes de l'enseignement supérieur, de la recherche et de l'innovation - Pôle Politique d'Achat",48.5716343863,7.76783353204,ETI,599.9414141648417,45.7859001722,3.11559551839,062019
20192019F1338200,Marché,Fournitures,Chromatographes,28/06/2019,180988.2,Ferme,Institut National de la Recherche Agronomique,48.8562037309,2.3121193117,ETI,27.701114672166558,48.7728906673,2.07603849225,062019
2019130014499300,Marché,Services,Services de location ou de vente d'immeubles,12/06/2019,18109.8,Révisable,"Ministères de l'Économie et des Finances, de l'Action et des Comptes publics - DGFIP 075 Paris",48.8682182328,2.34268958704,PME,6.492163299799556,48.8635257742,2.40121168869,062019
2019170009412100,Marché,Fournitures,Batteries,26/06/2019,18138.0,Ferme,Ministère de l'Intérieur - Région de Gendarmerie - RGPACA Marseille,,,NC,,45.2322012816,5.68429450533,062019
20192020F8729100,Marché,Fournitures,Produits pharmaceutiques,01/06/2019,181389.0,Révisable,CH VALENCIENNES,50.3591232468,3.51599087764,NC,,,,062019
2019100013742000,Marché,Travaux,Installation de panneaux de signalisation,14/06/2019,18141.0,Révisable,Ministère de la Transition écologique et solidaire - Ministère de la Cohésion des Territoires - D...,47.2321613301,-1.54797539458,NC,454.6377238520172,48.8963161116,2.20694242609,062019
20192019T1339600,Marché,Services,,11/06/2019,18154.77,Ferme,CH DU MANS,47.9889433531,0.20002401353,NC,10.79288221594246,47.9788917277,0.297105562283,062019
20190012300,Marché,Travaux,Travaux de plomberie,17/06/2019,181733.0,Révisable,Département de Saône et Loire,46.320613267,4.81834086547,PME,64.72300872480736,46.6756918542,4.35399639402,062019
2019Lkgr0VM5GL00,Marché,Services,,03/06/2019,181818.0,Ferme,CERIB Centre d'Etudes et de Recherches de l'Industrie du B�ton,48.5939664593,1.68506450117,NC,172.25444135300236,47.3980773574,0.696151819266,062019
20191407600,Marché,Travaux,Travaux de réfection,28/06/2019,181960.67,Ferme,"Etablissements et organismes de l'enseignement supérieur, de la recherche et de l'innovation - UN...",47.7502629938,-3.37883364048,NC,5.863467175262445,47.7840114084,-3.41959465982,062019
2019DWQ-g8fq_n00,Marché,Travaux,Travaux de remise en état,04/06/2019,182143.0,Ferme,SA HLM QUEVILLY HABITAT,49.4094883554,1.03952520974,NC,6.21135828777671,49.4110535444,1.09567654503,062019
20190012900,Marché,Fournitures,,05/06/2019,182316.1,Ferme et actualisable,COTES D'ARMOR HABITAT,48.487063217,-2.80840238288,PME,87.00105098206757,48.7076621866,-3.56329703259,062019
20192019F1210100,Marché,Fournitures,Articles textiles divers,11/06/2019,18240.0,Révisable,ASSISTANCE PUBLIQUE DES HOPITAUX DE MARSEILLE,43.2924013477,5.39786536432,PME,870.9333147669423,50.6868830496,2.76931634991,062019
2019150951885300,Marché,Travaux,Travaux de construction,15/06/2019,18285.0,Ferme et actualisable,Ministère de la Justice  - SECRETARIAT GENERAL DU MINISTERE DE LA JUSTICE,47.3230744087,5.03738286925,ETI,341.92458502788014,48.8628851439,2.35993164253,062019
2019I3mKbnuOZo00,Marché,Services,"Études de faisabilité, service de conseil, analyse",19/06/2019,18300.0,Ferme,Mairie d'Orsay - MPA,48.7002680837,2.18715224978,PME,21.917548667023745,48.8963161116,2.20694242609,062019
2019ueGrCX9RMd00,Marché,Services,Services de transport (à l'exclusion du transport des déchets),11/06/2019,18304.0,Révisable,GIP LABÉO,49.2152313192,-0.40138132268,ETI,16.604495404835887,49.1160657149,-0.289205729093,062019
