202101200,Marché,Travaux,Travaux de cloisonnement,22/03/2021,107427.5,Révisable,COMMUNE DE SAINT PAUL PES MARCHE,-21.0446108504,55.3222448792,PME,15.591879774643358,-20.9331856391,55.4471055195,032021
2021130016355400,Marché,Services,Services de réparation et d'entretien d'installations de bâtiments,18/03/2021,10743.89,Révisable,"Ministère de la Transition Écologique, Ministère de la Cohésion des Territoires, Ministère de la Mer - Direction Régionale Environnement, Aménagement et Logement Occitanie",43.5959710776,1.43229743595,NC,269.4952493946939,43.6131750772,3.86941278925,032021
2021232103000000,Marché,Travaux,Travaux de plomberie,02/03/2021,10750.0,Ferme et actualisable,CONSEIL DEPARTEMENTAL DE LA CREUSE,46.1631302569,1.87113488144,PME,0.0,46.1631302569,1.87113488144,032021
2020SMeNaPCl6V00,Marché,Services,Services de réparation et d'entretien de machines,01/03/2021,10752.84,Révisable,Sèvre Loire Habitat,47.0458179875,-0.877097655444,PME,0.0,47.0458179875,-0.877097655444,032021
20212021F0555500,Marché,Fournitures,"Dispositifs de stérilisation, de désinfection et d'hygiène",26/03/2021,1076.0,Révisable,CH VALENCIENNES,50.3591232468,3.51599087764,ETI,52.19796392615905,50.6114599415,3.1178549832,032021
2020M10701,Marché,Travaux,Travaux d'installation d'ascenseurs,30/03/2021,107676.0,Ferme et actualisable,Ville de Courbevoie,48.8983675206,2.25515424076,ETI,796.4673972820777,43.7123384529,7.23750191149,032021
202120200040500,Marché,Services,Services de nettoyage de bâtiments,18/03/2021,107742.0,Ferme,Ville de St Laurent du MARONI,4.94626572703,-53.9779657738,NC,0.0,4.94626572703,-53.9779657738,032021
20212021S0862600,Marché,Services,Services de transport routier,16/03/2021,1077440.0,Révisable,CHR ORLEANS,47.8824665066,1.91660961834,GE,492.38485778040877,49.1081027833,6.19595351042,032021
20212021T0383200,Marché,Services,Services d'ingénierie,04/03/2021,1078078.0,Révisable,ANDRA - Agence Nationale pour la gestion des Déchets Radioactifs,48.7682137464,2.26375687994,NC,556.1803295316067,45.2214311039,5.81565516978,032021
20200100000VER00,Marché,Services,Services de transport des ordures ménagères,22/03/2021,107861.82,Ferme,BA ENVIRONNEMENT,47.0075232948,5.15201955356,ETI,104.43294041348601,47.4910544194,4.34173252327,032021
20212021F01027,Marché,Fournitures,Stands d'exposition,26/03/2021,107885.4,Ferme,VILLE DE PARIS BUDGET PRINCIPAL,48.8542874923,2.35759608215,PME,25.111629626639346,48.9172863598,2.13951942246,032021
20212021T0696100,Marché,Travaux,Travaux d'installations électriques,25/03/2021,107926.0,Révisable,HOSPICES CIVILS DE LYON,45.7480493184,4.82567584415,GE,19.26294407836649,45.8335019074,4.97732640716,032021
2021100015253400,Marché,Services,"Services d'architecture, services de construction, services d'ingénierie et services d'inspection",23/03/2021,1080.0,Révisable,"Ministère de la Transition Écologique, Ministère de la Cohésion des Territoires, Ministère de la Mer - Direction Régionale et Interdépartementale Equipement et Aménagement Ile-de-France",48.840040811,2.29268840406,PME,196.73993051654912,47.0747420182,2.40492134914,032021
20212021F0548800,Marché,Fournitures,"Dispositifs de stérilisation, de désinfection et d'hygiène",26/03/2021,10800.0,Révisable,CH VALENCIENNES,50.3591232468,3.51599087764,PME,790.7225542297007,43.5439301138,1.47732357418,032021
20212021S0430600,Marché,Services,Services de réinsertion,10/03/2021,10800.0,Ferme et actualisable,Communauté d'Agglomération du Pays de Meaux,48.9569889049,2.89982507271,PME,0.0,48.9569889049,2.89982507271,032021
2019KbcE5JXDsX00,Marché,Fournitures,Produits alimentaires divers,03/03/2021,10800.0,Révisable,Commune de Saint Leu,-21.1659546177,55.333466602,NC,7.802508017714393,-21.0446108504,55.3222448792,032021
2021202103000,Marché,Fournitures,Peintures et revêtements muraux,26/03/2021,108000.0,Ferme,VILLE DE DRANCY,48.9233704771,2.44422453567,NC,14.924652623263965,48.7987986059,2.49441281984,032021
20212020FTI02500,Marché,Services,"Études de faisabilité, service de conseil, analyse",23/03/2021,108000.0,Révisable,Foncière de Transformation Immobilière,48.8282706469,2.362358986,PME,425.05844198986,49.1081027833,6.19595351042,032021
2021202118L0200,Marché,Services,Services d'entretien d'ascenseurs,09/03/2021,108000.0,Révisable,Valence Romans Agglo,44.9223144503,4.91311704006,ETI,174.21498886721483,43.403180825,5.31538372107,032021
2021185600,Marché,Travaux,Travaux routiers,09/03/2021,108000.0,Ferme et actualisable,CC DU PAYS DE MORTAGNE AU PERCHE,48.5207194044,0.561009017954,PME,8.160816168281317,48.5101450456,0.634041143949,032021
202127200100,Marché,Travaux,Travaux de construction d'immeubles collectifs et de maisons individuelles,02/03/2021,1080000.0,Ferme et actualisable,ALTEAL,43.611577156,1.32726979619,PME,11.742568974830187,43.5959710776,1.43229743595,032021
2021210160100,Marché,Services,Prestations de services pour la collectivité,05/03/2021,108009.0,Ferme,MAIRIE DE REZE,47.1765537278,-1.54989963253,PME,10.757609920749957,47.2246985502,-1.63426478543,032021
2020klqMkPKwE900,Marché,Travaux,Travaux de construction,23/03/2021,10806.0,Ferme et actualisable,SEMDAS,46.1619512738,-1.1749922971,PME,130.5303220320126,45.2883662116,-0.387461409737,032021
2020ka4yBf3D3K00,Marché,Fournitures,Serrurerie,09/03/2021,108110.64,Révisable,SYNDICAT MIXTE DU CHATEAU DE VALENCAY,47.1559939704,1.55890789955,PME,128.66856073801338,46.1311351524,1.02033958909,032021
2020F00101,Marché,Fournitures,Bitume,25/03/2021,1081170.0,Ferme,DEPARTEMENT 47,44.2024640047,0.625844587118,GE,143.94459538283806,45.1433810866,1.51897708197,032021
202119S0117300,Marché,Travaux,Travaux de construction de bâtiments,02/03/2021,108142.0,Révisable,OPAC Saône & Loire,46.320613267,4.81834086547,PME,2.842370581269104,46.3397939697,4.83538435798,032021
2020f6qsRY9iSn00,Marché,Services,"Services de nettoyage de matériel de bureau, de bureaux, des écoles",23/03/2021,108144.0,Ferme et actualisable,CAF LA GUADELOUPE,16.2387553814,-61.5358203948,PME,6.32354600703968,16.2515819199,-61.5922344723,032021
2021.005400,Marché,Travaux,Travaux de chantier,25/03/2021,10815.25,Ferme,Alpes Is�re Habitat,45.1821782198,5.72099089704,PME,6.8682259899394795,45.2322012816,5.68429450533,032021
202103230100,Marché,Services,Services de conseil en matière d'ingénierie et de construction,23/03/2021,108150.0,Révisable,Communauté de communes de l'Oisans,45.0341619826,6.03267661931,PME,38.528986261512976,45.3743236402,5.95913330526,032021
2021210193L48300,Marché,Fournitures,Consommables médicaux,16/03/2021,10816.0,Révisable,ASSISTANCE PUBLIQUE HÔPITAUX DE MARSEILLE,43.2924013477,5.39786536432,ETI,698.4846116757235,48.8745436228,2.48657191747,032021
202120M049200,Marché,Services,Services de réinsertion,12/03/2021,108297.6,Révisable,Toulouse Métropole,43.5959710776,1.43229743595,NC,0.0,43.5959710776,1.43229743595,032021
2021S0058600,Marché,Travaux,Travaux de charpente,24/03/2021,10830.0,Ferme et actualisable,Mairie de Villeneuve d'Ascq,50.6322610395,3.15284231203,PME,11.70468419075401,50.6317671102,3.04699299406,032021
2021100015253600,Marché,Services,"Services d'architecture, services de construction, services d'ingénierie et services d'inspection",16/03/2021,108424.8,Révisable,Ministère de l'Intérieur - Préfecture de la Guadeloupe,16.0003582983,-61.728836187,PME,24.949498521505628,16.2387553814,-61.5358203948,032021
20212001101,Marché,Services,Services de nettoyage de bâtiments,17/03/2021,108463.25,Ferme et actualisable,CA du Saint-Quentinois,49.8472686643,3.27792244404,PME,0.0,49.8472686643,3.27792244404,032021
202100201,Marché,Services,Services de traitement et d'élimination des ordures ménagères et des déchets non dangereux,25/03/2021,1.084751E7,Ferme,CALITOM,45.6852349616,0.292635221532,ETI,295.4754268860472,48.1076823048,-0.799735963393,032021
2020OF2Lc1eIcP00,Marché,Travaux,Travaux de construction de bâtiments liés à la santé,15/03/2021,108500.0,Ferme et actualisable,Centre hospitalier de Boulogne sur mer Service Economique,50.7270459478,1.60607177999,NC,38.80749429190271,50.9500555648,1.87591279453,032021
2018oRg-vPhe_o00,Marché,Travaux,Travaux d'extension de bâtiments,10/03/2021,1085000.0,Révisable,Régie des Transports Métropolitains,,,GE,,43.3595190014,5.36321282428,032021
2019FH4DFMw9Xo00,Marché,Services,Services de développement de logiciels divers et systèmes informatiques,22/03/2021,1085784.0,Révisable,Régie des Transports Métropolitains,,,PME,,48.8855642403,2.26624582625,032021
20200aM662Pg7Z00,Marché,Services,Services de dératisation,26/03/2021,10864.0,Révisable,CDC Habitat Social DIR Sud-Ouest,44.8889230081,-0.600409986888,NC,548.9746116826243,48.8873739998,2.30681348993,032021
2021PAO202601500,Marché,Travaux,Travaux de construction d'immeubles collectifs et de maisons individuelles,17/03/2021,108650.0,Ferme,PRESENCE HABITAT,49.1081027833,6.19595351042,PME,173.61590941578137,48.7206697781,7.71737161635,032021
20212021F0539800,Marché,Fournitures,Bistouris et lames,26/03/2021,108670.0,Ferme et actualisable,CHU NICE,43.7123384529,7.23750191149,NC,792.7841119041027,48.8365394869,2.2389245247,032021
20212021T0433700,Marché,Travaux,Travaux d'installation de matériel de ventilation et de climatisation,16/03/2021,10870.0,Révisable,"Etablissements et organismes de l'enseignement supérieur, de la recherche et de l'innovation - CNRS Délégation Alsace",48.5716343863,7.76783353204,NC,7873.776672520763,4.93343982185,-52.7663434655,032021
2019poaYNP9khV00,Marché,Fournitures,Fournitures de bureau,22/03/2021,108757.0,Révisable,CROUS de Toulouse-Occitanie,43.5959710776,1.43229743595,ETI,395.46818285689193,43.9281862792,4.99304878863,032021
202120200250101,Marché,Travaux,Mise en place de plafonds suspendus,22/03/2021,108800.0,Ferme et actualisable,VILLE DE FONTAINE,45.192971981,5.67744958928,ETI,10.466517180877082,45.1334670409,5.75097030293,032021
2021120007391200,Marché,Services,Services de nettoyage,30/03/2021,108837.4,Révisable,Ministère de la Justice  - Direction interrégionale de la protection judiciaire de la jeunesse Centre Est,45.7533230296,4.86924368009,GE,286.6299901707851,43.2343813418,5.45258699132,032021
2021DCAF5900,Marché,Travaux,Travaux de démolition de bâtiments et travaux de terrassement,30/03/2021,10887.5,Ferme et actualisable,Saint-Etienne Métropole,45.4301960415,4.37808697748,PME,5.063552740143382,45.4755866683,4.37351328089,032021
2020015903,Marché,Fournitures,Équipement de cuisine,29/03/2021,108875.0,Révisable,BUDGET PRINCIPAL DPT 53,48.0610922073,-0.766055300559,PME,6.384625175918309,48.1076823048,-0.799735963393,032021
2021MP04800,Marché,Travaux,Travaux de plâtrerie,29/03/2021,10890.32,Ferme et actualisable,Ville de Roanne,46.0450564645,4.08007309055,NC,0.0,46.0450564645,4.08007309055,032021
2020.044200,Marché,Travaux,Travaux de chantier,12/03/2021,108913.95,Ferme,Alpes Is�re Habitat,45.1821782198,5.72099089704,NC,67.9504916438445,45.6027035235,5.27377282352,032021
202120000701A00,Marché,Services,Entretien d'installations d'éclairage public et de feux de signalisation,05/03/2021,1089700.0,Ferme,COMMUNAUTE PARIS SACLAY,48.7002680837,2.18715224978,NC,29.385936791004333,48.8125956765,1.94662384182,032021
2021000030001,Marché,Travaux,Travaux routiers,12/03/2021,108995.29,Ferme,COMMUNE DE SAINT-PIERRE-EN-FAUCIGNY,46.0633605772,6.3723362559,NC,4.739763330137738,46.0729357561,6.33056087345,032021
2018014baed00100,Marché,Services,Services de réparation et d'entretien de matériel de restauration,15/03/2021,109.0,Ferme,Commune VIERZON,47.2370821272,2.07892537933,PME,28.825076379307987,47.1698787883,2.33068767079,032021
2021840600,Marché,Services,Services d'architecte pour les bâtiments,30/03/2021,10900.0,Révisable,REGION CENTRE VAL DE LOIRE,47.8824665066,1.91660961834,PME,145.32035962832842,47.3980773574,0.696151819266,032021
202007_2000,Marché,Fournitures,Modules solaires photovoltaïques,23/03/2021,109048.37,Révisable,COMMUNE DE SAINTE ANNE,16.2574951963,-61.3876493091,PME,93.81071794574599,14.6408734458,-61.069176472,032021
2020SUwEqAq-cK00,Marché,Travaux,Travaux de construction,18/03/2021,109096.0,Révisable,SHLMR - Société dHabitation à Loyer Modéré de la Réunion,-20.9331856391,55.4471055195,PME,15.591879774643358,-21.0446108504,55.3222448792,032021
2021CT00,Marché,Services,Services de contrôle technique,23/03/2021,10910.0,Ferme,MAIRIE D'AUDINCOURT,47.4810459973,6.85439665451,NC,18.30142493842779,47.6463850599,6.84549855352,032021
2021202009MAP200,Marché,Travaux,Travaux routiers,04/03/2021,109190.0,Ferme et actualisable,Communauté d'Agglomération du Bocage Bressuirais,46.8544563524,-0.479596254844,NC,23.92512614086222,46.863451781,-0.69577798219,032021
2020nW4FnKhVZf00,Marché,Services,"Services d'architecture, services de construction, services d'ingénierie et services d'inspection",31/03/2021,109240.0,Ferme et actualisable,OISE HABITAT,49.2530176025,2.48395578599,PME,44.01472811925046,49.3992658289,2.85383600769,032021
20202QeyKSGtQC00,Marché,Services,"Services de mise à disposition de personnel, y compris de personnel temporaire",02/03/2021,109252.0,Révisable,CARSAT ALSACE MOSELLE,48.5716343863,7.76783353204,NC,0.0,48.5716343863,7.76783353204,032021
202021000100,Marché,Services,Services d'études,19/03/2021,109310.0,Révisable,BUDGET PRINCIPAL,43.3127155398,5.36343891881,PME,46.949625487939166,43.4938866501,5.74723409088,032021
2021VI2021001700,Marché,Travaux,Travaux d'installation de dispositifs de prévention contre les incendies,22/03/2021,109351.25,Ferme,VILLE DE NARBONNE,43.1651014685,3.02005317318,GE,97.32623166133793,43.6165578686,3.77427203169,032021
2019m5r504koMo00,Marché,Fournitures,Voitures particulières,26/03/2021,10939.0,Ferme,Mairie d'Aubenas,44.6103105442,4.39568379495,PME,0.0,44.6103105442,4.39568379495,032021
20212021T0562600,Marché,Travaux,Travaux de pose de revêtements de sols souples,30/03/2021,109467.23,Révisable,"Etablissements et organismes de l'enseignement supérieur, de la recherche et de l'innovation - UNIVERSITE DE PAU ET DU PAYS DE L'ADOUR",43.3201640732,-0.3496692279,PME,6.9112354560172795,43.3798878648,-0.366745709313,032021
2019CN2180000000,Marché,Services,Services de conseil en télécommunications,02/03/2021,109480.28,Ferme,BUDGET PRINCIPAL,45.8544262114,1.24894834225,PME,0.0,45.8544262114,1.24894834225,032021
2021100015282200,Marché,Travaux,Travaux d'isolation thermique,05/03/2021,10950.0,Révisable,"Ministère de l'éducation nationale et de la jeunesse et Ministère de l'enseignement supérieur, de la recherche et de l'innovation - Rectorat de Rennes-Constructions",48.111571436,-1.68168588816,PME,98.8243893189535,47.2246985502,-1.63426478543,032021
20212021S0454500,Marché,Services,Services de maintenance et de réparation de logiciels,15/03/2021,109500.0,Révisable,Ministères sociaux,45.7533230296,4.86924368009,ETI,2.945363556998541,45.7708803723,4.88922582274,032021
2020uHq4ZTpU4z00,Marché,Services,Services de conseil et de consultation en ingénierie,15/03/2021,109504.0,Ferme,EST METROPOLE HABITAT,45.7708803723,4.88922582274,PME,8.965128209630706,45.782504698,4.8089966572,032021
2021100000003600,Marché,Travaux,Travaux d'aménagement paysager,19/03/2021,109564.0,Ferme et actualisable,Ville de Châlons en Champagne,48.9641633923,4.37882582203,PME,127.1666136175298,48.9832471529,5.52863608687,032021
20212m0VLe9ybO00,Marché,Fournitures,Chaudières,29/03/2021,1095797.5,Révisable,Grand Ouest Service Patrimoine,,,PME,,49.4244508808,1.05966183652,032021
202104L300,Marché,Travaux,Travaux de construction de bâtiments,10/03/2021,1095957.0,Ferme,COMMUNE D'EVRY-COURCOURONNES,48.6293513055,2.44049035394,PME,4.2701714269561775,48.603809105,2.46932274471,032021
2021uu1hql1b1D00,Marché,Services,Services relatifs aux logiciels,15/03/2021,109721.7,Ferme,Communauté de Communes Rives de Moselle,49.2081956345,6.15700583856,ETI,405.850876668965,45.7708803723,4.88922582274,032021
2019NyJzO70D_D00,Marché,Travaux,Travaux de gros œuvre,17/03/2021,1097320.0,Ferme et actualisable,OFFICE PUBLIC DE L'HABITAT de l'AISNE,49.5679878475,3.62136068206,GE,86.91815533511104,49.3992658289,2.85383600769,032021
20212021S0376900,Marché,Services,Services d'entretien d'ascenseurs,03/03/2021,109780.0,Révisable,CHU DIJON,47.3230744087,5.03738286925,NC,240.79252443487084,49.2517771432,4.03968745396,032021
2021202003900,Marché,Travaux,Travaux de construction de centres de loisirs,25/03/2021,10990.0,Ferme,Commune de Bonsecours,49.426121827,1.1303313864,ETI,3.4560559802114557,49.444109331,1.15580893653,032021
202120PB020800,Marché,Travaux,Travaux d'équipement électrique,08/03/2021,109900.0,Révisable,VILLE DE GRIGNY,45.6083483392,4.78678285072,NC,41.057553034134685,45.9722435435,4.71913168899,032021
2021M21000018600,Marché,Fournitures,Produits alimentaires divers,11/03/2021,109920.0,Révisable,Commune de Saint-Denis,-20.9331856391,55.4471055195,NC,21.7922148621075,-20.963611632,55.642081964,032021
20212021S0587900,Marché,Services,Services de réparation et d'entretien de matériel médical,29/03/2021,11000.0,Révisable,CHU NANTES,47.2321613301,-1.54797539458,GE,262.88737691768983,47.207710313,0.829366024695,032021
20216020300,Marché,Fournitures,"Équipement de cuisine, articles de maison, articles ménagers et fournitures de restauration",11/03/2021,11000.0,Révisable,CHU Sud Réunion,-20.9331856391,55.4471055195,NC,15.591879774643358,-21.0446108504,55.3222448792,032021
2020iSKvBhykGt00,Marché,Services,Services d'impression et services connexes,25/03/2021,11000.0,Révisable,CAF SEINE-MARITIME,49.4415068863,1.09373273216,PME,117.2598376614209,48.6962812628,1.84344970164,032021
2020H_IpTH3HSS00,Marché,Travaux,Travaux de dégagement de chantier,19/03/2021,11000.0,Ferme,CAF PERPIGNAN,42.6966171788,2.89890986886,NC,464.1980316793662,44.8695763722,-0.684564339398,032021
20195neUpO-4_y00,Marché,Fournitures,Produits alimentaires divers,03/03/2021,11000.0,Révisable,Commune de Saint Leu,-21.1659546177,55.333466602,NC,13.02395110560659,-20.9945145041,55.3978899478,032021
2020bntPUqs-Ch00,Marché,Services,Services d'abonnement,26/03/2021,11000.0,Révisable,Mairie d'Asnières sur Seine,48.9157198373,2.28764873642,PME,11.646585295090743,48.8152248222,2.31722185184,032021
2021202039900,Marché,Travaux,Travaux de gros œuvre,16/03/2021,11000.0,Ferme et actualisable,NEOTOA,48.111571436,-1.68168588816,PME,6.979550300808405,48.0517912853,-1.66257280637,032021
202120251900,Marché,Travaux,Travaux de construction d'immeubles collectifs et de maisons individuelles,15/03/2021,110000.0,Ferme,BATIGERE,48.6900671002,6.17594832427,PME,169.49556174494907,48.421468028,7.6849051858,032021
20212021F0296400,Marché,Fournitures,Machines et appareils d'essai et de mesure,22/03/2021,110000.0,,Ministère des armées - Service industriel de l'aéronautique,,,PME,,48.7727101883,2.12506457263,032021
20212021T0516300,Marché,Travaux,Travaux de construction,02/03/2021,110000.0,Ferme et actualisable,CHRU CAEN,49.1850685346,-0.370026383608,NC,68.75770604923773,49.1262405489,0.248970498611,032021
20212020-10-0200,Marché,Services,,29/03/2021,110000.0,Ferme et actualisable,COMMUNE DE CHIRONGUI,-12.9191519546,45.1487147673,PME,6.025816913286761,-12.8530643264,45.1761721245,032021
202120380100,Marché,Fournitures,Véhicules à moteur,24/03/2021,110000.0,Révisable,Communauté d'agglomération Val Parisis,49.0150594532,2.19244222258,ETI,3.5397171925787463,49.0190794714,2.1606870483,032021
2021MP2101500,Marché,Services,Services de conseil en matière d'ingénierie et de construction,22/03/2021,110000.0,Ferme,EPORA,45.4301960415,4.37808697748,PME,0.0,45.4301960415,4.37808697748,032021
20212021F0493400,Marché,Fournitures,Réactifs de laboratoire,19/03/2021,110000.0,Révisable,CHRU MONTPELLIER,43.6131750772,3.86941278925,NC,,,,032021
2020SIEA00,Marché,Fournitures,Gaz naturel,31/03/2021,110000.0,Révisable,COMMUNAUTE DE COMMUNES DE MIRIBEL ET D,45.8448431471,4.9408752362,GE,443.24215284715376,48.840040811,2.29268840406,032021
2020NfpVN9sjmo00,Marché,Services,Services de nettoyage de bâtiments,11/03/2021,110000.0,Révisable,Commune de Beauchamp,49.0150594532,2.19244222258,PME,123.4904229495213,47.9385808606,1.91988453844,032021
202142021200,Marché,Fournitures,Cabines,04/03/2021,110000.0,Ferme,Ville de Fos-sur-Mer,43.4556743263,4.90422543761,NC,75.05893651761288,43.2936269646,5.56325220466,032021
2021CT04200,Marché,Fournitures,Chaussures de protection,05/03/2021,110000.0,Révisable,SMICVAL,44.9879982963,-0.183703851795,NC,45.4774306483288,44.8578964782,-0.57357535767,032021
2021202028000,Marché,Travaux,Travaux de construction d'immeubles collectifs,18/03/2021,110000.0,Ferme,NEOTOA,48.111571436,-1.68168588816,NC,11.986819396755394,48.2190033581,-1.68968686269,032021
2019RGMNELQmHt00,Marché,Services,Services de conseil et d'évaluation,03/03/2021,1100000.0,Ferme,Autorité des marchés financiers,48.8682182328,2.34268958704,ETI,3.3732878511539273,48.8727847696,2.31253091684,032021
20212021S00019,Marché,Services,Service de gestion du réseau d'assainissement,12/03/2021,1100000.0,Révisable,VILLE DE PARIS BUDGET PRINCIPAL,48.8542874923,2.35759608215,ETI,17.302213988455716,48.8963161116,2.20694242609,032021
2020BC29PERETT00,Marché,Travaux,Travaux de façade,12/03/2021,110027.43,Ferme et actualisable,CRAPONNE SUR ARZON MAIRIE,45.331677574,3.85327956368,NC,32.65551191794121,45.046430608,3.92488857329,032021
201907901,Marché,Services,"Études de faisabilité, service de conseil, analyse",09/03/2021,110087.4,Révisable,REDON AGGLOMERATION AG,47.6613041495,-2.08022201303,NC,66.7209567854623,48.111571436,-1.68168588816,032021
2021003184555000,Marché,Travaux,Travaux de pose de revêtements muraux et de papiers peints,12/03/2021,1100968.76,Ferme et actualisable,OPH 65,43.2347953943,0.0657136709174,NC,6.181634817457286,43.1993394435,0.0226878275418,032021
2021P8U4O56Wx400,Marché,Travaux,Travaux d'entretien routier,18/03/2021,110097.0,Ferme et actualisable,COMMUNE DE SAINT-GERMAIN-LAVOLPS,45.6077630109,2.21321838076,NC,92.5339293267419,45.1433810866,1.51897708197,032021
