2019XDkv3zqrAt00,Marché,Travaux,Travaux de remise en état et de remise à neuf,18/08/2020,480000.0,Révisable,Communauté de Communes de la Côte d'Albâtre,49.7759067777,0.633309429007,PME,3.5718396609747107,49.7451148454,0.642398525315,082020
2020irb5OneVgq00,Marché,Fournitures,"Machines, fournitures et équipement de bureau divers",20/08/2020,480000.0,Révisable,Mairie de Montélimar,44.5538701101,4.74888787641,PME,0.0,44.5538701101,4.74888787641,082020
2019ajpywdGNqV00,Marché,Travaux,Travaux de remise en état et de remise à neuf,18/08/2020,480000.0,Révisable,Communauté de Communes de la Côte d'Albâtre,49.7759067777,0.633309429007,PME,26.360943861140818,49.7526272499,0.39606397889,082020
202030139900,Marché,Travaux,Installation de matériel d'éclairage public,31/08/2020,480000.0,Ferme,BUDGET PRINCIPAL,47.2551269927,6.0192810348,NC,95.04961265085902,46.408693782,5.8760540115,082020
202020141L0100,Marché,Travaux,Travaux de revêtement divers,06/08/2020,480000.0,Révisable,CINOR,-20.9331856391,55.4471055195,PME,0.0,-20.9331856391,55.4471055195,082020
202020-0010600,Marché,Fournitures,Matériel de télévision et matériel audiovisuel,05/08/2020,480000.0,Ferme,Ville de Saint-Denis,48.9296428406,2.35946866986,PME,36.94758048251935,48.6023519752,2.30235865988,082020
2019Ng5zntTSIA00,Marché,Travaux,Travaux de plomberie,18/08/2020,480000.0,Révisable,Communauté de Communes de la Côte d'Albâtre,49.7759067777,0.633309429007,PME,32.50849028150901,49.7320865603,0.342641246632,082020
20198YyXluwDw200,Marché,Services,Services de réparation et d'entretien d'installations électriques de bâtiment,18/08/2020,480000.0,Révisable,Communauté de Communes de la Côte d'Albâtre,49.7759067777,0.633309429007,PME,32.50849028150901,49.7320865603,0.342641246632,082020
20202020S1311300,Marché,Services,"Études de faisabilité, service de conseil, analyse",31/08/2020,480042.5,Révisable,CENTRE HOSPITALIER BRETAGNE ATLANTIQUE,47.6599029362,-2.75681901002,PME,336.3555271038492,47.1718581475,0.24514174955,082020
2020151017623100,Marché,Travaux,Travaux de démolition de bâtiments et travaux de terrassement,06/08/2020,48043.0,Ferme et actualisable,Ministère de l'Intérieur - 11 - Direction départementale des territoires et de la mer,43.2093616677,2.34379884342,PME,74.93977308494078,43.1651014685,3.02005317318,082020
2019037-457-L400,Marché,Travaux,Ouvrages annexes pour canalisations d'eau,03/08/2020,48056.0,Révisable,MAUGES COMMUNAUTE,47.2127102218,-0.983417331698,PME,162.64207043845192,48.2027788606,-2.06541586557,082020
2020130015688400,Marché,Services,Services de réparation et d'entretien de chauffage central,05/08/2020,481017.92,Ferme,Ministère de l'Intérieur - de Corse,41.9349194014,8.70135284615,NC,109.22760624048307,42.5740607271,9.45747924664,082020
2020130015015100,Marché,Fournitures,"Matériels médicaux, pharmaceutiques et produits de soins personnnels",20/08/2020,48163.33,Révisable,Ministère des armées - Direction des Approvisionnements en produits de santé des armées,,,NC,,48.8491121687,2.33284677548,082020
2019MQId1T4mMV00,Marché,Travaux,Carrelages,24/08/2020,48174.21,Ferme,Territoire Habitat 90,47.6463850599,6.84549855352,PME,56.74085794161208,47.8238098951,6.3640710825,082020
20202020S1721600,Marché,Travaux,Entretien des accotements,27/08/2020,483.4,Ferme,Ministère de l'agriculture et de l'alimentation - Direction territoriale Centre Ouest Aquitaine,47.9321365141,2.01838531803,PME,675.5882332003836,47.9968866318,-4.09100301844,082020
20202020S1301800,Marché,Services,Services d'impression et services connexes,28/08/2020,48300.0,Ferme et actualisable,CHU NICE,43.7123384529,7.23750191149,PME,349.1709960060333,45.7480493184,4.82567584415,082020
20202020T1227000,Marché,Travaux,Travaux de désamiantage,12/08/2020,48306.0,Ferme,"Etablissements et organismes de l'enseignement supérieur, de la recherche et de l'innovation - CNRS Délégation Aquitaine",44.8056323294,-0.59098965786,ETI,540.0484221060915,49.3804837643,1.0347973342,082020
20201210020022,Marché,Travaux,Travaux de construction,07/08/2020,483177.46,Ferme et actualisable,VILLE DE PARIS BUDGET PRINCIPAL,48.8542874923,2.35759608215,PME,14.426101503050699,48.9228776124,2.24687029827,082020
2020TPA00803,Marché,Travaux,Travaux de menuiserie,26/08/2020,48331.77,Ferme et actualisable,Budget principal,45.1821782198,5.72099089704,PME,149.58920669294199,46.1019916945,4.73124363356,082020
2020TPA00802,Marché,Travaux,Travaux de menuiserie,21/08/2020,48331.77,Ferme et actualisable,Budget principal,45.1821782198,5.72099089704,PME,149.58920669294199,46.1019916945,4.73124363356,082020
2018014008900400,Marché,Services,Services de conseil en matériel informatique,04/08/2020,48450.0,Ferme,Groupe CDC Habitat  GIE SYSTEMES D'INFORMATION ET NUMERIQUE,43.6131750772,3.86941278925,GE,612.2888650569157,48.8855642403,2.26624582625,082020
2020lg6rL1GA3z00,Marché,Fournitures,Équipement d'éclairage public,17/08/2020,48458.09,Ferme,Collectivité de SAINT-BARTHELEMY,,,PME,,43.8792387371,5.38850102897,082020
202150847700,Marché,Services,Services de formation professionnelle,16/08/2020,485432.0,Révisable,Budget principal,50.6317671102,3.04699299406,NC,11.70468419075401,50.6322610395,3.15284231203,082020
20180mj-U0NxYh00,Marché,Travaux,Travaux de réfection,19/08/2020,48551.0,Ferme,Cellule Marché SUD OUEST,44.8889230081,-0.600409986888,PME,269.46136848688496,43.662968552,1.50091500983,082020
2019M8D0027EPE01,Marché,Fournitures,Équipement d'éclairage public,04/08/2020,485514.68,Révisable,BUDGET PRINCIPAL,43.6131750772,3.86941278925,PME,6.616673295365614,43.5635286669,3.9024872849,082020
20202020F1430900,Marché,Fournitures,Pâtes alimentaires,31/08/2020,485568.0,Ferme et actualisable,Ministère de l'agriculture et de l'alimentation - FranceAgriMer,48.8631652232,2.4482059517,ETI,16.50774603293746,48.7495659946,2.35212808495,082020
20202020F1678700,Marché,Fournitures,Matériels de radiodiagnostic,04/08/2020,486222.43,Révisable,CHU NICE,43.7123384529,7.23750191149,ETI,795.6316449745723,48.8426287239,2.20839539221,082020
20202020F1300300,Marché,Fournitures,Consommables médicaux autres que chimiques à usage unique et consommables hématologiques,27/08/2020,48650.0,Ferme,CHU RENNES,48.111571436,-1.68168588816,ETI,418.7418374293597,48.758778972,2.04882028884,082020
20194EvzIY2y2m00,Marché,Fournitures,Fournitures orthopédiques,11/08/2020,4867.0,Ferme et actualisable,Centre hospitalier de Boulogne sur mer Service Economique,50.7270459478,1.60607177999,PME,627.8841299038261,48.0014591284,6.58149912599,082020
20202020T0030400,Marché,Travaux,Travaux de construction,18/08/2020,48681.63,Ferme,VILLE DE GEX,46.3470183346,6.0463935107,PME,42.932639814816945,46.0793085526,5.76556812911,082020
2020M20-019GRP00,Marché,Travaux,Travaux de fouille et de terrassement,20/08/2020,48694.64,Révisable,Ville de Châteauroux,46.8031778361,1.69389403678,NC,6.578134530619354,46.7563635976,1.73022404526,082020
20202020T1225300,Marché,Travaux,Travaux de pose de plaques de plâtre,14/08/2020,487079.06,Ferme et actualisable,Chambres de Commerce et d'Industrie,43.7123384529,7.23750191149,PME,6.739936455977421,43.6865360059,7.18227325545,082020
2018l5j-hduCse00,Marché,Services,Services de réparation et d'entretien d'installations de bâtiments,07/08/2020,48715.64,Révisable,SEMINOR,49.7526272499,0.39606397889,PME,74.02607684139454,49.2181314945,0.794399849851,082020
20202020F1698900,Marché,Fournitures,Matériels de radiodiagnostic,04/08/2020,4873.33,Révisable,CHU NICE,43.7123384529,7.23750191149,PME,968.2298703166559,43.491201999,-1.51566656435,082020
2019c7XlqTgndC00,Marché,Fournitures,Structures de construction diverses,14/08/2020,48750.0,Ferme,SOLEAM (Société Locale d'Equipement et d'Aménagement de l'aire Métropolitaine),43.3127155398,5.36343891881,PME,8.327763560844746,43.238566824,5.37561344061,082020
202030179400,Marché,Services,Services d'assurance responsabilité civile,05/08/2020,48778.59,Ferme,BUDGET PRINCIPAL,-20.9331856391,55.4471055195,NC,8091.984437493279,47.2551269927,6.0192810348,082020
2019s-uWoiEGao00,Marché,Travaux,Travaux de maçonnerie,13/08/2020,48829.88,Ferme,Mairie de Chevilly Larue,48.7667116171,2.35261812092,PME,18.90222840928932,48.817695916,2.51568784214,082020
20202020S1721800,Marché,Travaux,Entretien des accotements,27/08/2020,4892.8,Ferme,Ministère de l'agriculture et de l'alimentation - Direction territoriale Centre Ouest Aquitaine,47.9321365141,2.01838531803,PME,675.5882332003836,47.9968866318,-4.09100301844,082020
2019EcL_DWEhPJ00,Marché,Travaux,Travaux de vitrerie,26/08/2020,48937.0,Révisable,Ville de Saint-Louis,47.6022882653,7.54028126665,PME,34.43499601656939,47.7609642256,7.27221248177,082020
2019hwTRVkTW1U00,Marché,Travaux,Travaux d'équipement du bâtiment,04/08/2020,490.0,Ferme,GIE SESAM-Vitale,47.9889433531,0.20002401353,PME,0.0,47.9889433531,0.20002401353,082020
20202020T1537200,Marché,Travaux,Travaux de câblage et d'installations électriques,23/08/2020,49000.0,Ferme,Ministères sociaux,48.6900671002,6.17594832427,GE,3.8429183058534373,48.6573087563,6.16442957921,082020
20202020F1299600,Marché,Fournitures,Simulateurs de formation,27/08/2020,4900000.0,,"Etablissements et organismes de l'enseignement supérieur, de la recherche et de l'innovation - UNIVERSITE DE BORDEAUX",44.8578964782,-0.57357535767,PME,550.8057671620962,48.9691551178,2.19936288395,082020
201913115,Marché,Travaux,Travaux de gros œuvre,14/08/2020,4900334.64,Révisable,BUDGET PRINCIPAL,45.7016140067,4.94900275462,ETI,496.0232258729329,48.9890049642,1.91405725676,082020
2019h5Quqz4OcZ00,Marché,Travaux,Installation de réseau de conduites,28/08/2020,49035.5,Ferme,CDC Habitat Social DIR Sud-Ouest,44.8889230081,-0.600409986888,PME,259.8498831949237,43.4986861967,1.28740710256,082020
2019eviwxvYrno00,Marché,Fournitures,Fournitures orthopédiques,11/08/2020,4914.0,Ferme et actualisable,Centre hospitalier de Boulogne sur mer Service Economique,50.7270459478,1.60607177999,PME,696.0091105098641,45.2462974654,4.65115146795,082020
2019IFqKx3KHz000,Marché,Travaux,Travaux de désamiantage,26/08/2020,491525.0,Ferme,OFFICE PUBLIC DE L'HABITAT de l'AISNE,49.5679878475,3.62136068206,PME,90.5737095794595,50.3338484774,3.34090287517,082020
2020130015543700,Marché,Services,Services de nettoyage de parkings,07/08/2020,492172.0,Révisable,"Ministère de la Transition Écologique et Solidaire, Ministère de la Cohésion des Territoires - Direction Interdépartementale des Routes Est",48.6900671002,6.17594832427,PME,46.31922208733306,49.1081027833,6.19595351042,082020
2019_GIwnK4Wib00,Marché,Fournitures,Fournitures orthopédiques,11/08/2020,4923.0,Ferme et actualisable,Centre hospitalier de Boulogne sur mer Service Economique,50.7270459478,1.60607177999,GE,223.98419353610046,48.8231210367,2.26445901319,082020
2020Ub6KYkXHBd00,Marché,Travaux,Travaux de construction d'immeubles collectifs,20/08/2020,492548.0,Ferme et actualisable,Côte d'Azur Habitat (OPAM de Nice),43.7123384529,7.23750191149,PME,10.430592738420065,43.671853349,7.1522919117,082020
2020ZggyHbpiZF00,Marché,Services,"Services d'évacuation des eaux usées et d'élimination des déchets, services d'hygiénisation et services relatifs à l'environnement",17/08/2020,493074.0,Révisable,SIAH des vallées du Croult et du Petit Rosne,48.9660729815,2.43480854616,GE,17.043399291833452,48.8727847696,2.31253091684,082020
20202020T1230300,Marché,Travaux,Travaux de menuiserie,25/08/2020,49315.28,Ferme,Ministères sociaux,45.8391553925,4.99733131758,PME,25.329883273393595,45.6395492264,5.108702258,082020
20202020F1298400,Marché,Fournitures,Consommables médicaux autres que chimiques à usage unique et consommables hématologiques,25/08/2020,49387.33,Ferme,CHU RENNES,48.111571436,-1.68168588816,ETI,464.2870734005487,48.9073106793,2.44007227598,082020
2020151010654400,Marché,Services,Services d'ingénierie,17/08/2020,49425.0,Révisable,"Ministère de la Transition Écologique et Solidaire, Ministère de la Cohésion des Territoires - Directions Interdépartementales des Routes Méditerranée",43.3117424276,5.37932471314,ETI,161.32662353897211,43.6605965642,3.96304340941,082020
20202020F1204200,Marché,Fournitures,Analyseurs,11/08/2020,49473.98,Ferme,"Institut national de recherche pour l’agriculture, l’alimentation et l’environnement",48.8562037309,2.3121193117,NC,,,,082020
201811/22200,Marché,Services,Services de conseil en architecture,20/08/2020,49492.0,Révisable,COMMUNE NOGENT LE ROTROU,48.3172382455,0.804097274803,PME,98.92671797485129,47.5814306941,1.30596722868,082020
2020F0224APATS00,Marché,Fournitures,Compresseurs d'air,13/08/2020,49524.0,Ferme,SM EAUX ASSAINISSEMENT ALSACE MOSELLE,48.6117085666,7.74585158102,PME,602.5204286420159,48.7498603402,2.29906093692,082020
2020TGTg-ukTqW00,Marché,Travaux,Travaux de construction de bâtiments destinés aux services de secours,10/08/2020,49532.0,Révisable,SDIS de l'Isère,45.192971981,5.67744958928,PME,4.21510805883084,45.1549989093,5.67502244415,082020
20202020T1194600,Marché,Travaux,Travaux de plomberie,10/08/2020,4955.11,Ferme et actualisable,"Ministère de la Transition Écologique, Ministère de la Cohésion des Territoires, Ministère de la Mer - Conservatoire de l'Espace Littoral et des Rivages Lacustres",45.9425259054,-0.972397591834,PME,33.71381257980098,46.186866944,-1.1526001159,082020
20202b-Z76tcfR00,Marché,Services,"Services d'évacuation des eaux usées et d'élimination des déchets, services d'hygiénisation et services relatifs à l'environnement",17/08/2020,496100.0,Révisable,SIAH des vallées du Croult et du Petit Rosne,48.9660729815,2.43480854616,ETI,7.327668213044998,49.0240206283,2.46634275596,082020
20202000021300,Marché,Travaux,"Travaux d'installation de matériel de chauffage, de ventilation et de climatisation",18/08/2020,49644.83,Ferme et actualisable,Ville de Nimes,43.8445331544,4.34760475323,NC,601.7749840714827,48.8365394869,2.2389245247,082020
20182018-20-0601,Marché,Travaux,Travaux de construction,13/08/2020,49761.5,Révisable,COMMUNAUTE COMMUNES CHATEAUBRIANT-DERV,47.7220962122,-1.38697766124,PME,94.04240365377537,47.0458179875,-0.877097655444,082020
20202020F1198800,Marché,Fournitures,Réactifs et produits de contraste,10/08/2020,497946.44,Révisable,CHR ORLEANS,47.8824665066,1.91660961834,ETI,518.5685222090927,45.1256913332,5.70166045833,082020
20202021S0070500,Marché,Services,Services de conseil en gestion générale,10/08/2020,49800.0,Ferme,RESEAUX DES ACHETEURS HOSPITALIERS,48.8591103086,2.38017728226,ETI,14.497762653206168,48.8983675206,2.25515424076,082020
20201210000,Marché,Travaux,Travaux d'assainissement,28/08/2020,49828.8,Ferme et actualisable,COMMUNAUTE D AGGLOMERATION PAYS BASQUE,43.4922603626,-1.46624377766,NC,5.466194983432765,43.491201999,-1.51566656435,082020
20202020F1679200,Marché,Fournitures,Matériels de radiodiagnostic,04/08/2020,49830.0,Révisable,CHU NICE,43.7123384529,7.23750191149,NC,366.4704168071771,45.8549183057,4.71145136978,082020
2020151006675200,Marché,Fournitures,Clôtures,13/08/2020,49858.0,Ferme et actualisable,Ministère des armées - Etablissement du service d'infrastructure de la défense de Metz - ESID Metz,,,PME,,46.9573754652,6.11777108989,082020
2019_ejVJOvVCj00,Marché,Travaux,Travaux d'installations électriques,11/08/2020,49861.8,Ferme et actualisable,Communauté d' Agglomération de Lens Lievin,50.4372553549,2.82129881832,NC,24.606583470804402,50.3738840638,3.03451117586,082020
2019J_OjVbQwHs00,Marché,Travaux,Travaux de façade,07/08/2020,4988.0,Ferme,SA HLM QUEVILLY HABITAT,49.4094883554,1.03952520974,PME,17.250575602942845,49.3486815164,0.89602518422,082020
2020ZgHJj36T1q00,Marché,Travaux,Travaux de menuiserie,24/08/2020,49898.0,Ferme,VILLE SAINTES,45.7423034662,-0.649840149818,ETI,74.04757897284716,46.3517055816,-0.381350295498,082020
2020990200,Marché,Travaux,Travaux de remise à neuf de conduites d'eau,26/08/2020,49920.0,Ferme,SERVICE DES EAUX,,,NC,,48.7384501677,7.04716136958,082020
20202020F1095400,Marché,Fournitures,Équipement de cuisine,17/08/2020,49921.02,Ferme,"Etablissements et organismes de l'enseignement supérieur, de la recherche et de l'innovation - Centre Régional des oeuvres Universitaires et Scolaires de Lille",50.6317671102,3.04699299406,PME,3.316479733184548,50.6520500829,3.02499832356,082020
20202B010Trv0200,Marché,Travaux,Travaux de construction de passerelles pour piétons,25/08/2020,499225.0,Ferme et actualisable,Commune de MARIPA-SOULA,2.96743529098,-53.7582580953,PME,201.01644437684678,4.83156937433,-52.3435470866,082020
2020130015738400,Marché,Travaux,Travaux de marquage routier,18/08/2020,499594.0,Révisable,"Ministère de la Transition Écologique et Solidaire, Ministère de la Cohésion des Territoires - Direction Interdépartementale des Routes Sud-Ouest",43.5959710776,1.43229743595,NC,8.181168372484109,43.5288972686,1.40201144987,082020
2020000030-03500,Marché,Services,Services d'ingénierie,31/08/2020,49997.5,Ferme,BUDGET PRINCIPAL,44.580393647,6.06471167343,PME,185.39422045438684,45.7533230296,4.86924368009,082020
2020GVivEqo83000,Marché,Fournitures,Consommables médicaux,17/08/2020,5000.0,Ferme,CENTRE HOSPITALIER DE PAU,43.3201640732,-0.3496692279,ETI,674.0705439287907,48.7495659946,2.35212808495,082020
20202020F1158900,Marché,Fournitures,Consommables médicaux,05/08/2020,5000.0,Ferme et actualisable,CH DU MANS,47.9889433531,0.20002401353,PME,705.6604162618729,48.0014591284,6.58149912599,082020
2020151020627600,Marché,Services,Services de conseils financiers,25/08/2020,5000.0,Ferme,"Ministères de l'Économie et des Finances, de l'Action et des Comptes publics - Agence des Participations de l'Etat",48.8348302792,2.42102904428,GE,10.354532684020173,48.8769868607,2.33753841595,082020
20202020F1159400,Marché,Fournitures,Consommables médicaux,05/08/2020,5000.0,Ferme et actualisable,CH DU MANS,47.9889433531,0.20002401353,NC,435.6980365512252,50.6955784111,3.04755809523,082020
202120F1801,Marché,Fournitures,Vêtements de fonction,19/08/2020,50000.0,Ferme,EXERCICE BUDGETAIRE,43.8445331544,4.34760475323,ETI,439.8839667882813,46.8661629253,1.77864373549,082020
2020-OJsNuSTY700,Marché,Fournitures,Matériel de jardinage divers,05/08/2020,50000.0,Révisable,VILLE DE CHELLES,48.8837873385,2.59631331192,NC,21.440053893673415,48.6918752913,2.61487236964,082020
2020EF88fWAIFG00,Marché,Services,Services de conseil en architecture,06/08/2020,50000.0,Révisable,UEM METZ,49.1081027833,6.19595351042,PME,0.0,49.1081027833,6.19595351042,082020
2019-28iicu_Xb00,Marché,Services,Services d'enseignement et de formation,24/08/2020,50000.0,Ferme,OPCO MOBILITES,48.8365394869,2.2389245247,ETI,9.745001449779556,48.8292048923,2.3267445538,082020
2019L7scDK6AiF00,Marché,Services,Services de formation professionnelle,24/08/2020,50000.0,Ferme,OPCO MOBILITES,48.8365394869,2.2389245247,NC,54.857476535669605,49.2760553449,2.46402126163,082020
201918N0770-0000,Marché,Services,Services divers d'entretien et de réparation,07/08/2020,50000.0,Révisable,METROPOLE NICE COTE D'AZUR,43.7123384529,7.23750191149,PME,791.0393114415816,48.9296428406,2.35946866986,082020
2019mM42A7P_Di00,Marché,Services,Services de formation professionnelle,24/08/2020,50000.0,Ferme,OPCO MOBILITES,48.8365394869,2.2389245247,ETI,9.398203232102167,48.8873739998,2.30681348993,082020
2020IBx4JMuE3k00,Marché,Services,Services de gestion d'institutions,24/08/2020,50000.0,Ferme,ESPCI - Ecole Supérieure de Physique et Chimie Industrielles,48.8444087298,2.35049826183,PME,5.997278154505054,48.8635257742,2.40121168869,082020
2019b25DyzQxaF00,Marché,Services,Services d'enseignement supérieur,24/08/2020,50000.0,Ferme,OPCO MOBILITES,48.8365394869,2.2389245247,NC,355.67722880435207,47.2856858419,5.05293981105,082020
2019Gc0SX6K8Vp00,Marché,Services,Services d'enseignement et de formation,24/08/2020,50000.0,Ferme,OPCO MOBILITES,48.8365394869,2.2389245247,ETI,9.398203232102167,48.8873739998,2.30681348993,082020
2020-01000,Marché,Services,,31/08/2020,50000.0,Révisable,SYNDICAT MIXTE DES PORTS DU BASSIN D'A,44.714274952,-0.943875340865,NC,37.50222797297613,44.8792319263,-0.648147734074,082020
2020MkNF7WRolM00,Marché,Services,Services de contrôle et d'essais techniques,07/08/2020,50000.0,Révisable,Ville de Puteaux,48.8836186061,2.23810959636,PME,350.0314270144661,47.3391772539,4.99722409136,082020
2019w1-2U5OX0800,Marché,Services,Services de nettoyage de bureaux,21/08/2020,50000.0,Ferme et actualisable,VILLE DE VERNOUILLET,,,NC,,48.7759550031,1.99412790053,082020
2019p4cSaqZ5J900,Marché,Services,Services de campagne publicitaire,24/08/2020,50000.0,Ferme,Communauté d'Agglomération Centre Martinique CACEM,14.6408734458,-61.069176472,NC,0.0,14.6408734458,-61.069176472,082020
2020Wr8bi9rrIM00,Marché,Services,Services liés aux déchets et aux ordures,24/08/2020,50000.0,Ferme,ESPCI - Ecole Supérieure de Physique et Chimie Industrielles,48.8444087298,2.35049826183,GE,452.1597721387822,45.7016140067,4.94900275462,082020
20191eyeWshBmu00,Marché,Services,Services de formation professionnelle,24/08/2020,50000.0,Ferme,OPCO MOBILITES,48.8365394869,2.2389245247,NC,54.857476535669605,49.2760553449,2.46402126163,082020
202014ACTVX501,Marché,Travaux,Carrelages,25/08/2020,50000.0,Révisable,Ville de CENON Budget Principal,44.8544367823,-0.52152864014,NC,15.347088190978686,44.9696449578,-0.445289589443,082020
2020-ZgW6ogMtI00,Marché,Fournitures,Clés,06/08/2020,50000.0,Révisable,Mairie de Herblay,49.0006773606,2.14983544498,NC,30.056186652338216,48.7501956584,2.25176088201,082020
2019u2NhdQjsqy00,Marché,Services,Services de formation professionnelle,24/08/2020,50000.0,Ferme,OPCO MOBILITES,48.8365394869,2.2389245247,NC,54.857476535669605,49.2760553449,2.46402126163,082020
2020tlDxYsKl6s00,Marché,Fournitures,Matériel de jardinage divers,03/08/2020,50000.0,Ferme et actualisable,MAIRIE DE CAVAILLON,43.8505844003,5.03563866158,GE,7.274623921459638,43.912997088,5.05589953126,082020
202020000110000,Marché,Travaux,"Travaux de construction d'ouvrages de génie civil, excepté ponts, tunnels, puits et passages souterrains",19/08/2020,50000.0,Ferme et actualisable,COMMUNAUTE PARIS SACLAY,48.7002680837,2.18715224978,PME,27.70797672323924,48.8591103086,2.38017728226,082020
202020000170100,Marché,Services,Services de compostage,28/08/2020,50000.0,Ferme et actualisable,COMMUNAUTE PARIS SACLAY,48.7002680837,2.18715224978,PME,497.5699610138906,46.5361019521,6.12755613965,082020
20199biPl5wrXq00,Marché,Services,Services de formation professionnelle,24/08/2020,50000.0,Ferme,OPCO MOBILITES,48.8365394869,2.2389245247,NC,54.857476535669605,49.2760553449,2.46402126163,082020
