2018150916157800,Marché,Fournitures,Matériel de mesure et de contrôle,06/12/2018,18450.0,Ferme,Ministère des armées - Division achats - Toulouse/Balma,,,PME,,48.6811729227,2.1853558178,122018
2018100013294600,Marché,Services,Transport non régulier de passagers,17/12/2018,18455.5,Révisable,Ministère des armées - Direction du Service National et de la Jeunesse - DSNJ,,,GE,,47.9177164808,1.97312389077,122018
2018COM14L900,Marché,Travaux,Travaux de construction de bâtiments liés à la santé,28/12/2018,18476.0,Ferme,MAIRIE D'AUTRANS-MEAUDRE EN VERCORS,45.1320448421,5.5278223312,NC,0.0,45.1320448421,5.5278223312,122018
2018130014029700,Marché,Fournitures,Rations de campagne,18/12/2018,184800.0,Révisable,Ministère des armées - Plate-forme commissariat Rambouillet,,,PME,,47.9086507203,-4.26540205312,122018
2018150912815900,Marché,Travaux,Travaux de gros œuvre,07/12/2018,185002.84,Ferme et actualisable,Ministère de l'Intérieur - SGAMI EST - Metz - DAGF- Marchés Publics,49.1081027833,6.19595351042,PME,33.05171651094581,48.8148405267,6.13956307896,122018
20182018F0118400,Marché,Fournitures,Consommables médicaux,27/12/2018,185122.0,Révisable,HOSPICES CIVILS DE LYON,45.7480493184,4.82567584415,PME,11.945354116514782,45.7860240236,4.92675965549,122018
20190000400,Marché,Fournitures,,18/12/2018,18515.0,Ferme et actualisable,MAIRIE DE LOCTUDY,47.8250665056,-4.18780203809,ETI,444.02873064791663,46.3286026496,-0.464927924553,122018
20182018S1801700,Marché,Services,Services d'assurance dommages ou pertes,05/12/2018,185250.0,Ferme,CHRU TOURS,47.3314668694,0.715972131571,ETI,171.7935700808696,46.3286026496,-0.464927924553,122018
2018PR3500,Marché,Services,Services d'assurance,21/12/2018,18596.14,Ferme,Commune de Scionzier,46.0482394759,6.54705715843,PME,87.32234966702448,45.5837038917,5.90877548323,122018
2018Be1Kk5uuWn00,Marché,Travaux,Travaux de menuiserie et de charpenterie,22/12/2018,186045.0,Révisable,MACON HABITAT,46.320613267,4.81834086547,NC,,,,122018
2018130013989900,Marché,Services,Élimination et traitement des ordures,10/12/2018,18615.5,Révisable,Ministère des armées - Plateforme Achats Finances Nord Est,48.8348302792,2.42102904428,ETI,473.78172572308813,48.5810407171,6.69790218613,122018
20180003600,Marché,Services,Services d'installation de matériel de protection contre l'incendie,21/12/2018,186278.0,Révisable,Communauté d'Agglomération Rambouillet Territoires,48.6537226807,1.82599823389,ETI,89.83688647240932,48.5596804107,1.01907766978,122018
20182018S8011300,Marché,Services,"Services d'architecture, d'ingénierie et de planification",06/12/2018,186720.0,Ferme et actualisable,"Etablissements et organismes de l'enseignement supérieur, de la recherche et de l'innovation - UNIVERSITE DE POITIERS",46.5834165499,0.359436087058,PME,0.0,46.5834165499,0.359436087058,122018
20182018S1340200,Marché,Services,Services d'assurance responsabilité civile,14/12/2018,1869.0,Révisable,"Etablissements et organismes de l'enseignement supérieur, de la recherche et de l'innovation - Université de technologie de Troyes",48.2968506353,4.07801333034,GE,547.9779694818747,46.3286026496,-0.464927924553,122018
20182018F9000300,Marché,Fournitures,Cuves,17/12/2018,18708.09,Ferme,INRAE - Centre ILE-DE-FRANCE VERSAILLES-GRIGNON,48.8022788923,2.11716530117,PME,130.58702309936277,49.3814379486,1.09001869647,122018
20182018F0155600,Marché,Fournitures,Implants chirurgicaux,17/12/2018,1872.45,Ferme,CHU NICE,43.7123384529,7.23750191149,NC,792.7841119041027,48.8365394869,2.2389245247,122018
20182019S0558600,Marché,Services,Services de formation,31/12/2018,18720.0,Ferme,Institut national de recherche en sciences et technologies pour l'environnement et l'agriculture,48.7498603402,2.29906093692,PME,30.317713925574672,49.0209128769,2.27022769527,122018
2018160005025500,Marché,Travaux,Travaux d'isolation thermique,21/12/2018,1872235.72,Révisable,Ministère de l'Intérieur - SGAMI EST - Metz - DAGF- Marchés Publics,49.1081027833,6.19595351042,PME,167.75868294281653,47.7933730823,5.44250999084,122018
20182018S2951800,Marché,Fournitures,Laser chirurgical,20/12/2018,187600.0,Révisable,CHRU LILLE,50.6317671102,3.04699299406,ETI,785.1688102034605,43.6131750772,3.86941278925,122018
20182018S8003600,Marché,Services,Services relatifs à l'environnement,13/12/2018,1876408.0,Révisable,Ministère de la Transition écologique et solidaire - Ministère de la Cohésion des Territoires - Agence de l'Eau Loire Bretagne,47.8824665066,1.91660961834,ETI,407.49094372125415,45.7041579754,4.88121408321,122018
2018lJKch93wg000,Marché,Travaux,Travaux d'aménagement paysager,22/12/2018,187656.0,Révisable,Mairie de Mons en Baroeul,50.6427234653,3.10704546553,PME,11.686602626435842,50.5396002873,3.12763218608,122018
2018110004439000,Marché,Travaux,"Travaux d'installation de clôtures, de garde-corps et de dispositifs de sécurité",18/12/2018,1877623.54,Révisable,Ministère des armées - Etablissement du service d'infrastructure de la défense de Rennes - E...,,,GE,,43.5959710776,1.43229743595,122018
20182018F3780200,Marché,Fournitures,Articles textiles,05/12/2018,187920.0,Révisable,GCS BLANCHISSERIE,45.7480493184,4.82567584415,PME,578.467107063271,50.6120719497,2.95452652696,122018
20182018F0155000,Marché,Fournitures,Produits de nettoyage,19/12/2018,18908.75,Ferme et actualisable,CHU NICE,43.7123384529,7.23750191149,ETI,331.99492127000644,45.7299437905,5.01600256178,122018
20182018T4114700,Marché,Travaux,Travaux de menuiserie,21/12/2018,189595.0,Révisable,"Etablissements et organismes de l'enseignement supérieur, de la recherche et de l'innovation - UNIVERSITE RENNES  II  HAUTE BRETAGNE",48.111571436,-1.68168588816,PME,21.187278396615092,48.2041213664,-1.51423493148,122018
2018160005005500,Marché,Travaux,Réparation de toiture,05/12/2018,189800.0,Ferme et actualisable,Ministère des armées - Etablissement du service d'infrastructure de la défense de Toulon - E...,,,ETI,,47.4470980854,-1.51864718131,122018
2018130014036300,Marché,Fournitures,Appareils de détection et d'analyse,18/12/2018,18988.0,Révisable,Ministère des armées - Plateforme Achats Finances Nord Est,48.8348302792,2.42102904428,PME,16.72173860733657,48.6918192915,2.37437489187,122018
201803201832100,Marché,Services,Services internet,12/12/2018,190000.0,Ferme,Office de l'Environnement de la Corse,42.2703824683,9.08361106614,PME,0.0,42.2703824683,9.08361106614,122018
2018130013949100,Marché,Fournitures,Matériel de télévision et matériel audiovisuel,20/12/2018,190000.0,Révisable,Ministère de l'Europe et des Affaires étrangères -,48.8562037309,2.3121193117,PME,15.067849448719807,48.8631652232,2.4482059517,122018
2018110004470400,Marché,Services,Services de conseils et de représentation juridiques,17/12/2018,190000.0,Ferme et actualisable,"Ministère de l'Économie, des Finances et de la Relance - Agence des Participations de l'Etat",48.8348302792,2.42102904428,PME,17.825084758659127,48.8604673342,2.26190318372,122018
20182018T9003600,Marché,Travaux,Travaux de construction,14/12/2018,190000.0,Révisable,ASSISTANCE PUBLIQUE - HOPITAUX DE PARIS,48.8542874923,2.35759608215,GE,214.81876115812517,50.6603454446,3.04727537116,122018
20182018S1856000,Marché,Services,Services de blanchisserie et de nettoyage à sec,26/12/2018,190000.0,Révisable,"Institut national de recherche pour l’agriculture, l’alimentation et l’environnement",48.8562037309,2.3121193117,GE,11.692011676936863,48.8984598394,2.40893736699,122018
2018130013941100,Marché,Fournitures,Matériel de télévision et matériel audiovisuel,20/12/2018,190000.0,Révisable,Ministère de l'Europe et des Affaires étrangères -,48.8562037309,2.3121193117,PME,15.067849448719807,48.8631652232,2.4482059517,122018
20182019F0600500,Marché,Services,Serveurs informatiques,10/12/2018,1.9E7,Révisable,Union des Groupements d'Achats Publics -,48.8481450572,2.59605262949,ETI,43.35862882764271,48.8963161116,2.20694242609,122018
20180002400,Marché,Fournitures,Essence sans plomb,19/12/2018,19076.0,Révisable,Communauté de Communes du Pays de Landerneau-Daoulas,48.4513322018,-4.2642868735,GE,329.524479877421,47.2321613301,-1.54797539458,122018
2018100013284100,Marché,Fournitures,Pièces pour navires de guerre,13/12/2018,191166.15,Ferme et actualisable,Ministère des armées - Direction du service de soutien de la flotte de Toulon - DSSF Toulon,,,PME,,48.8641878981,2.67661656588,122018
2018110004475000,Marché,Services,"Services d'architecture, d'ingénierie et de planification",19/12/2018,191192.59,Ferme et actualisable,Ministère des armées - Etablissement du service d'infrastructure de la défense de Rennes - E...,,,PME,,47.2321613301,-1.54797539458,122018
20182018T0064800,Marché,Travaux,Travaux de désamiantage,07/12/2018,1916277.0,Révisable,HOSPICES CIVILS DE LYON,45.7480493184,4.82567584415,PME,431.18461016521104,48.729938105,2.32968167157,122018
20182019S6836400,Marché,Services,Services de blanchisserie et de nettoyage à sec,27/12/2018,1916942.0,Révisable,ASSISTANCE PUBLIQUE - HOPITAUX DE PARIS,48.8542874923,2.35759608215,GE,177.0781623518628,47.6110227025,1.35776910185,122018
201918S0079L0300,Marché,Travaux,"Travaux de construction d'établissements sociaux, excepté foyers et structures d'accueil à caractère social",11/12/2018,191756.96,Révisable,Conseil Départemental AM - BP,43.7123384529,7.23750191149,PME,6.739936455977421,43.6865360059,7.18227325545,122018
2018120005967000,Marché,Services,Services de maintenance et de réparation de logiciels,19/12/2018,191835.6,Révisable,Services du Premier ministre - Direction de l'information légale et administrative,48.840040811,2.29268840406,PME,5.432460945950832,48.8625262113,2.33630086089,122018
2018100013320900,Marché,Services,"Services de technologies de l'information, conseil, développement de logiciels, internet et appui",31/12/2018,19251.14,Révisable,Services du Premier ministre - Direction de l'information légale et administrative,48.840040811,2.29268840406,ETI,6.168823472973957,48.8951908356,2.28680331405,122018
20182018F0001500,Marché,Fournitures,Analyseur de spectre,04/12/2018,19259.4,Ferme,"Etablissements et organismes de l'enseignement supérieur, de la recherche et de l'innovation - Ec...",48.3775956474,-4.59902956851,PME,756.4844651826882,48.695957442,2.23477492911,122018
20182018S5020300,Marché,Services,Services de contrôle technique de bâtiments,11/12/2018,19300.0,Révisable,"Etablissements et organismes de l'enseignement supérieur, de la recherche et de l'innovation - UNIVERSITE CLAUDE BERNARD LYON 1",45.7708803723,4.88922582274,PME,12.897727166355873,45.7815925046,4.77308706649,122018
20182019S0874100,Marché,Services,Logiciels et systèmes d'information,27/12/2018,1936057.52,Ferme,Ministère de la Culture - ETABLISSEMENT PUBLIC DU MUSEE D'ORSAY ET DU MUSEE DE L'ORANGERIE,48.8562037309,2.3121193117,NC,,,,122018
2018150918473400,Marché,Travaux,Installation d'infrastructures de câblage,17/12/2018,193890.0,Ferme et actualisable,Ministère de l'Intérieur - SGAMI SUD EST -  Lyon - DAGF et DIM,45.7533230296,4.86924368009,NC,13.739113721200932,45.8771763044,4.86757430132,122018
2018150913249200,Marché,Fournitures,Lecteurs de microfilms,06/12/2018,19440.0,Ferme,Ministère de la Culture et de la Communication - Archives nationales de Pierrefitte,48.8628851439,2.35993164253,ETI,469.65331465651633,45.6395492264,5.108702258,122018
201819LOT300,Marché,Fournitures,Accessoires pour matériel audio et vidéo,27/12/2018,19443.0,Ferme,Ville de Saint-Pierre-lès-Elbeuf,49.2781454635,1.04763570328,PME,145.56122844497077,49.177758307,-0.264889603184,122018
20182019F1004100,Marché,Fournitures,Produits de boulangerie,17/12/2018,19461.61,Révisable,"Etablissements et organismes de l'enseignement supérieur, de la recherche et de l'innovation - Ce...",49.4415068863,1.09373273216,ETI,6.698238994107788,49.3814379486,1.09001869647,122018
20182019T0566900,Marché,Travaux,Travaux de restructuration,18/12/2018,19477.0,Ferme et actualisable,CHRU CAEN,49.1850685346,-0.370026383608,PME,300.47534197114874,48.9097290596,2.33319973974,122018
20182018T1934800,Marché,Travaux,Travaux d'installation d'ascenseurs,17/12/2018,19500.0,Ferme,Ministère des armées - Institut supérieur de l'aéronautique et de l'espace,43.5959710776,1.43229743595,NC,11.730579040350976,43.5390131127,1.52156442051,122018
20182019F0003000,Marché,Fournitures,Sel de déneigement,20/12/2018,195000.0,Révisable,Commune de Montmorency,48.9919061028,2.32087713345,NC,582.0565353409047,45.9471804389,6.60712332434,122018
2018S014400,Marché,Services,Services de conseil en développement,28/12/2018,195000.0,Ferme et actualisable,Lille Métropole Habitat,50.6317671102,3.04699299406,ETI,210.6078040209003,48.8951908356,2.28680331405,122018
2018COM16L0900,Marché,Travaux,"Travaux de construction de bâtiments liés à la santé et aux services sociaux, de crématoriums et de toilettes publiques",28/12/2018,1952.0,Ferme,MAIRIE D'AUTRANS-MEAUDRE EN VERCORS,45.1320448421,5.5278223312,PME,20.26138990864375,45.25450698,5.66389708434,122018
20182018F1815800,Marché,Fournitures,Consommables médicaux autres que chimiques à usage unique et consommables hématologiques,03/12/2018,1952.0,Révisable,CHU NANTES,47.2321613301,-1.54797539458,PME,484.62550648613467,48.2599945129,2.71097359584,122018
20182019S0127100,Marché,Services,Services d'assurance,31/12/2018,195345.82,Révisable,CHU GRENOBLE,45.2097006413,5.74400008015,ETI,429.83297707035814,47.1607460183,2.38661400781,122018
20182018T8004100,Marché,Travaux,Travaux d'installations électriques,07/12/2018,19539.3,Ferme,Institut National de la Recherche Agronomique,48.8562037309,2.3121193117,PME,355.1609945039392,45.7981463108,3.23991199443,122018
2019160005053200,Marché,Travaux,Travaux de plâtrerie,31/12/2018,195458.0,Révisable,Ministère de l'Europe et des Affaires étrangères - Sous- direction des opérations immobilières en...,48.840040811,2.29268840406,PME,12.281099838320474,48.8635257742,2.40121168869,122018
2018150912393700,Marché,Services,Services de conseil en bâtiment,01/12/2018,19575.0,Révisable,Ministère des armées - Etablissement du service d'infrastructure de la défense de BREST - ESID Brest,,,PME,,47.7502629938,-3.37883364048,122018
2018TVX260200,Marché,Fournitures,Équipement de parcs et de terrains de jeux,14/12/2018,195857.0,Ferme,VILLE DE PORNICHET,47.2619512895,-2.31411009833,NC,65.96112598122426,47.319310489,-1.72038331143,122018
20182019F0564700,Marché,Fournitures,Instruments de chirurgie dentaire,18/12/2018,1959.99,Ferme,CHU NICE,43.7123384529,7.23750191149,NC,,,,122018
2018100013297300,Marché,Fournitures,"Machines, appareils, équipements et consommables électriques; éclairage",21/12/2018,19629.9,Ferme,Ministère des armées - Direction du service de soutien de la flotte de Brest - DSSF Brest,,,NC,,48.3051824108,-4.14321071816,122018
2018150917919200,Marché,Fournitures,Peintures,12/12/2018,19636.04,Révisable,Ministère de la Justice  - Direction interrégionale des services pénitentiaires de Strasbourg,48.5716343863,7.76783353204,NC,9.572611904266536,48.6395730819,7.71398337003,122018
2018150917254200,Marché,Services,Services de contrôle technique,18/12/2018,19643.0,Révisable,Ministère des armées - Etablissement du service d'infrastructure de la défense de BREST - ESID Brest,,,ETI,,48.7839097374,2.19723411662,122018
20182018S0009900,Marché,Services,"Services d'architecture, services de construction, services d'ingénierie et services d'inspection",21/12/2018,196750.0,Révisable,Communauté urbaine Grand Paris Seine et Oise,48.9628543141,1.84938988584,NC,,,,122018
20182018S0073800,Marché,Services,Maintenance et réparation de matériel informatique,13/12/2018,19700.0,Révisable,CHRU STRASBOURG,48.5716343863,7.76783353204,ETI,614.4772798462518,43.7049292364,5.0885748152,122018
2018120005949800,Marché,Services,Services de réparation et d'entretien des navires de guerre,20/12/2018,1.97003169E7,Révisable,Ministère des armées - Direction du service de soutien de la flotte de Brest - DSSF Brest,,,ETI,,47.8961667158,-3.90749863443,122018
20182018S0077300,Marché,Services,Services de formation de personnel,18/12/2018,197040.0,Ferme,HOSPICES CIVILS DE LYON,45.7480493184,4.82567584415,NC,465.57025118457193,48.9412040612,2.09935987202,122018
20180001700,Marché,Services,Services de formation professionnelle,21/12/2018,1970404.0,Révisable,Région Bretagne,48.111571436,-1.68168588816,NC,,,,122018
2018140500,Marché,Travaux,Travaux de maçonnerie,21/12/2018,19728.0,Ferme,Commune d'Irigny,45.6749007819,4.81741808117,PME,10.086506911750805,45.6680469522,4.9083713349,122018
2018120005950700,Marché,Services,Logiciels et systèmes d'information,21/12/2018,1973143.0,Révisable,Ministère de l'Intérieur - Sous Direction de l'achat - Bureau des marchés publics,48.8348302792,2.42102904428,ETI,16.28997386384504,48.8951908356,2.28680331405,122018
201859775600,Marché,Services,Services d'architecture,11/12/2018,19750.0,Révisable,MAIRIE DU PERRAY-EN-YVELINES,48.6962812628,1.84344970164,PME,46.508369259573264,48.4470919696,1.50577061537,122018
20182018S0146400,Marché,Services,Services financiers et d'assurance,06/12/2018,19764.85,Révisable,CHU REIMS,49.2517771432,4.03968745396,ETI,594.8430355118129,46.3286026496,-0.464927924553,122018
20182018F5017500,Marché,Fournitures,Ustensiles de cuisson,10/12/2018,1980.0,Révisable,CHRU CAEN,49.1850685346,-0.370026383608,NC,382.0486839563026,47.0185257425,2.31002845498,122018
20182018F0147600,Marché,Fournitures,Médicaments du système respiratoire,06/12/2018,198000.0,Révisable,CHRU TOURS,47.3314668694,0.715972131571,ETI,233.99592521574633,48.8212450479,2.20940635474,122018
20182018S9005700,Marché,Services,Services de développement de logiciels de traitement de l'image,24/12/2018,198045.0,Ferme,Ministère des armées - Service hydrographique et océanographique de la Marine,48.3999000994,-4.5027702561,PME,10.928459278268075,48.3775956474,-4.59902956851,122018
20182018S0072700,Marché,Services,"Études de faisabilité, service de conseil, analyse",13/12/2018,19825.0,Ferme et actualisable,HOSPICES CIVILS DE LYON,45.7480493184,4.82567584415,PME,530.6632627571483,47.1718581475,0.24514174955,122018
2018T1700,Marché,Travaux,Travaux de plâtrerie,28/12/2018,19833.0,Ferme,MAIRIE DE LA TALAUDIERE,45.4787027055,4.42386888678,PME,54.31485856436659,45.782504698,4.8089966572,122018
2018100013222300,Marché,Services,Services d'architecture,21/12/2018,19840.0,Révisable,Ministère de la Culture et de la Communication - Direction Régionale des Affaires Culturelles - Bretagne,48.111571436,-1.68168588816,PME,22.78812673929185,48.2976965181,-1.59572101599,122018
2018150917264100,Marché,Fournitures,Équipement de lutte contre l'incendie,03/12/2018,19848.0,Ferme et actualisable,Ministère de l'Intérieur - SGAMI EST - Metz - DAGF- Marchés Publics,49.1081027833,6.19595351042,NC,3.711807511970708,49.1392715622,6.20834665215,122018
20182018T1889600,Marché,Travaux,"Travaux d'installation de matériel de chauffage, de ventilation et de climatisation",21/12/2018,198668.52,Révisable,Chambres de Commerce et d'Industrie,49.9002814748,2.29072265357,PME,0.0,49.9002814748,2.29072265357,122018
20182018F9970100,Marché,Fournitures,Machines diverses à usage spécifique,04/12/2018,19900.0,Ferme,"Institut national de recherche pour l’agriculture, l’alimentation et l’environnement",48.8562037309,2.3121193117,PME,474.63069709747964,47.9422052704,6.50511870882,122018
2019201901L0600,Marché,Fournitures,Serrurerie,14/12/2018,199000.0,Ferme et actualisable,BEAUMONT DE LOMAGNE,43.8771922295,1.01014543977,PME,22.835612586416534,44.0485272709,1.12375558149,122018
2018150918090400,Marché,Services,Services de bases de données,19/12/2018,19901.32,Ferme,Ministère de l'agriculture et de l'alimentation - Bureau de la commande publique et des achats,48.8562037309,2.3121193117,ETI,11.888067003851683,48.8410208466,2.41853928643,122018
20182018S1876900,Marché,Services,Services d'assurance,27/12/2018,19908.0,Révisable,Ministère de la Culture - THEATRE NATIONAL DE L'ODEON,48.8491121687,2.33284677548,NC,3.461155147630267,48.8727847696,2.31253091684,122018
20182018S5023600,Marché,Fournitures,Appareils extincteurs,13/12/2018,19922.0,Ferme et actualisable,"Etablissements et organismes de l'enseignement supérieur, de la recherche et de l'innovation - UNIVERSITE DE BRETAGNE SUD",47.7502629938,-3.37883364048,PME,630.6754917457458,48.8963161116,2.20694242609,122018
20182018T4112800,Marché,Travaux,Travaux de gros œuvre,21/12/2018,199260.22,Révisable,"Etablissements et organismes de l'enseignement supérieur, de la recherche et de l'innovation - CNRS Délégation Provence et Corse",43.2343813418,5.45258699132,NC,48.97092747552758,43.088993223,5.87078606863,122018
2018170009068000,Marché,Services,Services de formation professionnelle,18/12/2018,199300.0,Ferme,"Ministères de l'Économie et des Finances, de l'Action et des Comptes publics - Institut de la Ges...",48.8472864945,2.43799511731,PME,14.16026078611552,48.8727847696,2.31253091684,122018
2018180280200,Marché,Travaux,Travaux de plomberie,17/12/2018,19935.0,Ferme,Mairie d'Arcachon,44.6533552987,-1.17457729954,NC,10.81493230821086,44.5561843175,-1.17512066596,122018
20198TCP04L4R200,Marché,Services,Services de transport des ordures ménagères,20/12/2018,199396.0,Révisable,AGGLOMERATION D AGEN,44.2024640047,0.625844587118,PME,4.248766085182608,44.1701823435,0.646347618819,122018
2018TCP04L4R100,Marché,Services,Services de transport des ordures ménagères,20/12/2018,199396.0,Révisable,AGGLOMERATION D AGEN,44.2024640047,0.625844587118,PME,4.248766085182608,44.1701823435,0.646347618819,122018
20182019F4000500,Marché,Fournitures,Imprimés et produits connexes,17/12/2018,19988.0,Révisable,CH PONTOISE,49.05076192,2.09381827831,ETI,35.33338927278203,48.8760781984,2.36069992794,122018
20189FbkBhYMFi00,Marché,Travaux,Travaux d'aménagement du terrain,22/12/2018,199944.55,Révisable,OISE HABITAT,49.2530176025,2.48395578599,GE,172.02965578001675,49.2517771432,4.03968745396,122018
20182019S0126800,Marché,Services,Services de conseil juridique,07/12/2018,2.0,Révisable,CHU GRENOBLE,45.2097006413,5.74400008015,PME,121.33586203436658,45.782504698,4.8089966572,122018
20182019S0126900,Marché,Services,Services de conseil juridique,07/12/2018,2.0,Révisable,CHU GRENOBLE,45.2097006413,5.74400008015,PME,115.85276760751856,45.7333494426,4.83733100241,122018
20182018S0126700,Marché,Services,Services de conseil juridique,07/12/2018,2.0,Révisable,CHU GRENOBLE,45.2097006413,5.74400008015,PME,115.85276760751856,45.7333494426,4.83733100241,122018
20182018F1816000,Marché,Fournitures,Consommables médicaux autres que chimiques à usage unique et consommables hématologiques,03/12/2018,200.0,Révisable,CHU NANTES,47.2321613301,-1.54797539458,PME,484.62550648613467,48.2599945129,2.71097359584,122018
20182018S0029000,Marché,Services,Services de réparation et d'entretien de matériel médical,21/12/2018,2000.0,Révisable,CHRU CAEN,49.1850685346,-0.370026383608,NC,269.18177539771955,48.7796502574,2.02991602442,122018
20182019F7902100,Marché,Fournitures,Housses de microscope,04/12/2018,2000.0,Révisable,ASSISTANCE PUBLIQUE DES HOPITAUX DE MARSEILLE,43.2924013477,5.39786536432,PME,310.1230106598731,45.9486076632,4.52129321421,122018
20182018S0030800,Marché,Services,Services de réparation et d'entretien de matériel médical,24/12/2018,20000.0,Révisable,CHRU CAEN,49.1850685346,-0.370026383608,PME,938.7598703299615,43.1924821857,5.61223397006,122018
201800004000,Marché,Services,Transport non régulier de passagers,13/12/2018,20000.0,Ferme,Mairie de Nieppe,50.6991288082,2.8326772944,PME,13.252793671608046,50.6546277212,2.72149275254,122018
