2019000000004900,Marché,Travaux,Travaux de construction de lignes électriques,28/06/2019,258894.8,Ferme et actualisable,SYANE,45.9184078015,6.06302741902,PME,19.888782006380374,45.7899368483,5.93731889614,062019
2019wAK08YluEd00,Marché,Travaux,Travaux de restructuration,07/06/2019,25894.77,Ferme et actualisable,OPH Saumur Habitat,47.2672558506,-0.0826431573603,PME,13.970703378600518,47.2477512059,0.0421684280105,062019
2019130014543800,Marché,Fournitures,Produits pharmaceutiques,19/06/2019,259.22,Révisable,Ministère des armées - Direction des Approvisionnements en produits de santé des armées,,,GE,,48.8695044166,2.17789004853,062019
2019M1912200,Marché,Travaux,Travaux de construction d'arrêts de tramway,14/06/2019,259024.72,Révisable,ORLEANS METROPOLE,47.8824665066,1.91660961834,GE,401.5263099019825,45.820656077,4.8987353728,062019
2019JhEymmH2p200,Marché,Services,Services de réparation et d'entretien,14/06/2019,2594430.0,Révisable,Brest Métropole Habitat,48.3999000994,-4.5027702561,NC,0.0,48.3999000994,-4.5027702561,062019
2019V1902900,Marché,Fournitures,Électricité,21/06/2019,25950.0,Ferme et actualisable,VILLE DE CHOLET,47.0458179875,-0.877097655444,GE,71.64261448144863,47.3015616292,-1.47168011724,062019
2018I4a8YBM0e000,Marché,Travaux,Travaux de façade,12/06/2019,25953.11,Ferme et actualisable,DSIUD - Direction des systèmes d information et des usages digitaux,45.7480493184,4.82567584415,PME,130.22766158492328,45.02773512,3.89608931701,062019
2018AG004302,Marché,Travaux,Travaux de peinture de bâtiments,26/06/2019,25978.45,Révisable,DEPARTEMENT DE L'ISERE,45.1821782198,5.72099089704,NC,3.9373762841262745,45.1470636912,5.71546169286,062019
20192019F1258100,Marché,Fournitures,Articles textiles divers,18/06/2019,2600.0,Révisable,ASSISTANCE PUBLIQUE DES HOPITAUX DE MARSEILLE,43.2924013477,5.39786536432,PME,869.8779644555972,50.6991288082,2.8326772944,062019
20170125f5a00100,Marché,Services,Prestations de services pour la collectivité,28/06/2019,2600.0,Révisable,VOSGELIS,48.162954598,6.47953209434,PME,86.32034778424266,48.3367171447,5.71859029021,062019
20192019-5800,Marché,Fournitures,Aménagements divers,20/06/2019,26000.0,Ferme,DEPARTEMENT DE LA MARNE,48.9641633923,4.37882582203,NC,230.49969878895575,48.9346127594,2.29454165622,062019
2018UnkLM1-9lD00,Marché,Services,Réalisation et entretien d'espaces verts,24/06/2019,26000.0,Révisable,Centre Hospitalier de l'Estran,48.5688153061,-1.48703619198,ETI,18.482291311762527,48.5257756757,-1.32559930784,062019
2019170009362800,Marché,Services,Services de crèches et garderies d'enfants,11/06/2019,260000.0,Ferme,Ministère de l'Intérieur - Préfecture Ile de France 1,48.840040811,2.29268840406,NC,10.963819112184515,48.8123578699,2.3878497256,062019
2019MAPA1200,Marché,Travaux,Travaux d'aménagement paysager de jardins,24/06/2019,26047.0,Ferme et actualisable,1-BUDGET PRINCIPAL,44.8833318393,-0.784280122922,GE,60.88261551205078,44.9131126685,-0.234493624606,062019
2019iS3h0y9sBF00,Marché,Travaux,Travaux de désamiantage,17/06/2019,26052.0,Révisable,Département de l Indre Direction des Routes des Transports du Patrimoine et de l Education,46.8031778361,1.69389403678,PME,4.266450983809258,46.8405744553,1.70241320085,062019
2019150951572200,Marché,Travaux,Travaux de menuiserie,26/06/2019,26065.6,Ferme et actualisable,Ministère des armées - Etablissement du service d'infrastructure de la défense de BREST - ESID Br...,,,PME,,47.6787186638,-2.94580723576,062019
2019j-LxwS1Pfq00,Marché,Travaux,Travaux de peinture,18/06/2019,26066.35,Ferme et actualisable,Sèvre Loire Habitat,47.0458179875,-0.877097655444,PME,26.461218698079595,47.0059352266,-0.641182697402,062019
20191900501,Marché,Fournitures,Produits agrochimiques,18/06/2019,2610.0,Ferme et actualisable,Mairie d'Arcachon,44.6533552987,-1.17457729954,ETI,92.00168738038467,44.872035748,-0.372192330388,062019
2019150949552100,Marché,Services,Services d'ingénierie géotechnique,21/06/2019,26100.0,Ferme et actualisable,Ministère de la Transition écologique et solidaire - Ministère de la Cohésion des Territoires - D...,47.2551269927,6.0192810348,ETI,100.29243004514397,47.319158519,5.11462472428,062019
2018JLLHJq0qY800,Marché,Services,"Services de technologies de l'information, conseil, développement de logiciels, internet et appui",03/06/2019,26100.0,Révisable,,48.8964004469,2.15330952483,PME,231.90212634130083,50.7259486198,3.15990429501,062019
2018o0VRcDcQQ800,Marché,Travaux,Travaux de construction de bâtiments destinés aux institutions d'ordre public ou aux services de secours et de bâtiments militaires,11/06/2019,261200.0,Ferme et actualisable,Vannes Golfe Habitat,47.6599029362,-2.75681901002,PME,7.365348066806525,47.7239025576,-2.77399820808,062019
201912703,Marché,Travaux,Travaux de gros œuvre,27/06/2019,261531.02,Révisable,BUDGET PRINCIPAL,48.7640654352,5.16324051275,PME,40.0694433531355,48.5517433482,5.45649786497,062019
2019001LOT106,Marché,Travaux,,06/06/2019,261561.0,Révisable,COMMUNE DE VILLEMANDEUR,47.9830661878,2.70456448727,PME,14.140051768043065,47.8625325618,2.66382107623,062019
20192123200,Marché,Fournitures,Matériel d'enseignement,26/06/2019,26158.0,Ferme,Collectivité Territoriale de Guyane,5.03107464278,-52.5193923736,PME,28.550052949450883,4.8842283494,-52.2790571265,062019
2019rG-UuXDwDv00,Marché,Services,"Services d'architecture, services de construction, services d'ingénierie et services d'inspection",24/06/2019,26160.0,Ferme,MANCHE HABITAT,49.1097135871,-1.07754504719,NC,0.0,49.1097135871,-1.07754504719,062019
201919S0180L0000,Marché,Services,Services artistiques,28/06/2019,26190.0,Ferme,Conseil Départemental AM - BP,43.7123384529,7.23750191149,NC,10.430592738420065,43.671853349,7.1522919117,062019
20192019S1181600,Marché,Services,"Études de faisabilité, service de conseil, analyse",06/06/2019,26200.0,Ferme,Institut Français de Recherche pour l’Exploitation de la MER,48.8231210367,2.26445901319,NC,,,,062019
2019R_6iFrJw2n00,Marché,Fournitures,Fauteuils dentaires,26/06/2019,26250.0,Ferme,,46.0450564645,4.08007309055,PME,60.6765433491531,45.5349733012,4.27704758323,062019
20191367200,Marché,Services,Services sociaux pour les personnes handicapées,14/06/2019,262640.0,Révisable,"Etablissements et organismes de l'enseignement supérieur, de la recherche et de l'innovation - CN...",48.8604673342,2.26190318372,PME,11.062471031162879,48.9371223842,2.3256448828,062019
20191419100,Marché,Services,Services de maintenance préventive,12/06/2019,262800.0,Révisable,CHU NANTES,47.2321613301,-1.54797539458,GE,463.5228212262304,48.8562037309,2.3121193117,062019
2018iFfqrQrepQ00,Marché,Fournitures,Fournitures de bureau,06/06/2019,26299.0,Révisable,Centre Hospitalier Emile Roux,45.02773512,3.89608931701,ETI,440.77207245404145,47.4522451178,0.742849330797,062019
20192019T1252000,Marché,Travaux,Travaux de désamiantage,11/06/2019,26315.0,Ferme,"Etablissements et organismes de l'enseignement supérieur, de la recherche et de l'innovation - UN...",44.8578964782,-0.57357535767,ETI,12.331911084172813,44.8323242505,-0.682089528902,062019
2018012a08900600,Marché,Travaux,Travaux de chantier,25/06/2019,2634.0,Ferme,Commune VIERZON,47.2370821272,2.07892537933,PME,40.31743530006837,47.0747420182,2.40492134914,062019
201963945900,Marché,Fournitures,Serrurerie,03/06/2019,26342.0,Ferme et actualisable,Ville de Saint Sébastien sur Loire,47.2029731421,-1.49984554901,PME,18.96073744118899,47.3183639634,-1.62601344229,062019
201964557800,Marché,Services,Services liés aux déchets et aux ordures,27/06/2019,263550.0,Révisable,Préval Haut-Doubs,46.911819238,6.38871615294,ETI,0.0,46.911819238,6.38871615294,062019
20192019S1278900,Marché,Services,Services de reliure,19/06/2019,26360.0,Révisable,Ministère de la Culture - Bibliothèque publique d'information,48.8542874923,2.35759608215,PME,375.2344790416377,46.4935853187,-0.0653392490944,062019
20191056703,Marché,Travaux,Travaux de construction de parkings,27/06/2019,263721.1,Ferme,BUDGET PRINCIPAL,50.2899236486,2.76642705397,NC,4.3891235342954,50.2582331244,2.79009311526,062019
20192019S1652300,Marché,Services,Services de nettoyage,26/06/2019,2640.0,Révisable,ASSISTANCE PUBLIQUE - HOPITAUX DE PARIS,48.8542874923,2.35759608215,ETI,687.2422587144519,43.3211830233,-0.401824113107,062019
20192019S1303500,Marché,Services,"Études de faisabilité, service de conseil, analyse",27/06/2019,26400.0,Ferme,CH DU MANS,47.9889433531,0.20002401353,NC,256.18484570049003,48.8769868607,2.33753841595,062019
20192019S0878400,Marché,Services,Services de réparation et d'entretien de chauffage central,01/06/2019,2641882.0,Révisable,ASSISTANCE PUBLIQUE - HOPITAUX DE PARIS,48.8542874923,2.35759608215,GE,11.33302799142047,48.9346127594,2.29454165622,062019
2019150947380400,Marché,Services,Services de recherche de la pollution,04/06/2019,26420.0,Ferme,Ministère des armées - Etablissement du service d'infrastructure de la défense de Rennes - ESID R...,,,PME,,48.111571436,-1.68168588816,062019
201905001,Marché,Travaux,Travaux de menuiserie,28/06/2019,26430.92,Ferme et actualisable,BUDGET PRINCIPAL,42.9653610948,1.61016305727,PME,66.8013681962644,43.5288972686,1.40201144987,062019
20194594510000,Marché,Fournitures,Éclairage public,24/06/2019,2643710.5,Révisable,Ville de Marcoussis,48.6462245529,2.20638698084,ETI,7.975462594953481,48.6853914588,2.26680092682,062019
20192020F0598800,Marché,Fournitures,Produits pharmaceutiques,01/06/2019,264616.76,Révisable,CH VALENCIENNES,50.3591232468,3.51599087764,ETI,220.41301800383954,48.7495659946,2.35212808495,062019
201818VV02901,Marché,Travaux,Travaux de construction complète ou partielle et travaux de génie civil,19/06/2019,264952.65,Ferme et actualisable,Ville de Versailles,48.8022788923,2.11716530117,PME,576.8873150044832,45.4596412394,6.11160050683,062019
2017011f0eb00100,Marché,Services,Prestations de services pour la collectivité,28/06/2019,2650.0,Révisable,VOSGELIS,48.162954598,6.47953209434,PME,86.32034778424266,48.3367171447,5.71859029021,062019
2018AOO0406/0100,Marché,Fournitures,Produits alimentaires divers,12/06/2019,26500.0,Révisable,IMES PROISY,49.889947594,3.75359976993,NC,193.89255119234747,48.8282706469,2.362358986,062019
2018611401,Marché,Travaux,Travaux routiers,04/06/2019,265000.0,Ferme,BUDGET ZAC,,,NC,,50.2582331244,2.79009311526,062019
2019130014476700,Marché,Fournitures,Pièces détachées et accessoires pour véhicules et moteurs de véhicules,04/06/2019,265000.0,Révisable,Ministère de l'Intérieur - SGAMI OUEST - Rennes - Bureau Zonal des Achats et des Marchés Publics,48.075697512,-1.72369525238,ETI,95.20730879621043,47.2246985502,-1.63426478543,062019
2019130014504800,Marché,Fournitures,"Matériels médicaux, pharmaceutiques et produits de soins personnnels",13/06/2019,265146.67,Révisable,Ministère des armées - Direction des Approvisionnements en produits de santé des armées,,,ETI,,48.7495659946,2.35212808495,062019
20192019F1214000,Marché,Fournitures,Installations de chaudières,17/06/2019,26528.0,Ferme,Chambres de Commerce et d'Industrie,49.1097135871,-1.07754504719,NC,238.903179004792,49.4244508808,1.05966183652,062019
20192019T1191200,Marché,Travaux,Travaux de désamiantage,07/06/2019,26562.0,Ferme,Ministère de l'agriculture et de l'alimentation - Ecole Nationale Supérieure de Formation de l&#0...,43.5287987563,1.48771594314,PME,56.632420958007415,44.0225624278,1.36375484401,062019
2019iiAF7F3fU100,Marché,Services,"Services récréatifs, culturels et sportifs",28/06/2019,26580.0,Révisable,Mairie de Fos sur Mer,43.4556743263,4.90422543761,PME,84.08674483845476,43.3606473433,5.65862551732,062019
2019130014542800,Marché,Fournitures,Produits pharmaceutiques,16/06/2019,266.0,Révisable,Ministère des armées - Direction des Approvisionnements en produits de santé des armées,,,PME,,48.8604673342,2.26190318372,062019
20192019S1267900,Marché,Services,Services de santé et de sécurité,21/06/2019,2660.0,Ferme,"Etablissements et organismes de l'enseignement supérieur, de la recherche et de l'innovation - Un...",5.03107464278,-52.5193923736,NC,7299.46553139041,48.7728906673,2.07603849225,062019
20192019S2833200,Marché,Services,Services de maintenance préventive,05/06/2019,26600.0,Révisable,CH VALENCIENNES,50.3591232468,3.51599087764,NC,223.6363300406177,48.729938105,2.32968167157,062019
2019-oeKOZHYKE00,Marché,Travaux,Travaux de construction,19/06/2019,26600.0,Ferme et actualisable,Brest Métropole Habitat,48.3999000994,-4.5027702561,PME,13.711942142146649,48.4258947716,-4.62399409096,062019
2019130014445600,Marché,Services,Services de formation professionnelle,04/06/2019,266400.0,Révisable,Ministère des armées - Plate-forme commissariat Ouest,,,NC,,45.6973573688,5.9042177358,062019
2019170009370700,Marché,Travaux,Travaux de maçonnerie,05/06/2019,26664.0,Révisable,Ministère des armées - Direction des Approvisionnements en produits de santé des armées,,,PME,,48.8511697506,2.47460350341,062019
20192019F1297100,Marché,Fournitures,Gaz médicaux,27/06/2019,26664.0,Révisable,CHU REIMS,49.2517771432,4.03968745396,GE,196.02480987688097,48.8562037309,2.3121193117,062019
20193100,Marché,Services,Services d'arpentage cadastral,19/06/2019,266666.68,Révisable,BUDGET PRINCIPAL,43.3201640732,-0.3496692279,PME,176.65827250156008,44.8792319263,-0.648147734074,062019
20192020S0048500,Marché,Services,Services de développement des applications serveur internet ou intranet,20/06/2019,266922.0,Ferme,Ministère des armées - Service hydrographique et océanographique de la Marine,48.3999000994,-4.5027702561,GE,744.764310642496,48.9262855146,2.21169941044,062019
20191407700,Marché,Travaux,Travaux de réfection,28/06/2019,267029.95,Ferme,"Etablissements et organismes de l'enseignement supérieur, de la recherche et de l'innovation - UN...",47.7502629938,-3.37883364048,NC,5.863467175262445,47.7840114084,-3.41959465982,062019
2019CpN9UOuCrU00,Marché,Services,Services de réparation et d'entretien de matériel de restauration,26/06/2019,26740.0,Ferme et actualisable,Mairie de Maisons-Alfort,48.8060849119,2.43798340413,NC,10.256570519477734,48.8637518036,2.51036788744,062019
2019ZilJq3J-4B00,Marché,Travaux,Travaux d'assainissement,13/06/2019,267718.25,Révisable,Communauté d'agglomération Privas Centre Ardèche,44.7218752388,4.59409820072,ETI,17.400180842908142,44.7518807792,4.74854269239,062019
2018AoYDgrE7Jl00,Marché,Travaux,Travaux de désamiantage,11/06/2019,267841.0,Révisable,13 HABITAT,43.3066947635,5.4011177563,PME,95.7763085485133,43.7941219042,4.68611607169,062019
20192019S1191800,Marché,Services,Services de maintenance de systèmes,07/06/2019,26800.0,Révisable,Université Sorbonne Paris Nord,48.9567644994,2.34523261958,PME,35.253959118390554,48.9238114722,2.02813940207,062019
20192019T0006201,Marché,Travaux,Travaux d'entretien routier,19/06/2019,268600.0,Révisable,VILLE DE MONTIGNY LE BRETONNEUX,48.7796502574,2.02991602442,NC,3.1242406214929432,48.758778972,2.04882028884,062019
2019TE3jKSJvY300,Marché,Travaux,Travaux de construction,28/06/2019,26888.02,Ferme,BROQUIES,44.0178497566,2.70688377169,PME,12.074537346077578,44.0510320467,2.81085687843,062019
201917080200,Marché,Services,,04/06/2019,269494.0,Ferme,S.I.A.V,50.3453304924,3.54897300193,PME,17.682812244119486,50.26453794,3.41120199918,062019
2018GTqBtE7eof00,Marché,Travaux,Travaux de construction de routes,13/06/2019,2698000.0,Révisable,Service de la Commande Publique,-21.3061462696,55.6419447038,GE,43.94287461567443,-20.9441421191,55.3050347414,062019
20192019T0071000,Marché,Travaux,Travaux routiers,27/06/2019,269855.33,Ferme et actualisable,Communauté urbaine Grand Paris Seine et Oise,48.9628543141,1.84938988584,NC,7.719891991930158,48.9890049642,1.91405725676,062019
2019150948970000,Marché,Services,Services de publicité,14/06/2019,2700.0,Ferme,Ministère des armées - Structure Spécialisée d'achat et de Mandatement 33 504,,,ETI,,48.840040811,2.29268840406,062019
20192019.12.EM00,Marché,Travaux,Travaux de construction de bâtiments,25/06/2019,27000.0,Ferme et actualisable,COMMUNE DE CURTAFOND,46.2728729659,5.10268251089,PME,17.51083687820833,46.2047217001,5.24553216043,062019
20192019T1266200,Marché,Fournitures,,13/06/2019,27000.0,Ferme,"Etablissements et organismes de l'enseignement supérieur, de la recherche et de l'innovation - UN...",44.8578964782,-0.57357535767,NC,533.6665982291464,48.7839097374,2.19723411662,062019
2019130014548600,Marché,Fournitures,Distributeurs de boissons,25/06/2019,27000.0,Révisable,Ministère de la Justice  - Directcion interrégionale des services pénitentiaires de Rennes,48.111571436,-1.68168588816,NC,161.72042799050104,47.6596179005,-3.07176634278,062019
20192019S1338000,Marché,Services,Services de conception de sites WWW (World Wide Web),25/06/2019,27000.0,Révisable,Chambres de Commerce et d'Industrie,48.5716343863,7.76783353204,PME,103.10803460298486,47.7492339521,7.32544621628,062019
2018hAlLtwp3A000,Marché,Fournitures,Mobilier de bureau,03/06/2019,27000.0,Ferme,,48.8964004469,2.15330952483,PME,43.48251829945395,48.6293513055,2.44049035394,062019
20181rXrXlpUpW00,Marché,Services,Services d'appui dans le domaine des transports terrestres,18/06/2019,2700000.0,Révisable,Tours Métropole Val de Loire,47.3980773574,0.696151819266,PME,247.19645797319941,48.8591103086,2.38017728226,062019
20192020F0770700,Marché,Fournitures,Produits pharmaceutiques,11/06/2019,27026.0,Révisable,CH VALENCIENNES,50.3591232468,3.51599087764,NC,216.51135350341588,48.8836186061,2.23810959636,062019
20192019F1255900,Marché,Fournitures,Mobilier d'accueil et de réception,17/06/2019,270743.71,Ferme et actualisable,CH DU MANS,47.9889433531,0.20002401353,PME,217.13111948804965,48.2124043822,-1.75071247399,062019
2019uwvYvNw2Ok00,Marché,Fournitures,Serrurerie,27/06/2019,27075.0,Ferme,VOSGELIS,48.162954598,6.47953209434,PME,20.677775940065427,48.045929391,6.62535454112,062019
2018vsU5Fc3gQP00,Marché,Fournitures,Rayonnages mobiles,14/06/2019,27124.0,Ferme,Service D�partemental Incendie et  Secours Eure et Loir - SDIS 28,48.4470919696,1.50577061537,NC,244.64814584605324,50.3013363055,2.69542314327,062019
20192019F1193300,Marché,Fournitures,Gaz industriels,12/06/2019,27128.57,Ferme,"Etablissements et organismes de l'enseignement supérieur, de la recherche et de l'innovation - EC...",45.4301960415,4.37808697748,NC,48.59244386419229,45.3440873298,4.80893485558,062019
20192020F0712700,Marché,Fournitures,Produits pharmaceutiques,01/06/2019,27159.74,Révisable,CH VALENCIENNES,50.3591232468,3.51599087764,PME,227.46594330833196,48.7273690549,2.27501219877,062019
2019130014583500,Marché,Fournitures,Produits pharmaceutiques,28/06/2019,2719.0,Révisable,Ministère des armées - Direction des Approvisionnements en produits de santé des armées,,,ETI,,48.8983675206,2.25515424076,062019
20189pXd7PSC-x00,Marché,Travaux,Travaux de plomberie,26/06/2019,272000.0,Ferme,FDI HABITAT,43.6131750772,3.86941278925,PME,20.809672531292833,43.6974017809,4.03751702306,062019
2019130014544800,Marché,Fournitures,"Produits de panification, pâtisserie fraîche et gâteaux",27/06/2019,272000.0,Révisable,Ministère des armées - Plate-forme commissariat Ouest,,,PME,,47.8986932363,-3.5879358446,062019
20192019F1281300,Marché,Fournitures,Microscopes,24/06/2019,272037.0,Ferme,"Etablissements et organismes de l'enseignement supérieur, de la recherche et de l'innovation - UN...",46.5834165499,0.359436087058,ETI,882.9955719900781,49.0186680541,7.96145730305,062019
2019K162600,Marché,Services,Services d'exploitation de salles de spectacles,11/06/2019,27225.6,Ferme,Ville de Lyon,45.7700265344,4.82839245881,NC,442.0792073674919,48.8231210367,2.26445901319,062019
201900PA19-07300,Marché,Travaux,Travaux de fouille et de terrassement,03/06/2019,27235.0,Révisable,BUDGET PRINCIPAL,44.580393647,6.06471167343,NC,16.456960910949338,44.579843826,6.21352529442,062019
2018_EaBxlxafB00,Marché,Travaux,Travaux de construction,03/06/2019,27270.0,Ferme,Office de Tourisme Communautaire Rambouillet Territoires (OTCRT),48.6537226807,1.82599823389,PME,0.0,48.6537226807,1.82599823389,062019
20192019F0923700,Marché,Fournitures,Produits alimentaires divers,21/06/2019,27285.0,Ferme et actualisable,Ministère de l'agriculture et de l'alimentation - FranceAgriMer,48.8631652232,2.4482059517,ETI,16.50774603293746,48.7495659946,2.35212808495,062019
20192019F1248900,Marché,Fournitures,Matériel informatique,19/06/2019,27296.41,Ferme,"Etablissements et organismes de l'enseignement supérieur, de la recherche et de l'innovation - CN...",43.6276961423,7.02943470458,PME,163.95597342290597,43.1924821857,5.61223397006,062019
2019261MT102L000,Marché,Fournitures,Canalisations d'eau,06/06/2019,27300.0,Ferme,SYNDICAT DES EAUX DE LA REGION DE TINT,48.3605992638,-1.86935856936,NC,28.474563505233544,48.1542418257,-1.71705508926,062019
2019wBlZefe8Ud00,Marché,Travaux,Travaux de démolition,20/06/2019,27335.0,Ferme et actualisable,COMMUNE DE MAUBEUGE,50.2843741775,3.96274549268,ETI,10.178190235910048,50.296463295,3.87150570177,062019
20192019T1311600,Marché,Travaux,Travaux d'installation de matériel de climatisation,12/06/2019,27353.29,Ferme,Chambres de Commerce et d'Industrie,44.8578964782,-0.57357535767,NC,664.1405231737509,43.4500011794,5.26335968091,062019
2019qoX5kg1B_x00,Marché,Travaux,Travaux de plomberie,26/06/2019,27361.25,Révisable,HAUTE CORREZE COMMUNAUTE,45.5501002764,2.30483831309,PME,0.0,45.5501002764,2.30483831309,062019
20192017F0007900,Marché,Services,,27/06/2019,2.7375E7,,Ministère des armées - Service des Essences des Armées,,,NC,,,,062019
2019180005508100,Marché,Services,Services d'incendie,24/06/2019,2738485.08,Révisable,Ministère de la Transition écologique et solidaire - Ministère de la Cohésion des Territoires - S...,48.8836186061,2.23810959636,NC,20.941835738057428,48.8348302792,2.42102904428,062019
2019uCIpOM9lkc00,Marché,Travaux,Travaux de pose de plaques de plâtre,07/06/2019,27385.0,Ferme et actualisable,DSIUD - Direction des systèmes d information et des usages digitaux,45.7480493184,4.82567584415,PME,87.41370532820885,45.2147483891,5.40785071092,062019
