20202020S0591800,Marché,Services,Services de développement de logiciels de bureautique,22/04/2020,24000.0,Révisable,CHU GRENOBLE,45.2097006413,5.74400008015,PME,228.54133127820387,47.2551269927,6.0192810348,042020
2018pglfSz9OGz00,Marché,Fournitures,Papier d'impression,07/04/2020,24000.0,Révisable,OPHEOR,46.0450564645,4.08007309055,ETI,481.2455737233174,50.3453304924,3.54897300193,042020
2019vyrxrlOqrh00,Marché,Services,Services de réparation et d'entretien de véhicules et d'équipements associés et services connexes,06/04/2020,24000.0,Révisable,SDIS 44 Loire Atlantique,47.3030353752,-1.56014129347,NC,18.708110716094193,47.1602431078,-1.47084254473,042020
2019WENcH0BTap00,Marché,Travaux,Travaux de construction de centres de secours des sapeurs-pompiers,21/04/2020,24000.0,Révisable,SDIS 79 Deux Sèvres,46.3517055816,-0.381350295498,NC,95.26306186619414,45.7167180504,0.19621019901,042020
2018_BV6EPbala00,Marché,Services,Services liés aux déchets et aux ordures,06/04/2020,24000.0,Ferme,S.E.P.R,45.7533230296,4.86924368009,PME,2.945363556998541,45.7708803723,4.88922582274,042020
2019JAY7ECovm900,Marché,Services,Services de réparation et d'entretien de véhicules et d'équipements associés et services connexes,03/04/2020,24000.0,Révisable,SDIS 44 Loire Atlantique,47.3030353752,-1.56014129347,PME,21.420851550317373,47.1936820357,-1.71957284121,042020
2019B_lkdP0Nlu00,Marché,Fournitures,Livres de bibliothèque,07/04/2020,24000.0,Révisable,Conseil Départemental du Cantal-CD15,44.9245183348,2.4417949992,PME,0.0,44.9245183348,2.4417949992,042020
2018fDMQYPHjjg00,Marché,Travaux,Réparation et entretien d'infrastructures sportives,07/04/2020,24000.0,Ferme et actualisable,Ville d'ISSOUDUN,46.9485742584,2.00001011262,PME,0.0,46.9485742584,2.00001011262,042020
2020170009935400,Marché,Services,Services de formation,08/04/2020,24000.0,Ferme,Ministère de la Transition écologique et solidaire - Ministère de la Cohésion des Territoires - Centre Ministériel de Valorisation des Ressources Humaines,48.8836186061,2.23810959636,PME,560.4177197647953,45.4918364872,5.9917260608,042020
2018S5nOQ4EoaD00,Marché,Fournitures,Matériel de bureau,07/04/2020,24000.0,Révisable,COVALDEM 11,43.2093616677,2.34379884342,ETI,303.6386762711513,43.9281862792,4.99304878863,042020
2018BaOOrGCxNV00,Marché,Fournitures,Équipement de culture physique,07/04/2020,24000.0,Révisable,SDIS de l'Isère,45.192971981,5.67744958928,PME,695.0492876433377,50.7271428993,2.73769160094,042020
2020151002482900,Marché,Travaux,Travaux de réfection,22/04/2020,24000.0,Ferme et actualisable,Ministère des armées - Etablissement du service d'infrastructure de la défense de Metz - ESID Metz,,,NC,,47.5232642825,6.84402162872,042020
2018_NaDQADjDy00,Marché,Fournitures,Livres de bibliothèque,06/04/2020,24000.0,Ferme,Conseil Départemental de la Charente-Maritime-cg17,46.1619512738,-1.1749922971,PME,156.7869281677766,45.6475513407,0.144999112457,042020
2018CSLy-aZziQ00,Marché,Services,Services de contrôle technique,07/04/2020,240000.0,Révisable,ENAC Ecole Nationale de l'Aviation Civile,43.5959710776,1.43229743595,GE,429.84713767365724,43.3654982005,5.31265000369,042020
2020g4-Fe6qmSd00,Marché,Fournitures,Médicaments divers,10/04/2020,240000.0,Révisable,Centre Hospitalier de Versailles,48.8268542784,2.12982235179,NC,,,,042020
20191xKLoT30Ou00,Marché,Services,Services de réparation et d'entretien de véhicules à moteur et d'équipements connexes,07/04/2020,240000.0,Révisable,AGGLOMERATION MAUBEUGE VAL DE SAMBRE (AMVS),50.2843741775,3.96274549268,GE,94.59489472422449,50.5876380348,3.16339877343,042020
20193JceL-sSxY00,Marché,Services,Services de réparation et d'entretien de véhicules et d'équipements associés et services connexes,01/04/2020,240000.0,Révisable,SDIS 44 Loire Atlantique,47.3030353752,-1.56014129347,PME,45.19915738970526,47.0812376302,-1.21771018277,042020
2018G9_fhAni1f00,Marché,Fournitures,"Papiers à usage graphique, ni couchés ni enduits",06/04/2020,240000.0,Révisable,Mairie Saint-Maur-des-Fossés,48.7987986059,2.49441281984,ETI,24.097702674346074,48.5862081061,2.452303526,042020
2018LVhyNf8nBC00,Marché,Fournitures,Conteneurs et poubelles de déchets,07/04/2020,240000.0,Révisable,COVALDEM 11,43.2093616677,2.34379884342,NC,393.25760563419357,45.7333494426,4.83733100241,042020
20180Zf-x6qi5B00,Marché,Fournitures,Sel de déneigement,05/04/2020,240000.0,Révisable,Conseil Départemental de la Charente-Maritime-cg17,46.1619512738,-1.1749922971,PME,733.2738666363572,43.8505844003,5.03563866158,042020
20202002702,Marché,Travaux,Travaux de maçonnerie,22/04/2020,240000.0,Ferme,14BUDGET PRINCIPAL SIX FOURS,43.0866539393,5.82934646655,PME,4.58994868076846,43.088993223,5.87078606863,042020
20197sh7QosZRA00,Marché,Services,Services d'abonnement,10/04/2020,240000.0,Ferme,CENTRE HOSPITALIER DE PAU,43.3201640732,-0.3496692279,PME,671.5261912607173,48.7498603402,2.29906093692,042020
2020M20111R00,Marché,Fournitures,Conteneurs et poubelles de déchets,08/04/2020,240000.0,Révisable,ORLEANS METROPOLE,47.8824665066,1.91660961834,NC,606.4982450671585,47.782180039,7.40026744431,042020
20202020F0586000,Marché,Fournitures,Consommables médicaux,22/04/2020,240000.0,Révisable,CHRU MONTPELLIER,43.6131750772,3.86941278925,PME,285.8028892760037,43.5571578176,1.28536950712,042020
2020L2103A00,Marché,Services,Services de formation informatique,07/04/2020,240000.0,Révisable,Ville de Lyon,45.7700265344,4.82839245881,NC,4.186807216118752,45.7333494426,4.83733100241,042020
20183aIeWedh_h00,Marché,Services,Prestations de services pour la collectivité,07/04/2020,240000.0,Révisable,VILLE DE CHELLES,48.8837873385,2.59631331192,PME,37.06867441991058,48.8604673342,2.26190318372,042020
20202020S0670700,Marché,Services,Services de maintenance de systèmes,27/04/2020,240000.0,Révisable,Chambres de Commerce et d'Industrie,41.9349194014,8.70135284615,NC,0.0,41.9349194014,8.70135284615,042020
2018yAjtxL2dWN00,Marché,Travaux,Location de machines et de matériel de construction et de génie civil avec opérateur,01/04/2020,240000.0,Révisable,Département de l Indre Direction des Routes des Transports du Patrimoine et de l Education,46.8031778361,1.69389403678,PME,129.17126571177945,47.9495651276,1.8781912297,042020
2019V8D0051AJD00,Marché,Services,Services de conseils et de représentation juridiques,21/04/2020,240000.0,Révisable,EXERCICE 2020,43.6131750772,3.86941278925,PME,611.1884216007006,48.8873739998,2.30681348993,042020
202019V1603-0201,Marché,Fournitures,"Produits antiparasitaires, insecticides et insectifuges",06/04/2020,240000.0,Révisable,MAIRIE DE NICE,43.7123384529,7.23750191149,PME,388.27946194795624,46.3073320754,4.8751649707,042020
20202020J400000,Marché,Fournitures,Articles textiles divers,22/04/2020,240000.0,Ferme,MAIRIE ANNECY BUDGET PRINCIPAL,45.8900209706,6.12570413482,PME,199.86686649934967,45.4301960415,4.37808697748,042020
20192fmv4um6y000,Marché,Services,,06/04/2020,240000.0,Révisable,Communauté d'agglomération ARCHE Agglo,45.0289889617,4.81934000613,PME,2.7695307416432624,45.0536048017,4.81515587637,042020
2018R8ZfH7-xRA00,Marché,Fournitures,Articles et équipements de sport,07/04/2020,240000.0,Révisable,Mairie Saint-Maur-des-Fossés,48.7987986059,2.49441281984,ETI,691.2509218129624,43.3079059302,5.43964465576,042020
2019FyWhtf32Dm00,Marché,Fournitures,Ascenseurs,14/04/2020,240000.0,Révisable,OPHEA,48.5716343863,7.76783353204,NC,24.216278242084247,48.7558785488,7.64880489227,042020
20191909800,Marché,Travaux,Travaux d'assainissement,23/04/2020,2400000.0,Révisable,AURAY QUIBERON TERRE ATLANTIQUE,47.6674184229,-2.99019865229,ETI,213.39235464250214,48.6889710585,-1.35674833511,042020
2020077 2019L202,Marché,Travaux,Travaux de pose de conduites,16/04/2020,2400000.0,Ferme et actualisable,SYNDICAT EAU 47,,,PME,,44.0485272709,1.12375558149,042020
2020077 2019L102,Marché,Travaux,Travaux de pose de conduites,15/04/2020,2400000.0,Ferme et actualisable,SYNDICAT EAU 47,,,PME,,44.4246950004,0.741983078815,042020
2020130015294400,Marché,Travaux,Travaux de marquage routier,21/04/2020,2400000.0,Révisable,Ministère de la Transition écologique et solidaire - Ministère de la Cohésion des Territoires - Directions Interdépartementales des Routes Méditerranée,43.3117424276,5.37932471314,NC,782.5277945568205,43.3495190114,-1.69735242699,042020
2020C04900,Marché,Fournitures,Chèques-repas,24/04/2020,2400000.0,Révisable,BUDGET PRINCIPAL,43.9256996046,2.14745941954,ETI,544.271503746222,48.8164012464,2.29603611202,042020
2019Lm-njEmZif00,Marché,Services,Services de réparation et d'entretien de matériel de détection de gaz,10/04/2020,2400000.0,Révisable,Centre Hospitalier de Versailles,48.8268542784,2.12982235179,NC,8.853544622465256,48.7839097374,2.19723411662,042020
2018wV3A7kunMt00,Marché,Travaux,Travaux routiers,07/04/2020,2.4E7,Révisable,Mairie d'Aix en Provence,43.5360639608,5.39837823449,NC,17.71804808609744,43.4500011794,5.26335968091,042020
20201120000169,Marché,Fournitures,Consommables dentaires,03/04/2020,240009.99,Révisable,VILLE DE PARIS BUDGET PRINCIPAL,48.8542874923,2.35759608215,NC,439.7275676321618,45.8448431471,4.9408752362,042020
2019XseKVDxE_F00,Marché,Services,Services d'architecture,01/04/2020,24024.0,Révisable,COMMUNE DE MOISSAC,44.1257908601,1.09800782288,PME,52.902143235784436,44.2024640047,0.625844587118,042020
2018f35Pix8eLM00,Marché,Fournitures,"Granulés, gravillons, sable fin, cailloux, gravier, pierraille et pierre concassée, mélanges de pierres, de grave et autres agrégats",07/04/2020,24081.0,Révisable,Conseil Départemental du Cantal-CD15,44.9245183348,2.4417949992,GE,48.66888163262386,45.3560467942,2.51489795355,042020
20202020S0753500,Marché,Services,Services de formation professionnelle,06/04/2020,2410252.88,Ferme et actualisable,Ministères sociaux,14.6408734458,-61.069176472,PME,8.472233380404282,14.6246455763,-60.9935529523,042020
2018m2rx4DmVZD00,Marché,Services,Services d'architecture,07/04/2020,241606.72,Révisable,SOLOREM,48.6900671002,6.17594832427,PME,137.14347268311298,47.6463850599,6.84549855352,042020
20197hvAitir9800,Marché,Travaux,Travaux de construction,08/04/2020,241637.83,Révisable,3F NORD ARTOIS,50.6322610395,3.15284231203,PME,9.55452958946484,50.6546146137,3.06940961222,042020
202071136600,Marché,Travaux,Travaux d'isolation thermique,28/04/2020,241799.0,Ferme et actualisable,EVOLEA,46.5622744929,3.32725048972,ETI,247.0200935149831,46.6748755197,5.55822712075,042020
2018wB6RWRe57D00,Marché,Fournitures,Matériel d'ostéosynthèse,07/04/2020,2418.0,Ferme et actualisable,HOPITAL NORD OUEST - VILLEFRANCHE SUR SAONE,45.9909873528,4.68779445054,ETI,49.47421666425095,45.7541566032,5.06691649154,042020
2018wSXRiXwMX100,Marché,Services,Services de gardiennage,06/04/2020,2419143.0,Révisable,CAF MARSEILLE,43.344864211,5.39338098888,ETI,19.624420578079334,43.2936269646,5.56325220466,042020
2019oH7vIwXz9y00,Marché,Travaux,Travaux de construction de centres de secours des sapeurs-pompiers,09/04/2020,24195.28,Ferme et actualisable,SDIS 42 Loire,45.4301960415,4.37808697748,PME,31.126390426950632,45.4225909055,4.65946350803,042020
2019EfurkWbFQs00,Marché,Travaux,Travaux de remise en état et de remise à neuf,24/04/2020,24200.4,Ferme et actualisable,MANCHE HABITAT,49.1097135871,-1.07754504719,PME,14.378063161334854,48.9944828198,-1.13632657673,042020
2019-025-L403,Marché,Travaux,Travaux de terrassement,17/04/2020,242000.0,Révisable,COMMUNE LE POIRE-SUR-VIE,46.7703000469,-1.5050352442,PME,25.945526101144747,46.672862822,-1.29186798708,042020
20189GgMr32tpz00,Marché,Travaux,Travaux de plomberie,16/04/2020,242080.14,Révisable,HAUTE CORREZE COMMUNAUTE,45.5501002764,2.30483831309,PME,0.0,45.5501002764,2.30483831309,042020
2018d9jrbm4sYG00,Marché,Travaux,Travaux de construction,07/04/2020,24225.64,Révisable,Commune de Lys-Haut-Layon,47.1373667168,-0.559735227248,PME,7.336272960152813,47.186996479,-0.516080719733,042020
201907031007B05,Marché,Travaux,Travaux de construction d'ouvrages,14/04/2020,242443.91,Révisable,Budget Principal,47.2801589313,-2.25106183059,PME,89.48250077481624,47.3571579493,-1.44553530068,042020
20189wjvRbC8ON00,Marché,Travaux,Travaux de construction,07/04/2020,24245.0,Révisable,CC du Grand Pic Saint Loup,43.769526913,3.8699877137,PME,15.113781786094997,43.6886301371,3.97989482138,042020
20191ztS9UHXbv00,Marché,Travaux,Travaux de couverture et travaux d'autres corps de métier spécialisés,28/04/2020,242617.0,Ferme,Mairie de Herblay,49.0006773606,2.14983544498,NC,38.47625955671133,48.6899445585,2.30269723379,042020
2018-TMPZTUx7x00,Marché,Services,Services de réparation et d'entretien de matériel de restauration,07/04/2020,242816.0,Révisable,Commune VIERZON,47.2370821272,2.07892537933,PME,28.825076379307987,47.1698787883,2.33068767079,042020
2019062-2019L201,Marché,Travaux,Travaux de construction de stations d'épuration des eaux usées,02/04/2020,242925.0,Ferme,SYNDICAT EAU 47,,,NC,,44.791939845,-0.675986855592,042020
201918N0851-0401,Marché,Travaux,Installation de matériel d'éclairage public,27/04/2020,243141.7,Révisable,METROPOLE NICE COTE D'AZUR,43.7123384529,7.23750191149,GE,6.739936455977421,43.6865360059,7.18227325545,042020
2018YXne0EWXkl00,Marché,Services,Services d'assurance de biens,05/04/2020,24330.55,Révisable,SDIS 05 Hautes Alpes,44.580393647,6.06471167343,NC,750.9602544405208,50.6546146137,3.06940961222,042020
2019dousson0101,Marché,Fournitures,Électricité,10/04/2020,243384.6,Révisable,COMMUNE d' AUREC SUR LOIRE,45.3688560708,4.20438272746,PME,20.379539953083036,45.4301960415,4.37808697748,042020
20202020T0633800,Marché,Fournitures,Cloisons,24/04/2020,24344.16,Révisable,"Etablissements et organismes de l'enseignement supérieur, de la recherche et de l'innovation - CNRS Délégation Occitanie Est",43.6131750772,3.86941278925,PME,57.39171586504515,43.3922196149,3.40027116486,042020
2020120006789100,Marché,Services,Services d'envoi,29/04/2020,243477.0,Ferme,Ministère de l'agriculture et de l'alimentation - Bureau de la commande publique et des achats,48.8562037309,2.3121193117,GE,9.690556062345621,48.8123578699,2.3878497256,042020
2018cxAKNGR4wh00,Marché,Fournitures,Glissières de sécurité,07/04/2020,243750.0,Révisable,Conseil Départemental du Cantal-CD15,44.9245183348,2.4417949992,PME,507.7546099501033,48.7999534195,0.0183069623484,042020
2019KkRc1WqeFT00,Marché,Travaux,Travaux de construction,08/04/2020,243910.08,Révisable,3F NORD ARTOIS,50.6322610395,3.15284231203,PME,13.604195902187955,50.6955784111,3.04755809523,042020
2019p3M7C5EKFx00,Marché,Travaux,Travaux de réparation de routes,06/04/2020,24394.0,Ferme et actualisable,COMMUNE DE CHIRAC BELLEVUE,45.4525426144,2.30751779768,PME,26.018663654074174,45.2187973874,2.3165802982,042020
2018YyAZ1FK3MR00,Marché,Fournitures,Pièces détachées et accessoires pour véhicules et moteurs de véhicules,07/04/2020,24398.0,Révisable,Conseil Départemental du Cantal-CD15,44.9245183348,2.4417949992,ETI,0.0,44.9245183348,2.4417949992,042020
2020100014473100,Marché,Services,Services d'ingénierie,09/04/2020,244029.0,Révisable,Etablissement du service d'infrastructure de la défense de Toulon - ESID Toulon,,,ETI,,48.7796502574,2.02991602442,042020
2018xCECkuIwZM00,Marché,Fournitures,Pièces détachées et accessoires pour véhicules et moteurs de véhicules,07/04/2020,24469.0,Révisable,Conseil Départemental du Cantal-CD15,44.9245183348,2.4417949992,PME,325.29542471961327,47.6267715984,1.31849348356,042020
20202020T0704800,Marché,Travaux,Travaux d'équipement électrique,20/04/2020,244995.2,Ferme,CHU SAINT ETIENNE,45.4301960415,4.37808697748,PME,0.0,45.4301960415,4.37808697748,042020
20202020S0411900,Marché,Services,Services liés aux déchets et aux ordures,01/04/2020,245.99,Révisable,Ministère de l'agriculture et de l'alimentation - FranceAgriMer,48.8631652232,2.4482059517,PME,424.3752203554309,45.0587396139,2.15871759765,042020
2018WSkCn7gou300,Marché,Travaux,Travaux de construction,05/04/2020,245003.0,Révisable,Ville de Bayeux,49.2783343531,-0.705198916376,PME,277.5465747140485,49.768793024,1.75580883211,042020
2018qzZQ9aHD4g00,Marché,Travaux,Travaux d'aménagement paysager d'espaces verts,07/04/2020,24504.6,Ferme,SECOMILE,49.019805962,1.14132572141,PME,21.93512394005917,49.1923676945,1.23716430337,042020
2018oZxv6gm_PV00,Marché,Services,"Études de faisabilité, service de conseil, analyse",02/04/2020,24550.0,Ferme,Grand Paris Sud Est Avenir,48.783689162,2.4549804713,PME,13.713120948217693,48.8628851439,2.35993164253,042020
2020120006731300,Marché,Services,Logiciels de bases de données et d'exploitation,01/04/2020,2455093.33,Révisable,Ministère des armées - Service Parisien de Soutien de l'Administration Centrale - SPAC,,,NC,,48.8348302792,2.42102904428,042020
2018LrnI6e48Uc00,Marché,Travaux,Travaux de peinture,16/04/2020,245636.32,Révisable,HAUTE CORREZE COMMUNAUTE,45.5501002764,2.30483831309,PME,93.40643456843084,45.7859001722,3.11559551839,042020
2019xRoPl-kd4u00,Marché,Services,Réalisation et entretien d'espaces verts,07/04/2020,2456800.0,Révisable,FLERS AGGLO,48.7400079375,-0.562173805455,NC,50.67030714057243,49.1733150775,-0.421782322253,042020
20202020F0510700,Marché,Fournitures,Imprimés et produits connexes,14/04/2020,24598.4,Révisable,CHU SAINT ETIENNE,45.4301960415,4.37808697748,ETI,270.5812182361762,47.4025964667,2.94243562953,042020
2018zD86U7TfUb00,Marché,Fournitures,,05/04/2020,2460.0,Révisable,Communauté d' Agglomération de Lens Lievin,50.4372553549,2.82129881832,NC,49.05220378862907,50.5679015971,2.39759897123,042020
2020wZN_4kkop-00,Marché,Services,Services de télécommunications,27/04/2020,24600.0,Révisable,OPH de l'Agglomération d'Epinal,48.162954598,6.47953209434,GE,469.0436790977461,48.840040811,2.29268840406,042020
2018hXLBb9Rfcu00,Marché,Services,Distribution d'eau et services connexes,07/04/2020,2461.2,Ferme et actualisable,CPCAM Bouches du Rhone,43.2343813418,5.45258699132,ETI,717.1925446876604,48.9325906584,2.3996121008,042020
20190201201902,Marché,Travaux,Travaux de démolition,27/04/2020,246250.0,Ferme,COMMUNE DE LA DESIRADE,16.3114570341,-61.052978658,ETI,60.17717596756976,16.2515819199,-61.5922344723,042020
2018yQrsqLDeON00,Marché,Services,Services de transport routier public,07/04/2020,246267.0,Révisable,Conseil Départemental du Cantal-CD15,44.9245183348,2.4417949992,PME,45.394172993637845,45.3308184409,2.48090792595,042020
20202020S0497000,Marché,Services,"Services de technologies de l'information, conseil, développement de logiciels, internet et appui",03/04/2020,24650.0,Ferme,"Institut national de recherche pour l’agriculture, l’alimentation et l’environnement",48.8562037309,2.3121193117,PME,32.34599189842662,48.7796502574,2.02991602442,042020
2020100014458600,Marché,Services,Services d'hygiénisation d'installations,09/04/2020,24650.0,Ferme et actualisable,Ministère de la Transition écologique et solidaire - Ministère de la Cohésion des Territoires - Secrétariat Général,48.8836186061,2.23810959636,PME,8.432806281241081,48.9346127594,2.29454165622,042020
2019djon9YsYPf00,Marché,Fournitures,Microphones et haut-parleurs,07/04/2020,24654.0,Ferme,DAPJ,48.8491121687,2.33284677548,NC,23.781475761923918,48.8815252308,2.54542992924,042020
20192019OM0200,Marché,Travaux,Travaux de terrassement,06/04/2020,246884.0,Révisable,CCPR BUDGET ORDURES MENAGERES,46.0437305067,6.30022971427,NC,7.330898251921793,46.0976518953,6.33874914636,042020
2018yI5wrH15m000,Marché,Services,Services d'analyses,06/04/2020,247.5,Ferme et actualisable,MANCHE HABITAT,49.1097135871,-1.07754504719,NC,75.68335396953886,49.2152313192,-0.40138132268,042020
2018fyx_2i44cq00,Marché,Fournitures,Conduites d'eau potable,06/04/2020,247258.0,Ferme et actualisable,Commune de Thonon-les-Bains,46.3713202371,6.48296533168,NC,941.6850011756094,48.0447898404,-1.86532998666,042020
20202020S0185000,Marché,Services,Services de conseil en matière d'ingénierie et de construction,08/04/2020,24727.5,Révisable,La Ville d'Antony,48.7498603402,2.29906093692,PME,38.23000964235845,48.8339644354,2.63428680138,042020
2020130015302500,Marché,Services,Services d'analyses,07/04/2020,24734.0,Révisable,Ministère de la Transition écologique et solidaire - Ministère de la Cohésion des Territoires - Direction Interdépartementale des Routes Nord-Ouest,49.4415068863,1.09373273216,NC,174.19037874696394,48.6293513055,2.44049035394,042020
2018XCLtKkVvGf00,Marché,Services,Services d'assistance dans le domaine de l'ingénierie,05/04/2020,24750.0,Ferme,Communauté d' Agglomération de Lens Lievin,50.4372553549,2.82129881832,ETI,182.23099004223093,48.8983675206,2.25515424076,042020
201871a6bV0TH900,Marché,Services,Services d'action sociale et services connexes,06/04/2020,247500.0,Révisable,Département de l Indre Direction des Routes des Transports du Patrimoine et de l Education,46.8031778361,1.69389403678,PME,0.0,46.8031778361,1.69389403678,042020
2018gFCIgvPfES00,Marché,Fournitures,Installations de climatisation,07/04/2020,24756.0,Ferme,VIALIS SAEM,48.1100979739,7.3849252282,PME,564.4916788209995,48.8625262113,2.33630086089,042020
2019wxcQpsoJjY00,Marché,Services,Services d'entretien de l'éclairage public,02/04/2020,247566.0,Ferme et actualisable,Tours Métropole Val de Loire,47.3980773574,0.696151819266,NC,,,,042020
2019md-DKJEvi900,Marché,Services,"Services d'architecture, d'ingénierie et de planification",03/04/2020,24775.0,Ferme,Mairie de Colomiers,43.611577156,1.32726979619,PME,599.1371161192819,48.9412040612,2.09935987202,042020
201700150000,Marché,Fournitures,Structures et pièces structurelles,17/04/2020,247761.9,Ferme,COMMUNAUTE PARIS SACLAY,48.7002680837,2.18715224978,NC,22.66718649981589,48.657035519,2.38747793366,042020
2018013197600100,Marché,Fournitures,Moniteurs à écran tactile,30/04/2020,24786.0,Ferme,GIP MIPIH,43.5959710776,1.43229743595,PME,590.032050094116,48.8426287239,2.20839539221,042020
2020jtEHCrjsmW00,Marché,Services,Services immobiliers,15/04/2020,248000.0,Révisable,DM - Direction des mobilités,45.7480493184,4.82567584415,ETI,443.23006002075425,48.840040811,2.29268840406,042020
