20211868200,Marché,Services,Services de formation professionnelle,06/04/2021,31200.0,Révisable,Délégation Pays de la Loire,47.4766284713,-0.556089456786,NC,167.49356388631725,47.6433648412,0.949341264545,042021
20212021S0228800,Marché,Services,Services de conseil et d'évaluation,15/04/2021,31200.0,Révisable,Conseil Régional d'Ile-de-France,48.8562037309,2.3121193117,PME,5.572916273896129,48.8604673342,2.26190318372,042021
2021TOITALBIN200,Marché,Travaux,Travaux de charpente et de couverture et travaux connexes,22/04/2021,31210.0,Révisable,Mairie de Castres,43.6156093545,2.23815569342,NC,89.13491036305474,43.5959710776,1.43229743595,042021
20218r9m-vJviV00,Marché,Travaux,Travaux de pose de revêtements de sols souples,02/04/2021,31222.0,Révisable,Commune de Soucieu-en-Jarrest,45.6770079662,4.69244184904,PME,26.518262308804108,45.4648248577,4.80286553171,042021
2021INVIT100,Marché,Services,Services de création et d'interprétation d'œuvres artistiques et littéraires,19/04/2021,31250.0,Ferme,OT,43.5690320446,4.07634585671,PME,188.59084923091032,44.358571606,2.56667306391,042021
2021M210043400,Marché,Services,Réalisation et entretien d'espaces verts,30/04/2021,31300.0,Révisable,CONSEIL DEPARTEMENTAL DES PYRENEES-ORIENTALES,42.6966171788,2.89890986886,PME,180.73500217990716,43.7167088105,4.1720446409,042021
2021M003400,Marché,Fournitures,Bitume,01/04/2021,313200.0,Ferme,BUDGET PRINCIPAL CD15,44.9245183348,2.4417949992,GE,62.809844696225106,44.3608465804,2.47683205524,042021
2021M2105300,Marché,Travaux,Travaux de plomberie,30/04/2021,313220.1,Révisable,ACM HABITAT,43.6131750772,3.86941278925,PME,125.00941625968863,43.995554072,4.93274816859,042021
2020iHJ-S8iaJe00,Marché,Fournitures,Consommables médicaux,22/04/2021,313333.42,Ferme,CENTRE HOSPITALIER DE PAU,43.3201640732,-0.3496692279,ETI,674.0705439287907,48.7495659946,2.35212808495,042021
2021250200,Marché,Travaux,Travaux de réfection,08/04/2021,31359.6,Révisable,Maine-et-Loire Habitat,47.4766284713,-0.556089456786,PME,44.17166870221002,47.1155557948,-0.721800013985,042021
2021109100,Marché,Services,Services de conseil en matière de santé et de sécurité,21/04/2021,3136.0,Révisable,TROYES AUBE HABITAT,48.2968506353,4.07801333034,GE,206.55992072927887,48.8873739998,2.30681348993,042021
2020JppCsjthdC00,Marché,Services,Services de contrôle technique de bâtiments,23/04/2021,31400.0,Révisable,Société Immobilière de la Réunion-SIDR,-20.9331856391,55.4471055195,PME,6.715825774837828,-20.9945145041,55.3978899478,042021
2021210020500,Marché,Fournitures,Équipements de protection,26/04/2021,3142.1,Révisable,Département de la Charente,45.6475513407,0.144999112457,GE,53.38023726639962,45.6965325322,-0.335230368086,042021
20212021T0807800,Marché,Travaux,Travaux de menuiserie,21/04/2021,31454.75,Ferme et actualisable,CHU SAINT ETIENNE,45.4301960415,4.37808697748,PME,5.063552740143382,45.4755866683,4.37351328089,042021
2021120007390100,Marché,Services,Maintenance de logiciels de technologies de l'information,16/04/2021,31469.33,Ferme,Ministère de la Culture - ARCHIVES NATIONALES,48.9602089765,2.36360854927,PME,473.35397439260896,47.2321613301,-1.54797539458,042021
2021SONO00,Marché,Fournitures,Matériel d'interphonie,12/04/2021,31470.62,Ferme,Patrimoine SA Languedocienne,43.5959710776,1.43229743595,PME,8.519730325622046,43.6692162286,1.45471819581,042021
2021151063402700,Marché,Travaux,Travaux d'installation d'ascenseurs,14/04/2021,31476.4,Ferme et actualisable,Ministère de la Justice  - Direction interrégionale des services pénitentiaires de Toulouse,43.5959710776,1.43229743595,PME,81.73814521632134,43.5842043433,2.17141000299,042021
2021070200,Marché,Travaux,Travaux de réfection,08/04/2021,314782.34,Révisable,Maine-et-Loire Habitat,47.4766284713,-0.556089456786,GE,103.09914109948899,47.3015616292,-1.47168011724,042021
2021130016513300,Marché,Services,Services de contrôle technique de bâtiments,09/04/2021,3150.0,Ferme,"Ministère de l'Économie, des Finances et de la Relance - Direction départementale de l'Ariège",42.9653610948,1.61016305727,NC,72.87854309815592,43.5959710776,1.43229743595,042021
2021151060438200,Marché,Services,Services de contrôle technique,20/04/2021,3150.0,Révisable,Ministère de la Culture - Direction Régionale des Affaires Culturelles - Ile de France,48.8769868607,2.33753841595,NC,14.599964026095954,48.8963161116,2.20694242609,042021
2020xspSSGPG7s00,Marché,Services,Réalisation et entretien d'espaces verts,26/04/2021,315000.0,Révisable,Commune de Chambourcy,48.8961839233,2.03262969592,NC,0.0,48.8961839233,2.03262969592,042021
20212004400,Marché,Services,Services de télécommunications,09/04/2021,315092.72,Ferme,VILLE DE VESOUL,47.631875925,6.15550489936,GE,447.7091779870113,48.840040811,2.29268840406,042021
20212003600,Marché,Services,Services de télécommunications,08/04/2021,315092.72,Ferme,CAV,47.631875925,6.15550489936,GE,447.7091779870113,48.840040811,2.29268840406,042021
2021200860200,Marché,Travaux,Travaux de remise en état et de remise à neuf,01/04/2021,31514.2,Ferme et actualisable,Ville de Metz,49.1081027833,6.19595351042,PME,21.11208022256004,49.2986904394,6.2041001196,042021
2018eMOTaQ7kxA00,Marché,Travaux,Travaux de menuiserie,30/04/2021,315215.0,Ferme,3F-DGRDI NE,48.8282706469,2.362358986,PME,10.448054475873528,48.8845546351,2.43800840946,042021
2019MXdMq9YErP00,Marché,Fournitures,Cabines,23/04/2021,31525.0,Révisable,Régie des Transports Métropolitains,,,PME,,46.2403879763,-0.218038921082,042021
2020FC02100,Marché,Services,Services de gares routières,15/04/2021,3155070.0,Révisable,GRAND AVIGNON,43.9352959178,4.84131733764,PME,0.0,43.9352959178,4.84131733764,042021
2020.67.0000,Marché,Services,Services de nettoyage et d'hygiène,07/04/2021,315513.6,Ferme et actualisable,NOREVIE,,,NC,,50.6114599415,3.1178549832,042021
2020000001830000,Marché,Travaux,"Travaux de construction, de fondation et de revêtement d'autoroutes, de routes",26/04/2021,315820.7,Ferme,Conseil départemental de la Dordogne,45.1920126931,0.711534338387,NC,21.741481170724853,45.1482419172,0.519912114993,042021
2020dYDIyKTYpN00,Marché,Travaux,Travaux de menuiserie,27/04/2021,31594.0,Révisable,Ardèche Habitat,45.2462974654,4.65115146795,PME,0.0,45.2462974654,4.65115146795,042021
2021A1E01100,Marché,Travaux,Installations de chauffage,29/04/2021,31600.0,Révisable,Département de la Haute-Loire,45.02773512,3.89608931701,GE,632.8685476904373,50.6603454446,3.04727537116,042021
2020VweSkbPHPv00,Marché,Travaux,Travaux de plomberie,09/04/2021,31608.0,Révisable,VOSGELIS,48.162954598,6.47953209434,NC,67.1883577296607,48.7053283146,6.20628313233,042021
202190000392900,Marché,Services,"Autres services communautaires, sociaux et personnels",07/04/2021,31660.0,Ferme,Ville de Gien,47.7121662255,2.66542721165,NC,530.1922985726153,48.6531614353,7.36620137258,042021
20212021F0890000,Marché,Fournitures,Étiquettes autocollantes,27/04/2021,3168.0,Révisable,CHU SAINT ETIENNE,45.4301960415,4.37808697748,PME,144.31573999180588,44.1659555952,4.0744042249,042021
2021MA21004700,Marché,Travaux,Travaux de couverture,28/04/2021,316987.22,Ferme,VILLE DE BERGERAC,44.8541459592,0.486424000322,PME,130.56733618684777,45.6965325322,-0.335230368086,042021
2021SACM00,Marché,Fournitures,Serrurerie,12/04/2021,31726.0,Ferme,Patrimoine SA Languedocienne,43.5959710776,1.43229743595,PME,121.58749363071365,43.2052039598,2.45919218182,042021
20212021T0669900,Marché,Travaux,Travaux d'étanchéification,16/04/2021,31750.0,Ferme,Institut National de l'Environnement Industriel et des Risques,49.2734299978,2.53417955279,PME,473.58358571199153,45.6251855236,4.74987118966,042021
202125400,Marché,Travaux,Travaux de chantier,07/04/2021,31766.0,Ferme,SOCIETE IMMOBILIERE GRAND HAINAUT (SIGH),50.3591232468,3.51599087764,NC,60.064114655498614,50.6317671102,3.04699299406,042021
2020k65MzCyQ3t00,Marché,Fournitures,Consommables médicaux,23/04/2021,3177.0,Ferme,CENTRE HOSPITALIER DE PAU,43.3201640732,-0.3496692279,NC,199.41730555536665,43.5959710776,1.43229743595,042021
20212021T01786,Marché,Travaux,Travaux d'installation de vélums,09/04/2021,318572.0,Ferme et actualisable,VILLE DE PARIS BUDGET PRINCIPAL,48.8542874923,2.35759608215,PME,318.93314558146955,48.0976298874,5.1398599496,042021
2021151060886600,Marché,Travaux,Travaux de gros œuvre,14/04/2021,318637.26,Ferme et actualisable,Ministère de l'Intérieur - Bureau des marchés immobiliers et des moyens généraux,48.8348302792,2.42102904428,NC,10.4443767800442,48.8292048923,2.3267445538,042021
2021100015343200,Marché,Travaux,Travaux de fouille et de terrassement,22/04/2021,318637.5,Ferme et actualisable,"Ministère de la Transition Écologique, Ministère de la Cohésion des Territoires, Ministère de la Mer - Direction Régionale Environnement, Aménagement et Logement de la Normandie",49.4415068863,1.09373273216,NC,14.28577452901719,49.3480832975,1.00514073027,042021
2021CDC21003A00,Marché,Travaux,Travaux de protection des berges,01/04/2021,318650.0,Ferme et actualisable,INTERCOM DE LA VIRE AU NOIREAU,48.8506192378,-0.890964371806,PME,34.195175306224094,48.7252845481,-1.17331064336,042021
2020YOZaRWePAY00,Marché,Services,Services de contrôle technique de bâtiments,23/04/2021,31900.0,Révisable,Société Immobilière de la Réunion-SIDR,-20.9331856391,55.4471055195,PME,6.715825774837828,-20.9945145041,55.3978899478,042021
2020DEnaCLv0pT00,Marché,Services,Services de contrôle technique de bâtiments,23/04/2021,31900.0,Révisable,Société Immobilière de la Réunion-SIDR,-20.9331856391,55.4471055195,PME,6.715825774837828,-20.9945145041,55.3978899478,042021
2020HLx-fq60b600,Marché,Services,Services de contrôle technique de bâtiments,23/04/2021,31900.0,Révisable,Société Immobilière de la Réunion-SIDR,-20.9331856391,55.4471055195,PME,6.715825774837828,-20.9945145041,55.3978899478,042021
2020DxmeLPadxf00,Marché,Travaux,Travaux de câblage et d'installations électriques,01/04/2021,319000.0,Ferme et actualisable,"DJSSH - Direction de la jeunesse, de la santé, du sport et du handicap",45.7480493184,4.82567584415,GE,9.013168755121216,45.6733570262,4.8577653898,042021
20212021T0889100,Marché,Travaux,Travaux de plomberie,26/04/2021,319000.0,Ferme et actualisable,HOSPICES CIVILS DE LYON,45.7480493184,4.82567584415,GE,24.36786182064643,45.7908704388,5.04180920984,042021
2021120007456400,Marché,Services,Services de nettoyage,01/04/2021,31913.18,Révisable,Ministère de l'Intérieur - Région de Gendarmerie - RGRA Lyon,,,ETI,,45.2222689855,5.85876930746,042021
202067qJE9VET300,Marché,Services,Services d'impression et de livraison,27/04/2021,319309.0,Révisable,UCANSS,48.8635257742,2.40121168869,PME,454.29362956718757,49.6330980885,-1.63358524312,042021
2021151063166100,Marché,Travaux,Installations de chauffage,26/04/2021,31940.0,Ferme,Ministère des armées - Etablissement du service d'infrastructure de la défense de Metz - ESID Metz,,,NC,,49.1801818808,6.11132762996,042021
2021000020F02900,Marché,Fournitures,Gants jetables,02/04/2021,319500.0,Révisable,SDMIS,45.7533230296,4.86924368009,PME,658.8310585609477,49.5667543766,0.308696960472,042021
2020006-LOT102,Marché,Travaux,Travaux de terrassement,12/04/2021,319678.95,Ferme,MONTAUROUX,43.598570477,6.78927116442,PME,0.0,43.598570477,6.78927116442,042021
2021130016331000,Marché,Services,Services liés aux déchets et aux ordures,15/04/2021,32000.0,Révisable,"Ministère de la Transition Écologique, Ministère de la Cohésion des Territoires, Ministère de la Mer - Secrétariat Général",48.8836186061,2.23810959636,NC,18.670576855405177,48.9325906584,2.3996121008,042021
2020XLxKVSXZ9z00,Marché,Services,Services de transport (à l'exclusion du transport des déchets),13/04/2021,32000.0,Révisable,Mairie de St  Herblain,47.2246985502,-1.63426478543,PME,66.71426914858544,46.6442289799,-1.78533841652,042021
2021CNFP33000,Marché,Services,Services d'hôtellerie,30/04/2021,320000.0,Révisable,Direction de la commande publique,48.8348302792,2.42102904428,PME,7629.4471604837445,14.6460950766,-61.100358959,042021
2020JZIz8gNIDT00,Marché,Fournitures,Pièces détachées et accessoires pour véhicules et moteurs de véhicules,29/04/2021,320000.0,Ferme et actualisable,Grand Paris Sud Est Avenir,48.783689162,2.4549804713,ETI,0.0,48.783689162,2.4549804713,042021
2021023A000,Marché,Travaux,Mise en place de plafonds suspendus,12/04/2021,320000.0,Révisable,BUDGET PRINCIPAL,46.2047217001,5.24553216043,PME,23.43469312068425,46.0074583398,5.16937685312,042021
2020AJWNeC7F-b00,Marché,Travaux,Travaux de maçonnerie,06/04/2021,320000.0,Révisable,Commune de Bougival,48.8636644704,2.13752713445,PME,81.28501030754113,49.0916255268,1.43912207651,042021
2020mh0GxEVUPr00,Marché,Services,Services de conseil juridique,08/04/2021,320000.0,Ferme,COMMUNAUTE DE COMMUNES ILE DE RE,46.1990801961,-1.36630018466,PME,215.66081396072258,48.111571436,-1.68168588816,042021
202120CC0330300,Marché,Travaux,Travaux routiers,05/04/2021,320000.0,Révisable,Communauté de Communes des Vallées du Haut-Anjou,47.630971878,-0.7497090654,ETI,36.353408330571554,47.7844992331,-1.0398902741,042021
20212021F0733000,Marché,Fournitures,Cartes accréditives,29/04/2021,320000.0,Révisable,"Etablissements et organismes de l'enseignement supérieur, de la recherche et de l'innovation - UNISTRA - DAM",48.5716343863,7.76783353204,GE,615.9954013867848,48.8963161116,2.20694242609,042021
2021A2100,Marché,Services,Exploitation d'une station de traitement des eaux d'égout,12/04/2021,320000.0,Révisable,CAB-ASSAINISSEMENT,,,PME,,49.2614673745,1.21163851421,042021
2020GMg3RNaDY400,Marché,Services,Services de développement de logiciels comptables,14/04/2021,320000.0,Ferme,INSTITUT FRANCAIS DU TEXTILE ET DE L'HABILLEMENT,48.8282706469,2.362358986,NC,348.27674388053646,45.7744175201,3.06210159222,042021
20212020F00007,Marché,Fournitures,Pianos,23/04/2021,320000.0,Révisable,VILLE DE PARIS BUDGET PRINCIPAL,48.8542874923,2.35759608215,PME,5.391152712030328,48.8727847696,2.31253091684,042021
2020ES6TqFqQ2n00,Marché,Fournitures,Pièces détachées et accessoires pour véhicules et moteurs de véhicules,29/04/2021,320000.0,Ferme et actualisable,Grand Paris Sud Est Avenir,48.783689162,2.4549804713,PME,404.3345655954144,46.2314449436,-0.147510283485,042021
2020jtRhzFqTbj00,Marché,Services,Location de véhicules industriels avec chauffeur,30/04/2021,320000.0,Ferme et actualisable,Service de la Commande Publique,-21.3061462696,55.6419447038,PME,0.0,-21.3061462696,55.6419447038,042021
2020pH8HQYF9xt00,Marché,Services,Réalisation et entretien d'espaces verts,08/04/2021,320000.0,Révisable,COMMUNAUTE DE COMMUNES ILE DE RE,46.1990801961,-1.36630018466,NC,21.553642960272064,46.1619512738,-1.1749922971,042021
2021M21024L0200,Marché,Fournitures,Dispositifs mécaniques de levage,07/04/2021,320000.0,Révisable,VILLE DE MACON,46.320613267,4.81834086547,NC,519.5331640299819,50.675257141,3.10114805967,042021
2020tKNvds3Qpe00,Marché,Services,Location de véhicules industriels avec chauffeur,30/04/2021,320000.0,Ferme et actualisable,Service de la Commande Publique,-21.3061462696,55.6419447038,PME,0.0,-21.3061462696,55.6419447038,042021
20212021T0138600,Marché,Travaux,Travaux de construction complète ou partielle et travaux de génie civil,07/04/2021,3200000.0,,Ministère des armées - Etablissement du service d'infrastructure de la défense de Metz - ESID Metz,,,NC,,,,042021
202120GC04L0100,Marché,Fournitures,Cartes pour l'achat de carburant,07/04/2021,3200000.0,Ferme,VILLE DE BAYEUX,49.2783343531,-0.705198916376,ETI,345.9227179049281,48.8123578699,2.3878497256,042021
202050825500,Marché,Services,Services de nettoyage,02/04/2021,3200000.0,Révisable,Budget principal,50.6317671102,3.04699299406,ETI,98.57786014394361,49.7736798025,3.27230296168,042021
20212021T0138500,Marché,Travaux,Travaux de construction complète ou partielle et travaux de génie civil,08/04/2021,3200000.0,,Ministère des armées - Etablissement du service d'infrastructure de la défense de Metz - ESID Metz,,,NC,,48.5705922228,7.50794107442,042021
20212100004300,Marché,Services,Services d'impression,14/04/2021,3200000.0,Révisable,Ville de Nimes,43.8445331544,4.34760475323,PME,155.67492567978178,43.2982637914,5.64441013704,042021
20212021T0138000,Marché,Travaux,Travaux de construction complète ou partielle et travaux de génie civil,07/04/2021,3200000.0,,Ministère des armées - Etablissement du service d'infrastructure de la défense de Metz - ESID Metz,,,ETI,,48.6417969959,7.23999022888,042021
202120GC04L0200,Marché,Fournitures,Fioul domestique,07/04/2021,3200000.0,Ferme,VILLE DE BAYEUX,49.2783343531,-0.705198916376,NC,43.97788381674225,49.1546776305,-0.327460237934,042021
20212021S00061,Marché,Services,Réalisation et entretien d'espaces verts,09/04/2021,320009.99,Révisable,VILLE DE PARIS BUDGET PRINCIPAL,48.8542874923,2.35759608215,PME,8.38183743693599,48.7884475501,2.3944741313,042021
20212021S00060,Marché,Services,Réalisation et entretien d'espaces verts,02/04/2021,320009.99,Révisable,VILLE DE PARIS BUDGET PRINCIPAL,48.8542874923,2.35759608215,PME,8.38183743693599,48.7884475501,2.3944741313,042021
2021CDC21003C00,Marché,Travaux,Travaux de protection des berges,01/04/2021,320023.0,Ferme et actualisable,INTERCOM DE LA VIRE AU NOIREAU,48.8506192378,-0.890964371806,PME,111.92154201657488,48.1815031015,-1.6465881036,042021
2019qa2sal1ynP00,Marché,Services,Services d'architecte pour les bâtiments,01/04/2021,320150.0,Ferme et actualisable,CIG Versailles,48.8022788923,2.11716530117,PME,27.677704538745402,48.8628851439,2.35993164253,042021
2021030101,Marché,Travaux,Travaux d'installations électriques,06/04/2021,3203396.0,Révisable,VILLE DE SARTROUVILLE,48.9396530917,2.17437718086,NC,0.0,48.9396530917,2.17437718086,042021
2020mEeBhEpe8_00,Marché,Fournitures,Véhicules de sauvetage,06/04/2021,320536.0,Révisable,SDIS 36 - Indre,46.8661629253,1.77864373549,ETI,134.7535535991139,47.3326814781,0.654069551082,042021
20212021F0556100,Marché,Fournitures,"Verrerie de laboratoire, d'hygiène ou de pharmacie",01/04/2021,3206.0,Ferme et actualisable,CHR ORLEANS,47.8824665066,1.91660961834,ETI,373.92877945775956,49.2272646879,5.01649526713,042021
20212021F0777100,Marché,Fournitures,Textiles et articles connexes,30/04/2021,320736.0,Révisable,ASSISTANCE PUBLIQUE - HOPITAUX DE PARIS,48.8542874923,2.35759608215,PME,229.86679337480348,50.7748732647,3.12674472505,042021
2020930000543800,Marché,Services,Services d'organisation économique,16/04/2021,320737.33,Ferme,REGION-BUDGET REGIONAL,-20.9331856391,55.4471055195,NC,0.0,-20.9331856391,55.4471055195,042021
161890374684000,Marché,Fournitures,Équipement de piscine,20/04/2021,32085.0,Ferme,CA DE BELFORT,47.6463850599,6.84549855352,PME,645.8773412032227,43.2576460163,3.00554623686,042021
20210016FSTB0400,Marché,Services,Réalisation et entretien d'espaces verts,15/04/2021,3210.0,Révisable,1- SDIS Charente Maritime,46.1578937747,-1.08822293978,PME,59.88296740455311,45.9213924332,-0.601794152947,042021
2020202000170401,Marché,Services,Services d'assurance,26/04/2021,321225.8,Révisable,LANNION,48.7436151962,-3.46283464144,NC,110.773858445937,47.7502629938,-3.37883364048,042021
20212021S0670000,Marché,Services,Services de contrôle technique,19/04/2021,3214.0,Ferme,CENTRE HOSPITALIER BRETAGNE ATLANTIQUE,47.6599029362,-2.75681901002,NC,134.60286831060938,48.0530085081,-1.60555615262,042021
2021ZGd1WOgM_C00,Marché,Travaux,Travaux de construction,23/04/2021,32151.08,Ferme et actualisable,Brest Métropole Habitat,48.3999000994,-4.5027702561,PME,24.421506088560598,48.3510268971,-4.71810268106,042021
2020MfYIpVuePS00,Marché,Travaux,Travaux de peinture de bâtiments,23/04/2021,32151.19,Révisable,Mairie de Lille,50.6317671102,3.04699299406,PME,20.77205954179402,50.6607230103,3.23257481684,042021
2021TOITALBIN300,Marché,Travaux,Travaux de couverture et de peinture de toiture,22/04/2021,32179.8,Révisable,Mairie de Castres,43.6156093545,2.23815569342,NC,89.13491036305474,43.5959710776,1.43229743595,042021
2020CINEHTL0300,Marché,Travaux,Travaux de construction de cinémas,15/04/2021,322000.0,Ferme,COMMUNAUTE DE COMMUNES VALS DE SAINTON,45.9430620119,-0.520275049856,PME,175.07094961835804,47.2470106877,-1.4057336979,042021
2021Lot 3 PAPR00,Marché,Services,,27/04/2021,3220209.0,Révisable,SYVALORM,47.924297609,0.746656772703,NC,127.33881297939308,47.6040241065,-0.35889932411,042021
20202ga1MVmSG500,Marché,Services,,27/04/2021,322061.6,Ferme,CENTRE HOSPITALIER DE PAU,43.3201640732,-0.3496692279,ETI,663.8576843488543,48.7359872251,2.16608547126,042021
2021100015337300,Marché,Services,Services relatifs à l'environnement,27/04/2021,32240.0,Ferme et actualisable,Ministère des armées - Sous-Direction chargée de la préfiguration agence ministérielle de gestion - SDPAMG,,,PME,,44.5977136583,4.33260483412,042021
2021D0400,Marché,Fournitures,Couvertures,20/04/2021,32240.66,Ferme,2 - DOMIA,45.7859001722,3.11559551839,PME,9.124316082237929,45.7434742148,3.18623551965,042021
2021130016464700,Marché,Travaux,Installation de matériel d'éclairage public,27/04/2021,322614.0,Révisable,"Ministère de la Transition Écologique, Ministère de la Cohésion des Territoires, Ministère de la Mer - Direction Interdépartementale des Routes Est",48.6900671002,6.17594832427,NC,353.5265597446111,45.7380869696,4.96241516988,042021
2021bnyqSAA3Ax00,Marché,Fournitures,Véhicules utilitaires,07/04/2021,32283.78,Ferme,Territoire Habitat 90,47.6463850599,6.84549855352,ETI,0.0,47.6463850599,6.84549855352,042021
2020jmGA3xz9B700,Marché,Services,Services d'études,07/04/2021,32300.0,Ferme,Communauté d'agglomération Saint Germain Boucles de Seine,48.8942430373,2.10548394273,PME,25.294334342250217,48.6811729227,2.1853558178,042021
