20202020S1978000,Marché,Services,Services de formation professionnelle,10/12/2020,1174500.0,Révisable,Ministères sociaux,49.4415068863,1.09373273216,ETI,585.1038986096021,45.7533230296,4.86924368009,122020
2019CAA034602,Marché,Travaux,Travaux de construction de bâtiments,03/12/2020,117500.0,Ferme,REGIE AUTO FINAN MAISON DE SANTE,45.6681611919,6.40403320604,PME,55.56109999687897,45.5837038917,5.90877548323,122020
2020.49LOT0100,Marché,Travaux,Travaux de gros œuvre,29/12/2020,1175223.01,Ferme et actualisable,NOREVIE,,,PME,,50.45324528,2.94641941619,122020
2019pOAwliYq-C00,Marché,Services,"Services de nettoyage de logements, de bâtiments et de vitres",10/12/2020,117532.0,Révisable,CPAM MELUN,48.5645255065,2.68028856931,PME,46.589011184263974,48.9779936842,2.61229304573,122020
202084305,Marché,Travaux,Travaux routiers,01/12/2020,1175811.8,Révisable,Budget principal M52,43.6131750772,3.86941278925,NC,8.185101792815896,43.6244752697,3.7962679963,122020
20202020S1875800,Marché,Services,Services de collecte des ordures ménagères,01/12/2020,117600.0,Révisable,CHI TOULON LA SEYNE,43.1364847512,5.93276630299,NC,8.639174201275837,43.088993223,5.87078606863,122020
2019NOkTV13AS300,Marché,Travaux,Travaux de parachèvement de bâtiment,14/12/2020,117670.0,Ferme,CAF MAINE ET LOIRE (CAF ANGERS),47.4766284713,-0.556089456786,ETI,7.777723435105413,47.4738755133,-0.48580477673,122020
2020.026000,Marché,Travaux,Travaux de chantier,02/12/2020,117697.64,Ferme,Alpes Is�re Habitat,45.1821782198,5.72099089704,PME,44.71364260524462,45.1526726075,5.31773426609,122020
20202021S0082300,Marché,Services,Services d'assurance de responsabilité professionnelle,15/12/2020,11782.0,Révisable,CHU ANGERS,47.4766284713,-0.556089456786,ETI,630.4133695743932,45.7338821165,4.86899471975,122020
20202020S2142800,Marché,Services,Services de réparation et d'entretien,22/12/2020,11784.0,Ferme,Ministères sociaux,48.8060849119,2.43798340413,PME,29.573323442067384,48.6847134623,2.67594904742,122020
2020RTCA2004700,Marché,Services,Services de transport routier public,08/12/2020,117860.4,Ferme,LE PUY EN VELAY,45.02773512,3.89608931701,PME,11.832823639928316,45.0457939523,3.79063030593,122020
20202020F2034900,Marché,Fournitures,"Matériel d'imagerie à usages médical, dentaire et vétérinaire",29/12/2020,1178760.0,Ferme et actualisable,GCS UNIHA,45.7533230296,4.86924368009,NC,770.3971659691299,48.111571436,-1.68168588816,122020
2020200160300,Marché,Services,Services de réinsertion,08/12/2020,117936.0,Ferme,COMMUNAUTÉ D'AGGLOMÉRATION,14.6408734458,-61.069176472,PME,0.0,14.6408734458,-61.069176472,122020
20202020F2278600,Marché,Fournitures,Réactifs chimiques,23/12/2020,117965.0,Révisable,CHU SAINT ETIENNE,45.4301960415,4.37808697748,NC,386.5933775891118,43.64120757,1.38004602326,122020
2020-0202,Marché,Travaux,Travaux d'entretien routier,14/12/2020,117996.0,Ferme et actualisable,COMMUNE MAZET-SAINT-VOY,45.0436907747,4.24003784058,NC,42.20128720699236,45.0801652995,3.86016312287,122020
2020130015918400,Marché,Services,Services de réparation et d'entretien du matériel de sécurité,14/12/2020,1180.0,Révisable,Ministère de l'Intérieur - SGAMI OUEST - Rennes - Bureau Zonal des Achats et des Marchés Publics,48.075697512,-1.72369525238,ETI,87.85871973724174,47.3030353752,-1.56014129347,122020
2020151040873200,Marché,Travaux,Travaux de plâtrerie,21/12/2020,11800.0,Ferme et actualisable,Ministère de l'Intérieur - SGAMI EST - Metz - DAGF- Marchés Publics,48.8348302792,2.42102904428,PME,496.07107848469815,49.1915770387,6.89272878713,122020
2020130016075000,Marché,Services,Services photographiques,11/12/2020,11800.0,Ferme,Ministère de la Culture - MISSION ACHATS,48.8625262113,2.33630086089,PME,1.6142331195285915,48.8769868607,2.33753841595,122020
2020130015940900,Marché,Services,Services de lutte contre les déversements accidentels d'hydrocarbures,04/12/2020,118000.0,Révisable,"Ministère de la Transition Écologique, Ministère de la Cohésion des Territoires, Ministère de la Mer - Direction Régionale Environnement, Aménagement et Logement de la Nouvelle-Aquitaine",46.5834165499,0.359436087058,PME,518.728124167894,48.5603042238,-3.88928419641,122020
2020130015944400,Marché,Services,Services de lutte contre les déversements accidentels d'hydrocarbures,04/12/2020,118000.0,Révisable,"Ministère de la Transition Écologique, Ministère de la Cohésion des Territoires, Ministère de la Mer - Direction Régionale Environnement, Aménagement et Logement de la Nouvelle-Aquitaine",46.5834165499,0.359436087058,PME,518.728124167894,48.5603042238,-3.88928419641,122020
2020130015945100,Marché,Services,Services de lutte contre les déversements accidentels d'hydrocarbures,04/12/2020,118000.0,Révisable,"Ministère de la Transition Écologique, Ministère de la Cohésion des Territoires, Ministère de la Mer - Direction Régionale Environnement, Aménagement et Logement de la Nouvelle-Aquitaine",46.5834165499,0.359436087058,PME,518.728124167894,48.5603042238,-3.88928419641,122020
2020130015936800,Marché,Services,Services de lutte contre les déversements accidentels d'hydrocarbures,04/12/2020,118000.0,Révisable,"Ministère de la Transition Écologique, Ministère de la Cohésion des Territoires, Ministère de la Mer - Direction Régionale Environnement, Aménagement et Logement de la Nouvelle-Aquitaine",46.5834165499,0.359436087058,PME,518.728124167894,48.5603042238,-3.88928419641,122020
20202020F2074100,Marché,Fournitures,Presses,11/12/2020,118038.0,Ferme,"Etablissements et organismes de l'enseignement supérieur, de la recherche et de l'innovation - UNIVERSITE DE PAU ET DU PAYS DE L'ADOUR",43.3201640732,-0.3496692279,PME,204.95922734420384,44.0225624278,1.36375484401,122020
20202020T1983400,Marché,Travaux,"Travaux d'installation de clôtures, de garde-corps et de dispositifs de sécurité",10/12/2020,118091.48,Ferme,"Etablissements et organismes de l'enseignement supérieur, de la recherche et de l'innovation - CNRS Délégation Rhône Auvergne",45.7708803723,4.88922582274,PME,5.6201967774285295,45.820656077,4.8987353728,122020
201829600,Marché,Travaux,Travaux d'équipement du bâtiment,17/12/2020,11810.0,Ferme et actualisable,Conseil départemental d'Eure-et-Loir,48.4470919696,1.50577061537,PME,4.704353318143105,48.4161898796,1.53480275564,122020
20202020S2210000,Marché,Services,Services d'entretien d'ascenseurs,23/12/2020,1.1818039E7,Révisable,CHU NANTES,47.2321613301,-1.54797539458,GE,457.21697300978775,48.8836186061,2.23810959636,122020
20202021S0668300,Marché,Services,Services relatifs à l'environnement,18/12/2020,118200.0,Ferme et actualisable,"Ministère de la Transition Écologique, Ministère de la Cohésion des Territoires, Ministère de la Mer - Service des Achats et des Affaires Juridiques",45.7333494426,4.83733100241,PME,112.03979861477293,45.6435859611,5.84649372461,122020
20204lS-L6GOLP00,Marché,Services,Services de traitement et d'élimination des ordures ménagères et des déchets non dangereux,09/12/2020,118400.0,Révisable,Sictom Sud Allier,46.2576588291,3.27638419988,NC,359.4687481380958,43.5959710776,1.43229743595,122020
20202020S2046700,Marché,Services,"Études de faisabilité, service de conseil, analyse",02/12/2020,118450.0,Ferme,Agence De l'Environnement et de la Maitrise de l'Energie,47.4766284713,-0.556089456786,PME,355.9876834416116,48.8682182328,2.34268958704,122020
2020180006243000,Marché,Travaux,Pose de portes,17/12/2020,118500.0,Révisable,Ministère de l'Intérieur - SGAMI OUEST - Rennes - Bureau Zonal des Achats et des Marchés Publics,48.075697512,-1.72369525238,PME,90.70556193831958,48.3039564834,-0.93621225568,122020
2020SUFAG00,Marché,Fournitures,,07/12/2020,118500.0,Révisable,SM MARKSTEIN GRAND-BALLON PRINCIPAL,47.9156969967,6.95750298522,PME,287.2930195070293,45.4802291518,6.05447001428,122020
20202020F2158800,Marché,Services,Maintenance et réparation de matériel de réseau informatique,21/12/2020,1185000.0,Révisable,"Etablissements et organismes de l'enseignement supérieur, de la recherche et de l'innovation - UNIVERSITE DE REIMS CHAMPAGNE-ARDENNE",49.2517771432,4.03968745396,NC,244.0305191696395,48.6573087563,6.16442957921,122020
20202020S2207700,Marché,Services,Services informatiques,31/12/2020,1185275.01,Révisable,Ministère de l'agriculture et de l'alimentation - AGENCE DE SERVICES ET DE PAIEMENT,45.8544262114,1.24894834225,NC,246.73610976657585,43.64120757,1.38004602326,122020
20205kkYgLNUiF00,Marché,Travaux,Travaux de remise en état et de remise à neuf,08/12/2020,11853.72,Révisable,Communauté de Communes de Parthenay Gâtine,46.6455153878,-0.233850430433,NC,59.612244865974056,46.6318389647,0.305088627554,122020
2020GiydeRt6st00,Marché,Services,Services de collecte des ordures,08/12/2020,1185644.0,Révisable,Etablissement Public Territorial,48.817695916,2.51568784214,ETI,431.8349658283923,45.7014538128,4.85041939867,122020
2020uSdBR2_cY700,Marché,Travaux,Travaux de plomberie,07/12/2020,118610.24,Ferme,CDC Habitat Social DIR Sud-Ouest,44.8889230081,-0.600409986888,PME,258.96742593758916,43.5783751148,1.33466866952,122020
2019BDBQqqt1hb00,Marché,Travaux,Travaux d'aménagement paysager,17/12/2020,118677.0,Ferme,EPA EUROMEDITERRANEE,43.3127155398,5.36343891881,NC,20.202513741761074,43.4527920234,5.48035081509,122020
20202020T2183700,Marché,Travaux,Travaux de pose de revêtements de sols,22/12/2020,11870.52,Ferme,CHU DIJON,47.3230744087,5.03738286925,PME,0.0,47.3230744087,5.03738286925,122020
20202020T2294900,Marché,Travaux,Travaux de bardage,22/12/2020,118715.27,Révisable,CHU DIJON,47.3230744087,5.03738286925,PME,93.65768019372604,46.9980743232,5.81918730205,122020
202046T_qSqjmY00,Marché,Fournitures,Fournitures pour diagnostic,30/12/2020,11880.0,Révisable,CENTRE HOSPITALIER DE MACON,46.320613267,4.81834086547,PME,,,,122020
20202020F0887500,Marché,Fournitures,"Légumes, fruits et noix",30/12/2020,11886.7,Ferme,La Ville de Rosny-sous-Bois,48.8745436228,2.48657191747,NC,23.65664320679058,48.729938105,2.32968167157,122020
2020160006024400,Marché,Travaux,"Travaux d'installation de matériel de chauffage, de ventilation et de climatisation",22/12/2020,118941.0,Révisable,Ministère des armées - Etablissement du service d'infrastructure de la défense de Rennes - ESID Rennes,,,NC,,46.8031778361,1.69389403678,122020
2020180006244000,Marché,Travaux,Travaux de plâtrerie,18/12/2020,118965.63,Révisable,Ministère de l'Intérieur - SGAMI OUEST - Rennes - Bureau Zonal des Achats et des Marchés Publics,48.075697512,-1.72369525238,PME,6.776624215419538,48.0974237255,-1.78094828874,122020
2019Cvt3ccp9Of00,Marché,Travaux,Travaux de désamiantage,02/12/2020,11897.8,Ferme et actualisable,THEMELIA,43.9256996046,2.14745941954,PME,0.0,43.9256996046,2.14745941954,122020
20202020F2046300,Marché,Travaux,Installations mécaniques,17/12/2020,118990.0,Ferme,Office national d'études et de recherches aérospatiales,48.8030644645,2.28639478919,ETI,200.18711417467068,49.2517771432,4.03968745396,122020
20202020F2084800,Marché,Fournitures,"Instruments et matériels de télémétrie, d'hydrographie, d'océanographie et d'hydrologie",22/12/2020,11900.0,Ferme,Institut Français de Recherche pour l’Exploitation de la MER,48.8231210367,2.26445901319,PME,622.3858944551375,47.8074054749,-3.27057807852,122020
2020000000000300,Marché,Services,"Services d'architecture, d'ingénierie et de planification",24/12/2020,119000.0,Révisable,COMMUNAUTE DE COMMUNES DE MIRIBEL ET D,45.8448431471,4.9408752362,PME,14.885833218090166,45.7790342353,4.82355716114,122020
20202020F2080600,Marché,Fournitures,Consommables médicaux autres que chimiques à usage unique et consommables hématologiques,22/12/2020,119000.0,Ferme,CHU RENNES,48.111571436,-1.68168588816,PME,460.7427113377317,48.8348302792,2.42102904428,122020
2020M081L00R0000,Marché,Services,"Autres services communautaires, sociaux et personnels",28/12/2020,119064.0,Ferme,LAVAL AGGLOMERATION,48.0610922073,-0.766055300559,PME,0.0,48.0610922073,-0.766055300559,122020
2020160006039100,Marché,Services,Services de contrôle technique de bâtiments,21/12/2020,11922.0,Révisable,"Ministère de l'éducation nationale et de la jeunesse et Ministère de l'enseignement supérieur, de la recherche et de l'innovation - Rectorat de Montpellier-Service Technique des Constructions et du Patrimoine",43.6131750772,3.86941278925,PME,260.62167457492467,45.7815925046,4.77308706649,122020
202020076521,Marché,Fournitures,Gasoils,02/12/2020,11927.4,Ferme,Conseil Départemental AM - BP,43.7123384529,7.23750191149,ETI,341.3373108447214,45.7041579754,4.88121408321,122020
2020.030200,Marché,Travaux,Travaux de chantier,10/12/2020,119287.24,Ferme,Alpes Is�re Habitat,45.1821782198,5.72099089704,NC,51.709334836120505,45.5695014389,5.98213867184,122020
2020GZZ3AIEBZ400,Marché,Fournitures,Système d'extinction d'incendie,11/12/2020,11932.0,Révisable,CPAM de la Gironde,44.8578964782,-0.57357535767,ETI,610.0298768271854,45.7533230296,4.86924368009,122020
2020uVie0DmjQa00,Marché,Services,Services de conseil en matière de santé et de sécurité,11/12/2020,119350.0,Ferme,GEIE DU TUNNEL DU MONT BLANC,45.9312323079,6.92405219434,ETI,593.0355597351058,48.8348302792,2.42102904428,122020
2020mUH22xNjZf00,Marché,Fournitures,Équipement de piscine,07/12/2020,119368.0,Révisable,Tours Métropole Val de Loire,47.3980773574,0.696151819266,PME,572.178592581962,42.7938841451,3.00185585761,122020
20202020S1894400,Marché,Fournitures,Onduleurs,01/12/2020,11946.7,Révisable,"Etablissements et organismes de l'enseignement supérieur, de la recherche et de l'innovation - Ecole Normale Supérieure de Lyon",45.7333494426,4.83733100241,ETI,433.35919846238136,48.7495659946,2.35212808495,122020
2020ziCFXcTmnF00,Marché,Travaux,Travaux de terrassement,03/12/2020,119490.0,Ferme et actualisable,MACON HABITAT,46.320613267,4.81834086547,ETI,90.75755614339202,46.6748755197,5.55822712075,122020
2020202014100,Marché,Fournitures,,02/12/2020,119500.0,Révisable,COMMUNE DE MILIZAC-GUIPRONVEL,48.4913109858,-4.56964408061,ETI,0.0,48.4913109858,-4.56964408061,122020
202030029601,Marché,Fournitures,Serrurerie,14/12/2020,119500.0,Ferme et actualisable,Département du Doubs,47.2551269927,6.0192810348,PME,6.2488744319762874,47.287996658,5.97334531118,122020
20202020S2040900,Marché,Services,Services d'assurance dommages ou pertes,07/12/2020,119535.0,Révisable,Ministère de l'agriculture et de l'alimentation - Ecole Nationale Vétérinaire Agro-Alimentaire et de l'Alimentation,47.2321613301,-1.54797539458,GE,156.38273896189688,46.3286026496,-0.464927924553,122020
2020aTAyB0x_W_00,Marché,Services,Services d'entretien des installations de signalisation,24/12/2020,119684.0,Ferme,Mairie de Drancy,48.9233704771,2.44422453567,GE,17.334450911375065,48.9157198373,2.28764873642,122020
20202020F2171500,Marché,Fournitures,Réactifs de laboratoire,22/12/2020,11970.0,Révisable,CENTRE HOSPITALIER WILLIAM MOREY,46.7898307141,4.85243666689,ETI,365.1529218444923,48.7566452125,2.20675730342,122020
2020151043073100,Marché,Travaux,Travaux de maçonnerie,15/12/2020,119762.8,Ferme et actualisable,Ministère des armées - Etablissement du service d'infrastructure de la défense de Metz - ESID Metz,,,GE,,47.3230744087,5.03738286925,122020
202075675400,Marché,Services,Services de courtage et services liés de titres et marchandises,24/12/2020,1197840.0,Ferme,CA Mont Saint Michel - Normandie,48.6889710585,-1.35674833511,ETI,404.664965433412,48.9346127594,2.29454165622,122020
2020151043521300,Marché,Services,"Services d'architecture, services de construction, services d'ingénierie et services d'inspection",18/12/2020,119786.8,Ferme et actualisable,Ministère de l'Intérieur - Provence-Alpes-Côte d'Azur,43.2868669832,5.38037571899,PME,77.99714409086864,43.3993323129,6.07663333823,122020
2020440100,Marché,Fournitures,Électricité,04/12/2020,1198000.0,Révisable,CCPRO BP,44.1289689475,4.81041508178,PME,165.8436435208532,43.1364847512,5.93276630299,122020
2020.43LOT0500,Marché,Travaux,Travaux de gros œuvre,28/12/2020,119817.52,Ferme et actualisable,NOREVIE,,,NC,,49.5679878475,3.62136068206,122020
2020130015940500,Marché,Services,Services de lutte contre les déversements accidentels d'hydrocarbures,04/12/2020,119883.18,Révisable,"Ministère de la Transition Écologique, Ministère de la Cohésion des Territoires, Ministère de la Mer - Direction Régionale Environnement, Aménagement et Logement de la Nouvelle-Aquitaine",46.5834165499,0.359436087058,NC,231.30960025589727,44.7154004305,-0.556765585966,122020
2020y4g5iZ0uZz00,Marché,Services,Services de réparation et d'entretien de camions,28/12/2020,119900.0,Révisable,SDIS de l'Ardèche,44.7218752388,4.59409820072,ETI,25.19326871505547,44.6103105442,4.39568379495,122020
2019tCS375Ftyf00,Marché,Fournitures,Groupes électrogènes,11/12/2020,11991.0,Révisable,CPAM de la Gironde,44.8578964782,-0.57357535767,GE,557.2599658613086,48.9296428406,2.35946866986,122020
2020151043814500,Marché,Services,Services de conseil en matière de santé et de sécurité,15/12/2020,11991.78,Ferme et actualisable,Ministère des armées - Direction d'infrastructure de la défense de Papeete - DID Papeete,,,NC,,,,122020
2020ELmIra1rcc00,Marché,Travaux,Travaux de réparation d'ouvrages en béton,23/12/2020,119914.0,Révisable,ATMB - DSTI - Direction des systèmes et technologie de l'information,46.0739029681,6.40835573143,GE,554.3530173801602,48.7839097374,2.19723411662,122020
2018azbAuUKLu600,Marché,Travaux,Travaux de construction,01/12/2020,1199465.31,Révisable,Val d'Europe agglomération,48.8726903987,2.77025918382,PME,14.116470397787495,48.8165872264,2.65573957718,122020
2020V20316GR00,Marché,Services,Services d'assurance de véhicules à moteur,14/12/2020,119986.2,Ferme,VILLE D'ORLEANS,47.8824665066,1.91660961834,NC,743.9030405723,43.671853349,7.1522919117,122020
2020180006249100,Marché,Services,Services de réparation et d'entretien du matériel de sécurité,18/12/2020,1200.0,Révisable,"Ministère de l'Économie, des Finances et de la Relance - DI NANTES",47.2321613301,-1.54797539458,PME,86.6501325217753,47.3500105413,-0.7733709473,122020
2020151038116100,Marché,Services,Services de conseil en matière de santé et de sécurité,06/12/2020,12000.0,Révisable,Ministère de l'Intérieur - Préfecture du Lot et Garonne,44.2024640047,0.625844587118,NC,160.72362197292478,44.8323242505,-0.682089528902,122020
20190PKzcQuoDR00,Marché,Services,Services de centres de vacances,08/12/2020,12000.0,Ferme,Mairie de Bagnolet,48.8694561887,2.42256669613,ETI,8.833579956313267,48.8682182328,2.34268958704,122020
20202020S1953300,Marché,Services,Services de nettoyage de vitres,04/12/2020,12000.0,Révisable,CHI TOULON LA SEYNE,43.1364847512,5.93276630299,GE,753.9006450506166,48.8873739998,2.30681348993,122020
2020MA20071100,Marché,Services,Services de contrôle technique automobile,14/12/2020,12000.0,Révisable,SDIS de la Vendée,46.6676055556,-1.4078581699,ETI,468.78518260514284,48.7802898374,2.25979241616,122020
2020mBLGjG2YwJ00,Marché,Services,Services d'impression et services connexes,30/12/2020,12000.0,Révisable,Mairie de Fos sur Mer,43.4556743263,4.90422543761,PME,667.7541462023764,48.8604673342,2.26190318372,122020
20202020S2035900,Marché,Services,Services d'hébergement pour l'exploitatuion de sites WWW,15/12/2020,12000.0,Ferme,Ministère de l'agriculture et de l'alimentation - AGENCE DE SERVICES ET DE PAIEMENT,45.8544262114,1.24894834225,NC,358.85819805268477,48.9038810507,2.30581093912,122020
2020MA20071400,Marché,Services,Services de contrôle technique automobile,14/12/2020,12000.0,Révisable,SDIS de la Vendée,46.6676055556,-1.4078581699,ETI,468.78518260514284,48.7802898374,2.25979241616,122020
2020bc9S9fLG2H00,Marché,Fournitures,Papier d'impression,03/12/2020,12000.0,Révisable,Commune de Wattignies,50.5861642535,3.04164865606,ETI,231.7310243101794,48.5862081061,2.452303526,122020
20202020S0806800,Marché,Services,Services de développement des applications serveur internet ou intranet,08/12/2020,12000.0,Ferme,Comité Régional du Tourisme Ile-de-France,48.8769868607,2.33753841595,NC,5.3559683519501045,48.8869811827,2.38492060382,122020
20202020S1909300,Marché,Services,Services de conseil en génie civil,16/12/2020,120000.0,Révisable,"Ministère de la Transition Écologique, Ministère de la Cohésion des Territoires, Ministère de la Mer - VOIES NAVIGABLES DE FRANCE",48.6900671002,6.17594832427,PME,419.7844442768917,48.8869811827,2.38492060382,122020
202020_05500,Marché,Fournitures,Fioul domestique,23/12/2020,120000.0,Révisable,BUDGET PRINCIPAL,48.6811729227,2.1853558178,NC,25.36280053109111,48.8983675206,2.25515424076,122020
2020V0M36100AU00,Marché,Fournitures,Formules de chèque,04/12/2020,120000.0,Ferme,BUDGET PRINCIPAL EXERCICE 2020,45.8544262114,1.24894834225,ETI,361.6937027547358,48.9346127594,2.29454165622,122020
2020cAPFjIAnin00,Marché,Services,Services de télécommunications,22/12/2020,120000.0,Révisable,CAVAMAC,48.8292048923,2.3267445538,GE,7.9686545769965065,48.8604673342,2.26190318372,122020
2020A12900,Marché,Fournitures,Installations de climatisation,10/12/2020,120000.0,Révisable,VILLE DE DUNKERQUE - PRINCIPAL,51.030563712,2.33703738753,NC,58.89099299661486,50.9290540053,1.8143354837,122020
20202043800,Marché,Travaux,Travaux de marquage routier,23/12/2020,120000.0,Révisable,BUDGET PRINCIPAL DEPT SARTHE,47.9889433531,0.20002401353,NC,224.85810488232622,47.1983706601,-1.67133954513,122020
20180145aef00900,Marché,Services,Services informatiques,04/12/2020,120000.0,Ferme et actualisable,Informatique ICDC,48.8053725236,2.33400842575,PME,7.939846474204988,48.8231210367,2.26445901319,122020
20181vesIlgFKT00,Marché,Services,Services sociaux pour les enfants et les adolescents,08/12/2020,120000.0,Ferme,SHLMR - Société dHabitation à Loyer Modéré de la Réunion,-20.9331856391,55.4471055195,PME,6.715825774837828,-20.9945145041,55.3978899478,122020
2020ftcydjxq3A00,Marché,Services,Services de conseils en publicité,23/12/2020,120000.0,Révisable,SERL Groupe,45.7533230296,4.86924368009,PME,0.0,45.7533230296,4.86924368009,122020
20202020047901,Marché,Services,Services de conseil en matière de santé et de sécurité,14/12/2020,120000.0,Ferme,DEPARTEMENT DU VAR,43.1364847512,5.93276630299,NC,753.191373210669,48.8365394869,2.2389245247,122020
20202020F0896800,Marché,Fournitures,Fournitures informatiques,15/12/2020,120000.0,Ferme,Etablissement Public Territorial Grand-Orly Seine Bièvre,48.7884475501,2.3944741313,NC,,,,122020
20202020F2019700,Marché,Fournitures,"Boîtes-classeurs, classe-lettres, boîtes de rangement et articles similaires",18/12/2020,120000.0,Révisable,"Etablissements et organismes de l'enseignement supérieur, de la recherche et de l'innovation - CENTRE TECHNIQUE DU LIVRE DE L'ENSEIGNEMENT SUPERIEUR",48.830615363,2.72287301087,PME,273.5843484176579,49.5899395482,5.07650804155,122020
2020i7Nu6DX00E00,Marché,Services,Services de réparation et d'entretien d'installations d'extinction d'incendie,30/12/2020,120000.0,Révisable,Commune AURILLAC,44.9245183348,2.4417949992,NC,121.34376611685812,45.7859001722,3.11559551839,122020
20202020S2121400,Marché,Services,"Services de technologies de l'information, conseil, développement de logiciels, internet et appui",29/12/2020,120000.0,,"Etablissements et organismes de l'enseignement supérieur, de la recherche et de l'innovation - UNIVERSITE PARIS DAUPHINE",48.8604673342,2.26190318372,ETI,3.6815602348323804,48.8836186061,2.23810959636,122020
2020lv4TWNRwBJ00,Marché,Fournitures,Systèmes d'alarme,28/12/2020,120000.0,Ferme,Mairie du Perreux sur Marne,48.8421812372,2.50400643241,PME,753.9116563697212,43.6990265285,6.96152435324,122020
2020weEA6p4BT200,Marché,Services,Services informatiques,28/12/2020,120000.0,Révisable,Informatique ICDC,48.8053725236,2.33400842575,PME,6.946022696917538,48.7884475501,2.3944741313,122020
2020V0C0001AI00,Marché,Services,Services de gestion de biens immobiliers pour le compte de tiers,15/12/2020,120000.0,Révisable,EXERCICE 2020,43.6131750772,3.86941278925,PME,0.0,43.6131750772,3.86941278925,122020
