2020-yX-4Yp74W00,Marché,Travaux,Travaux d'installation d'échafaudages,19/11/2020,909904.0,Révisable,CAF CHAMBERY,45.5837038917,5.90877548323,NC,111.02305406080535,45.6680469522,4.9083713349,112020
20202020T1870200,Marché,Travaux,Travaux de restructuration,26/11/2020,91000.0,Ferme et actualisable,CHRU CAEN,49.1850685346,-0.370026383608,PME,49.38468687793905,48.8072782352,-0.604171999955,112020
202020-0017100,Marché,Fournitures,Véhicules à moteur servant au transport de marchandises,04/11/2020,910000.0,Révisable,Ville de Saint-Denis,48.9296428406,2.35946866986,ETI,19.84686818916798,48.9595327185,2.53641870202,112020
2020KDPhilarCV00,Marché,Travaux,Travaux de construction d'usines d'incinération des ordures ménagères,25/11/2020,91079.0,Ferme,PARIS LA DEFENSE,48.8983675206,2.25515424076,ETI,0.0,48.8983675206,2.25515424076,112020
2020S03600,Marché,Services,Services d'aire de caravanage,09/11/2020,91181.86,Révisable,COMMUNAUTE D'AGGLOMERATION,47.0747420182,2.40492134914,PME,485.05344588760056,44.5561843175,-1.17512066596,112020
2020SIS03700,Marché,Travaux,Travaux d'enrochement,09/11/2020,912614.27,Ferme et actualisable,BUDGET PRINCIPAL,45.6681611919,6.40403320604,GE,48.76829452915746,45.9539749422,6.73985281708,112020
2020SIS03702,Marché,Travaux,Travaux d'enrochement,25/11/2020,912614.27,Ferme et actualisable,BUDGET PRINCIPAL,45.6681611919,6.40403320604,GE,48.76829452915746,45.9539749422,6.73985281708,112020
2020TRANSPSCO01,Marché,Services,,17/11/2020,91264.08,Ferme et actualisable,COMMUNE DE PONT SALOMON,45.3346603724,4.2433929988,PME,51.64390897349969,45.1352191094,3.82148888542,112020
2020130015994500,Marché,Fournitures,"Équipements de laboratoire, d'optique et de précision (excepté les lunettes)",16/11/2020,91273.64,Révisable,Ministère des armées - Direction des Approvisionnements en produits de santé des armées,,,ETI,,48.8637518036,2.51036788744,112020
20202020T2271700,Marché,Travaux,Travaux de menuiserie,02/11/2020,913017.0,Révisable,Chambres de Commerce et d'Industrie,47.2321613301,-1.54797539458,ETI,8.648538118903327,47.2533982505,-1.47273793378,112020
2020jsZUznK9oe00,Marché,Services,Services de conseil en aménagement de site informatique,05/11/2020,91535.0,Ferme et actualisable,CGSS MARTINIQUE,14.6246455763,-60.9935529523,ETI,7610.437774570558,48.8727847696,2.31253091684,112020
20202020S0021100,Marché,Services,Services d'ingénierie,20/11/2020,9158124.0,Révisable,Département de Saône et Loire,46.320613267,4.81834086547,PME,616.9851058820542,44.8018298503,-0.548245460299,112020
2020232301,Marché,Services,Services spécialisés de transport routier de passagers,27/11/2020,91650.0,Révisable,VILLE DE BONNEVILLE,46.0739029681,6.40835573143,NC,12.088891954505964,46.1666337717,6.35053336064,112020
202120ST017L2000,Marché,Travaux,Travaux de construction de piscines,06/11/2020,916575.04,Révisable,Com de Com TERRES DES CONFLUENCES,44.0485272709,1.12375558149,NC,26.69473779541626,44.0225624278,1.36375484401,112020
201955LOT104,Marché,Fournitures,,10/11/2020,91666.2,Révisable,SAINT DOMINEUC,48.3605992638,-1.86935856936,PME,50.89178870605233,48.258612635,-1.42070138518,112020
2020M0600,Marché,Fournitures,Chèques-repas,26/11/2020,91800.0,Ferme,EXERCICE BUDGETAIRE ASSAINISSE,43.5360639608,5.39837823449,GE,676.8433128159743,48.8282706469,2.362358986,112020
2020202001401,Marché,Travaux,Travaux de construction complète ou partielle et travaux de génie civil,17/11/2020,91867.5,Ferme et actualisable,LOTISSEMENT LES CHAMPTOUX,,,PME,,47.5355500711,2.80266089876,112020
20202020F1855700,Marché,Fournitures,"Produits alimentaires, boissons, tabac et produits connexes",24/11/2020,919833.6,Ferme et actualisable,Ministère de l'agriculture et de l'alimentation - FranceAgriMer,48.8631652232,2.4482059517,PME,571.8077427300155,48.5001396568,-2.71009143445,112020
2020an4J7VRTdf00,Marché,Fournitures,Réactifs de laboratoire,18/11/2020,920.0,Révisable,CENTRE HOSPITALIER DE PAU,43.3201640732,-0.3496692279,ETI,690.2308799988538,48.8511697506,2.47460350341,112020
2020_4zk8ogkC200,Marché,Services,Services de dératisation,25/11/2020,92000.0,Révisable,Mairie de Romainville,48.8845546351,2.43800840946,NC,10.028521664232262,48.9296428406,2.35946866986,112020
20202020M46100,Marché,Services,Élimination et traitement des ordures,10/11/2020,92000.0,Ferme,COMMUNAUTE DE COMMUNES PAYS DE LUNEL,43.6820622826,4.13604052571,ETI,30.459881143830508,43.6131750772,3.86941278925,112020
2020EL-tt38o4p00,Marché,Services,Services d'audit,19/11/2020,92000.0,Ferme,DAFA - Direction de l agriculture,45.7480493184,4.82567584415,PME,2.0784656444565397,45.7333494426,4.83733100241,112020
202020_05200,Marché,Services,Services de blanchisserie et de nettoyage à sec,26/11/2020,92000.0,Révisable,BUDGET PRINCIPAL,48.6811729227,2.1853558178,PME,40.81734963177814,48.6260042221,2.55029416883,112020
2020FIPajW8b4u00,Marché,Fournitures,Pièces détachées et accessoires pour véhicules et moteurs de véhicules,18/11/2020,92000.0,Ferme et actualisable,Pôle Ressources,48.4315335696,0.0917701886296,GE,4.68046573913108,48.4439579013,0.132208634626,112020
20202020F0737400,Marché,Fournitures,Matériel de réseau,10/11/2020,920000.0,Révisable,CD94 - Conseil départemental du Val-de-Marne,48.783689162,2.4549804713,NC,17.948109948141322,48.8164012464,2.29603611202,112020
2020DO2qly057J00,Marché,Services,Services juridiques,18/11/2020,920000.0,Révisable,SIDEN-SIAN,50.6752771707,3.12787285895,PME,223.5702707893568,48.8292048923,2.3267445538,112020
20202001900100,Marché,Travaux,Travaux d'installation de menuiseries non métalliques,05/11/2020,92181.5,Ferme et actualisable,COMMUNE DE CARCASSONNE,43.2093616677,2.34379884342,PME,0.0,43.2093616677,2.34379884342,112020
201859ji5RtY_C00,Marché,Fournitures,Matériel de plomberie et de chauffage,02/11/2020,921850.0,Ferme,3F-DGRDI NE,48.8282706469,2.362358986,ETI,9.717489922719466,48.9128078947,2.38454842862,112020
2020XpcsyPeK8x00,Marché,Travaux,Travaux de construction,25/11/2020,92275.49,Révisable,Territoire30,43.8445331544,4.34760475323,PME,0.0,43.8445331544,4.34760475323,112020
2020120007099100,Marché,Services,Réalisation et entretien d'espaces verts,03/11/2020,922779.65,Révisable,Ministère des armées - Plate-forme commissariat Paris,,,NC,,48.8188881482,2.61033265984,112020
20202020T1841400,Marché,Travaux,Travaux de menuiserie,06/11/2020,923365.0,Révisable,CHRU MONTPELLIER,43.6131750772,3.86941278925,NC,165.75044266579712,44.4232525022,2.61087229053,112020
2020120000,Marché,Travaux,Réparation et entretien de station d'épuration,30/11/2020,92390.0,Ferme et actualisable,C. C. ALPES PROVENCE VERDON,43.9716922786,6.50168938201,PME,59.27561827426089,43.9946258331,5.96617382552,112020
2020170010366300,Marché,Services,Services de transport routier,16/11/2020,92586.54,Révisable,Ministère des armées - Plate-forme commissariat Sud,,,ETI,,48.9128078947,2.38454842862,112020
20202020F1867200,Marché,Fournitures,Robots industriels,26/11/2020,92590.0,Ferme,CENTRE HOSPITALIER GROUPE HOSPITALIER DE LA ROCHELLE RE AUNIS,46.1619512738,-1.1749922971,PME,482.14240224171624,48.8963161116,2.20694242609,112020
20202020F0692100,Marché,Travaux,Travaux de construction d'installations sportives,09/11/2020,92622.0,Ferme,LA MAIRIE DE NANTERRE,48.8963161116,2.20694242609,PME,430.95234449790485,48.0822348122,-1.60333259248,112020
201800013401,Marché,Travaux,Installation de matériel de signalisation,05/11/2020,926833.33,Ferme,BUDGET PRINCIPAL,50.2899236486,2.76642705397,NC,5.336521434629204,50.3081347422,2.81107875678,112020
2020MC000200,Marché,Fournitures,Colis alimentaires,23/11/2020,92800.0,Ferme,CCAS COURBEVOIE,48.8983675206,2.25515424076,NC,44.9994484185614,49.2633980961,2.43062879669,112020
20202020F2063300,Marché,Fournitures,Consommables médicaux autres que chimiques à usage unique et consommables hématologiques,16/11/2020,92880.0,Ferme,CHU RENNES,48.111571436,-1.68168588816,NC,1002.8940037897944,48.2801866972,7.38618553368,112020
2020KjXYHwDJAd00,Marché,Travaux,Travaux de construction,09/11/2020,9290.0,Ferme et actualisable,Mairie d'Arnouville,48.9859786056,2.41754697069,PME,39.02750663063025,49.3289360059,2.49226152753,112020
20202020S2311600,Marché,Services,Services d'architecture,25/11/2020,92900.0,Révisable,HOSPICES CIVILS DE LYON,45.7480493184,4.82567584415,NC,279.7065315642722,43.2868669832,5.38037571899,112020
20202020S1772700,Marché,Services,"Services de nettoyage de logements, de bâtiments et de vitres",09/11/2020,929942.0,Révisable,Ministère de l'Intérieur - Occitanie,43.5959710776,1.43229743595,NC,438.6143886013326,43.5360639608,5.39837823449,112020
20202020F0792300,Marché,Fournitures,Clés,26/11/2020,93024.0,Révisable,Ville de Neuilly-sur-Seine,48.8855642403,2.26624582625,PME,528.6957730251091,44.9223144503,4.91311704006,112020
20201gKJ1LNzvh00,Marché,Fournitures,Réactifs de laboratoire,17/11/2020,933.33,Révisable,CENTRE HOSPITALIER DE PAU,43.3201640732,-0.3496692279,ETI,698.5868193503022,45.1256913332,5.70166045833,112020
2020fOO9PCYfIz00,Marché,Fournitures,Réactifs de laboratoire,17/11/2020,933.33,Révisable,CENTRE HOSPITALIER DE PAU,43.3201640732,-0.3496692279,PME,808.4148626652143,47.2970080153,5.77167336131,112020
20202020T1897400,Marché,Travaux,Travaux de menuiserie,19/11/2020,933000.0,Ferme et actualisable,Pouvoirs publics - Assemblée Nationale,48.8562037309,2.3121193117,PME,21.514535474622807,48.7732937592,2.48790854128,112020
202120ST017L0400,Marché,Travaux,Travaux de couverture,06/11/2020,933659.18,Révisable,Com de Com TERRES DES CONFLUENCES,44.0485272709,1.12375558149,NC,60.83323604622079,43.5959710776,1.43229743595,112020
20202020S2217800,Marché,Fournitures,Appareils de distribution et de commande électriques,04/11/2020,93413.56,Ferme,CTRE HOSPITALIER INTERCOM ALPES DU SUD,44.580393647,6.06471167343,GE,633.2026603771563,48.9296428406,2.35946866986,112020
20202020S1822600,Marché,Services,"Services d'architecture, services de construction, services d'ingénierie et services d'inspection",20/11/2020,93450.0,Révisable,Ministère de la Culture - Opérateur du patrimoine et des projets immobiliers de la culture,48.8282706469,2.362358986,PME,356.0459184048217,47.4766284713,-0.556089456786,112020
20202020S1827600,Marché,Services,Services de développement des applications serveur internet ou intranet,02/11/2020,93540.0,Révisable,"Ministère de la Transition Écologique, Ministère de la Cohésion des Territoires, Ministère de la Mer - Parc National Port-Cros",43.1019824736,6.18958692395,PME,970.9678954021178,47.2321613301,-1.54797539458,112020
2020110005169000,Marché,Services,Services d'ingénierie,09/11/2020,93600.0,Révisable,"Ministère de la Transition Écologique, Ministère de la Cohésion des Territoires, Ministère de la Mer - Direction Régionale Environnement, Aménagement et Logement des Hauts de France",50.6317671102,3.04699299406,PME,234.6768311698393,48.7796502574,2.02991602442,112020
2020151033748400,Marché,Fournitures,"Machines, appareils, équipements et consommables électriques; éclairage",05/11/2020,93619.13,Ferme,Ministère des armées - Structure Spécialisée d'achat et de Mandatement 33 504,,,PME,,48.8855642403,2.26624582625,112020
20201912400300,Marché,Services,Services de prestations,18/11/2020,93638.52,Ferme,BUDGET PRINCIPAL,16.2938320694,-61.7107129682,PME,13.391740878378286,16.2515819199,-61.5922344723,112020
20202020T1792100,Marché,Travaux,Travaux relatifs aux conduites d'alimentation en eau,16/11/2020,93700.0,Ferme,"Etablissements et organismes de l'enseignement supérieur, de la recherche et de l'innovation - CNRS Délégation Bretagne Pays de Loire",48.111571436,-1.68168588816,NC,104.94679913693368,47.170656178,-1.61651705517,112020
202020S0009L0000,Marché,Services,Services d'organisation d'événements culturels,25/11/2020,93785.88,Ferme,Conseil Départemental AM - BP,43.7123384529,7.23750191149,NC,0.0,43.7123384529,7.23750191149,112020
2020PKYblR6FnJ00,Marché,Fournitures,"Pièces de rechange mécaniques, excepté moteurs et parties de moteurs",26/11/2020,93820.64,Révisable,Département de l Indre Direction des Routes des Transports du Patrimoine et de l Education,46.8031778361,1.69389403678,PME,97.27729980818606,47.6110227025,1.35776910185,112020
2019EIQcJAMaPX00,Marché,Services,Services de nettoyage et d'hygiène,25/11/2020,938275.0,Révisable,Institut National des Sciences Appliquées de Lyon (INSA Lyon),45.7708803723,4.88922582274,PME,29.201916589386656,45.9722435435,4.71913168899,112020
202020.019.0701,Marché,Services,Services d'ingénierie,24/11/2020,93831.75,Ferme et actualisable,ATLANTIC' EAU,47.2321613301,-1.54797539458,NC,9.577530771797647,47.2246985502,-1.63426478543,112020
2020m26MdKjlsH00,Marché,Services,Services de nettoyage de bureaux,10/11/2020,9384.0,Révisable,URSSAF Midi Pyrénéées,43.5390131127,1.52156442051,ETI,214.05535266289712,43.3211830233,-0.401824113107,112020
202020005604,Marché,Services,Services de conseils et de représentation juridiques,09/11/2020,93866.66,Révisable,BUDGET PRINCIPAL,43.3127155398,5.36343891881,PME,698.7284453883929,48.8591103086,2.38017728226,112020
2020rASzM28isD00,Marché,Fournitures,Réactifs de laboratoire,18/11/2020,94.67,Révisable,CENTRE HOSPITALIER DE PAU,43.3201640732,-0.3496692279,PME,689.8761141012518,48.9346127594,2.29454165622,112020
20205qIny7xIel00,Marché,Travaux,Travaux de peinture,12/11/2020,9400.1,Ferme,VOSGELIS,48.162954598,6.47953209434,NC,67.1883577296607,48.7053283146,6.20628313233,112020
2020uBnWxF5Z7Y00,Marché,Fournitures,Pompes,16/11/2020,94000.0,Révisable,DCOM,48.8491121687,2.33284677548,NC,4.553747624561257,48.840040811,2.29268840406,112020
2019SSA01L401,Marché,Travaux,Travaux de construction,30/11/2020,94085.64,Révisable,AGGLOMERATION D AGEN,44.2024640047,0.625844587118,PME,22.824410855034458,44.4059437021,0.60037303329,112020
20202020S2012900,Marché,Services,Logiciels médicaux,25/11/2020,94136.0,Ferme,Ministères sociaux,48.9296428406,2.35946866986,PME,435.44423660601535,45.8310057435,4.77089761479,112020
2020exiJFUB4qV00,Marché,Services,Services d'analyse technique ou services de conseil,02/11/2020,94207.0,Ferme,Direction de la Maintenance,48.8348302792,2.42102904428,PME,6.815146115524547,48.783689162,2.4549804713,112020
2020CPP-01-AQ100,Marché,Travaux,Travaux de construction,25/11/2020,94218.9,Ferme,COMMUNAUTE COMMUNES BRETAGNE ROMANTIQU,48.4084992413,-1.74502834748,GE,451.6294427042713,48.8727847696,2.31253091684,112020
20202020F1738200,Marché,Services,Maintenance de logiciels de technologies de l'information,04/11/2020,94285.56,Révisable,CHU DE LIMOGES,45.8544262114,1.24894834225,PME,781.3390005849843,48.5716343863,7.76783353204,112020
20200g9QfQ9qfz00,Marché,Travaux,Travaux de désamiantage,04/11/2020,9430.0,Ferme,VOSGELIS,48.162954598,6.47953209434,ETI,130.82399000852863,48.8175182848,7.46524676661,112020
2020000002175800,Marché,Services,Services de conseil juridique,23/11/2020,94400.0,Ferme et actualisable,Collectivité Territoriale de Guyane,5.03107464278,-52.5193923736,PME,0.0,5.03107464278,-52.5193923736,112020
20202006506,Marché,Travaux,Travaux de gros œuvre,02/11/2020,94411.22,Ferme,14BUDGET PRINCIPAL SIX FOURS,43.0866539393,5.82934646655,NC,0.0,43.0866539393,5.82934646655,112020
2020202005300,Marché,Services,Élimination et traitement des ordures,04/11/2020,945000.0,Révisable,COMMUNAUTE D'AGGLOMERATION DU NIORTAIS,46.3286026496,-0.464927924553,NC,58.55825756611421,46.8544563524,-0.479596254844,112020
2019L6CANTSEZ00,Marché,Travaux,Travaux de construction,17/11/2020,94569.67,Ferme,COMMUNAUTE DE COMMUNES SEZANNE SUD OUE,48.5875507068,3.81757319173,PME,56.49024368968023,48.2474856081,4.19750153024,112020
20202020T1731500,Marché,Travaux,Travaux de construction de bâtiments liés à la santé,03/11/2020,94746.0,Révisable,CH AVIGNON,43.9352959178,4.84131733764,PME,9.280709754442903,44.0150969256,4.86653739233,112020
20202020G010200,Marché,Services,Serveurs de réseau,02/11/2020,947464.97,Révisable,MAIRIE ANNECY BUDGET PRINCIPAL,45.8900209706,6.12570413482,ETI,546.9444239154855,48.8963161116,2.20694242609,112020
2020130016062300,Marché,Services,"Services de réparation, d'entretien et services connexes relatifs aux ordinateurs personnels, au matériel de bureau, au matériel de télécommunications et au matériel audiovisuel",23/11/2020,94752.0,Révisable,Ministère de l'Intérieur - Occitanie,43.5959710776,1.43229743595,ETI,64.10051238307334,43.4656532463,1.99697050286,112020
20202021F0038200,Marché,Fournitures,Consommables médicaux autres que chimiques à usage unique et consommables hématologiques,16/11/2020,9478.0,Ferme,CHU RENNES,48.111571436,-1.68168588816,ETI,468.66090215946747,48.8745436228,2.48657191747,112020
2020kIWP8hCZSS00,Marché,Services,Services d'animation pour enfants,23/11/2020,9478.0,Ferme,Mairie de Salon de Provence,43.6463117052,5.0679949909,PME,0.0,43.6463117052,5.0679949909,112020
20202020F1857900,Marché,Fournitures,Bâtiments modulaires préfabriqués,26/11/2020,94782.0,Ferme et actualisable,"Ministère de la Transition Écologique, Ministère de la Cohésion des Territoires, Ministère de la Mer - VOIES NAVIGABLES DE FRANCE",47.3230744087,5.03738286925,PME,300.44266673376495,48.2969772032,7.5734195541,112020
2020MG01100,Marché,Services,Services de nettoyage,03/11/2020,94848.0,Ferme et actualisable,SMICVAL,44.9879982963,-0.183703851795,PME,57.76902403800739,44.8323242505,-0.682089528902,112020
2020MATDENT00,Marché,Fournitures,"Matériel d'imagerie à usages médical, dentaire et vétérinaire",04/11/2020,94867.5,Ferme,CC FUMEL VALLEE DU LOT,44.5078616548,0.980357535501,PME,113.12492542894127,43.5959710776,1.43229743595,112020
2020130015891600,Marché,Services,Services de dératisation,03/11/2020,9496.0,Révisable,Ministère de la Justice  - Directcion interrégionale des services pénitentiaires de Rennes,48.111571436,-1.68168588816,NC,98.8243893189535,47.2246985502,-1.63426478543,112020
20202020T1829700,Marché,Travaux,Travaux d'installation de matériel de ventilation et de climatisation,20/11/2020,94970.44,Ferme et actualisable,"Etablissements et organismes de l'enseignement supérieur, de la recherche et de l'innovation - UNIVERSITE DE POITIERS",46.5834165499,0.359436087058,NC,8.072687146397442,46.6318389647,0.305088627554,112020
20202020S1886500,Marché,Services,"Services aux entreprises: droit, marketing, conseil, recrutement, impression et sécurité",23/11/2020,950.0,Ferme,Chambres de Commerce et d'Industrie,45.7480493184,4.82567584415,PME,11.234867673335254,45.6776041395,4.75268296549,112020
20202020T1692100,Marché,Travaux,Travaux de menuiserie,05/11/2020,9500.0,Ferme,CH DU MANS,47.9889433531,0.20002401353,PME,105.25985724084839,47.8294089517,-0.738267470726,112020
20202020S1878400,Marché,Services,"Services aux entreprises: droit, marketing, conseil, recrutement, impression et sécurité",23/11/2020,9500.0,Ferme,Chambres de Commerce et d'Industrie,45.7480493184,4.82567584415,NC,187.9159324999565,45.8941119385,3.1326472398,112020
20202020S2082700,Marché,Services,"Études de faisabilité, service de conseil, analyse",18/11/2020,95000.0,Ferme,Agence De l'Environnement et de la Maitrise de l'Energie,47.4766284713,-0.556089456786,PME,353.21169139663255,48.8727847696,2.31253091684,112020
2020130015943300,Marché,Fournitures,"Matériels médicaux, pharmaceutiques et produits de soins personnnels",04/11/2020,95000.0,Révisable,Ministère des armées - Direction des Approvisionnements en produits de santé des armées,,,ETI,,49.0400551805,2.05074797264,112020
2020116300,Marché,Travaux,Travaux de resurfaçage de chaussées,18/11/2020,950000.0,Ferme,BUDGET PRINCIPAL,44.4090858199,-1.17698756245,GE,72.20679813839834,44.8323242505,-0.682089528902,112020
160466024580600,Marché,Fournitures,Béton prêt à l'emploi,06/11/2020,95020.0,Ferme,Conseil Départemental de l'Aveyron,44.358571606,2.56667306391,ETI,6.763403419683366,44.3055578754,2.53669964673,112020
2019DCT09401,Marché,Travaux,Travaux de construction,26/11/2020,95031.58,Révisable,Budget principal,45.1821782198,5.72099089704,PME,44.05644987363965,45.4482906485,5.42496501064,112020
20202020T1806700,Marché,Travaux,Travaux d'installations électriques,12/11/2020,95033.5,Ferme et actualisable,"Etablissements et organismes de l'enseignement supérieur, de la recherche et de l'innovation - UNIVERSITE D ARTOIS",50.2899236486,2.76642705397,GE,162.52640388349346,48.9228776124,2.24687029827,112020
20202020S0758900,Marché,Services,Réalisation et entretien d'espaces verts,12/11/2020,95192.0,Révisable,Etablissement Public Territorial Grand-Orly Seine Bièvre,48.7884475501,2.3944741313,PME,6.946022696917538,48.8053725236,2.33400842575,112020
2020lrAYa4LYEp00,Marché,Fournitures,"Boissons, tabac et produits connexes",16/11/2020,95200.0,Ferme,Mairie de Calais,50.9500555648,1.87591279453,NC,0.0,50.9500555648,1.87591279453,112020
2020FRppdBIRPz00,Marché,Fournitures,Disques compacts (CD),02/11/2020,95225.0,Révisable,Mairie de Calais,50.9500555648,1.87591279453,PME,240.61691518002647,48.8631652232,2.4482059517,112020
2020K2010300,Marché,Services,Services d'entretien de terrains,06/11/2020,95250.0,Ferme,BUDGET PRINCIPAL,49.6330980885,-1.63358524312,NC,22.25340514779925,49.5127881172,-1.47282810544,112020
2020vBMoUvJRPG00,Marché,Travaux,Travaux de menuiserie,26/11/2020,95282.2,Révisable,VOSGELIS,48.162954598,6.47953209434,ETI,62.37195064844548,48.6518313707,6.19871166784,112020
2020MAPSE0003700,Marché,Services,Services d'entretien de l'éclairage public,02/11/2020,9530.0,Révisable,Mairie de ROGNONAS,43.8999923319,4.79900062183,PME,48.163742524811,44.2477420926,5.05986850913,112020
20202020S0762100,Marché,Services,"Études de faisabilité, service de conseil, analyse",23/11/2020,95300.0,Révisable,VILLE DE MELUN,48.5447982823,2.65777855027,PME,46.520280883247054,48.8591103086,2.38017728226,112020
2020M2027602,Marché,Services,Logiciels et systèmes d'information,27/11/2020,953082.0,Révisable,ORLEANS METROPOLE,47.8824665066,1.91660961834,PME,458.98959395878944,47.2551269927,6.0192810348,112020
201816-6/201701,Marché,Travaux,Carrelages,25/11/2020,95326.68,Révisable,ROQUEVAIRE,43.3436358549,5.59821231686,PME,60.81324131545679,43.3799827921,5.04949160777,112020
160378400901100,Marché,Services,Services de transport routier public,06/11/2020,9533814.0,Révisable,SYNDICAT MIXTE TRANSPORTS COMMUN HERAULT,43.6131750772,3.86941278925,NC,,,,112020
