2019g7ijuPQP6S00,Marché,Services,"Services d'architecture, services de construction, services d'ingénierie et services d'inspection",20/08/2019,189830.0,Révisable,DSIUD - Direction des systèmes d information et des usages digitaux,45.7480493184,4.82567584415,NC,156.59649913365547,44.4003071224,4.40554924137,082019
2019150959244000,Marché,Travaux,Travaux de rénovation de ponts,06/08/2019,189869.81,Révisable,Ministère de la Transition écologique et solidaire - Ministère de la Cohésion des Territoires - D...,43.3117424276,5.37932471314,GE,11.795907176245315,43.2343813418,5.45258699132,082019
20192019F1751800,Marché,Fournitures,Fournitures pour l'angiographie,28/08/2019,1900.0,Révisable,CH DU MANS,47.9889433531,0.20002401353,PME,246.42946047056284,48.8231210367,2.26445901319,082019
20192019F1668100,Marché,Fournitures,Systèmes de diagnostic,21/08/2019,19000.0,Révisable,CHU NANTES,47.2321613301,-1.54797539458,NC,468.743472282618,48.8924795867,2.34788399022,082019
20184lEluBSQk-00,Marché,Fournitures,Tuyaux et raccords,06/08/2019,19000.0,Révisable,COMMUNE DE VALLET,47.1715226334,-1.2615495481,ETI,212.57672965153083,47.3326814781,0.654069551082,082019
20192019S1753000,Marché,Services,Études de marché et recherche économique; sondages et statistiques,28/08/2019,19000.0,Ferme,Ministère des armées - Office national des anciens combattants et victimes de guerre,48.8562037309,2.3121193117,PME,5.338877828831302,48.8628851439,2.35993164253,082019
2019130014706200,Marché,Services,Services de publicité et de marketing,14/08/2019,190000.0,Révisable,Ministère de la Transition écologique et solidaire - Ministère de la Cohésion des Territoires - D...,45.7731043316,4.85202749669,NC,113.52665099325725,45.2198746489,5.71597377571,082019
20191230000088,Marché,Fournitures,Clôture en treillis métallique,23/08/2019,190000.0,Ferme et actualisable,VILLE DE PARIS BUDGET PRINCIPAL,48.8542874923,2.35759608215,PME,34.290509158647446,48.9118016277,2.66226017903,082019
201965960800,Marché,Services,Services de nettoyage,23/08/2019,190000.0,Révisable,CIVIS,-21.3123152713,55.4940884083,NC,0.0,-21.3123152713,55.4940884083,082019
2019201903000,Marché,Travaux,Travaux de réparation de terrains de sports,09/08/2019,190000.0,Ferme et actualisable,BEAUMONT DE LOMAGNE,43.8771922295,1.01014543977,NC,42.315404176810304,44.0225624278,1.36375484401,082019
20191370000106,Marché,Services,Services de maintenance de systèmes,23/08/2019,1900000.0,Révisable,VILLE DE PARIS BUDGET PRINCIPAL,48.8542874923,2.35759608215,NC,17.302213988455716,48.8963161116,2.20694242609,082019
2019_OkWpu_EPp00,Marché,Travaux,Travaux de construction,20/08/2019,19001.62,Révisable,SAFI,47.9968866318,-4.09100301844,PME,63.83394701678736,48.3999000994,-4.5027702561,082019
2019012f6d000100,Marché,Travaux,Installation de matériel d'éclairage public,13/08/2019,190147.49,Ferme et actualisable,Tours Métropole Val de Loire,47.3980773574,0.696151819266,NC,44.92232522311894,46.9945038103,0.696526491294,082019
2019Tb6M3R8RRu00,Marché,Services,Étude de faisabilité,19/08/2019,190150.0,Ferme,AGENCE FRANCAISE DE DEVELOPPEMENT,48.8348302792,2.42102904428,NC,10.321374654095626,48.8924795867,2.34788399022,082019
2019Z9gyHfRCIN00,Marché,Travaux,Travaux de construction,13/08/2019,19016.0,Révisable,Mairie de L'Hay les Roses,48.776029777,2.33737630174,ETI,32.08014775919676,48.6918752913,2.61487236964,082019
2019130014746300,Marché,Services,Services de formation professionnelle,30/08/2019,190311.0,Révisable,Ministère des armées - Direction du Commissariat Outre-Mer FAZSOI et groupement de soutien de la ...,48.840040811,2.29268840406,PME,32.83694486419548,48.9784393812,2.55500199053,082019
20192019T1550300,Marché,Services,,05/08/2019,19032.0,Ferme,Ministères sociaux,43.5959710776,1.43229743595,PME,14.950325338468742,43.6311239068,1.56279223869,082019
20192019S1748900,Marché,Services,Services de formation professionnelle,30/08/2019,19040.0,Révisable,CH DU MANS,47.9889433531,0.20002401353,PME,212.77714081412324,48.1542418257,-1.71705508926,082019
2019150961274900,Marché,Fournitures,Revêtements de sol,19/08/2019,19089.21,Ferme et actualisable,Ministère de la Justice  - Direction interrégionale des services pénitentiaires de Strasbourg,48.5716343863,7.76783353204,PME,155.55617277773655,48.1078867384,6.43971415144,082019
2019130014724300,Marché,Services,Réalisation et entretien d'espaces verts,29/08/2019,191000.0,Révisable,Ministère de l'Intérieur - SGAMI SUD OUEST- Bordeaux - DAGF - BCP,44.8578964782,-0.57357535767,NC,151.67032390074786,46.2185295503,-0.646393985158,082019
20191230010002,Marché,Travaux,Travaux d'aménagement paysager d'espaces verts,23/08/2019,191083.68,Ferme et actualisable,VILLE DE PARIS BUDGET PRINCIPAL,48.8542874923,2.35759608215,PME,104.93732788588119,49.0916255268,1.43912207651,082019
2018a8CYVUF8fP00,Marché,Travaux,"Travaux de démolition, travaux de préparation et de dégagement de chantier",19/08/2019,191200.0,Révisable,Ville de Sainte Suzanne,-20.9455740943,55.5931298767,NC,5.567309296966732,-20.963611632,55.642081964,082019
20192019F1651200,Marché,Services,Services de désinfection et de désinfestation,06/08/2019,1916.52,Ferme,Ministère de la Culture - ETABLISSEMENT PUBLIC DU MUSEE D'ORSAY ET DU MUSEE DE L'ORANGERIE,48.8562037309,2.3121193117,PME,14.177999233709247,48.729938105,2.32968167157,082019
20192019S1563800,Marché,Services,"Services d'architecture, services de construction, services d'ingénierie et services d'inspection",27/08/2019,19175.0,Ferme,Ministère de l'agriculture et de l'alimentation - Ecole Nationale Vétérinaire Agro-Alimentaire et...,47.2321613301,-1.54797539458,PME,468.0143970557365,48.9097290596,2.33319973974,082019
20192019S1841200,Marché,Services,Services divers d'entretien et de réparation,24/08/2019,19195.01,Ferme,Services du Premier ministre - Conseil Supérieur de l'Audiovisuel,48.840040811,2.29268840406,GE,12.403822308083894,48.9296428406,2.35946866986,082019
2018fAA1z0HcIy00,Marché,Services,Services de colonies de vacances,29/08/2019,19199.0,Ferme,Mairie de Drancy,48.9233704771,2.44422453567,PME,202.6614974713772,50.6520500829,3.02499832356,082019
20192019F1634600,Marché,Fournitures,Consommables médicaux autres que chimiques à usage unique et consommables hématologiques,19/08/2019,192.0,Ferme,CHU RENNES,48.111571436,-1.68168588816,PME,791.9871962821426,43.6131750772,3.86941278925,082019
2019Kwz2MT1KQU00,Marché,Fournitures,Pièces détachées et accessoires pour véhicules et moteurs de véhicules,05/08/2019,19200.0,Révisable,VILLE DE CHELLES,48.8837873385,2.59631331192,PME,36.47745497751352,49.2116367629,2.58581200974,082019
20183W0S28yGpd00,Marché,Travaux,Travaux de construction,12/08/2019,19201.0,Ferme et actualisable,HARMONIE HABITAT,47.2246985502,-1.63426478543,PME,362.68290860346787,44.5050678127,0.172319701696,082019
2019yPpMzzc9oG00,Marché,Services,Services de contrôle technique de bâtiments,01/08/2019,19240.0,Ferme,Ministère des armées - Accord-Cadre Mandat de Maîtrise d'Ouvrage au profit du SID,48.8282706469,2.362358986,ETI,18.913844737493587,48.7839097374,2.19723411662,082019
20192019F1925300,Marché,Fournitures,Machines-outils à usage spécifique,20/08/2019,1925000.0,Ferme,"Etablissements et organismes de l'enseignement supérieur, de la recherche et de l'innovation - EC...",48.8282706469,2.362358986,PME,604.6414423229523,48.8420959686,7.83005981715,082019
20194635790000,Marché,Travaux,Travaux de construction de routes,08/08/2019,192759.95,Ferme,Département de Maine et Loire,47.4766284713,-0.556089456786,ETI,27.85464731027074,47.3500105413,-0.7733709473,082019
2019zm35NNNzKr00,Marché,Fournitures,Véhicules à moteur,01/08/2019,19283.0,Ferme,Mairie de Villeneuve le roi,48.7321607291,2.41097949757,ETI,6.04279065939753,48.6918192915,2.37437489187,082019
2019000000010000,Marché,Travaux,Travaux de construction de lignes électriques,27/08/2019,192838.2,Ferme,SYANE,45.9184078015,6.06302741902,NC,74.95218285451018,45.9539749422,6.73985281708,082019
20192019T1585300,Marché,Services,,09/08/2019,19291.94,Ferme,"Institut national de recherche pour l’agriculture, l’alimentation et l’environnement",48.8562037309,2.3121193117,PME,351.2762546971411,45.7464465204,2.86967373001,082019
2019ZbMULOrs6200,Marché,Travaux,Travaux de construction,22/08/2019,19308.15,Ferme et actualisable,Brest Métropole Habitat,48.3999000994,-4.5027702561,PME,78.67372934840952,48.6002133524,-3.82032631476,082019
2018YajLstusVl00,Marché,Fournitures,Consommables médicaux,02/08/2019,193205.0,Révisable,Centre hospitalier de Boulogne sur mer Service Economique,50.7270459478,1.60607177999,NC,902.2390624457058,43.5360639608,5.39837823449,082019
20192019F1949700,Marché,Fournitures,Instruments dentaires,20/08/2019,1933.2,Révisable,CHU REIMS,49.2517771432,4.03968745396,PME,5.886452885657519,49.270579992,3.98991630079,082019
2019vNOBZHIPZV00,Marché,Services,Services de réparation et d'entretien de groupes de réfrigération,13/08/2019,193464.0,Révisable,Tours Métropole Val de Loire,47.3980773574,0.696151819266,NC,4.78526625244773,47.4183323884,0.657979930785,082019
2019rTZzftBjxY00,Marché,Travaux,Travaux de construction,22/08/2019,19367.4,Ferme et actualisable,Brest Métropole Habitat,48.3999000994,-4.5027702561,PME,68.86292751123018,48.2586398787,-3.89639330848,082019
201966023200,Marché,Travaux,Travaux de terrassement,27/08/2019,193700.0,Ferme et actualisable,Préval Haut-Doubs,46.911819238,6.38871615294,GE,19.26289330307262,47.0545793159,6.48845473085,082019
2019100013868000,Marché,Travaux,Travaux de revêtement divers,07/08/2019,193806.8,Révisable,Ministère de la Transition écologique et solidaire - Ministère de la Cohésion des Territoires - D...,48.840040811,2.29268840406,NC,18.991764938409986,48.9172863598,2.13951942246,082019
2018RAeOggMZfA00,Marché,Travaux,Travaux de démolition,13/08/2019,193820.0,Révisable,Mairie de Vieux-Condé,50.4730767331,3.56588473003,PME,31.619884625463584,50.3127413058,3.32964774268,082019
20191370000272,Marché,Travaux,Travaux routiers,23/08/2019,1939639.02,Révisable,VILLE DE PARIS BUDGET PRINCIPAL,48.8542874923,2.35759608215,NC,7.158782630482266,48.9128078947,2.38454842862,082019
20192210000015,Marché,Travaux,Travaux de réfection,23/08/2019,194000.0,Révisable,VILLE DE PARIS BUDGET PRINCIPAL,48.8542874923,2.35759608215,PME,32.42320724270961,48.8539678711,2.65081586823,082019
20197oSOIa4rvJ00,Marché,Travaux,"Travaux d'installation de matériel de chauffage, de ventilation et de climatisation",16/08/2019,194064.0,Ferme,Direction de la Maintenance,48.8348302792,2.42102904428,NC,12.551553052242392,48.9296428406,2.35946866986,082019
20190Hrlwm-Qau00,Marché,Services,Services de nettoyage de bâtiments,13/08/2019,194168.24,Ferme,OPHEOR,46.0450564645,4.08007309055,PME,0.0,46.0450564645,4.08007309055,082019
20192019F1803200,Marché,Fournitures,Consommables médicaux,13/08/2019,19422.0,Ferme et actualisable,CHD VENDEE,46.6676055556,-1.4078581699,ETI,961.3105054230393,47.7251065113,7.22041435516,082019
2019vr8m9C2ZxK00,Marché,Travaux,Travaux de plomberie et de pose de conduits d'évacuation,20/08/2019,19422.0,Ferme et actualisable,DSIUD - Direction des systèmes d information et des usages digitaux,45.7480493184,4.82567584415,PME,7.837181054025518,45.7041579754,4.88121408321,082019
2019cMoc9I6DAC00,Marché,Fournitures,Cloisons,16/08/2019,194226.87,Ferme,CPAM DU JURA,46.6748755197,5.55822712075,ETI,47.18991767904679,47.085527611,5.44519528977,082019
20192019F1752300,Marché,Fournitures,Fournitures pour l'angiographie,28/08/2019,19440.0,Révisable,CH DU MANS,47.9889433531,0.20002401353,ETI,221.65828004306158,48.758778972,2.04882028884,082019
2019C19036-MS400,Marché,Travaux,Travaux de réparation de routes,08/08/2019,194471.08,Ferme et actualisable,AGGLOMERATION DU CHOLETAIS,47.0458179875,-0.877097655444,PME,19.928020786871464,47.0346785128,-0.697224251201,082019
20192020S0055200,Marché,Services,Services sylvicoles,30/08/2019,19452.5,Révisable,Ministère de l'agriculture et de l'alimentation - Direction territoriale Centre Ouest Aquitaine,47.9321365141,2.01838531803,NC,222.6057776265173,45.9493923158,1.74870475933,082019
20191380000462,Marché,Fournitures,Véhicules pour ordures,23/08/2019,1947637.0,Révisable,VILLE DE PARIS BUDGET PRINCIPAL,48.8542874923,2.35759608215,ETI,492.30897891921234,46.1619512738,-1.1749922971,082019
2019120006358000,Marché,Services,Services de nettoyage,22/08/2019,1948384.04,Révisable,Ministère des armées - Plate-forme commissariat Ouest,,,NC,,47.9889433531,0.20002401353,082019
2019-hJHHFHs3300,Marché,Travaux,Travaux de construction,01/08/2019,1948503.81,Révisable,SERL marchés,45.7533230296,4.86924368009,NC,30.115001256949093,45.9871827357,4.73094011507,082019
2019150958021100,Marché,Travaux,Travaux d'excavation sur sites archéologiques,14/08/2019,194900.0,Ferme et actualisable,Ministère de la Transition écologique et solidaire - Ministère de la Cohésion des Territoires - D...,49.4415068863,1.09373273216,NC,331.8720233450597,48.1205469701,-1.59697171557,082019
2018012aac500100,Marché,Travaux,Travaux routiers,27/08/2019,194999.0,Révisable,Communauté d'agglomération du Val de Fensch,49.3315592832,6.06608414569,PME,8.57534972308155,49.3758482446,6.12970624329,082019
2019130014753400,Marché,Services,Services de surveillance d'installations d'alarme,19/08/2019,19500.0,Révisable,Ministère de l'Intérieur - Bourgogne Franche-Comté,47.3230744087,5.03738286925,GE,0.0,47.3230744087,5.03738286925,082019
2018OsTLUMLJuZ00,Marché,Fournitures,Jeux et jouets; attractions foraines,01/08/2019,19500.0,Révisable,Mairie d'Orsay - MPA,48.7002680837,2.18715224978,NC,26.39657292913175,48.7647201734,2.4168982905,082019
20192019F1632700,Marché,Fournitures,Équipements médicaux,20/08/2019,195000.0,Ferme et actualisable,CHU GRENOBLE,45.2097006413,5.74400008015,PME,127.7626588505785,45.8310057435,4.77089761479,082019
2018Tlkg4wvGCD00,Marché,Services,"Services d'architecture, services de construction, services d'ingénierie et services d'inspection",23/08/2019,195000.0,Ferme et actualisable,Mairie de Coueron,47.2305431151,-1.7303481837,NC,20.166708853610974,47.2321613301,-1.54797539458,082019
2019RVdr-q1PlW00,Marché,Fournitures,Équipement audiovisuel,19/08/2019,195000.0,Révisable,Val d'Europe agglomération,48.8726903987,2.77025918382,PME,36.89531957283374,48.9862889229,2.45676363518,082019
2019160005345200,Marché,Travaux,Travaux de construction de routes,05/08/2019,1950021.75,Révisable,Ministère de la Transition écologique et solidaire - Ministère de la Cohésion des Territoires - D...,47.2551269927,6.0192810348,NC,195.03531915445606,46.6756918542,4.35399639402,082019
20192019F1651700,Marché,Services,Logiciels de gestion des temps de travail et des ressources humaines,06/08/2019,195282.0,Révisable,CHU NANTES,47.2321613301,-1.54797539458,PME,465.32816980065456,48.8491121687,2.33284677548,082019
20192019F1890900,Marché,Fournitures,Réactifs de laboratoire,08/08/2019,195622.0,Ferme,CHU REIMS,49.2517771432,4.03968745396,PME,214.63241157725471,48.6811729227,2.1853558178,082019
20192019S1731500,Marché,Services,Services de programmation de progiciels,19/08/2019,19572.0,Ferme,Ministère de la Transition écologique et solidaire - Ministère de la Cohésion des Territoires - A...,47.8824665066,1.91660961834,NC,0.0,47.8824665066,1.91660961834,082019
20191210000663,Marché,Travaux,Travaux de construction,23/08/2019,195793.87,Ferme et actualisable,VILLE DE PARIS BUDGET PRINCIPAL,48.8542874923,2.35759608215,PME,14.426101503050699,48.9228776124,2.24687029827,082019
2019150960292600,Marché,Fournitures,,22/08/2019,19586.0,Ferme,Ministère des armées - Structure Spécialisée d'achat et de Mandatement 33 504,,,PME,,44.8792319263,-0.648147734074,082019
2018-55to18ii400,Marché,Travaux,Travaux de charpente,13/08/2019,195960.53,Révisable,Mairie de Vieux-Condé,50.4730767331,3.56588473003,PME,68.07787871337229,50.7496797016,3.01656979154,082019
20192019F1618700,Marché,Fournitures,"Instruments et matériels de télémétrie, d'hydrographie, d'océanographie et d'hydrologie",28/08/2019,196104.0,Révisable,Ministère des armées - Service hydrographique et océanographique de la Marine,48.3999000994,-4.5027702561,PME,144.05779617581666,47.8135382033,-3.34072060334,082019
20192019T2105100,Marché,Travaux,Travaux de construction,13/08/2019,196251.0,Révisable,ASSISTANCE PUBLIQUE DES HOPITAUX DE MARSEILLE,43.2924013477,5.39786536432,PME,0.0,43.2924013477,5.39786536432,082019
2019C19036-MS300,Marché,Travaux,Travaux de réparation de routes,08/08/2019,196270.4,Ferme et actualisable,AGGLOMERATION DU CHOLETAIS,47.0458179875,-0.877097655444,ETI,0.0,47.0458179875,-0.877097655444,082019
20191210000534,Marché,Travaux,Travaux de pose de sols,23/08/2019,196489.85,Ferme et actualisable,VILLE DE PARIS BUDGET PRINCIPAL,48.8542874923,2.35759608215,PME,14.426101503050699,48.9228776124,2.24687029827,082019
2019130014553400,Marché,Services,Services de réparation et d'entretien,02/08/2019,196549.0,Révisable,Ministère de l'Intérieur - SGAMI SUD - Marseille - BMP- DAFJ,43.344864211,5.39338098888,ETI,702.6085267683756,48.8365394869,2.2389245247,082019
2019G9wzvLPEe200,Marché,Travaux,"Pose de menuiseries métalliques, excepté portes et fenêtres",30/08/2019,19656.0,Ferme et actualisable,DSIUD - Direction des systèmes d information et des usages digitaux,45.7480493184,4.82567584415,PME,189.1468482874184,45.7859001722,3.11559551839,082019
2019eGZV0NnLbn00,Marché,Travaux,Travaux de construction d'installations sportives,16/08/2019,196730.0,Ferme,Mairie de Privas,44.7218752388,4.59409820072,NC,100.43531465607069,43.8915898577,4.95619905867,082019
2019oriEl3wAdp00,Marché,Services,Services de transport routier public,01/08/2019,196740.0,Révisable,Conseil Départemental du Cantal-CD15,44.9245183348,2.4417949992,ETI,56.161261886901904,44.5848771572,2.06599293149,082019
2018-HR8Qb0yKM00,Marché,Travaux,Travaux de construction d'installations sportives,16/08/2019,196792.3,Révisable,Mairie de St  Herblain,47.2246985502,-1.63426478543,NC,21.192406002290003,47.2231457867,-1.82591431135,082019
2018V6hc9MIDC300,Marché,Fournitures,Consommables médicaux,02/08/2019,19680.0,Révisable,Centre hospitalier de Boulogne sur mer Service Economique,50.7270459478,1.60607177999,PME,229.72615609197518,48.8511697506,2.47460350341,082019
2018i-YDHcZpHL00,Marché,Travaux,Travaux d'équipement électrique,13/08/2019,196972.67,Révisable,Mairie de Vieux-Condé,50.4730767331,3.56588473003,PME,10.896855885485515,50.4108530267,3.48971491044,082019
2019150960712900,Marché,Services,Services de conseil en matière d'ingénierie et de construction,20/08/2019,197620.0,Révisable,Ministère des armées - Etablissement du service d'infrastructure de la défense de Lyon - ESID Lyon,,,PME,,44.8056323294,-0.59098965786,082019
2019T0288GPACS01,Marché,Travaux,Travaux d'assainissement,22/08/2019,197827.5,Ferme et actualisable,SM EAUX ASSAINISSEMENT ALSACE MOSELLE,48.6117085666,7.74585158102,PME,42.47875520652162,48.6950696962,7.37086916975,082019
20192019S2893300,Marché,Services,Services ambulanciers,20/08/2019,198.13,Révisable,CHU REIMS,49.2517771432,4.03968745396,PME,11.250363901501343,49.1597194152,4.08217726199,082019
20183Bm_da9pBG00,Marché,Services,Services de surveillance d'installations d'alarme,29/08/2019,19800.0,Révisable,,43.5959710776,1.43229743595,NC,174.78474900762288,44.8541459592,0.486424000322,082019
201919033701,Marché,Travaux,Travaux de câblage et d'installations électriques,08/08/2019,1980000.0,Révisable,BUDGET PRINCIPAL,43.3127155398,5.36343891881,GE,59.70024276472051,43.6853130528,5.75341378324,082019
20192019S1899400,Marché,Services,"Services de technologies de l'information, conseil, développement de logiciels, internet et appui",21/08/2019,1980000.0,Révisable,Agence De l'Environnement et de la Maitrise de l'Energie,47.4766284713,-0.556089456786,ETI,347.58409946749975,48.8604673342,2.26190318372,082019
20191472400,Marché,Services,"Services de technologies de l'information, conseil, développement de logiciels, internet et appui",30/08/2019,1980000.0,Révisable,Agence De l'Environnement et de la Maitrise de l'Energie,47.4766284713,-0.556089456786,NC,355.9876834416116,48.8682182328,2.34268958704,082019
2019M2502,Marché,Travaux,Travaux d'installation de matériel de ventilation et de climatisation,29/08/2019,198052.4,Ferme,COMMUNE VILLEPINTE BUDGET PRIN,48.9595327185,2.53641870202,PME,37.285706338262735,48.9691551178,2.19936288395,082019
20191474100,Marché,Fournitures,Convoyeurs,12/08/2019,198220.0,Ferme,CH DU MANS,47.9889433531,0.20002401353,PME,228.94561709223217,47.5685484061,2.22683432676,082019
201918S0238L0102,Marché,Services,Services d'entretien de parcs,30/08/2019,198384.0,Révisable,Conseil Départemental AM - BP,43.7123384529,7.23750191149,ETI,0.0,43.7123384529,7.23750191149,082019
20192020T1547600,Marché,Travaux,Travaux de construction de monuments historiques ou de mémoriaux,12/08/2019,1985050.0,Révisable,Ministère de la Culture - Etablissement public du Musée du Louvre,48.8625262113,2.33630086089,PME,349.9042218310306,49.0617658953,5.49423963089,082019
2018wy_RYfgdsv00,Marché,Travaux,Travaux de construction de bâtiments,06/08/2019,198692.84,Révisable,COMMUNE DE VALLET,47.1715226334,-1.2615495481,PME,55.598032657658365,46.672862822,-1.29186798708,082019
2019TD26GzK47200,Marché,Travaux,Travaux de menuiserie,23/08/2019,19937.0,Ferme et actualisable,Mairie de Coueron,47.2305431151,-1.7303481837,NC,29.67391855958348,47.3015616292,-1.47168011724,082019
2019VQlWrVcYqZ00,Marché,Fournitures,Fournitures de bureau,20/08/2019,1994.35,Révisable,Centre Hospitalier Avranches Granville,48.8327939183,-1.5661139044,ETI,590.1094067094959,50.3453304924,3.54897300193,082019
2019eK_w58xqXl00,Marché,Travaux,"Travaux de construction, de fondation et de revêtement d'autoroutes, de routes",06/08/2019,199416.6,Révisable,HAUTE CORREZE COMMUNAUTE,45.5501002764,2.30483831309,GE,31.707178906875022,45.3560467942,2.51489795355,082019
20191230082702,Marché,Travaux,Travaux d'aménagement paysager d'espaces verts,23/08/2019,199478.6,Révisable,VILLE DE PARIS BUDGET PRINCIPAL,48.8542874923,2.35759608215,NC,,,,082019
2018012421d00100,Marché,Travaux,Travaux routiers,27/08/2019,19960.0,Ferme et actualisable,Communauté d'agglomération du Val de Fensch,49.3315592832,6.06608414569,NC,6.3446479957184785,49.3277706085,6.12333123467,082019
2019193600,Marché,Services,Services d'installation de matériel électrique,22/08/2019,199600.0,Ferme,EXERCICE BUDGETAIRE VILLE,45.5837038917,5.90877548323,GE,4.82170939273807,45.5527437141,5.93943607994,082019
2018V5Zi7KpitK00,Marché,Fournitures,Consommables médicaux,02/08/2019,1997.0,Révisable,Centre hospitalier de Boulogne sur mer Service Economique,50.7270459478,1.60607177999,NC,159.6835785098433,50.6317671102,3.04699299406,082019
2019150955850000,Marché,Services,Fourniture de cours de langues,05/08/2019,199714.0,Ferme,Ministère de l'Intérieur - Préfecture Ile de France 1,48.840040811,2.29268840406,PME,12.403822308083894,48.9296428406,2.35946866986,082019
