202020-006 L200,Marché,Services,Services de nettoyage,28/07/2020,60000.0,Révisable,Ville de Châteauroux,46.8031778361,1.69389403678,NC,0.0,46.8031778361,1.69389403678,072020
201800901,Marché,Travaux,Location de matériel de terrassement avec opérateur,10/07/2020,60000.0,Révisable,CAMIERS,50.5644100429,1.61239843413,PME,0.0,50.5644100429,1.61239843413,072020
20190lQaX2Xma-00,Marché,Fournitures,Livres scolaires,15/07/2020,60000.0,Révisable,Mairie de Coueron,47.2305431151,-1.7303481837,PME,143.15586939299448,47.3426285019,-0.440620330078,072020
202020V0517-0100,Marché,Services,Services de réparation et d'entretien de véhicules à moteur et d'équipements connexes,01/07/2020,60000.0,Ferme,MAIRIE DE NICE,43.7123384529,7.23750191149,PME,0.0,43.7123384529,7.23750191149,072020
202020DAB00500,Marché,Fournitures,Distributeurs de boissons,06/07/2020,60000.0,Ferme,DEPARTEMENT DES ALPES DE HAUTE PROVENC,44.0904434342,6.23557275155,ETI,12.831631730269745,44.022947591,6.14123056877,072020
2020170010136700,Marché,Services,Services de formation professionnelle,01/07/2020,60000.0,Révisable,"Ministère de l'éducation nationale et de la jeunesse et Ministère de l'enseignement supérieur, de la recherche et de l'innovation - Rectorat de TOULOUSE",43.5959710776,1.43229743595,PME,595.1081791810885,48.8727847696,2.31253091684,072020
20202020F1141500,Marché,Fournitures,"Équipements de laboratoire, d'optique et de précision (excepté les lunettes)",31/07/2020,60000.0,Ferme,CHRU NANCY,48.6900671002,6.17594832427,PME,441.28330276191093,48.6811729227,2.1853558178,072020
202120024200,Marché,Services,Services sociaux,22/07/2020,60000.0,Ferme,BUDGET PRINCIPAL CD65,43.2347953943,0.0657136709174,NC,29.908630797207095,42.9745362292,0.132879028245,072020
20202020S1083300,Marché,Services,Services de conseil en logiciels,21/07/2020,60000.0,Ferme,"Etablissements et organismes de l'enseignement supérieur, de la recherche et de l'innovation - Direction des achats",48.6900671002,6.17594832427,PME,176.53343908197357,48.5716343863,7.76783353204,072020
2019x1raMFJ0gl00,Marché,Fournitures,Fournitures de bureau,17/07/2020,60000.0,Ferme et actualisable,SIDEN-SIAN,50.6752771707,3.12787285895,ETI,243.9957573292274,48.5862081061,2.452303526,072020
20202020S1088100,Marché,Services,Services de réparation et d'entretien de matériel médical et chirurgical,17/07/2020,60000.0,Révisable,CHU GRENOBLE,45.2097006413,5.74400008015,NC,561.6026756175811,48.9157198373,2.28764873642,072020
20202020S2225700,Marché,Services,Services de publicité,16/07/2020,60000.0,Ferme,Chambres de Commerce et d'Industrie,49.1081027833,6.19595351042,NC,7.4525715141417885,49.1634622968,6.15758879329,072020
2019_e8TKJ3D7F00,Marché,Fournitures,Pièces de lampes et d'appareils d'éclairage,15/07/2020,60000.0,Révisable,Mairie de Coueron,47.2305431151,-1.7303481837,GE,482.99343418914856,48.8873739998,2.30681348993,072020
2020CP005F00200,Marché,Travaux,Travaux de débroussaillage,29/07/2020,60000.0,Ferme,BUDGET PRINCIPAL CD40,43.8994418261,-0.490443107618,PME,52.82597760448772,43.4623303655,-0.676472641069,072020
2019013d5c600100,Marché,Services,Services informatiques,08/07/2020,600000.0,Ferme,Informatique ICDC,48.8053725236,2.33400842575,GE,17.313191181204555,48.8963161116,2.20694242609,072020
20202020S1386900,Marché,Services,Location de véhicules de transport de personnes avec chauffeur,24/07/2020,600000.0,,"Etablissements et organismes de l'enseignement supérieur, de la recherche et de l'innovation - Direction des achats",48.6900671002,6.17594832427,PME,11.182160775712939,48.6141724287,6.10920736089,072020
20202020/0300,Marché,Fournitures,Serrurerie,08/07/2020,600000.0,Révisable,EPF AUVERGNE,45.7859001722,3.11559551839,PME,5.106001414076385,45.7498237009,3.08701231475,072020
20202020S1168500,Marché,Services,Services de recrutement,24/07/2020,600000.0,Révisable,"Ministère de la Transition Écologique et Solidaire, Ministère de la Cohésion des Territoires - Agence Nationale de l'Habitat",48.8625262113,2.33630086089,NC,8.159253326188486,48.8855642403,2.26624582625,072020
20180Bx6StsD1c00,Marché,Services,"Études de faisabilité, service de conseil, analyse",23/07/2020,600000.0,Révisable,Communauté Urbaine Caen la Mer,49.1850685346,-0.370026383608,GE,690.9250257996686,45.7731043316,4.85202749669,072020
2019PiaIAb0lY700,Marché,Travaux,Travaux d'installations sanitaires,16/07/2020,600000.0,Révisable,SIDEN-SIAN,50.6752771707,3.12787285895,NC,32.74944265429436,50.6991288082,2.8326772944,072020
202090700,Marché,Services,Services de maintenance des systèmes et services d'assistance,28/07/2020,600000.0,Révisable,Budget principal M52,43.6131750772,3.86941278925,GE,354.96719717787147,45.8900209706,6.12570413482,072020
202020024200,Marché,Fournitures,"Journaux, revues spécialisées, périodiques et magazines",22/07/2020,600000.0,Ferme,BUDGET PRINCIPAL,43.3127155398,5.36343891881,NC,2.589929121158257,43.2999288243,5.38304196226,072020
202072709800,Marché,Services,Maintenance et réparation de matériel de réseau informatique,27/07/2020,600000.0,Ferme,Musée du Louvre Lens,50.4372553549,2.82129881832,NC,31.396445604200792,50.5398927913,3.085816073,072020
2020CP011F00502,Marché,Travaux,Travaux de rénovation de ponts,30/07/2020,600000.0,Ferme,BUDGET PRINCIPAL CD40,43.8994418261,-0.490443107618,PME,101.06336354747113,44.7767766736,-0.255329819493,072020
2020biQnn8rXjh00,Marché,Services,Services d'action sociale et services connexes,03/07/2020,600000.0,Révisable,MSA DES CHARENTES,45.7423034662,-0.649840149818,PME,0.0,45.7423034662,-0.649840149818,072020
2018W83TN8nrG600,Marché,Services,Services d'études,09/07/2020,600000.0,Ferme et actualisable,Mairie de Lille,50.6317671102,3.04699299406,PME,0.0,50.6317671102,3.04699299406,072020
2020CP011F00600,Marché,Travaux,Travaux de rénovation de ponts,30/07/2020,600000.0,Ferme,BUDGET PRINCIPAL CD40,43.8994418261,-0.490443107618,ETI,258.1391784923536,46.1345242678,-1.11327247407,072020
2019Cu7RZly30600,Marché,Services,Services d'entretien des installations de signalisation,23/07/2020,600000.0,Révisable,Communauté Urbaine Caen la Mer,49.1850685346,-0.370026383608,GE,9.27601348695604,49.1779273123,-0.286445599024,072020
2019AO0271200,Marché,Fournitures,"Vêtements professionnels, vêtements de travail spéciaux et accessoires",28/07/2020,600000.0,Révisable,SDIS DU PAS DE CALAIS BUDGET PRINCIPAL,50.3081347422,2.81107875678,NC,36.25200005472018,50.5468153947,3.034449778,072020
20202020F1029500,Marché,Fournitures,,16/07/2020,600000.0,Ferme,"Etablissements et organismes de l'enseignement supérieur, de la recherche et de l'innovation - UNIVERSITE DE BORDEAUX",44.8578964782,-0.57357535767,NC,,,,072020
20202020T0991200,Marché,Travaux,Travaux d'installations électriques,01/07/2020,600000.0,Révisable,Ministères sociaux,47.2551269927,6.0192810348,GE,7.805127402011286,47.2865163782,6.08247964074,072020
20202020F0518400,Marché,Fournitures,Matériel électrique,13/07/2020,600000.0,Révisable,VILLE DE MONTIGNY LE BRETONNEUX,48.7796502574,2.02991602442,PME,223.66353947428695,49.4965847516,0.140273146733,072020
20202020T0905600,Marché,Travaux,Travaux de marquage routier,07/07/2020,600000.0,Révisable,Ville de Maisons Laffitte,48.9523319493,2.15274949447,NC,19.747083481035656,49.0832310447,2.03212828106,072020
2020HUmEHnKzIN00,Marché,Fournitures,Systèmes d'éclairage,17/07/2020,600000.0,Révisable,Mairie de Marcq en Baroeul,50.675257141,3.10114805967,PME,795.6875688631372,43.8792387371,5.38850102897,072020
2020M04000,Marché,Fournitures,"Vêtements professionnels, vêtements de travail spéciaux et accessoires",03/07/2020,600000.0,Ferme,Ville de Courbevoie,48.8983675206,2.25515424076,PME,18.789050770247663,48.8694561887,2.42256669613,072020
2020034N2000,Marché,Services,Services de traitement des eaux usées,24/07/2020,600000.0,Révisable,BUDGET PRINCIPAL SMEA,43.5959710776,1.43229743595,NC,0.0,43.5959710776,1.43229743595,072020
2020St0XUE6lBU00,Marché,Services,Services de courrier,16/07/2020,600000.0,Révisable,CAF PARIS,48.840040811,2.29268840406,PME,10.521319250257463,48.9346127594,2.29454165622,072020
20202020F1138500,Marché,Travaux,Ouvrages en bois,31/07/2020,600000.0,Révisable,CHU BESANCON,47.2551269927,6.0192810348,PME,53.12311610345517,47.1228579661,5.5575275995,072020
2020CP011F00402,Marché,Travaux,Travaux de rénovation de ponts,30/07/2020,600000.0,Ferme,BUDGET PRINCIPAL CD40,43.8994418261,-0.490443107618,PME,101.06336354747113,44.7767766736,-0.255329819493,072020
2020M202902L0200,Marché,Services,Services d'impression,30/07/2020,600000.0,Révisable,BUDGET PRINCIPAL,48.902321262,2.48360567737,NC,11.635236710769533,48.8360445933,2.56502268278,072020
20202020/0701,Marché,Fournitures,Enrobés routiers,06/07/2020,600000.0,Révisable,COMMUNE DE VAUJANY,45.1861869282,6.10096344033,NC,39.14213312576828,45.1334670409,5.75097030293,072020
202030010600,Marché,Fournitures,Produits de nettoyage,22/07/2020,600000.0,Révisable,BUDGET PRINCIPAL VC,48.7910373864,2.33181332782,ETI,70.50986920839654,48.3146159593,2.75254978113,072020
20202020S1103800,Marché,Services,Services de nettoyage et d'hygiène,21/07/2020,600000.0,Révisable,Ministère de l'Intérieur -  Pays de la Loire,47.2321613301,-1.54797539458,NC,,,,072020
2020CP011F00200,Marché,Travaux,Travaux de rénovation de ponts,29/07/2020,600000.0,Ferme,BUDGET PRINCIPAL CD40,43.8994418261,-0.490443107618,PME,101.06336354747113,44.7767766736,-0.255329819493,072020
20202020F0449500,Marché,Fournitures,Matériel et fournitures informatiques,27/07/2020,600000.0,Ferme,RESEAUX DES ACHETEURS HOSPITALIERS,48.8591103086,2.38017728226,NC,155.46070907721813,49.4744089013,1.11792062882,072020
2020DHyCQhGBtf00,Marché,Fournitures,Fournitures scolaires,09/07/2020,600000.0,Ferme,Ville de Puteaux,48.8836186061,2.23810959636,NC,2.4987456776992825,48.8983675206,2.25515424076,072020
20202015000,Marché,Services,Plantation d'arbres par ensemencement,27/07/2020,600000.0,Révisable,Budget principal,47.9889433531,0.20002401353,PME,54.857797133544985,47.8145004926,-0.263970100304,072020
20190Mjn1lcC4v00,Marché,Services,Études techniques,08/07/2020,600000.0,Révisable,Mairie de Lille,50.6317671102,3.04699299406,NC,46.08529709097592,50.5291112881,2.64320584341,072020
201919FF010200,Marché,Fournitures,Véhicules de lutte contre l'incendie,02/07/2020,600000.0,Ferme et actualisable,SDIS DE L OISE,49.4363296139,2.08715087996,ETI,536.3704176225693,47.2801589313,-2.25106183059,072020
20202020T1223400,Marché,Travaux,Travaux de dragage et de pompage,07/07/2020,6000000.0,Révisable,"Ministère de la Transition Écologique, Ministère de la Cohésion des Territoires, Ministère de la Mer - Direction territoriale Nord - Pas de Calais",50.6317671102,3.04699299406,NC,,,,072020
2020Ftjo8ngVoM00,Marché,Services,Entretien d'installations d'éclairage public et de feux de signalisation,09/07/2020,6000000.0,Révisable,Val d'Europe agglomération,48.8726903987,2.77025918382,NC,8.940735213652797,48.819930904,2.70924343454,072020
202019N0495-0001,Marché,Services,Logiciels et systèmes d'information,06/07/2020,6000000.0,Révisable,METROPOLE NICE COTE D'AZUR,43.7123384529,7.23750191149,GE,270.3550960066923,45.8900209706,6.12570413482,072020
20202020F1526200,Marché,Fournitures,Instruments de contrôle de propriétés physiques,14/07/2020,600231.6,Ferme,"Etablissements et organismes de l'enseignement supérieur, de la recherche et de l'innovation - CNRS Délégation Paris Centre",48.8444087298,2.35049826183,NC,,,,072020
2020M2009103,Marché,Travaux,Travaux de couverture en ardoises,07/07/2020,60045.84,Révisable,ORLEANS METROPOLE,47.8824665066,1.91660961834,PME,56.29925787277552,47.9801492214,2.41618215513,072020
2020TR MAT 0601,Marché,Fournitures,Appareils sanitaires,02/07/2020,60066.09,Ferme et actualisable,THORIGNE SUR DUE,48.0291430068,0.519913493046,PME,13.335775751465487,48.0580550815,0.40287369706,072020
2018U7TihdxqtQ00,Marché,Travaux,Travaux d'étanchéification,07/07/2020,601178.0,Ferme,3F-DGRDI NE,48.8282706469,2.362358986,PME,11.96552235181293,48.7321607291,2.41097949757,072020
20202020F0445000,Marché,Fournitures,"Plantes vivantes, bulbes, racines, boutures et greffons",24/07/2020,6012.16,Ferme,La Ville d'Antony,48.7498603402,2.29906093692,NC,76.8163430654023,48.4679221534,1.66491927309,072020
2020100014702600,Marché,Fournitures,Azote,27/07/2020,60140.0,Ferme,Ministère des armées - Etablissement du service d'infrastructure de la défense de BREST - ESID Brest,,,PME,,48.3999000994,-4.5027702561,072020
20202020021600,Marché,Travaux,Travaux de câblage et d'installations électriques,08/07/2020,602066.88,Révisable,CC PEVELE CAREMBAULT,50.5217595365,3.11483368471,NC,18.683988369511052,50.3738840638,3.03451117586,072020
2020170010112000,Marché,Services,Services de formation professionnelle,24/07/2020,60240.0,Révisable,Ministère des armées - Service Parisien de Soutien de l'Administration Centrale - SPAC,,,PME,,43.5959710776,1.43229743595,072020
159221014090400,Marché,Travaux,Travaux de charpente et de couverture et travaux connexes,06/07/2020,60250.0,Ferme et actualisable,SDIS 34,43.663798664,3.72843489659,PME,104.019035146997,43.5468109054,4.6617387917,072020
2018nrR2Bkq-Yb00,Marché,Travaux,Travaux de peinture,01/07/2020,60267.8,Ferme,OPHEA,48.5716343863,7.76783353204,PME,25.170155672359687,48.7905370344,7.83215036497,072020
20202020F1094200,Marché,Fournitures,Chromatographes,24/07/2020,60275.35,Ferme,"Etablissements et organismes de l'enseignement supérieur, de la recherche et de l'innovation - Direction des achats",48.6900671002,6.17594832427,NC,440.09204066023887,48.7839097374,2.19723411662,072020
20202020S1093400,Marché,Services,"Services de comptabilité, services d'audit et services fiscaux",08/07/2020,60300.0,Révisable,"Ministère de la Transition Écologique et Solidaire, Ministère de la Cohésion des Territoires - Météo France",48.8410208466,2.41853928643,ETI,11.82462345866368,48.9296428406,2.35946866986,072020
2020INFRA0009900,Marché,Services,Services de transport routier public,03/07/2020,603391.76,Révisable,Budget principal,46.5622744929,3.32725048972,PME,482.2129717317858,43.1613315352,6.04281101303,072020
2019TSG06301,Marché,Travaux,Travaux relatifs aux conduites d'alimentation en eau,16/07/2020,60350.1,Révisable,Budget principal,45.1821782198,5.72099089704,PME,115.97692660124169,45.4783628423,4.71512827376,072020
20202020S1067100,Marché,Services,"Services d'architecture, services de construction, services d'ingénierie et services d'inspection",21/07/2020,60439.39,Ferme,SOCIETE DU CANAL SEINE-NORD EUROPE,49.4324180433,2.80620954652,NC,94.39486181285021,48.7802898374,2.25979241616,072020
2019r0m0CTHSHn00,Marché,Services,Logiciels de réseau d'internet et d'intranet,20/07/2020,60484.0,Révisable,Office de Tourisme Dieppe-Maritime,49.9219289587,1.08708489429,PME,487.5784196371571,46.1619512738,-1.1749922971,072020
2019yvuRVk8qu800,Marché,Services,Services d'assurance dommages ou pertes,01/07/2020,60530.0,Révisable,Commune de Mèze,43.4292130127,3.57831584575,PME,620.9750934217744,48.8769868607,2.33753841595,072020
20202020T1079400,Marché,Travaux,Travaux d'installations électriques,22/07/2020,60556.37,Ferme et actualisable,"Etablissements et organismes de l'enseignement supérieur, de la recherche et de l'innovation - UNIVERSITE D ARTOIS",50.2899236486,2.76642705397,PME,37.33472398779155,50.3819513722,3.09113688598,072020
20202020F1296800,Marché,Fournitures,Consommables médicaux autres que chimiques à usage unique et consommables hématologiques,24/07/2020,60726.0,Ferme,CHU RENNES,48.111571436,-1.68168588816,ETI,637.5641957403104,43.5651011775,1.82580984999,072020
202000200500,Marché,Services,Services de contrôle légal des comptes,16/07/2020,60800.0,Révisable,OPH Toul Habitat,48.6866434118,5.89495783448,ETI,31.076081525581053,48.6900671002,6.17594832427,072020
2018fGnTNfH3Qq00,Marché,Travaux,Travaux d'aménagement paysager,23/07/2020,60839.98,Révisable,Communauté Urbaine Caen la Mer,49.1850685346,-0.370026383608,PME,14.86715259719035,49.0810445825,-0.285700234667,072020
2018r9MOt9llsN00,Marché,Services,Services de réseaux informatiques,01/07/2020,60847.0,Ferme,GIE SESAM-Vitale,47.9889433531,0.20002401353,NC,,,,072020
2020AC20.0200,Marché,Travaux,Travaux de construction de stations d'épuration des eaux usées,01/07/2020,60866.0,Révisable,CSMA ASSAINISSEMENT REGIE,47.0969805229,-1.27155483808,ETI,444.205107404403,48.9346127594,2.29454165622,072020
2020M11200,Marché,Travaux,Travaux de menuiserie,06/07/2020,60890.0,Ferme,BUDGET DEPARTEMENTAL,45.7859001722,3.11559551839,PME,0.0,45.7859001722,3.11559551839,072020
202072738000,Marché,Fournitures,Équipements de protection,28/07/2020,60918.0,Ferme,CIVIS,-21.3123152713,55.4940884083,PME,24.541161837161233,-20.9331856391,55.4471055195,072020
2019bH9b6aAWg400,Marché,Travaux,Travaux d'extension de bâtiments,08/07/2020,6092.08,Révisable,FLERS AGGLO,48.7400079375,-0.562173805455,PME,8.3943223752223,48.7948886024,-0.510108160041,072020
2020jmDyNZdn7c00,Marché,Fournitures,Insignes,06/07/2020,6096.0,Révisable,DQAJ,48.8491121687,2.33284677548,PME,18.85729325261216,48.7148263602,2.22875253896,072020
20205e5CYCLOet00,Marché,Travaux,Travaux de construction,29/07/2020,60985.0,Ferme,SET,47.3980773574,0.696151819266,PME,78.2752643683074,47.9788917277,0.297105562283,072020
20202020T0528500,Marché,Travaux,Travaux de construction,23/07/2020,60990.72,Ferme,CD95 - Conseil départemental du Val d'Oise,49.0400551805,2.05074797264,NC,,,,072020
20200010101,Marché,Travaux,Travaux de construction complète ou partielle et travaux de génie civil,22/07/2020,61000.0,Ferme et actualisable,MAIRIE AZAY SUR CHER,47.3343753198,0.845190883122,PME,5.470575481963209,47.2855844491,0.851147252623,072020
2019YDumOKFWQ400,Marché,Travaux,"Travaux d'installation de matériel de chauffage, de ventilation et de climatisation",21/07/2020,61020.0,Ferme,CDC Habitat Social DIR Grand-Ouest (SAMO Nantes),47.2321613301,-1.54797539458,PME,203.9195125677007,47.9594908352,0.144645189116,072020
2020M20-010 L601,Marché,Travaux,Travaux de menuiserie,30/07/2020,61059.0,Révisable,COM. AGGLOMERATION CHATEAUROUX METROPO,,,PME,,46.63486232,1.10022127773,072020
2020gWNCBHQOJD00,Marché,Travaux,Travaux d'équipement du bâtiment,15/07/2020,61070.0,Révisable,Département de l Indre Direction des Routes des Transports du Patrimoine et de l Education,46.8031778361,1.69389403678,PME,84.22694091030758,47.0747420182,2.40492134914,072020
2020/0101,Marché,Travaux,Travaux de construction,28/07/2020,61100.0,Ferme,MALVALETTE,45.3547255432,4.15320811132,PME,46.11821826182398,45.02773512,3.89608931701,072020
2020.5600,Marché,Travaux,Travaux d'équipement électrique,30/07/2020,61129.24,Révisable,ALCEANE,49.4965847516,0.140273146733,PME,0.0,49.4965847516,0.140273146733,072020
20202005020400,Marché,Travaux,Travaux de menuiserie,09/07/2020,61132.31,Ferme et actualisable,GRAND ANNECY,45.8900209706,6.12570413482,PME,66.31095064013509,46.3713202371,6.48296533168,072020
2019-2Ty3CoqvN00,Marché,Travaux,Travaux de construction,23/07/2020,6114.0,Ferme et actualisable,Mairie de Cornebarrieu,43.6486405718,1.32264006592,PME,7.932133431540077,43.5783751148,1.33466866952,072020
201919038-1900,Marché,Travaux,Travaux de construction de bâtiments,17/07/2020,61153.0,Révisable,VILLE DE SAINT-PAUL-TROIS-CHÂTEAUX,44.3484630171,4.75744156422,PME,607.8624171083117,44.7238064664,-0.726794024454,072020
2020HktsmMiA3c00,Marché,Services,Services de distribution de courrier,13/07/2020,61160.0,Ferme et actualisable,SEMAPA,48.8282706469,2.362358986,PME,20.179694303727064,48.7656350255,2.53363576939,072020
20199050402,Marché,Services,Services d'ingénierie,28/07/2020,61172.5,Révisable,Région de Bretagne,48.111571436,-1.68168588816,NC,5.213461498766663,48.1582843043,-1.68533502046,072020
20202020F1296400,Marché,Fournitures,Consommables médicaux autres que chimiques à usage unique et consommables hématologiques,24/07/2020,61342.05,Ferme,CHU RENNES,48.111571436,-1.68168588816,NC,754.3049052123465,48.0976298874,5.1398599496,072020
20199q7miiNz8300,Marché,Fournitures,Aménagements,15/07/2020,61390.0,Révisable,MACON HABITAT,46.320613267,4.81834086547,NC,16.696860194334036,46.189986656,4.74333512467,072020
20202020F2104200,Marché,Fournitures,"Équipements de laboratoire, d'optique et de précision (excepté les lunettes)",01/07/2020,61400.0,Ferme,"Etablissements et organismes de l'enseignement supérieur, de la recherche et de l'innovation - ECOLE NATIONALE SUPERIEURE DE MECANIQUE ET D'AEROTECHNIQUE",46.6518315191,0.362203052781,NC,314.3982958836937,48.5968549847,2.424435968,072020
2019zl2OBx1zkX00,Marché,Services,Services de conseils et d'information juridiques,20/07/2020,61443.0,Révisable,ACOSS (Caisse nationale),48.8631652232,2.4482059517,NC,,,,072020
20202020T1015000,Marché,Travaux,Travaux de construction de chemins piétonniers,07/07/2020,61466.25,Ferme et actualisable,"Etablissements et organismes de l'enseignement supérieur, de la recherche et de l'innovation - UNIVERSITE DE POITIERS",46.5834165499,0.359436087058,NC,6.854781305106579,46.5859101335,0.297494406027,072020
20202020T0414800,Marché,Travaux,Travaux de menuiserie,02/07/2020,61500.0,Révisable,CHU REIMS,49.2517771432,4.03968745396,PME,5.541756367947655,49.2495894753,3.98962014487,072020
2020T040200,Marché,Travaux,Travaux de désamiantage,28/07/2020,61536.41,Révisable,MAYENNE COMMUNAUTE,48.3076282491,-0.614762085578,PME,50.383493757663,48.1089184372,-1.02416114433,072020
20202020T040200,Marché,Travaux,Travaux de désamiantage,27/07/2020,61536.41,Révisable,MAYENNE COMMUNAUTE,48.3076282491,-0.614762085578,PME,50.383493757663,48.1089184372,-1.02416114433,072020
2019FcD_5eIZOc00,Marché,Fournitures,Consommables médicaux,02/07/2020,6160.0,Révisable,CENTRE HOSPITALIER DE MACON,46.320613267,4.81834086547,PME,391.85797228673096,48.6811729227,2.1853558178,072020
