20202020S1985500,Marché,Services,Services de recherche en matière de pollution par produits chimiques et par hydrocarbures,07/12/2020,84932.0,Ferme,Agence De l'Environnement et de la Maitrise de l'Energie,47.4766284713,-0.556089456786,ETI,346.01709610847604,48.8231210367,2.26445901319,122020
2018UG9I7Fm2gZ00,Marché,Travaux,Travaux de restructuration,11/12/2020,84943.63,Révisable,Mairie de Caen,49.1850685346,-0.370026383608,PME,98.6850835252007,49.2966246966,-1.25540922772,122020
2020GN9C22A0700,Marché,Travaux,Travaux de terrassement,11/12/2020,84944.0,Ferme,GRAND NARBONNE COMMUNAUTE AGGLOMERATIO,43.1651014685,3.02005317318,NC,0.0,43.1651014685,3.02005317318,122020
2020V2032600,Marché,Fournitures,Mobilier modulaire,09/12/2020,85000.0,Révisable,VILLE D'ORLEANS,47.8824665066,1.91660961834,PME,117.73295696501322,48.9172863598,2.13951942246,122020
2020M200075301,Marché,Services,Services de réparation et d'entretien du matériel de sécurité,23/12/2020,85000.0,Révisable,DEPARTEMENT DES PYRENEES ORIENTALES,42.6966171788,2.89890986886,PME,5.537296900336617,42.679064655,2.94577352274,122020
202020201000,Marché,Fournitures,"Machines, matériel et fournitures de bureau, excepté ordinateurs, imprimantes et meubles",03/12/2020,85000.0,Révisable,EPF AUVERGNE,45.7859001722,3.11559551839,PME,14.1826428498164,45.896843982,3.05225388591,122020
2020M200075201,Marché,Services,Services de réparation et d'entretien du matériel de sécurité,23/12/2020,85000.0,Révisable,DEPARTEMENT DES PYRENEES ORIENTALES,42.6966171788,2.89890986886,NC,146.95388175185215,43.5635286669,3.9024872849,122020
20202020S2225600,Marché,Services,Services de contrôle légal des comptes,02/12/2020,85000.0,Révisable,Chambres de Commerce et d'Industrie,49.1081027833,6.19595351042,ETI,435.2514907925943,48.8855642403,2.26624582625,122020
2020120007201400,Marché,Services,Services de nettoyage et d'hygiène,15/12/2020,85000.0,Ferme,Ministère des armées -  Ministère des Armées direction du commissariat d'outre-mer aux Antilles,,,NC,,16.2727026732,-61.5016988194,122020
2018zU5hsDRiML00,Marché,Travaux,Travaux de restructuration,11/12/2020,85000.0,Révisable,Mairie de Caen,49.1850685346,-0.370026383608,PME,11.844316965068428,49.2892377911,-0.391853258658,122020
2019yE6fuKNZg100,Marché,Services,Services de maintenance préventive,10/12/2020,85000.0,Révisable,CPAM MELUN,48.5645255065,2.68028856931,NC,87.42584335799643,49.0400551805,2.05074797264,122020
20205200,Marché,Travaux,Travaux de construction de bâtiments,29/12/2020,85000.0,Ferme et actualisable,CAECPC COMMUNAUTE D'AGGLOMERATION,49.0369746943,3.93167573178,PME,24.265003926636087,49.2540901675,3.9071552187,122020
20202020F1997000,Marché,Fournitures,"Matériels médicaux, pharmaceutiques et produits de soins personnnels",07/12/2020,85000.0,Ferme,CHU AMIENS PICARDIE,49.9002814748,2.29072265357,NC,,,,122020
2020V0B0057TM00,Marché,Travaux,Réparation et entretien d'infrastructures sportives,21/12/2020,85000.0,Ferme et actualisable,EXERCICE 2020,43.6131750772,3.86941278925,PME,0.0,43.6131750772,3.86941278925,122020
20212326100-0000,Marché,Services,Services de conseils et de représentation juridiques,08/12/2020,85000.0,Ferme,Budget principal,48.6293513055,2.44049035394,PME,30.549910107179564,48.8727847696,2.31253091684,122020
2020r5S3w7S5sZ00,Marché,Fournitures,Matériel de communications,15/12/2020,85000.0,Ferme,CAISSE CENTRALE MSA,48.9073106793,2.44007227598,ETI,16.376229883708064,48.9346127594,2.29454165622,122020
2020V0B0059EM00,Marché,Fournitures,Articles d'habillement,07/12/2020,85000.0,Ferme,EXERCICE 2020,43.6131750772,3.86941278925,PME,0.0,43.6131750772,3.86941278925,122020
20202020F2009300,Marché,Fournitures,Réactifs et produits de contraste,15/12/2020,85000.0,Révisable,CHI TOULON LA SEYNE,43.1364847512,5.93276630299,NC,,,,122020
2020n4vZQW35F500,Marché,Services,Logiciels et systèmes d'information,18/12/2020,85051.0,Révisable,BRL DJRSE,43.8445331544,4.34760475323,PME,58.78816290826456,43.6131750772,3.86941278925,122020
2018MxnfsFHjFB00,Marché,Travaux,Travaux de fouille et de terrassement,11/12/2020,850809.05,Révisable,Mairie de Caen,49.1850685346,-0.370026383608,NC,9.0130950044096,49.186794323,-0.451519503888,122020
20202020F1994200,Marché,Fournitures,Viande,14/12/2020,850887.0,Révisable,CHRU NANCY,48.6900671002,6.17594832427,NC,46.31922208733306,49.1081027833,6.19595351042,122020
20209azlgC8bpA00,Marché,Fournitures,Matériel biomédical,09/12/2020,85101.49,Révisable,CENTRE HOSPITALIER DE PAU,43.3201640732,-0.3496692279,PME,622.1297598697488,45.6776041395,4.75268296549,122020
20202020F2336500,Marché,Fournitures,Pansements,17/12/2020,851139.84,Révisable,CHU NANTES,47.2321613301,-1.54797539458,PME,533.0854816198349,43.5390131127,1.52156442051,122020
2020170010431700,Marché,Services,Services de formation professionnelle,30/12/2020,85152.0,Ferme,Ministère de l'agriculture et de l'alimentation - Bureau de la commande publique et des achats,48.8562037309,2.3121193117,PME,1.8448613856586162,48.8727847696,2.31253091684,122020
20202021T0065300,Marché,Fournitures,Revêtements de sol,10/12/2020,8516.63,Ferme et actualisable,"Etablissements et organismes de l'enseignement supérieur, de la recherche et de l'innovation - Institut polytechnique de Bordeaux",44.8056323294,-0.59098965786,PME,9.52129786745416,44.791939845,-0.675986855592,122020
20202021S0124500,Marché,Services,Services d'entretien d'ascenseurs,21/12/2020,851998.32,Révisable,"Etablissements et organismes de l'enseignement supérieur, de la recherche et de l'innovation - Université Paris 1 - Panthéon Sorbonne",48.8444087298,2.35049826183,ETI,18.234521997509308,48.7839097374,2.19723411662,122020
2020.21LOT0600,Marché,Services,,23/12/2020,85254.0,Ferme,NOREVIE,,,PME,,50.6312232921,2.73902077381,122020
2020151041174500,Marché,Travaux,Travaux de construction,03/12/2020,852814.29,Révisable,Ministère des armées - Etablissement du Service d'infrastructure de la défense d'Ile de France - ESID Ile de France,,,ETI,,48.702576425,2.33729767244,122020
2019000002135904,Marché,Travaux,Travaux de construction de bâtiments,09/12/2020,85296.65,Ferme et actualisable,Collectivité Territoriale de Guyane,5.03107464278,-52.5193923736,GE,28.550052949450883,4.8842283494,-52.2790571265,122020
20202020S0001600,Marché,Services,Services d'assurance défense et recours,17/12/2020,853.84,Ferme,Commune de Saint-Aubin d'Aubigné,48.2619104837,-1.60052979264,PME,957.7162076002204,48.7384501677,7.04716136958,122020
201920190800,Marché,Travaux,Réparation et entretien d'infrastructures sportives,14/12/2020,85375.14,Ferme et actualisable,COM COM DES RIVES DU HAUT ALLIER,45.0822428141,3.47795844174,PME,161.87800783061644,43.752147035,4.07616963171,122020
2020KcVWKC3jVu00,Marché,Travaux,Travaux de pose de revêtements de sols,25/12/2020,8540.0,Ferme,Commune d'Aubergenville,48.9628543141,1.84938988584,PME,91.23195728827528,48.9424899673,2.67419646369,122020
20202020S2064900,Marché,Services,Services de collecte des ordures,21/12/2020,8544.0,Ferme et actualisable,CHU NIMES,43.8445331544,4.34760475323,PME,0.0,43.8445331544,4.34760475323,122020
2020M1310B00,Marché,Fournitures,Serrurerie,17/12/2020,85442.8,Révisable,14 Ville 2020,45.7041579754,4.88121408321,PME,10.247142447905025,45.6945569252,4.78905050427,122020
202001/MF/PA00,Marché,Travaux,,04/12/2020,85517.25,Ferme,MAIRIE D'ORCIERES,44.6838344792,6.34871056074,NC,93.95342824580173,45.4802291518,6.05447001428,122020
2020du0BUkO4Zh00,Marché,Services,Services d'entretien d'ascenseurs,29/12/2020,85560.0,Ferme et actualisable,SA HLM QUEVILLY HABITAT,49.4094883554,1.03952520974,NC,267.9451926814419,50.675257141,3.10114805967,122020
2020100015057700,Marché,Services,"Services d'architecture, services de construction, services d'ingénierie et services d'inspection",24/12/2020,855600.0,Révisable,Ministère des armées - Etablissement du service d'infrastructure de la défense de Lyon - ESID Lyon,,,PME,,43.5959710776,1.43229743595,122020
20180i4ccuMemK00,Marché,Services,,28/12/2020,855625.0,Ferme et actualisable,OPH - Direction Technique du Patrimoine,48.783689162,2.4549804713,NC,10.686164876978506,48.8635257742,2.40121168869,122020
20202020S0883800,Marché,Services,Services d'impression et de distribution,08/12/2020,856000.0,Révisable,Ville de Sevran,48.9390274514,2.53062675237,PME,18.954785762512333,48.9296428406,2.35946866986,122020
20202020VO-00201,Marché,Travaux,Travaux de construction de voies,04/12/2020,85603.81,Ferme et actualisable,COMMUNAUTE DE COMMUNES DU FRONTONNAIS,43.7956101203,1.41808408112,NC,22.272407867239146,43.5959710776,1.43229743595,122020
2020LG9gO2Q5-400,Marché,Fournitures,Matériel informatique,24/12/2020,8561.0,Ferme,Mairie Saint-Maur-des-Fossés,48.7987986059,2.49441281984,PME,33.58695645407643,48.8963161116,2.20694242609,122020
202019CAD2100,Marché,Travaux,Travaux de construction de monuments historiques ou de mémoriaux,08/12/2020,85610.0,Ferme,COMMUNE DE CADENET,43.7301499558,5.38385067288,PME,63.093175583713226,43.9111147804,5.92482311169,122020
20202000021-100,Marché,Services,Services d'architecte pour les bâtiments,03/12/2020,856364.2,Révisable,DEMBENI,-12.8530643264,45.1761721245,NC,7319.024569237359,43.5390131127,1.52156442051,122020
2020200021100,Marché,Services,Services d'architecte pour les bâtiments,04/12/2020,856364.2,Révisable,DEMBENI,-12.8530643264,45.1761721245,NC,7202.286736026879,45.7333494426,4.83733100241,122020
2020.62R03.400,Marché,Travaux,Travaux de couverture,29/12/2020,857130.0,Ferme et actualisable,NOREVIE,,,PME,,50.4752011938,2.57821782647,122020
20202020S1971300,Marché,Services,Services de blanchisserie et de nettoyage à sec,10/12/2020,85723.74,Révisable,"Etablissements et organismes de l'enseignement supérieur, de la recherche et de l'innovation - Centre régional des oeuvres universitaires et scolaires de Poitiers",46.5834165499,0.359436087058,PME,189.16439412023254,46.50418744,2.06831264529,122020
2020151043714900,Marché,Travaux,Travaux de construction de chemins piétonniers,16/12/2020,85787.0,Ferme et actualisable,Ministère de l'Intérieur - SGAMI EST - Metz - DAGF- Marchés Publics,48.8348302792,2.42102904428,NC,413.48977931142826,49.0661568455,6.15306595989,122020
20202020T1908800,Marché,Travaux,Travaux de construction de bâtiments,03/12/2020,858185.0,Ferme,"Ministère de la Transition Écologique, Ministère de la Cohésion des Territoires, Ministère de la Mer - Service de l'Aviation Civile Saint Pierre et Miquelon",,,PME,,,,122020
20202020T2113900,Marché,Travaux,Travaux de maçonnerie,29/12/2020,85869.15,Ferme,AgroSup Dijon,47.3230744087,5.03738286925,PME,7.1525360914964216,47.3677521534,5.08403472367,122020
2020352000,Marché,Travaux,Travaux de réfection,16/12/2020,85958.6,Révisable,COLLECTIVITE TERRITORIALE SPM,,,PME,,,,122020
2020KdSQII7MSY00,Marché,Travaux,Travaux de construction,29/12/2020,85990.0,Révisable,Mairie de Mons en Baroeul,50.6427234653,3.10704546553,PME,6.617701184751581,50.594147352,3.07244604895,122020
2020130016103500,Marché,Services,Services de télévision,14/12/2020,86000.0,Révisable,Services du Premier ministre - Direction des Services Administratifs et Financiers,48.8562037309,2.3121193117,GE,2.8015276154530535,48.840040811,2.29268840406,122020
20202020155600,Marché,Fournitures,"Équipements de laboratoire, d'optique et de précision (excepté les lunettes)",10/12/2020,86000.0,Ferme,DEPARTEMENT DU VAR,43.1364847512,5.93276630299,ETI,323.08136999830424,45.7844572839,4.71154753703,122020
20202020S2215500,Marché,Services,Services liés à la pêche,22/12/2020,86000.0,Ferme et actualisable,Institut Français de Recherche pour l’Exploitation de la MER,48.8231210367,2.26445901319,PME,7605.848711431224,16.2515819199,-61.5922344723,122020
2020M0D0004DCC00,Marché,Services,Services de reliure et de finition,08/12/2020,86000.0,Révisable,BUDGET PRINCIPAL,43.6131750772,3.86941278925,PME,0.0,43.6131750772,3.86941278925,122020
2020MSPL1200,Marché,Travaux,,10/12/2020,86057.64,Ferme et actualisable,ST MARTIN-BELLE-ROCHE,46.3801952569,4.85438882833,PME,17.110705383414626,46.2410408806,4.787628443,122020
20202020T0024100,Marché,Travaux,Travaux de peinture,22/12/2020,8609.58,Ferme et actualisable,COTES D'ARMOR HABITAT,48.487063217,-2.80840238288,NC,,,,122020
2020130015889300,Marché,Services,Services d'inspection technique,03/12/2020,8610.0,Ferme et actualisable,Ministère de l'Intérieur - Préfecture de la Réunion,-20.9331856391,55.4471055195,NC,8789.364979558288,47.3015616292,-1.47168011724,122020
2020prEaotZInG00,Marché,Fournitures,Dentiers,31/12/2020,861015.0,Révisable,CPAM Haut-Rhin,48.1100979739,7.3849252282,PME,256.12541609819993,48.7640654352,5.16324051275,122020
2020450300,Marché,Fournitures,Balayeuses aspiratrices,18/12/2020,86200.0,Ferme,CCPRO BP,44.1289689475,4.81041508178,PME,21.753741455999148,43.9352959178,4.84131733764,122020
20200310000,Marché,Fournitures,Tracteurs,10/12/2020,86278.0,Ferme,MAIRIE DE DEAUVILLE,49.3538571516,0.0748599090274,ETI,40.39335092368628,49.1377893425,0.368342326712,122020
20202020T2367300,Marché,Travaux,Travaux de pose de plaques de plâtre,14/12/2020,8628.0,Révisable,"Etablissements et organismes de l'enseignement supérieur, de la recherche et de l'innovation - Université de Toulon",43.1266832216,6.01911240277,PME,30.846352994905036,43.3993323129,6.07663333823,122020
2019EYaCwWyl_O00,Marché,Travaux,Travaux de câblage et d'installations électriques,11/12/2020,8629.52,Ferme et actualisable,Mairie de Caen,49.1850685346,-0.370026383608,GE,5.8211012998688005,49.1407518973,-0.342080570948,122020
20202021F0082200,Marché,Fournitures,"Pommes, poires et coings",30/12/2020,8630.4,Ferme,La Ville de Rosny-sous-Bois,48.8745436228,2.48657191747,NC,23.65664320679058,48.729938105,2.32968167157,122020
202030029101,Marché,Travaux,"Travaux d'installation de matériel de chauffage, de ventilation et de climatisation",08/12/2020,863194.0,Ferme et actualisable,Département du Doubs,47.2551269927,6.0192810348,NC,4.042507041657332,47.2739274498,5.98794392013,122020
20202020T1847000,Marché,Travaux,Travaux de plomberie,09/12/2020,86341.0,Ferme,"Etablissements et organismes de l'enseignement supérieur, de la recherche et de l'innovation - Centre Régional des oeuvres Universitaires et Scolaires de Lille",50.6317671102,3.04699299406,PME,7.0030079602464586,50.5701255161,3.06006386644,122020
2019KCr4-7omYv00,Marché,Fournitures,Installations de distribution d'eau,04/12/2020,8640.0,Révisable,CPAM CERGY PONTOISE,49.0400551805,2.05074797264,PME,59.059523146216115,48.6458423553,2.40853022618,122020
2020151041185200,Marché,Services,Services de santé divers,01/12/2020,86400.0,Ferme,Services du Premier ministre - Secrétariat Général de la Défense et de la Sécurité Nationale,48.8562037309,2.3121193117,PME,45.50873683952401,48.830615363,2.72287301087,122020
2020002b00,Marché,Travaux,,10/12/2020,86437.5,Ferme et actualisable,TORCE EN VALLEE -,48.1315572916,0.391026726199,NC,40.758880733750125,47.9275765766,0.0849157889578,122020
20209gXdUw3fe700,Marché,Services,"Études de faisabilité, service de conseil, analyse",24/12/2020,86638.0,Révisable,ETABLISSEMENT PUBLIC D'AMENAGEMENT DE BORDEAUX - EURATLANTIQUE,44.8578964782,-0.57357535767,ETI,544.8580460747463,48.840040811,2.29268840406,122020
2020170010438600,Marché,Services,Services de formation professionnelle,30/12/2020,86667.2,Ferme,Ministère de l'agriculture et de l'alimentation - Bureau de la commande publique et des achats,48.8562037309,2.3121193117,PME,3.6392493057458544,48.8769868607,2.33753841595,122020
2020170010435100,Marché,Services,Services de conseil en matière de santé et de sécurité,21/12/2020,86670.0,Révisable,"Ministère de la Transition Écologique, Ministère de la Cohésion des Territoires, Ministère de la Mer - Direction Interdépartementale des Routes Massif Central",45.7859001722,3.11559551839,GE,362.24807400071995,43.3654982005,5.31265000369,122020
2020M0390018,Marché,Travaux,Travaux de construction de stades,29/12/2020,866898.0,Ferme,LAVAL AGGLOMERATION,48.0610922073,-0.766055300559,PME,71.22010187548027,47.4304315274,-0.874801728379,122020
202020N13400100,Marché,Services,Services de maintenance et de réparation de logiciels,09/12/2020,867.0,Révisable,COMMUNE D ANTIBES,43.587619807,7.10541287744,PME,784.1277254975805,48.8591103086,2.38017728226,122020
2020-004-1000,Marché,Travaux,Travaux de construction de bâtiments,24/12/2020,86788.08,Ferme,CCVT budget principal,45.8849156416,6.31892952752,NC,46.109272004137416,45.7241809976,5.93426738228,122020
20202020S2229400,Marché,Services,Services de nettoyage de bâtiments,17/12/2020,8682.12,Révisable,Chambres de Commerce et d'Industrie,49.1081027833,6.19595351042,ETI,438.36994724829117,48.8836186061,2.23810959636,122020
20202020 200,Marché,Services,,10/12/2020,86848.15,Révisable,CDC des Vallées d'Auge et du Merleraul,,,PME,,48.60429341,0.169948521871,122020
2020160006022200,Marché,Travaux,Travaux de construction complète ou partielle et travaux de génie civil,17/12/2020,869899.0,Révisable,"Ministère de la Transition Écologique, Ministère de la Cohésion des Territoires, Ministère de la Mer - Direction Interdépartementale des Routes Centre-Ouest",45.8544262114,1.24894834225,GE,354.6542494012093,48.8963161116,2.20694242609,122020
20202020F2325600,Marché,Fournitures,Machines et appareils de filtration ou de purification de liquides,07/12/2020,86993.7,Ferme,"Etablissements et organismes de l'enseignement supérieur, de la recherche et de l'innovation - UNIVERSITE D'ORLEANS",47.8824665066,1.91660961834,PME,97.09615334836096,48.695957442,2.23477492911,122020
20202020T0016000,Marché,Travaux,Travaux de construction,07/12/2020,87000.0,Ferme et actualisable,Région Bourgogne-Franche-Comté,47.2551269927,6.0192810348,GE,7.805127402011286,47.2865163782,6.08247964074,122020
2020200300101,Marché,Services,Services d'architecte pour les bâtiments,08/12/2020,87000.0,Ferme,CNE D ECHIROLLES,45.1470636912,5.71546169286,PME,114.58400345558184,45.7708803723,4.88922582274,122020
2020-003-MAPA00,Marché,Fournitures,"Produits pétroliers, combustibles, électricité et autres sources d'énergie",16/12/2020,87000.0,Ferme,COMMUNAUTE DE COMMUNES DU PAYS HOUDANA,48.7835303556,1.61593398832,PME,200.17747777669243,49.379088307,3.32427699323,122020
2020015-2020S01,Marché,Travaux,Travaux de chantier,14/12/2020,87000.0,Ferme et actualisable,VILLE DE BLOIS,47.5814306941,1.30596722868,GE,174.12653616757245,48.8231210367,2.26445901319,122020
2019x7h5-BQkrf00,Marché,Travaux,Travaux de construction,11/12/2020,87000.0,Révisable,Mairie de Caen,49.1850685346,-0.370026383608,PME,38.48813873708455,49.2783343531,-0.705198916376,122020
2020xe4dcdABSC00,Marché,Travaux,"Travaux de construction de ponts et de tunnels, de puits et de passages souterrains",30/12/2020,87010.0,Ferme,Mairie de Colomiers,43.611577156,1.32726979619,PME,3.7845322778533914,43.5783751148,1.33466866952,122020
20202017300,Marché,Services,Services de gestion de données,21/12/2020,87012.56,Révisable,VILLE D AIX EN PROVENCE - BP,43.5360639608,5.39837823449,ETI,674.2691272577136,48.8348302792,2.42102904428,122020
2020DCT04201,Marché,Travaux,Travaux de construction de bâtiments,06/12/2020,87025.91,Révisable,Budget principal,45.1821782198,5.72099089704,PME,5.9081141879957935,45.1549989093,5.67502244415,122020
2020BATLO0004703,Marché,Travaux,Travaux de restructuration,08/12/2020,871143.13,Révisable,Budget principal,46.5622744929,3.32725048972,PME,5.862437037465689,46.563721028,3.38024682344,122020
2020151037415500,Marché,Travaux,Travaux de restructuration,16/12/2020,87143.0,Révisable,Ministère des armées - Direction d'infrastructure de la défense de Fort de France - DID Fort de France,,,PME,,16.1715176617,-61.6576615914,122020
2020005ATE30200,Marché,Travaux,Travaux de construction,15/12/2020,87168.36,Ferme,COMMUNAUTE DE COMMUNES PAYS DE MIREPOI,43.1093589027,1.86870342668,PME,19.731058020408515,42.9333914819,1.84654795528,122020
20202020T2087100,Marché,Travaux,Travaux de gros œuvre,22/12/2020,87182.46,Ferme,Chambres de Commerce et d'Industrie,46.5622744929,3.32725048972,PME,20.8363184598375,46.4109858027,3.43856165889,122020
2020M000902,Marché,Services,"Services d'architecture, services de construction, services d'ingénierie et services d'inspection",14/12/2020,87296.0,Ferme,BUDGET PRINCIPAL CD15,44.9245183348,2.4417949992,NC,0.0,44.9245183348,2.4417949992,122020
2020rsFvWTeeol00,Marché,Services,Services de réparation et d'entretien d'installations d'extinction d'incendie,31/12/2020,87325.0,Révisable,CENTRE HOSPITALIER DE MACON,46.320613267,4.81834086547,NC,113.79155225954432,47.3230744087,5.03738286925,122020
202020.021.0003,Marché,Services,"Services d'architecture, services de construction, services d'ingénierie et services d'inspection",11/12/2020,87335.0,Ferme et actualisable,ATLANTIC' EAU,47.2321613301,-1.54797539458,ETI,468.0143970557365,48.9097290596,2.33319973974,122020
20202020S2229200,Marché,Services,Services de nettoyage de bâtiments,17/12/2020,87367.32,Révisable,Chambres de Commerce et d'Industrie,49.1081027833,6.19595351042,ETI,438.36994724829117,48.8836186061,2.23810959636,122020
2020Uxg9e64b6J00,Marché,Travaux,Travaux de terrassement,03/12/2020,87376.0,Ferme et actualisable,MACON HABITAT,46.320613267,4.81834086547,PME,0.0,46.320613267,4.81834086547,122020
157665991048300,Marché,Travaux,Travaux de façade,22/12/2020,8741.0,Ferme et actualisable,SDIS 34 DE L'HERAULT,43.663798664,3.72843489659,NC,,,,122020
20202020T2001200,Marché,Travaux,Travaux de peinture,03/12/2020,87447.25,Ferme,"Ministère de la Transition Écologique, Ministère de la Cohésion des Territoires, Ministère de la Mer - Service de l'Aviation Civile Saint Pierre et Miquelon",,,NC,,,,122020
2020SD272900,Marché,Travaux,Travaux de peinture,10/12/2020,87449.0,Ferme,PROMOCIL,50.2843741775,3.96274549268,PME,12.902900133914477,50.2077917355,3.87500040908,122020
2020151040877800,Marché,Services,,17/12/2020,8745.0,Ferme et actualisable,Ministère de l'Intérieur - SGAMI EST - Metz - DAGF- Marchés Publics,48.8348302792,2.42102904428,PME,475.68707925927487,49.1287278747,6.71258678084,122020
2020rlRhVXPmGX00,Marché,Travaux,Travaux de construction,30/12/2020,87466.44,Ferme et actualisable,Angers Loire habitat,47.4766284713,-0.556089456786,PME,30.15662221358901,47.4606955105,-0.283834407687,122020
