20182018F5506500,Marché,Fournitures,Matériel de mesure des émissions,19/12/2018,24009.53,Ferme,"Etablissements et organismes de l'enseignement supérieur, de la recherche et de l'innovation - CNRS Délégation Alsace",48.5716343863,7.76783353204,NC,592.7092387029842,48.6458423553,2.40853022618,122018
20182018F4107700,Marché,Services,Exploitation d'une décharge,12/12/2018,240240.0,Ferme,Agence De l'Environnement et de la Maitrise de l'Energie,47.4766284713,-0.556089456786,PME,723.7345496628973,45.3308276274,5.62328688798,122018
2018RO18A0220800,Marché,Fournitures,Produits alimentaires divers,28/12/2018,24067.0,Révisable,Centre Hospitalier Sainte-Marie,44.3389018882,2.54700094526,PME,5.072513210081826,44.3826731465,2.55990190943,122018
20182018S8003500,Marché,Services,Services relatifs à l'environnement,13/12/2018,2407268.0,Révisable,Ministère de la Transition écologique et solidaire - Ministère de la Cohésion des Territoires - Agence de l'Eau Loire Bretagne,47.8824665066,1.91660961834,GE,477.1809802269945,48.7097804259,6.15116242992,122018
2018160005000200,Marché,Travaux,Travaux d'étanchéification,19/12/2018,241065.0,Ferme et actualisable,Ministère des armées - Etablissement du service d'infrastructure de la défense de Lyon - ESID Lyon,,,PME,,43.2585697652,5.5660529517,122018
20182019S1301200,Marché,Services,Services d'études,17/12/2018,24129.0,Ferme,Ministères sociaux,41.9349194014,8.70135284615,PME,1337.1643630034214,48.111571436,-1.68168588816,122018
2018DSP100,Contrat de concession,Services,Services d'animation pour enfants,21/12/2018,2413464.0,,COMMUNAUTE DE COMMUNES DES VALLONS DU LYONNAIS,45.7296761685,4.64252373926,PME,0.0,45.7296761685,4.64252373926,122018
2018100013312400,Marché,Fournitures,Pièces pour navires de guerre,21/12/2018,24140.92,Ferme et actualisable,Ministère des armées - Direction du service de soutien de la flotte de Toulon - DSSF Toulon,,,NC,,48.3051824108,-4.14321071816,122018
20180270200,Marché,Travaux,Travaux de câblage et d'installations électriques,26/12/2018,241600.0,Ferme,Ville de BALARUC-LES-BAINS,43.4470517561,3.69108725838,PME,702.6874297931874,49.7379689452,3.04922994184,122018
20182018S5017700,Marché,Services,Services de maintenance préventive,26/12/2018,24179.4,Révisable,"Etablissements et organismes de l'enseignement supérieur, de la recherche et de l'innovation - Centre régional des oeuvres universitaires et scolaires de Rouen Normandie",49.4415068863,1.09373273216,PME,46.68406500958773,49.6174474589,0.710479299424,122018
2018160004975100,Marché,Travaux,Travaux de rénovation de ponts,18/12/2018,2420000.0,Révisable,Ministère de la Transition écologique et solidaire - Ministère de la Cohésion des Territoires - D...,48.6900671002,6.17594832427,GE,764.7793431046011,43.6110430672,1.50470197314,122018
2018ASSURLOT200,Marché,Services,Services d'assurance,21/12/2018,2424.0,Ferme,MAIRIE D'ESPIRA DE L'AGLY,42.7968115613,2.82197552003,ETI,535.3139254681861,46.3286026496,-0.464927924553,122018
20182018S0062600,Marché,Services,Services de maintenance et de réparation de logiciels,05/12/2018,24254.0,Révisable,CHR ORLEANS,47.8824665066,1.91660961834,PME,522.698826985382,45.2214311039,5.81565516978,122018
2018Q1wHVfD5yR00,Marché,Travaux,Travaux de terrassement,22/12/2018,242561.79,Révisable,Communaut� de communes de Grand Lieu,47.0888225829,-1.59648931129,NC,23.577700885105454,46.9710977334,-1.4192056678,122018
20182018T5021700,Marché,Travaux,Travaux de construction de salles de bains,20/12/2018,243000.0,Ferme et actualisable,"Etablissements et organismes de l'enseignement supérieur, de la recherche et de l'innovation - Ce...",50.6317671102,3.04699299406,NC,16.15916434148173,50.6882414286,3.18164958238,122018
20181370100,Marché,Travaux,Travaux de construction de bâtiments,27/12/2018,24307.0,Révisable,DEPARTEMENT DU LOT,44.4506478544,1.44049806604,PME,77.78256838705676,44.9263129077,0.92512497209,122018
20182018S8012000,Marché,Services,Services de conseil en ingénierie de l'environnement,03/12/2018,24355.0,Ferme et actualisable,Ministère de la Transition écologique et solidaire - Ministère de la Cohésion des Territoires - Conservatoire de l'Espace Littoral et des Rivages Lacustres,45.9425259054,-0.972397591834,PME,93.63732241696886,46.4757761021,-1.62742506319,122018
2018CLIM000600,Marché,Travaux,Travaux d'installation de matériel de climatisation,20/12/2018,24407.83,Ferme et actualisable,Communauté de communes Seille et Grand Couronné,48.7347801176,6.35289709157,PME,17.956032487217673,48.6669496451,6.20539408366,122018
2018150917258500,Marché,Fournitures,Pièces pour navires de guerre,18/12/2018,2446.0,Ferme,Ministère des armées - Direction du service de soutien de la flotte de Brest - DSSF Brest,,,NC,,48.3051824108,-4.14321071816,122018
20182018S0018500,Marché,Services,Services de nettoyage de bureaux,21/12/2018,24470.0,Ferme,"Ministère de l'éducation nationale et Ministère de l'enseignement supérieur, de la recherche et de l'innovation - Réseau Canopé",46.6518315191,0.362203052781,ETI,220.87377234932856,47.2321613301,-1.54797539458,122018
20182019S0555800,Marché,Services,Services prestés par les laboratoires médicaux,26/12/2018,244800.0,Révisable,CHRU TOURS,47.3314668694,0.715972131571,PME,250.57873788165747,47.2321613301,-1.54797539458,122018
2018130014090000,Marché,Services,Logiciels de sécurité,27/12/2018,24500.0,Ferme,"Ministères de l'Économie et des Finances, de l'Action et des Comptes publics - Agence pour l'Info...",48.8360445933,2.56502268278,NC,17.433252297949828,48.8223214828,2.40796998952,122018
20182018S1862900,Marché,Services,Services d'exposition dans les musées,20/12/2018,24500.0,Ferme,Ministère de la Culture - ETABLISSEMENT PUBLIC DU MUSEE D'ORSAY ET DU MUSEE DE L'ORANGERIE,48.8562037309,2.3121193117,PME,7.5325282961342905,48.8591103086,2.38017728226,122018
2018150917921900,Marché,Fournitures,Pièces électroniques et électriques de rechange pour navires de guerre,21/12/2018,24509.56,Ferme,Ministère des armées - Direction du service de soutien de la flotte de Brest - DSSF Brest,,,NC,,48.3051824108,-4.14321071816,122018
2018130014022900,Marché,Travaux,Travaux de démolition de bâtiments et travaux de terrassement,24/12/2018,245181.0,Révisable,Ministère des armées - Etablissement du service d'infrastructure de la défense de Metz - ESI...,,,PME,,48.7914520617,7.03571902376,122018
2018150919068400,Marché,Services,"Services d'architecture, services de construction, services d'ingénierie et services d'inspection",27/12/2018,24525.0,Ferme,Ministère de la Culture et de la Communication - Direction Régionale des Affaires Culturelles - Bretagne,48.111571436,-1.68168588816,GE,460.7427113377317,48.8348302792,2.42102904428,122018
20181813402,Marché,Services,Services de conseils et de représentation juridiques,13/12/2018,245300.0,Révisable,VILLE DE BAYONNE,,,NC,,,,122018
2018110004446000,Marché,Services,Services d'ingénierie,18/12/2018,245433.5,Révisable,Ministère de la Transition écologique et solidaire - Ministère de la Cohésion des Territoires - D...,46.5834165499,0.359436087058,ETI,222.9301972142968,47.2321613301,-1.54797539458,122018
20182018F0026800,Marché,Fournitures,Ustensiles de cuisine,10/12/2018,2456.0,Révisable,CHRU CAEN,49.1850685346,-0.370026383608,NC,382.0486839563026,47.0185257425,2.31002845498,122018
20181803301AOO00,Marché,Services,Services d'entretien de camions,28/12/2018,246438.0,Révisable,SDIS DE LA MOSELLE,49.1392715622,6.20834665215,PME,8.434896186788686,49.2117142223,6.18464954852,122018
2018120005906200,Marché,Services,Prestations de services pour la collectivité,01/12/2018,2465661.96,Révisable,Ministère de l'Intérieur - SGAMI ILE DE FRANCE - Préfecture de Police Paris,48.8542874923,2.35759608215,ETI,8.384017750417666,48.9296428406,2.35946866986,122018
2018130014046500,Marché,Travaux,Travaux de revêtement de routes,19/12/2018,2471631.0,Révisable,Ministère des armées - Etablissement du service d'infrastructure de la défense de Bordeaux - ESID...,,,NC,,48.5968549847,2.424435968,122018
20182018S7213800,Marché,Services,Services de blanchisserie et de nettoyage à sec,27/12/2018,2477757.0,Révisable,ASSISTANCE PUBLIQUE - HOPITAUX DE PARIS,48.8542874923,2.35759608215,GE,177.0781623518628,47.6110227025,1.35776910185,122018
2018150918478400,Marché,Fournitures,Verrous de sécurité renforcés,17/12/2018,24788.39,Révisable,Ministère des armées - Etablissement du service d'infrastructure de la défense de Toulon - E...,,,GE,,43.1364847512,5.93276630299,122018
2018100013245100,Marché,Fournitures,Pièces pour navires de guerre,10/12/2018,24793.49,Ferme et actualisable,Ministère des armées - Direction du service de soutien de la flotte de Toulon - DSSF Toulon,,,PME,,49.6330980885,-1.63358524312,122018
20182018S0028300,Marché,Services,Services de réparation et d'entretien de matériel médical,21/12/2018,24800.0,Révisable,CHRU CAEN,49.1850685346,-0.370026383608,PME,73.66171983935043,49.5440121031,0.189621948106,122018
2018S011400,Marché,Travaux,Travaux d'étanchéification,26/12/2018,248232.4,Ferme,Lille Métropole Habitat,50.6317671102,3.04699299406,NC,9.544868471219331,50.5468153947,3.034449778,122018
20182018S0061800,Marché,Services,Services de programmation et de conseil en logiciels,04/12/2018,248240.0,Révisable,CHI TOULON LA SEYNE,43.1364847512,5.93276630299,ETI,757.4673909180049,48.8699520558,2.21968010802,122018
2018150918095100,Marché,Travaux,Travaux d'entretien routier,19/12/2018,248364.3,Révisable,Ministère de la Transition écologique et solidaire - Ministère de la Cohésion des Territoires - D...,50.6317671102,3.04699299406,NC,165.9288793914524,49.2116367629,2.58581200974,122018
20180006200,Marché,Services,Services d'assurance,10/12/2018,248981.65,Révisable,MAIRIE DE MORLAIX,48.6002133524,-3.82032631476,NC,723.9262638552137,50.64429422,2.39513141872,122018
2018180005238400,Marché,Services,Services de surveillance,24/12/2018,24900.0,Ferme,"Ministères de l'Économie et des Finances, de l'Action et des Comptes publics - DR Ile de France - Pôle Achats",48.7796502574,2.02991602442,PME,8549.904089422056,-20.9441421191,55.3050347414,122018
20182018S1920700,Marché,Services,Études techniques,13/12/2018,249000.0,Ferme,Institut Français de Recherche pour l’Exploitation de la MER,48.8231210367,2.26445901319,ETI,4.466604298760629,48.7896635904,2.28679609541,122018
20181886200,Marché,Services,Services d'assurance responsabilité civile,24/12/2018,249165.0,Ferme,HOSPICES CIVILS DE LYON,45.7480493184,4.82567584415,ETI,259.4939056800822,43.6131750772,3.86941278925,122018
2018150914753000,Marché,Services,Services de conseil en matière d'infrastructure,19/12/2018,24990.0,Révisable,Ministère des armées - Etablissement du service d'infrastructure de la défense de Lyon - ESID Lyon,,,PME,,43.6619267157,3.88638789403,122018
2018150915482300,Marché,Fournitures,Balisage et éclairage d'aérodrome,10/12/2018,24992.0,Ferme,Ministère des armées - Etablissement du service d'infrastructure de la défense de Metz - ESI...,,,PME,,48.626956198,2.67046642908,122018
2018120005926000,Marché,Fournitures,Équipement de lutte contre l'incendie,18/12/2018,24999.0,Révisable,"Ministères de l'Économie et des Finances, de l'Action et des Comptes publics - DR Ile de France -...",48.7796502574,2.02991602442,NC,534.4236117109882,44.0225624278,1.36375484401,122018
2018130013965100,Marché,Travaux,"Travaux d'installation de matériel de chauffage, de ventilation et de climatisation",18/12/2018,24999.0,Révisable,"Ministères de l'Économie et des Finances, de l'Action et des Comptes publics - DR Ile de France -...",48.7796502574,2.02991602442,NC,240.54481876171235,50.6322610395,3.15284231203,122018
2018180005249000,Marché,Fournitures,Produits extincteurs,14/12/2018,24999.99,Ferme,"Ministères de l'Économie et des Finances, de l'Action et des Comptes publics - DR Ile de France -...",48.7796502574,2.02991602442,PME,427.00079812784526,47.1602431078,-1.47084254473,122018
2018F3000,Marché,Fournitures,Produits horticoles et produits de pépinières,28/12/2018,2500.0,Ferme,MAIRIE DE LA TALAUDIERE,45.4787027055,4.42386888678,NC,92.75113356350289,46.1231310324,4.95815709961,122018
20182018S8756800,Marché,Services,Services d'impression,05/12/2018,25000.0,Révisable,Chambres de Commerce et d'Industrie,43.3201640732,-0.3496692279,PME,356.5869146004187,44.9245183348,2.4417949992,122018
20182018S1859200,Marché,Services,Services de formation,10/12/2018,25000.0,Révisable,"Institut national de recherche pour l’agriculture, l’alimentation et l’environnement",48.8562037309,2.3121193117,PME,7.5325282961342905,48.8591103086,2.38017728226,122018
2018130014040100,Marché,Fournitures,Peintures,19/12/2018,25000.0,Révisable,Ministère de l'Intérieur - SGAMI SUD - Marseille - BMP- DAFJ,43.344864211,5.39338098888,NC,11.943821745727588,43.238566824,5.37561344061,122018
2018hHBFKiSOsX00,Marché,Services,Services d'impression et de livraison,22/12/2018,25000.0,Révisable,Mairie de Bonneuil sur Marne,48.7732937592,2.48790854128,PME,22.668272627933376,48.5882523233,2.57387682447,122018
2018150916140000,Marché,Services,Services de conception des systèmes de chauffage,20/12/2018,25000.0,Révisable,Ministère des armées - Etablissement du service d'infrastructure de la défense de BREST - ESID Brest,,,PME,,48.3999000994,-4.5027702561,122018
20182019S0165000,Marché,Services,Services de télécommunications,18/12/2018,25000.0,Ferme,"Etablissements et organismes de l'enseignement supérieur, de la recherche et de l'innovation - UN...",45.5837038917,5.90877548323,GE,539.0591422833872,48.840040811,2.29268840406,122018
20188CC4uwkG5c00,Marché,Fournitures,,22/12/2018,25000.0,Ferme et actualisable,Ville de Garches,48.8456238029,2.18800429564,NC,9.463353097298436,48.8983675206,2.25515424076,122018
2018170009078600,Marché,Services,Services de conseil en protection et contrôle en matière d'incendie et d'explosion,14/12/2018,25000.0,Ferme,"Ministère de l'éducation nationale et Ministère de l'enseignement supérieur, de la recherche et d...",48.8022788923,2.11716530117,PME,123.63775899206242,49.9002814748,2.29072265357,122018
20182019S8267100,Marché,Services,Services de conseils et de représentation juridiques,28/12/2018,25000.0,Ferme et actualisable,ARS Guadeloupe,15.9939974793,-61.6863714172,ETI,7809.995675875317,45.7533230296,4.86924368009,122018
2018170009084000,Marché,Services,Services d'organisation de séminaires,20/12/2018,25000.0,Révisable,"Ministère de la Transition écologique et solidaire - Ministère de la Cohésion des Territoires - Direction Régionale Environnement, Aménagement et Logement Auvergne-Rhône-Alpes",45.7731043316,4.85202749669,ETI,221.150066296689,43.8445331544,4.34760475323,122018
2018130014027600,Marché,Services,Services liés aux déchets et aux ordures,17/12/2018,25000.0,Révisable,"Ministères de l'Économie et des Finances, de l'Action et des Comptes publics - DR Ile de France -...",48.7796502574,2.02991602442,GE,514.8573679991908,44.8535991639,-0.432469297996,122018
2018130014080200,Marché,Services,Services de réparation de voitures,31/12/2018,25000.0,Révisable,Ministère de l'Intérieur - SGAMI ILE DE FRANCE - Préfecture de Police Paris,48.8542874923,2.35759608215,PME,18.15816430950896,48.946227127,2.49329631847,122018
20182018S0092500,Marché,Services,Services de maintenance préventive,10/12/2018,25000.0,Révisable,Chambres de Commerce et d'Industrie,41.9349194014,8.70135284615,PME,12.007516634399629,41.9839501986,8.79834460109,122018
2018130013921200,Marché,Services,Services de maintenance et de réparation de logiciels,17/12/2018,250000.0,Révisable,Ministère de la Transition écologique et solidaire - Ministère de la Cohésion des Territoires - S...,48.8836186061,2.23810959636,NC,36.53402015958602,48.8360445933,2.56502268278,122018
20180008300,Marché,Services,Services de réparation et d'entretien,05/12/2018,250000.0,Révisable,Lorient Agglomération,47.7502629938,-3.37883364048,NC,,,,122018
20182018S0085400,Marché,Services,Services de réparation et d'entretien de matériel médical,20/12/2018,250000.0,Ferme et actualisable,CHR ORLEANS,47.8824665066,1.91660961834,ETI,114.85303849851364,48.8699520558,2.21968010802,122018
2018000000230000,Marché,Services,"Services d'élimination de déchets toxiques, excepté déchets radioactifs et sols contaminés",27/12/2018,250000.0,Révisable,SYDED du Lot,44.5578371596,1.34109989372,NC,96.54856611839114,43.6931383538,1.41194581588,122018
20182018S0108900,Marché,Services,"Services de collecte, de transport et d'élimination de déchets hospitaliers",01/12/2018,250000.0,Révisable,CHRU TOURS,47.3314668694,0.715972131571,GE,501.9168815358757,45.7016140067,4.94900275462,122018
2018120005919300,Marché,Fournitures,Verrerie de laboratoire,10/12/2018,250000.0,Révisable,Ministère des armées - Division achats - Ile de France/Normandie,,,PME,,48.8348302792,2.42102904428,122018
20182018S1805500,Marché,Services,Services d'impression,31/12/2018,250000.0,Ferme,ASSISTANCE PUBLIQUE DES HOPITAUX DE MARSEILLE,43.2924013477,5.39786536432,NC,697.4435837935,48.8223214828,2.40796998952,122018
20182018F0076300,Marché,Fournitures,Prothèses,17/12/2018,250000.0,Révisable,ASSISTANCE PUBLIQUE DES HOPITAUX DE MARSEILLE,43.2924013477,5.39786536432,ETI,275.3494243882203,45.7541566032,5.06691649154,122018
2018170009093500,Marché,Services,Services de représentation légale,28/12/2018,250000.0,Ferme et actualisable,Services du Premier ministre - Direction des Services Administratifs et Financiers,48.8562037309,2.3121193117,PME,1.8448613856586162,48.8727847696,2.31253091684,122018
2018130014047100,Marché,Services,Services d'abonnement,28/12/2018,250000.0,Révisable,Services du Premier ministre - Direction des Services Administratifs et Financiers,48.8562037309,2.3121193117,PME,2.7648319467905265,48.8625262113,2.33630086089,122018
2018130013993800,Marché,Services,Services de réparation et d'entretien de compresseurs,21/12/2018,2500000.0,Révisable,Ministère des armées - Division achats - Toulouse/Balma,,,GE,,43.5959710776,1.43229743595,122018
20182019T0828200,Marché,Travaux,Travaux de menuiserie,21/12/2018,25001.92,Ferme,"Institut national de recherche pour l’agriculture, l’alimentation et l’environnement",48.8562037309,2.3121193117,PME,616.4752098055424,43.9626769156,4.94133023443,122018
2018pE3uxap5Ff00,Marché,Services,Services d'organisation de concours d'architecture,22/12/2018,250250.0,Révisable,MACON HABITAT,46.320613267,4.81834086547,NC,,,,122018
20182018S1807800,Marché,Services,Services d'assurance responsabilité civile,14/12/2018,250944.0,Révisable,Office national d'études et de recherches aérospatiales,48.8030644645,2.28639478919,ETI,4.171385084336181,48.840040811,2.29268840406,122018
2018150919482700,Marché,Travaux,Revêtement de sols et de murs,21/12/2018,251004.14,Révisable,Ministère de l'Intérieur - SGAMI OUEST - Rennes - Bureau Zonal des Achats et des Marchés Publics,48.075697512,-1.72369525238,NC,446.2730780596098,48.8365394869,2.2389245247,122018
2018F1tsVmnkaG00,Marché,Travaux,Travaux de construction,22/12/2018,251833.54,Ferme,Ville de Garches,48.8456238029,2.18800429564,NC,9.60689825429629,48.9172863598,2.13951942246,122018
2018130014079700,Marché,Travaux,"Travaux d'installation de matériel de chauffage, de ventilation et de climatisation",21/12/2018,2520.0,Ferme et actualisable,Ministère de l'Intérieur - Préfecture du Haut Rhin,48.1100979739,7.3849252282,NC,563.110969314341,48.9296428406,2.35946866986,122018
2018130013995700,Marché,Fournitures,Pièces détachées et accessoires pour véhicules et moteurs de véhicules,20/12/2018,252000.0,Révisable,Ministère de la Transition écologique et solidaire - Ministère de la Cohésion des Territoires - D...,45.7859001722,3.11559551839,ETI,0.0,45.7859001722,3.11559551839,122018
2018160004999600,Marché,Travaux,Bâtiments présentant un intérêt historique ou architectural particulier,14/12/2018,25221.15,Révisable,Ministère de la Culture - Direction Régionale des Affaires Culturelles - Bretagne,48.111571436,-1.68168588816,PME,263.2662223456818,48.3948087969,-4.045430918,122018
2018100013128200,Marché,Fournitures,Appareils de détection et d'analyse,18/12/2018,25222.75,Ferme,Ministère des armées - Plateforme Achats Finances Nord Est,48.8348302792,2.42102904428,PME,33.90346030920856,48.7149937413,2.13911306427,122018
201800004100,Marché,Services,Services d'assurance de véhicules à moteur,14/12/2018,25224.0,Révisable,Mairie de Nieppe,50.6991288082,2.8326772944,ETI,607.8635370760907,46.3286026496,-0.464927924553,122018
20182018S7961800,Marché,Services,Services d'assurance accidents,14/12/2018,2539.0,Révisable,"Etablissements et organismes de l'enseignement supérieur, de la recherche et de l'innovation - Université de technologie de Troyes",48.2968506353,4.07801333034,PME,296.63961930433237,45.7333494426,4.83733100241,122018
2018150919069200,Marché,Fournitures,Résistances de chauffage électrique,18/12/2018,25408.5,Ferme,"Ministères de l'Économie et des Finances, de l'Action et des Comptes publics - DGFIP 075 Paris",48.8682182328,2.34268958704,PME,18.468347251085675,48.7987986059,2.49441281984,122018
2018150918082300,Marché,Services,Services de bases de données,19/12/2018,25421.9,Ferme,Ministère de l'agriculture et de l'alimentation - Bureau de la commande publique et des achats,48.8562037309,2.3121193117,ETI,11.888067003851683,48.8410208466,2.41853928643,122018
2018170009081500,Marché,Services,Services de formation professionnelle,20/12/2018,25440.0,Révisable,Ministère des armées - Service Parisien de Soutien de l'Administration Centrale - SPAC,,,NC,,48.8125956765,1.94662384182,122018
2018170009063100,Marché,Services,Services de formation professionnelle,20/12/2018,254400.0,Ferme,"Ministères de l'Économie et des Finances, de l'Action et des Comptes publics - Institut de la Ges...",48.8472864945,2.43799511731,PME,14.16026078611552,48.8727847696,2.31253091684,122018
201859726900,Marché,Travaux,Travaux de construction d'églises,07/12/2018,255023.0,Ferme,Commune Les Angles,43.9467457769,4.75214648359,PME,9.94216309999162,43.9352959178,4.84131733764,122018
2018150916440000,Marché,Fournitures,Pièces électroniques et électriques de rechange pour navires de guerre,20/12/2018,2557.0,Ferme,Ministère des armées - Direction du service de soutien de la flotte de Brest - DSSF Brest,,,PME,,49.6330980885,-1.63358524312,122018
20182020F0831900,Marché,Fournitures,Gaz médicaux,29/12/2018,2559.85,Révisable,CH VALENCIENNES,50.3591232468,3.51599087764,NC,76.34102209627459,50.4040217552,2.82708396345,122018
2018MWHZwLXvQS00,Marché,Fournitures,Enveloppes à fenêtre imprimées,22/12/2018,25600.0,Révisable,CPAM de Roubaix - Tourcoing,50.6882414286,3.18164958238,ETI,527.8156675669176,47.8878806084,7.04177147633,122018
2018130014037900,Marché,Fournitures,Système de localisation de véhicules,31/12/2018,2560832.5,Révisable,Ministère de la Transition écologique et solidaire - Ministère de la Cohésion des Territoires - D...,50.6317671102,3.04699299406,NC,214.17792733533665,48.8963161116,2.20694242609,122018
2018110004485000,Marché,Fournitures,,14/12/2018,2563.0,Ferme,Ministère de l'Intérieur - Préfecture du Lot,44.4506478544,1.44049806604,GE,444.82792065731275,43.3654982005,5.31265000369,122018
2018120005941400,Marché,Services,Services de gardiennage,12/12/2018,2567207.54,Révisable,Ministère des armées - Plate-forme commissariat Sud,,,GE,,48.8635257742,2.40121168869,122018
20182019F0997700,Marché,Fournitures,"Fruits, légumes et produits connexes",26/12/2018,25677.0,Révisable,"Etablissements et organismes de l'enseignement supérieur, de la recherche et de l'innovation - Ce...",49.4415068863,1.09373273216,NC,324.29282782990686,48.0913421717,-1.50512500504,122018
2018150915141600,Marché,Services,Services de crèches et garderies d'enfants,26/12/2018,25695.0,Révisable,Ministère des armées - Service Parisien de Soutien de l'Administration Centrale - SPAC,,,ETI,,48.8365394869,2.2389245247,122018
20182018F0084800,Marché,Fournitures,Aménagements divers,20/12/2018,257235.6,Révisable,CHI TOULON LA SEYNE,43.1364847512,5.93276630299,PME,789.8874419432398,48.9479265922,1.81350083131,122018
20182XnbqFX4vf00,Marché,Travaux,Travaux de construction,22/12/2018,25757.0,Ferme,CAF PERIGUEUX,45.1920126931,0.711534338387,NC,6.525519871557769,45.2098640275,0.655322200367,122018
20182020F0747100,Marché,Fournitures,Gaz médicaux,31/12/2018,25762.32,Révisable,CH VALENCIENNES,50.3591232468,3.51599087764,GE,213.63273312799038,48.8562037309,2.3121193117,122018
2018e0p6uESp2000,Marché,Fournitures,Système de contrôle des accès,22/12/2018,25777.16,Ferme,Mairie Hoerdt,48.6906787922,7.78465785332,PME,0.0,48.6906787922,7.78465785332,122018
