20202020T0634200,Marché,Travaux,Travaux d'installation du gaz,24/04/2020,459728.26,Révisable,"Etablissements et organismes de l'enseignement supérieur, de la recherche et de l'innovation - CNRS Délégation Occitanie Est",43.6131750772,3.86941278925,GE,18.65535563940746,43.6403415061,4.03589726687,042020
20201210000346,Marché,Travaux,Modernisation d'installations,24/04/2020,459833.74,Révisable,VILLE DE PARIS BUDGET PRINCIPAL,48.8542874923,2.35759608215,PME,9.87093498456811,48.9325906584,2.3996121008,042020
2018tRrZJbGXzg00,Marché,Services,Services de nettoyage,01/04/2020,45984.0,Ferme,CGSS GUADELOUPE,16.2727026732,-61.5016988194,ETI,0.0,16.2727026732,-61.5016988194,042020
20208vEWwvzR3l00,Marché,Travaux,Travaux routiers,14/04/2020,459981.0,Ferme et actualisable,Tours Métropole Val de Loire,47.3980773574,0.696151819266,NC,7.410819203669008,47.4535931053,0.659157369982,042020
2018dcvOVJC0Qu00,Marché,Services,Services de nettoyage,06/04/2020,4600.0,Révisable,Ports de Normandie,49.2152313192,-0.40138132268,ETI,67.58783977569708,49.4965847516,0.140273146733,042020
2020COLOHIVER00,Marché,Services,Services de colonies de vacances,23/04/2020,46000.0,Révisable,SAINT-CHAMAS,43.5438524128,5.07297989033,PME,174.74579217110718,44.6191435799,6.22912731114,042020
2018SIoik5U88c00,Marché,Fournitures,Papier d'impression,06/04/2020,460000.0,Révisable,CAISSE CENTRALE MSA,48.9073106793,2.44007227598,ETI,6.504132520298119,48.8869811827,2.38492060382,042020
2018J-mbGw6TVl00,Marché,Services,Services de gestion de cantine,06/04/2020,460000.0,Révisable,CPAM NIORT,46.3286026496,-0.464927924553,GE,410.36126814800775,48.8030644645,2.28639478919,042020
202020A0301,Marché,Fournitures,"Citernes, réservoirs, conteneurs et cuves sous pression",30/04/2020,46001.0,Ferme,EXERCICE BUDGETAIRE,43.8445331544,4.34760475323,PME,784.2047046038485,47.2976391518,-1.83536476567,042020
2020.00001_501,Marché,Services,Réalisation et entretien d'espaces verts,23/04/2020,46021.75,Révisable,COMMUNE NOUVELLE CLOYES LES TROIS RIVI,47.9934175708,1.22094931337,PME,40.41999983408665,48.2468008928,1.48284220264,042020
2018X2uBZ-V2CB00,Marché,Services,Services de curage des égouts,04/04/2020,461145.0,Révisable,Tours Métropole Val de Loire,47.3980773574,0.696151819266,NC,15.69194179834065,47.2928273173,0.790564730924,042020
2019t1FHUki_Te00,Marché,Travaux,Travaux de gros œuvre,07/04/2020,46120.0,Ferme et actualisable,Mairie d'Aubigny Sur Nere,47.4860698554,2.42075473503,PME,191.91817201173632,46.0961334676,3.45008685464,042020
2019XQTCsTjyYO00,Marché,Travaux,Travaux de construction de centres de secours des sapeurs-pompiers,09/04/2020,46134.5,Ferme et actualisable,SDIS 42 Loire,45.4301960415,4.37808697748,NC,30.701029392407197,45.5565717692,4.13113578264,042020
20185YrwjCj5f-00,Marché,Travaux,Travaux de maçonnerie,01/04/2020,4615.0,Ferme et actualisable,Mairie La Riche,47.381412804,0.638106614595,PME,11.379035927950241,47.4547163351,0.709834015887,042020
2019VrTvx-L700,Marché,Travaux,Travaux de pose de revêtement de sols et de murs et pose de papiers peints,30/04/2020,46200.45,Révisable,AIRVAULT,46.8327299145,-0.13478853947,PME,50.23656152670873,46.7362021112,-0.578598205012,042020
2019CHOBcTSGX_00,Marché,Travaux,Travaux de gros œuvre,16/04/2020,462236.86,Révisable,Sa hlm du cotentin,49.6330980885,-1.63358524312,PME,54.81982183324199,49.1917735049,-1.41329398373,042020
202020DSI1100,Marché,Fournitures,Ordinateur tablette,03/04/2020,46242.96,Ferme,COMMUNE DE LOON PLAGE,51.0010679189,2.22286153117,PME,761.7813827895728,44.791939845,-0.675986855592,042020
2018wZIV58D0Tl00,Marché,Services,Services d'impression et de distribution,06/04/2020,462500.0,Ferme,CAISSE CENTRALE MSA,48.9073106793,2.44007227598,ETI,366.8130605710825,48.0610922073,-0.766055300559,042020
2020Ix4ufZ9NBk00,Marché,Travaux,Travaux de construction,20/04/2020,46280.0,Révisable,VOSGELIS,48.162954598,6.47953209434,PME,25.797004744199917,48.1439719803,6.2470349855,042020
20183VfL22uTZs00,Marché,Services,"Services d'architecture, d'ingénierie et de planification",15/04/2020,46280.0,Révisable,SDIS 42 Loire,45.4301960415,4.37808697748,PME,5.8401324273485695,45.4551755017,4.33160548513,042020
2018nRuDlbO8dt00,Marché,Services,Services de projection de vidéos,04/04/2020,46353.0,Ferme,Mairie de Niort (Service marchés publics),46.3286026496,-0.464927924553,PME,17.785415072177805,46.3658510074,-0.308514275167,042020
2018qiRmSNmXwS00,Marché,Services,Location d'autobus et d'autocars avec chauffeur,07/04/2020,46400.0,Révisable,Mairie d'Ermont,48.9881282104,2.25640594696,ETI,23.462976545892364,49.0400551805,2.05074797264,042020
20192018ASS10A00,Marché,Services,Services d'ingénierie,15/04/2020,464156.0,Révisable,CC DU PAYS ROCHOIS,46.0437305067,6.30022971427,NC,25.726969861517993,45.8900209706,6.12570413482,042020
20198fqNO3rGQe00,Marché,Travaux,Travaux de réparation d'espaces de loisir,07/04/2020,464225.0,Ferme et actualisable,CC du Grand Pic Saint Loup,43.769526913,3.8699877137,PME,230.33197839180218,43.1388519901,5.85450715581,042020
2018-07_0600,Marché,Services,Services de télécommunications,14/04/2020,464356.0,Révisable,MEGALIS RUHD,,,GE,,48.840040811,2.29268840406,042020
2018awBG_aliom00,Marché,Travaux,Travaux de construction de bâtiments à usage artistique et culturel,07/04/2020,464779.31,Révisable,Ville de Poissy,48.9238114722,2.02813940207,NC,0.0,48.9238114722,2.02813940207,042020
2019IB8f76wQck00,Marché,Services,,30/04/2020,465.0,Révisable,SDIS de l'Ardèche,44.7218752388,4.59409820072,GE,533.6999546150591,48.8963161116,2.20694242609,042020
2020130015404400,Marché,Services,Services d'inventaire forestier,17/04/2020,46540.0,Révisable,"Ministère de la Transition Écologique et Solidaire, Ministère de la Cohésion des Territoires - Direction Régionale Environnement, Aménagement et Logement de la Nouvelle-Aquitaine",46.5834165499,0.359436087058,PME,229.95150167320807,44.791939845,-0.675986855592,042020
2018GXjswtvS2j00,Marché,Fournitures,Matériel d'ostéosynthèse,07/04/2020,4656.0,Ferme et actualisable,HOPITAL NORD OUEST - VILLEFRANCHE SUR SAONE,45.9909873528,4.68779445054,PME,404.8527858823066,48.695957442,2.23477492911,042020
2018wpVUR2tbFs00,Marché,Services,Services de télécommunications,06/04/2020,46581.0,Ferme,Alès Agglomération,44.1254048703,4.08883549513,NC,7.329295747625442,44.1019942859,4.15080758082,042020
20202020F0645900,Marché,Fournitures,Matériel électrique,14/04/2020,46588.42,Ferme,"Etablissements et organismes de l'enseignement supérieur, de la recherche et de l'innovation - INSTITUT NATIONAL POLYTECHNIQUE DE TOULOUSE",43.5959710776,1.43229743595,ETI,653.8592585041358,49.4363296139,2.08715087996,042020
2019-soFudAECk00,Marché,Fournitures,Consommables médicaux,07/04/2020,46599.0,Ferme et actualisable,HOPITAL NORD OUEST - VILLEFRANCHE SUR SAONE,45.9909873528,4.68779445054,PME,418.7735309169567,48.9371223842,2.3256448828,042020
20189glTeyjgeL00,Marché,Fournitures,Pain,01/04/2020,46610.67,Révisable,Centre Hospitalier Avranches Granville,48.8327939183,-1.5661139044,PME,73.11855285523636,48.6485016322,-0.931403777391,042020
201936-2019 DL00,Marché,Travaux,Travaux de construction,10/04/2020,46620.0,Ferme,COMMUNE DE DZAOUDZI-LABATTOIR,-12.778162297,45.2824610959,PME,0.0,-12.778162297,45.2824610959,042020
2019d0gij_nOGx00,Marché,Fournitures,Consommables médicaux,14/04/2020,4663.75,Révisable,Centre Hospitalier de Beauvais,49.4363296139,2.08715087996,NC,170.11242525181464,50.6317671102,3.04699299406,042020
2020130015370200,Marché,Services,Services d'analyse technique ou services de conseil,02/04/2020,46635.0,Révisable,"Ministère de la Transition Écologique, Ministère de la Cohésion des Territoires, Ministère de la Mer - Direction Interdépartementale des Routes Centre-Ouest",45.8544262114,1.24894834225,PME,400.48199058638875,45.7533230296,4.86924368009,042020
2019TRAV2-L200,Marché,Travaux,Travaux de construction de lignes électriques,20/04/2020,4664804.0,Ferme et actualisable,SEZEO,49.4795370757,2.8810918655,NC,51.36999008801148,49.2760553449,2.46402126163,042020
2020A2003701,Marché,Travaux,Réparation et entretien d'infrastructures sportives,27/04/2020,46650.0,Ferme,BUDGET GENERAL 2020,45.5837038917,5.90877548323,NC,21.972083719866472,45.4199003891,6.02093490138,042020
2020SNEF202000,Marché,Travaux,Installation d'appareils d'éclairage extérieur,27/04/2020,46656.08,Ferme et actualisable,SAINT-CHAMAS,43.5438524128,5.07297989033,NC,23.483848214801956,43.4500011794,5.26335968091,042020
20202020T0638700,Marché,Travaux,Travaux de construction,20/04/2020,46697.0,Ferme,"Etablissements et organismes de l'enseignement supérieur, de la recherche et de l'innovation - ECOLE NATIONALE SUPERIEURE D'ARTS ET METIERS",48.8282706469,2.362358986,PME,695.0953274409729,43.344864211,5.39338098888,042020
2019MMMT21LOT100,Marché,Fournitures,Escaliers mécaniques,15/04/2020,46700.7,Ferme et actualisable,COM COM HAUT CHABLAIS,46.2726346201,6.64019260724,PME,18.37282243135634,46.1454516495,6.53330225799,042020
2019RKSY11Hpfk00,Marché,Services,Services de contrôle technique de bâtiments,07/04/2020,4675.0,Ferme,MANCHE HABITAT,49.1097135871,-1.07754504719,NC,84.69324133854688,49.6330980885,-1.63358524312,042020
2018DJ_GMf7Wm-00,Marché,Travaux,Travaux de construction,06/04/2020,46753.6,Ferme et actualisable,SEMDAS,46.1619512738,-1.1749922971,NC,195.67858997683888,45.2449857742,0.334835321633,042020
2020100014366900,Marché,Services,"Services d'architecture, d'ingénierie et de planification",24/04/2020,4680.0,Révisable,"Ministère de la Transition Écologique et Solidaire, Ministère de la Cohésion des Territoires - Direction Régionale et Interdépartementale Equipement et Aménagement Ile-de-France",48.840040811,2.29268840406,PME,196.73993051654912,47.0747420182,2.40492134914,042020
20199vDM3YoiFA00,Marché,Services,"Services d'architecture, services de construction, services d'ingénierie et services d'inspection",28/04/2020,46800.0,Révisable,DEL - Direction de l éducation et des lycées,45.7480493184,4.82567584415,PME,130.22766158492328,45.02773512,3.89608931701,042020
2019d8DaLV84M800,Marché,Travaux,Travaux d'installation de ventilation,15/04/2020,46800.0,Révisable,DM - Direction des mobilités,45.7480493184,4.82567584415,PME,192.26089893801637,45.7498237009,3.08701231475,042020
20209XhjwF1C-600,Marché,Services,Services d'interconnexion,01/04/2020,46810.0,Ferme et actualisable,SPL FACONEO,43.2936269646,5.56325220466,PME,0.0,43.2936269646,5.56325220466,042020
2019RNfNFpV_9C00,Marché,Travaux,Travaux de construction de routes secondaires,10/04/2020,468233.85,Ferme et actualisable,OISE HABITAT,49.2530176025,2.48395578599,NC,12.166817770919037,49.2116367629,2.58581200974,042020
2018HFVSRga6YB00,Marché,Services,Services de conseil en protection et contrôle des risques,07/04/2020,46840.0,Révisable,Mairie des Lilas,48.8814193509,2.41997665333,ETI,360.82077103919755,45.8544262114,1.24894834225,042020
2019zZAJFwWJqt00,Marché,Travaux,Travaux de construction de centres de secours des sapeurs-pompiers,09/04/2020,46926.0,Ferme et actualisable,SDIS 42 Loire,45.4301960415,4.37808697748,PME,7.189696978504587,45.4946738952,4.37188069146,042020
2018y3Vjjalfbx00,Marché,Services,Services de gestion d'immeubles et d'installations,07/04/2020,469378.0,Révisable,CPAM CLERMONT-FERRAND,45.7859001722,3.11559551839,GE,351.5855982435926,48.840040811,2.29268840406,042020
2020L2052A00,Marché,Fournitures,Articles et équipements de sport,09/04/2020,469972.0,Révisable,Ville de Lyon,45.7700265344,4.82839245881,ETI,427.46517852518934,48.524742723,7.53803998773,042020
2018wIoLK6vgbj00,Marché,Travaux,Travaux de plomberie,07/04/2020,4700.0,Ferme,Terres de Loire Habitat,47.5814306941,1.30596722868,GE,77.21753178851507,47.3326814781,0.654069551082,042020
2018MpMSFKhixL00,Marché,Travaux,Jardins intérieurs,01/04/2020,47000.0,Révisable,OISE HABITAT,49.2530176025,2.48395578599,PME,143.26891178746462,49.003677009,1.21281122004,042020
20191bGSBAFn-I00,Marché,Services,Services de conseils en publicité,14/04/2020,470000.0,Révisable,AGEFIPH,48.7987242503,2.30977129909,PME,4.968722539536662,48.840040811,2.29268840406,042020
20202021F0070600,Marché,Fournitures,"Matériels médicaux, pharmaceutiques et produits de soins personnnels",21/04/2020,470000.0,Ferme,Conseil Régional d'Ile-de-France,48.8562037309,2.3121193117,ETI,3.51634908040724,48.8873739998,2.30681348993,042020
20202020F0883300,Marché,Fournitures,"Matériels médicaux, pharmaceutiques et produits de soins personnnels",24/04/2020,470000.0,Ferme,Conseil Régional d'Ile-de-France,48.8562037309,2.3121193117,ETI,3.51634908040724,48.8873739998,2.30681348993,042020
20202020F0881800,Marché,Fournitures,"Matériels médicaux, pharmaceutiques et produits de soins personnnels",14/04/2020,470000.0,Ferme,Conseil Régional d'Ile-de-France,48.8562037309,2.3121193117,ETI,3.51634908040724,48.8873739998,2.30681348993,042020
20181KwGT9YeOL00,Marché,Services,"Services de l'administration publique, de la défense et de la sécurité sociale",07/04/2020,47040.0,Révisable,FLERS AGGLO,48.7400079375,-0.562173805455,PME,0.0,48.7400079375,-0.562173805455,042020
2020170009969400,Marché,Services,Contrôle de la conformité aux normes environnementales,21/04/2020,4709.4,Ferme et actualisable,Ministère des armées - Etablissement du Service d'infrastructure de la défense d'Ile de France - ESID Ile de France,,,PME,,48.9721403034,2.32629729334,042020
2019Cnby-KRy3y00,Marché,Fournitures,Pylônes de radio,09/04/2020,47126.0,Ferme,SDIS 42 Loire,45.4301960415,4.37808697748,PME,68.0078815387777,45.7345274274,4.91192378092,042020
20201101201900,Marché,Services,Études techniques,30/04/2020,47150.0,Ferme,COMMUNE DE LA DESIRADE,16.3114570341,-61.052978658,PME,46.62870881690627,16.2250869819,-61.4693509551,042020
20183lxIKA6NaY00,Marché,Services,Services de réparation et d'entretien de matériel médical,07/04/2020,47210.94,Révisable,Centre Hospitalier Avranches Granville,48.8327939183,-1.5661139044,NC,969.4958369305663,43.5360639608,5.39837823449,042020
2019evBVz8122m00,Marché,Services,Réalisation et entretien d'espaces verts,16/04/2020,47235.0,Révisable,Société OZANAM,14.6460950766,-61.100358959,ETI,2.8416140623833166,14.6587983693,-61.1251082579,042020
2019OAxNfwkpO-00,Marché,Fournitures,Systèmes avertisseurs d'effraction,01/04/2020,4725.0,Révisable,Mairie de Villiers-sur-Marne,48.8263001327,2.54537749642,ETI,33.90554084242203,48.8365394869,2.2389245247,042020
2020rtplnu66rI00,Marché,Travaux,Travaux de construction,20/04/2020,47308.0,Révisable,VOSGELIS,48.162954598,6.47953209434,PME,36.72683588922837,48.1274714151,6.80973312862,042020
2020P0420T032901,Marché,Travaux,Travaux de transformation de bâtiments,21/04/2020,47367.1,Ferme,PARC NATUREL DU VERCORS,44.9724926219,5.41244922014,ETI,22.550275362457544,45.1526726075,5.31773426609,042020
2020150999328500,Marché,Travaux,Travaux de gros œuvre,21/04/2020,474699.49,Ferme et actualisable,Ministère des armées - Etablissement du service d'infrastructure de la défense de Lyon - ESID Lyon,,,PME,,43.8520662902,5.10953063847,042020
2019Dh8_q23sja00,Marché,Travaux,Travaux de construction,08/04/2020,474843.39,Révisable,3F NORD ARTOIS,50.6322610395,3.15284231203,PME,38.75125860619906,50.3775319117,2.91360666335,042020
202020.002.0002,Marché,Travaux,Travaux relatifs aux conduites d'alimentation en eau,24/04/2020,474974.8,Ferme et actualisable,ATLANTIC' EAU,47.2321613301,-1.54797539458,GE,8.000686519718727,47.3030353752,-1.56014129347,042020
20202020T0598400,Marché,Travaux,Travaux de câblage et d'installations électriques,28/04/2020,475000.0,Révisable,Ministère de la Culture - Opérateur du patrimoine et des projets immobiliers de la culture,48.8282706469,2.362358986,NC,35.52113797061697,48.758778972,2.04882028884,042020
202020F2500,Marché,Services,Logiciels de planification,27/04/2020,475000.0,Ferme,EXERCICE BUDGETAIRE,43.8445331544,4.34760475323,PME,783.7300353164408,49.2594420958,-0.188135632051,042020
2018vZIeEGX1L600,Marché,Services,Services de stockage et d'entreposage,06/04/2020,475000.0,Révisable,CAISSE CENTRALE MSA,48.9073106793,2.44007227598,ETI,37.62295525794169,49.0444862396,2.12906447579,042020
2019PN9tpjP_bP00,Marché,Travaux,Travaux de couverture,03/04/2020,475000.0,Ferme,Mairie de Colomiers,43.611577156,1.32726979619,PME,22.951646281743606,43.5390131127,1.52156442051,042020
20202021F0049400,Marché,Fournitures,Équipements médicaux,30/04/2020,4750000.0,Ferme,HOSPICES CIVILS DE LYON,45.7480493184,4.82567584415,ETI,435.05772524945013,48.7498603402,2.29906093692,042020
20191370000904,Marché,Travaux,Travaux de fondation,10/04/2020,4756710.0,Révisable,VILLE DE PARIS BUDGET PRINCIPAL,48.8542874923,2.35759608215,GE,19.943135369757314,48.8695044166,2.17789004853,042020
20202020F0513600,Marché,Fournitures,Consommables médicaux,06/04/2020,47596.4,Révisable,ASSISTANCE PUBLIQUE DES HOPITAUX DE MARSEILLE,43.2924013477,5.39786536432,NC,,,,042020
2020DCT07800,Marché,Travaux,Travaux d'installation d'appareils sanitaires,10/04/2020,476272.0,Révisable,Budget principal,45.1821782198,5.72099089704,PME,4.212301536652314,45.2198746489,5.71597377571,042020
2018DUMPFTMuqd00,Marché,Travaux,Travaux de menuiserie,07/04/2020,476430.47,Ferme et actualisable,MANCHE HABITAT,49.1097135871,-1.07754504719,PME,5.782984220570258,49.1155352385,-1.12951508533,042020
2019CzPWn0iPF_00,Marché,Travaux,Travaux de construction,22/04/2020,47647.5,Ferme et actualisable,DPMG - Direction du patrimoine et des moyens généraux,45.7480493184,4.82567584415,PME,60.92968490935497,45.468757838,4.35128266574,042020
2019XFzcbuULse00,Marché,Fournitures,Consommables médicaux,14/04/2020,47655.93,Révisable,Centre Hospitalier de Beauvais,49.4363296139,2.08715087996,PME,73.1544762929101,48.8694561887,2.42256669613,042020
2019K4KWab9bgv00,Marché,Travaux,Pose de portes et de fenêtres et d'éléments accessoires,16/04/2020,47701.67,Révisable,Sa hlm du cotentin,49.6330980885,-1.63358524312,PME,47.859831096946166,49.2168052421,-1.52481750679,042020
2019BwgwrMgol500,Marché,Services,Services de contrôle technique de bâtiments,07/04/2020,4775.0,Ferme,MANCHE HABITAT,49.1097135871,-1.07754504719,GE,493.80979493062557,50.675257141,3.10114805967,042020
20194mYnlc3rYt00,Marché,Services,"Services d'architecture, services de construction, services d'ingénierie et services d'inspection",07/04/2020,47750.0,Révisable,FLERS AGGLO,48.7400079375,-0.562173805455,PME,18.626009423275832,48.7332586806,-0.730484453871,042020
20202020F0562700,Marché,Fournitures,Équipement maritime,21/04/2020,47837.43,Ferme,Ministère des armées - Service hydrographique et océanographique de la Marine,48.3999000994,-4.5027702561,PME,144.4780717429892,47.7160099801,-3.391311386,042020
2019-10702,Marché,Travaux,Travaux de démolition de bâtiments et travaux de terrassement,15/04/2020,47842.0,Ferme et actualisable,SEGRE EN ANJOU BLEU-ASS,,,ETI,,47.2548412826,-1.05162791043,042020
2020ALSHL1203,Marché,Fournitures,Revêtements de sol,24/04/2020,47849.47,Révisable,PREVESSIN MOENS,46.2580457682,6.07155422572,PME,150.87102076306064,45.7566434898,4.80314551427,042020
2019A10802,Marché,Travaux,Travaux de construction,29/04/2020,47878.48,Révisable,BUDGET PRINCIPAL,43.3201640732,-0.3496692279,PME,76.69488519433811,43.3439779054,-1.04285885539,042020
20181h5UHLpIid00,Marché,Travaux,Travaux de gros œuvre,07/04/2020,479116.0,Ferme,SECOMILE,49.019805962,1.14132572141,PME,24.259187239044497,48.9545259368,0.932005023744,042020
20202020S0752400,Marché,Services,Services de formation professionnelle,06/04/2020,479586.91,Ferme et actualisable,Ministères sociaux,14.6408734458,-61.069176472,PME,0.0,14.6408734458,-61.069176472,042020
2019aTj1p6jPRv00,Marché,Travaux,Travaux d'installations électriques,16/04/2020,47978.25,Révisable,Sa hlm du cotentin,49.6330980885,-1.63358524312,PME,82.68100848490347,48.8971511325,-1.53067522665,042020
2018nPns0sOOny00,Marché,Services,Services d'assurance responsabilité civile,05/04/2020,47990.0,Révisable,ETBT du Château de Versailles,48.8022788923,2.11716530117,GE,396.63291811922477,46.3286026496,-0.464927924553,042020
2018TVBsAZ9Jdg00,Marché,Fournitures,Cultures microbiologiques,07/04/2020,480.0,Révisable,GIP LABÉO,49.2152313192,-0.40138132268,PME,292.13844643622645,48.6811729227,2.1853558178,042020
20202020S0539100,Marché,Services,Services de formation de personnel,13/04/2020,4800.0,Ferme et actualisable,CHU SAINT ETIENNE,45.4301960415,4.37808697748,NC,62.462078915380864,45.7700265344,4.82839245881,042020
20181SBbb4v0kV00,Marché,Fournitures,"Vêtements professionnels, vêtements de travail spéciaux et accessoires",01/04/2020,48000.0,Révisable,Mairie de Marcq en Baroeul,50.675257141,3.10114805967,PME,12.597539251487403,50.5661643687,3.13201595891,042020
2018y6PJ702Ipu00,Marché,Travaux,Travaux de transformation de bâtiments,07/04/2020,48000.0,Ferme et actualisable,Ville d'Allauch,43.3532759417,5.51151319514,PME,7.8220800585756685,43.2883854261,5.48366970686,042020
2018vPUR_2XEKk00,Marché,Fournitures,Mobilier de bureau,06/04/2020,48000.0,Révisable,DIJON METROPOLE,47.3230744087,5.03738286925,NC,,,,042020
2020L2002100,Marché,Fournitures,Livres imprimés,23/04/2020,48000.0,Ferme,BUDGET PRINCIPAL,49.2206305889,1.15342309131,NC,0.0,49.2206305889,1.15342309131,042020
2018fBBl9-fcr500,Marché,Services,Services juridiques,06/04/2020,48000.0,Révisable,Mairie de Villeneuve le roi,48.7321607291,2.41097949757,PME,14.524687786156836,48.8591103086,2.38017728226,042020
2018_JPLCoAXSx00,Marché,Fournitures,,07/04/2020,48000.0,Révisable,DAPJ,48.8491121687,2.33284677548,GE,414.47471876628174,45.9722435435,4.71913168899,042020
20005500,Marché,Fournitures,Articles funéraires,30/04/2020,48000.0,Révisable,BUDGET PRINCIPAL,49.6330980885,-1.63358524312,PME,0.0,49.6330980885,-1.63358524312,042020
