2019130015040300,Marché,Fournitures,Fromage de table,23/12/2019,126666.64,Ferme et actualisable,Direction des Services Administratifs et Financiers,48.8562037309,2.3121193117,ETI,12.659281377696878,48.7495659946,2.35212808495,122019
2019130015046500,Marché,Fournitures,Fromage de table,23/12/2019,1266666.64,Ferme et actualisable,Services du Premier ministre - Direction des Services Administratifs et Financiers,48.8562037309,2.3121193117,PME,0.0,48.8562037309,2.3121193117,122019
20192019F2488600,Marché,Fournitures,Véhicules à moteur,12/12/2019,12672.48,Ferme,Chambres de Commerce et d'Industrie,47.9889433531,0.20002401353,ETI,0.0,47.9889433531,0.20002401353,122019
20191059700,Marché,Services,Services d'assurance de véhicules à moteur,03/12/2019,126728.38,Ferme,BUDGET PRINCIPAL,50.2899236486,2.76642705397,PME,164.13293662439062,48.8769868607,2.33753841595,122019
20192019S2473600,Marché,Services,Services de collecte de déchets hospitaliers,10/12/2019,1267335.03,Ferme et actualisable,CHU NICE,43.7123384529,7.23750191149,GE,10.430592738420065,43.671853349,7.1522919117,122019
157536966618900,Marché,Travaux,Murs de soutènement,03/12/2019,126890.0,Ferme,Communauté de communes MILLAU GRANDS CAUSSES,44.0974934004,3.11719423537,PME,0.0,44.0974934004,3.11719423537,122019
2019s96eMlMuKa00,Marché,Services,Services de maintenance et de réparation de logiciels,16/12/2019,126987.35,Révisable,CENTRE HOSPITALIER DE MACON,46.320613267,4.81834086547,ETI,629.8467935955613,44.760310031,-0.657279122002,122019
201901389a400100,Marché,Fournitures,Matériel de sonorisation,24/12/2019,127.0,Ferme,Commune VIERZON,47.2370821272,2.07892537933,PME,73.65309428637708,47.8831055202,1.93329564491,122019
2019100014038600,Marché,Fournitures,Matériel de photographie,05/12/2019,127017.0,Ferme,Ministère des armées - Plate-forme commissariat Sud-Ouest,,,PME,,48.8348302792,2.42102904428,122019
20192019F2520700,Marché,Fournitures,Consommables médicaux,06/12/2019,127095.6,Ferme et actualisable,CH DU MANS,47.9889433531,0.20002401353,ETI,252.57504949064509,48.7495659946,2.35212808495,122019
2019150980461900,Marché,Travaux,Travaux de remise en état et de remise à neuf,03/12/2019,12710.0,Révisable,Ministère des armées - Direction d'infrastructure de la défense de Fort de France - DID Fort de F...,,,ETI,,16.2515819199,-61.5922344723,122019
2019vhCyHNLIW300,Marché,Fournitures,Fournitures pour l'angioplastie,09/12/2019,127200.0,Révisable,CENTRE HOSPITALIER DE MACON,46.320613267,4.81834086547,PME,396.29678372082947,48.8231210367,2.26445901319,122019
2018CA3200,Marché,Fournitures,Véhicules d'entretien routier,11/12/2019,127200.0,Ferme,Communauté d'Agglomération du Grand Villeneuvois,44.4480990803,0.622538683662,NC,30.562460576060683,44.1880583705,0.711246750038,122019
2018013473a00100,Marché,Services,"Services d'architecture, d'ingénierie et de planification",02/12/2019,12750.0,Ferme,Communaut� Paris-Saclay,48.7002680837,2.18715224978,PME,5.287708201082123,48.695957442,2.23477492911,122019
2020201909L0900,Marché,Travaux,Travaux de construction d'écoles primaires,23/12/2019,127551.66,Ferme et actualisable,COMMUNE DE PRINQUIAU,47.3741694731,-2.01859761397,PME,25.17823524790995,47.1752482545,-2.12720816245,122019
20192020F0472900,Marché,Travaux,Carrelages,14/12/2019,12768.0,Ferme,"Ministères de l'Économie et des Finances, de l'Action et des Comptes publics - Chambre Régionale ...",44.8578964782,-0.57357535767,NC,288.3494056378716,47.2246985502,-1.63426478543,122019
2019DftGrjFG2t00,Marché,Fournitures,Camions à benne basculante,12/12/2019,127800.0,Ferme et actualisable,Conseil Départemental de la Charente-Maritime-cg17,46.1619512738,-1.1749922971,GE,161.54367975918396,47.4766284713,-0.556089456786,122019
201916500,Marché,Travaux,Travaux de revêtement de rues,06/12/2019,1278619.18,Ferme,LIVRY GARGAN VILLE - VILLE,48.9202318556,2.5350599357,NC,0.0,48.9202318556,2.5350599357,122019
2019HxSfqqysZ-00,Marché,Services,Services de transport de colis,31/12/2019,127868.0,Révisable,CENTRE HOSPITALIER DE MACON,46.320613267,4.81834086547,NC,105.78655567450096,47.2449326412,5.05438848398,122019
2019CXyAW4Etsi00,Marché,Fournitures,Machines et appareils d'essai et de mesure,06/12/2019,127908.0,Ferme,"Etablissements et organismes de l'enseignement supérieur, de la recherche et de l'innovation - UN...",48.5716343863,7.76783353204,NC,,,,122019
2019150983748200,Marché,Fournitures,Revêtements de sol,19/12/2019,12793.25,Ferme et actualisable,Ministère de la Transition écologique et solidaire - Ministère de la Cohésion des Territoires - D...,49.1081027833,6.19595351042,PME,30.021003844139692,49.3761182329,6.23786587577,122019
20192019003-0300,Marché,Fournitures,Autres véhicules particuliers,09/12/2019,127960.0,Ferme,Ville de St Laurent du MARONI,4.94626572703,-53.9779657738,PME,162.42463940771768,5.03107464278,-52.5193923736,122019
20192019F2551500,Marché,Fournitures,Réactifs de laboratoire,17/12/2019,1280.0,Ferme et actualisable,CHU SAINT ETIENNE,45.4301960415,4.37808697748,NC,596.2681765674232,50.6317671102,3.04699299406,122019
201919CVD01800,Marché,Travaux,Travaux de rénovation de ponts,16/12/2019,1280000.0,Révisable,DEPARTEMENT DES ALPES DE HAUTE PROVENC,44.0904434342,6.23557275155,NC,49.400609026133225,43.9618751991,6.6633675831,122019
20192019S2660700,Marché,Services,"Services de technologies de l'information, conseil, développement de logiciels, internet et appui",17/12/2019,128100.0,Révisable,Ministère de la Culture - CENTRE DES MONUMENTS NATIONAUX,48.8542874923,2.35759608215,PME,6.713829932851367,48.8873739998,2.30681348993,122019
20192019T2737500,Marché,Fournitures,Échafaudages,24/12/2019,128181.35,Ferme et actualisable,Ministère de la Culture - CENTRE DES MONUMENTS NATIONAUX,48.8542874923,2.35759608215,ETI,611.461390766687,43.8675307901,4.69710548566,122019
20190Sq088NaPr00,Marché,Services,Services de contrôle technique,24/12/2019,12833.0,Révisable,CPAM de l'Essonne,48.6293513055,2.44049035394,NC,4.026680915236841,48.5968549847,2.424435968,122019
20202019-CT-0100,Marché,Services,Services de contrôle technique,17/12/2019,1284000.0,Ferme et actualisable,ETABLISSEMENT EAU & D'ASSAINISSEMENT,,,ETI,,48.7839097374,2.19723411662,122019
20192019F2554200,Marché,Fournitures,Microscope à fluorescence,18/12/2019,128466.0,Ferme,"Etablissements et organismes de l'enseignement supérieur, de la recherche et de l'innovation - Dé...",50.6317671102,3.04699299406,NC,,,,122019
2019AMGTCTRE1500,Marché,Travaux,Travaux d'installations électriques,04/12/2019,128621.0,Révisable,ORLEAT,45.8598014776,3.43843628268,PME,0.0,45.8598014776,3.43843628268,122019
201968746100,Marché,Travaux,Travaux d'assainissement,30/12/2019,12874.0,Ferme et actualisable,MAIRIE DU PERRAY-EN-YVELINES,48.6962812628,1.84344970164,PME,45.79571371599013,48.6257444414,2.25148148985,122019
2019150985177000,Marché,Services,Services d'hygiénisation d'installations,19/12/2019,12880.0,Révisable,Ministère des armées - Direction du Commissariat Outre-Mer FAZSOI et groupement de soutien de la ...,48.840040811,2.29268840406,PME,8535.992996694502,-21.0446108504,55.3222448792,122019
20192019S2257500,Marché,Services,"Services d'hôtellerie, de restauration et de commerce au détail",18/12/2019,1.2899E9,Révisable,Ministère des armées - Plate-forme commissariat Sud-Est,,,ETI,,48.8984598394,2.40893736699,122019
20192020S0519100,Marché,Services,Services d'assurance,31/12/2019,129080.0,Révisable,CH VALENCIENNES,50.3591232468,3.51599087764,PME,16.96167083585227,50.2507083459,3.62398443538,122019
2019COCO60-1500,Marché,Services,Services de traitement et d'élimination des ordures ménagères et des déchets non dangereux,10/12/2019,129230.0,Ferme,COMMUNAUTE COMMUNES PRINCIPAL,48.6906787922,7.78465785332,PME,22.473125928037444,48.8688842525,7.68619151677,122019
20190010101,Marché,Fournitures,,17/12/2019,129250.0,Ferme et actualisable,Commune LOUANNEC,48.7834219271,-3.41190441243,PME,96.44840321078445,48.4872054593,-2.59209005216,122019
2019jZobNB10wS00,Marché,Travaux,Travaux de pose de revêtements de sols souples,02/12/2019,12943.0,Ferme et actualisable,THEMELIA,43.9256996046,2.14745941954,PME,0.0,43.9256996046,2.14745941954,122019
20192019T2429100,Marché,Services,Services de maintenance de systèmes,04/12/2019,129450.0,Ferme et actualisable,"Etablissements et organismes de l'enseignement supérieur, de la recherche et de l'innovation - UN...",45.7708803723,4.88922582274,NC,114.58400345558184,45.1470636912,5.71546169286,122019
2019e-UwCbkRJA00,Marché,Travaux,Travaux de construction,26/12/2019,129500.0,Révisable,Mayenne Habitat,48.0610922073,-0.766055300559,NC,25.97105530925525,47.8294089517,-0.738267470726,122019
20192019T2487000,Marché,Fournitures,Systèmes d'alarme incendie,11/12/2019,129532.3,Ferme,"Etablissements et organismes de l'enseignement supérieur, de la recherche et de l'innovation - CN...",44.8056323294,-0.59098965786,NC,563.1140637743306,48.9296428406,2.35946866986,122019
2019130014991400,Marché,Fournitures,Machines à affranchir,03/12/2019,12960.0,Révisable,"Ministère de l'éducation nationale et de la jeunesse et Ministère de l'enseignement supérieur, de...",48.8562037309,2.3121193117,ETI,9.702387869284527,48.9296428406,2.35946866986,122019
20192021F0053600,Marché,Fournitures,Produits laitiers,31/12/2019,129603.8,Révisable,CHU DU HAVRE,49.4965847516,0.140273146733,NC,99.90578492950668,49.4094883554,1.03952520974,122019
20192019S2433200,Marché,Services,Planification environnementale,03/12/2019,129650.0,Ferme,Agence De l'Environnement et de la Maitrise de l'Energie,47.4766284713,-0.556089456786,NC,344.1288665450252,48.8365394869,2.2389245247,122019
20192152400,Marché,Services,Services d'études,12/12/2019,129700.0,Ferme,Collectivité Territoriale de Guyane,5.03107464278,-52.5193923736,ETI,7323.4848397358355,48.8983675206,2.25515424076,122019
2019110004871100,Marché,Travaux,Travaux de construction de viaducs routiers,30/12/2019,1.297000001E7,Révisable,Ministère de la Transition écologique et solidaire - Ministère de la Cohésion des Territoires - D...,45.7731043316,4.85202749669,NC,64.76464087991582,45.4301960415,4.37808697748,122019
20190924142000,Marché,Services,Service de gestion du réseau d'assainissement,17/12/2019,129738.0,Ferme,Budget Principal,47.2801589313,-2.25106183059,NC,11.381431685506316,47.2909984893,-2.35341118898,122019
2019130015020200,Marché,Services,Mise en état d'exploitation d'installations de chauffage,11/12/2019,1297824.0,Révisable,Ministère des armées - Etablissement du service d'infrastructure de la défense de Lyon - ESI...,,,GE,,50.6603454446,3.04727537116,122019
2019150982418400,Marché,Travaux,Travaux de démolition,03/12/2019,1298.0,Ferme,Ministère de la Justice  - Antenne régionale de l'équipement de Toulouse,43.5959710776,1.43229743595,PME,33.48592623186969,43.7593774994,1.68659283376,122019
2019uezi5-uYTw00,Marché,Travaux,Travaux de construction d'ouvrages,17/12/2019,12980.0,Ferme,Ville de Pont Saint Esprit,44.2524138484,4.63921279535,NC,45.26902236084846,44.0338905553,4.98494540657,122019
20191rPs60KLmw00,Marché,Travaux,Travaux d'installations électriques,13/12/2019,12982.03,Ferme,COMMUNAUTE DE COMMUNES DU GRAND LANGRES,47.8592849798,5.33887552486,PME,30.455753909949486,47.7867562956,5.60451965944,122019
201919S0017L1B01,Marché,Travaux,Travaux de maçonnerie,04/12/2019,129934.0,Ferme et actualisable,Conseil Départemental AM - BP,43.7123384529,7.23750191149,PME,0.0,43.7123384529,7.23750191149,122019
2019A1911700,Marché,Services,Services de conseil en matière d'infrastructure,17/12/2019,129977.0,Ferme,BUDGET GENERAL 2019,45.5837038917,5.90877548323,PME,118.72985829403233,45.7731043316,4.85202749669,122019
2019U000801,Marché,Travaux,Travaux de construction de stations de traitement de l'eau potable,12/12/2019,1.2999999E7,Révisable,"SIE vallees du Girou, de l'Hers, de la",43.7637773291,1.28055977252,PME,102.0176946931381,43.8681733433,0.363949351201,122019
20192019F2693000,Marché,Fournitures,Réactifs de laboratoire,19/12/2019,1300.0,Révisable,ASSISTANCE PUBLIQUE DES HOPITAUX DE MARSEILLE,43.2924013477,5.39786536432,ETI,694.6101016689014,48.695957442,2.23477492911,122019
20192019F2923800,Marché,Fournitures,Consommables dentaires,24/12/2019,13000.0,Révisable,CHRU TOURS,47.3314668694,0.715972131571,ETI,235.60953014574147,48.8426287239,2.20839539221,122019
2019ex18KtTd9X00,Marché,Services,"Services d'architecture, services de construction, services d'ingénierie et services d'inspection",02/12/2019,13000.0,Ferme,VILLE DE VITROLLES,43.4500011794,5.26335968091,PME,30.666781015354488,43.6463117052,5.0679949909,122019
2019130014705500,Marché,Services,Services d'abattage d'arbres,11/12/2019,130000.0,Révisable,Ministère de la Transition écologique et solidaire - Ministère de la Cohésion des Territoires - D...,47.8824665066,1.91660961834,NC,178.62836419490515,48.7321382062,0.546077755608,122019
2019BFO-LZ4M2F00,Marché,Fournitures,Infrastructure de réseau,20/12/2019,130000.0,Révisable,Institut d'Etudes Politiques,43.5360639608,5.39837823449,NC,679.3897085449217,48.8164012464,2.29603611202,122019
20182xT110YUC000,Marché,Fournitures,Équipement de restaurant,06/12/2019,130000.0,Ferme,Lomme,50.6317671102,3.04699299406,PME,3.316479733184548,50.6520500829,3.02499832356,122019
20191938100,Marché,Services,Services de publicité et de marketing,10/12/2019,130000.0,Ferme,Budget principal,47.9889433531,0.20002401353,PME,0.0,47.9889433531,0.20002401353,122019
201968389900,Marché,Services,Services d'entretien de l'éclairage public,12/12/2019,130000.0,Ferme,VILLE DE PORNICHET,47.2619512895,-2.31411009833,NC,13.732063517274645,47.3315305713,-2.41669663649,122019
20192019S2633400,Marché,Services,"Services récréatifs, culturels et sportifs",20/12/2019,130000.0,Révisable,Ministère de la Culture - CITE de la CERAMIQUE - Sèvres et Limoges,48.8212450479,2.20940635474,PME,61.99415359336941,48.7542499474,1.65282358019,122019
20202019-2700,Marché,Services,Services de gestion de documents,12/12/2019,130000.0,Révisable,CIG Grande Couronne,48.8022788923,2.11716530117,PME,455.4024631214925,45.7708803723,4.88922582274,122019
2019170009733300,Marché,Travaux,Installation de panneaux de signalisation,02/12/2019,130000.0,Révisable,Ministère de la Transition écologique et solidaire - Ministère de la Cohésion des Territoires - D...,46.5834165499,0.359436087058,NC,220.00266910445836,44.8792319263,-0.648147734074,122019
2019PA0180800,Marché,Travaux,Travaux de construction de centres de secours des sapeurs-pompiers,11/12/2019,130000.0,Révisable,SDIS DU PAS DE CALAIS BUDGET PRINCIPAL,50.3081347422,2.81107875678,ETI,38.22049663345354,50.6041128389,2.98690052997,122019
2019yU33UJB4Zn00,Marché,Services,Services de surveillance ou de mesure de la pollution atmosphérique,10/12/2019,130000.0,Révisable,UEM METZ,49.1081027833,6.19595351042,PME,340.15907368711424,50.2722121982,3.35013490418,122019
2019M04501,Marché,Services,"Services de nettoyage de logements, de bâtiments et de vitres",24/12/2019,130000.0,Ferme et actualisable,MAIRIE DE LIEVIN,50.4241970985,2.77294074293,NC,17.603964808095988,50.2771247645,2.7140075703,122019
2019130014877500,Marché,Services,Services d'abattage d'arbres,04/12/2019,130000.0,Révisable,Ministère de la Transition écologique et solidaire - Ministère de la Cohésion des Territoires - D...,47.8824665066,1.91660961834,PME,228.49007747884568,47.0584514834,3.80959257016,122019
2019V1902003,Marché,Services,Services de réparation et d'entretien d'installations de bâtiments,10/12/2019,130059.09,Ferme,LE PUY EN VELAY,45.02773512,3.89608931701,NC,9.154254042974564,45.0324433424,3.97873851768,122019
2019050 2019L202,Marché,Fournitures,Eau potable,06/12/2019,130151.0,Ferme,SYNDICAT EAU 47,,,PME,,45.6965325322,-0.335230368086,122019
2019DVsCweDaHK00,Marché,Travaux,Installation de panneaux de signalisation,27/12/2019,13021.0,Ferme,Communaut� de Communes Loire Layaon Aubance,47.4023317074,-0.75598969988,PME,162.18734733554737,47.4547163351,0.709834015887,122019
2019pWLIlscz9E00,Marché,Travaux,Travaux de charpente et de couverture et travaux connexes,31/12/2019,130269.0,Révisable,CRISTAL HABITAT,45.5837038917,5.90877548323,PME,49.382201670995926,45.6528294074,6.34992931697,122019
201968571600,Marché,Travaux,Travaux de construction,19/12/2019,13030.0,Ferme et actualisable,EVOLEA,46.5622744929,3.32725048972,PME,53.85388999329328,46.5042727324,3.81077026359,122019
201968572200,Marché,Travaux,Travaux de construction,19/12/2019,13030.0,Ferme et actualisable,EVOLEA,46.5622744929,3.32725048972,PME,53.85388999329328,46.5042727324,3.81077026359,122019
2019vKlLj-tJ3P00,Marché,Travaux,Travaux d'installation de matériel de climatisation partielle de l'air,26/12/2019,130308.0,Ferme,Grand Paris Sud Est Avenir,48.783689162,2.4549804713,GE,267.96190566422007,49.4965847516,0.140273146733,122019
201968312700,Marché,Fournitures,Systèmes et appareils de surveillance et de sécurité,09/12/2019,130362.0,Révisable,Institution Eaux de la Montagne Noire,43.5390131127,1.52156442051,NC,18.312342734894234,43.6715080235,1.42334880464,122019
2020201909L1400,Marché,Travaux,Travaux de construction d'écoles primaires,23/12/2019,130404.5,Ferme et actualisable,COMMUNE DE PRINQUIAU,47.3741694731,-2.01859761397,PME,10.731539428476855,47.4334977763,-2.09512343941,122019
20192019T1520700,Marché,Travaux,Travaux de plâtrerie,23/12/2019,130532.86,Ferme et actualisable,Ministère de la Transition écologique et solidaire - Ministère de la Cohésion des Territoires - Agence Nationale pour la Garantie des Droits des Mineurs,48.8591103086,2.38017728226,ETI,205.3110393619696,50.6041128389,2.98690052997,122019
2020196000,Marché,Services,Système d'automatisation,09/12/2019,130610.0,Ferme,GRAND ANNECY,,,PME,,48.8964004469,2.15330952483,122019
20192019T2481400,Marché,Travaux,Travaux de peinture,11/12/2019,130622.65,Ferme,CHU SAINT ETIENNE,45.4301960415,4.37808697748,PME,0.0,45.4301960415,4.37808697748,122019
20192019S2688900,Marché,Services,Services de conseils et d'information juridiques,18/12/2019,130720.0,Révisable,Ministère de la Transition écologique et solidaire - Ministère de la Cohésion des Territoires - A...,47.8824665066,1.91660961834,ETI,117.26850547633481,48.8963161116,2.20694242609,122019
2019LwhD-0H7QI00,Marché,Travaux,Travaux de construction d'immeubles collectifs et de maisons individuelles,23/12/2019,1307623.0,Ferme,3F-DGRDI NE,48.8282706469,2.362358986,PME,32.2655323714176,48.9779936842,2.61229304573,122019
20180z2vqTR0wd00,Marché,Travaux,Travaux de construction d'immeubles collectifs et de maisons individuelles,23/12/2019,1307623.0,Ferme,3F-DGRDI NE,48.8282706469,2.362358986,PME,32.2655323714176,48.9779936842,2.61229304573,122019
2019150984381700,Marché,Travaux,Travaux de menuiserie et de charpenterie,19/12/2019,130876.3,Ferme et actualisable,Ministère des armées - Etablissement du service d'infrastructure de la défense de BREST - ESID Br...,,,PME,,48.3999000994,-4.5027702561,122019
20192019S0053700,Marché,Services,Services de colonies de vacances,31/12/2019,1310.0,Ferme,Ville de Sevran,48.9390274514,2.53062675237,NC,25.64077651078657,48.8292048923,2.3267445538,122019
20192019S0053800,Marché,Services,Services de colonies de vacances,30/12/2019,1310.0,Ferme,Ville de Sevran,48.9390274514,2.53062675237,NC,25.64077651078657,48.8292048923,2.3267445538,122019
2019100014179600,Marché,Fournitures,Analyseurs de gaz,19/12/2019,13100.0,Ferme,Ministère des armées - Plate-forme commissariat Brest,,,PME,,48.8625262113,2.33630086089,122019
20192019F2516300,Marché,Fournitures,Réchauffeurs d'air,16/12/2019,131000.0,Ferme,"Etablissements et organismes de l'enseignement supérieur, de la recherche et de l'innovation - ECOLE NATIONALE SUPERIEURE DE MECANIQUE ET D'AEROTECHNIQUE",46.6518315191,0.362203052781,NC,,,,122019
20190040501,Marché,Travaux,,16/12/2019,131030.0,Ferme,GROISY,46.0183373748,6.17569467528,PME,68.06415885701513,46.1561440875,5.57587732677,122019
2019MOBASE AVI00,Marché,Services,"Services d'architecture, services de construction, services d'ingénierie et services d'inspection",18/12/2019,131100.0,Ferme et actualisable,Communauté de Communes du Pays de Faye,43.6100884209,6.67852594566,PME,17.95498386290226,43.4718555069,6.76374233833,122019
2019180005761100,Marché,Services,Services de traitement de données,13/12/2019,131130.0,Ferme,Ministère des armées - Plate-forme commissariat Paris,,,NC,,48.8769868607,2.33753841595,122019
20191059600,Marché,Services,Services d'assurance responsabilité civile,03/12/2019,131136.25,Ferme,BUDGET PRINCIPAL,50.2899236486,2.76642705397,PME,164.13293662439062,48.8769868607,2.33753841595,122019
2019_fgFDsyB-V00,Marché,Travaux,Travaux d'aménagement paysager,18/12/2019,131216.0,Ferme et actualisable,Ports de Normandie,49.2152313192,-0.40138132268,PME,128.0999245482619,49.379688382,-1.54798621196,122019
2019lniBQ0ljIG00,Marché,Fournitures,Analyseurs de sang,03/12/2019,131460.0,Ferme et actualisable,Centre hospitalier de Boulogne sur mer Service Economique,50.7270459478,1.60607177999,PME,223.18021363136583,48.8852204631,2.40598240357,122019
20189Aln8Ka9N-00,Marché,Travaux,Travaux de construction,16/12/2019,131495.24,Ferme et actualisable,Commune de La Membrolle sur Choisille,47.444765885,0.625982952911,PME,40.994911929396714,47.0810354235,0.684124923436,122019
20194G8i5j8eyd00,Marché,Travaux,Travaux de construction,11/12/2019,13152.0,Révisable,Mayenne Habitat,48.0610922073,-0.766055300559,PME,25.30057455059488,47.8440388997,-0.833983615816,122019
20192019F2511300,Marché,Services,,02/12/2019,131624.0,Ferme,Chambres de Commerce et d'Industrie,48.5716343863,7.76783353204,ETI,183.66428917004865,49.1081027833,6.19595351042,122019
2019M068L0300,Marché,Travaux,Travaux d'aménagement paysager d'espaces verts,05/12/2019,131636.13,Ferme,LAVAL AGGLOMERATION,48.0610922073,-0.766055300559,PME,6.384625175918309,48.1076823048,-0.799735963393,122019
20192019S2566900,Marché,Services,Services de réparation et d'entretien,02/12/2019,1.3166666E7,Révisable,Ministère de la Transition écologique et solidaire - Ministère de la Cohésion des Territoires - S...,48.840040811,2.29268840406,ETI,7.5765359406630175,48.7802898374,2.25979241616,122019
20192019S0086100,Marché,Services,Services d'études,23/12/2019,131766.25,Ferme et actualisable,Communauté urbaine Grand Paris Seine et Oise,48.9628543141,1.84938988584,PME,40.2236107909163,48.8963161116,2.20694242609,122019
20191059300,Marché,Travaux,Travaux de gros œuvre,06/12/2019,131784.16,Ferme,BUDGET PRINCIPAL,50.2899236486,2.76642705397,PME,9.124117972508964,50.2843252026,2.84874855584,122019
