2019A1905704,Marché,Travaux,Travaux de construction de bâtiments,13/10/2020,27897.0,Ferme,VILLE 02700,43.4718555069,6.76374233833,NC,0.0,43.4718555069,6.76374233833,102020
2019K73wFWmQef00,Marché,Services,"Services aux entreprises: droit, marketing, conseil, recrutement, impression et sécurité",20/10/2020,27900.0,Ferme,Territoire Habitat 90,47.6463850599,6.84549855352,PME,669.1809383858651,49.5042362731,1.08853218963,102020
2020i_Ir_BEZNw00,Marché,Services,"Services d'architecture, d'ingénierie et de planification",15/10/2020,27940.0,Révisable,CC du Grand Pic Saint Loup,43.769526913,3.8699877137,PME,177.05482352651129,43.2924013477,5.39786536432,102020
20202020S1530400,Marché,Services,"Études de faisabilité, service de conseil, analyse",01/10/2020,28000.0,Ferme,Institut Français de Recherche pour l’Exploitation de la MER,48.8231210367,2.26445901319,NC,6.948559088670917,48.8855642403,2.26624582625,102020
2020170010329500,Marché,Services,Services de réinsertion,22/10/2020,28000.0,Révisable,Ministère de la Justice  - Directcion interrégionale des services pénitentiaires de Rennes,48.111571436,-1.68168588816,PME,946.8398673339967,43.2999288243,5.38304196226,102020
20202020T1675800,Marché,Fournitures,Serrurerie,01/10/2020,28000.0,Ferme et actualisable,Ministère de la Culture - CENTRE DES MONUMENTS NATIONAUX,48.8542874923,2.35759608215,PME,436.1307529604353,49.0982509299,-1.57896887595,102020
2019vGyLIlusa100,Marché,Travaux,Travaux de restructuration,07/10/2020,28000.0,Ferme et actualisable,Université Paris-Saclay,48.7149937413,2.13911306427,PME,40.335721208881104,48.6254013998,2.49258314929,102020
20202020S0624000,Marché,Services,Services de conseil en gestion générale,13/10/2020,28000.0,Ferme,RESEAUX DES ACHETEURS HOSPITALIERS,48.8591103086,2.38017728226,NC,13.079159228509262,48.8604673342,2.26190318372,102020
201908M4vlItjy00,Marché,Services,Services de conception graphique,27/10/2020,28000.0,Révisable,Commune d'Ezanville,49.0385997432,2.36297947386,PME,8.893215903294829,48.9704037595,2.40496801543,102020
202020CVD02600,Marché,Fournitures,Pelles mécaniques,09/10/2020,280000.0,Révisable,DEPARTEMENT DES ALPES DE HAUTE PROVENC,44.0904434342,6.23557275155,PME,128.80589718759072,43.4500011794,5.26335968091,102020
2019JoIo3skiK400,Marché,Fournitures,Produits en béton,02/10/2020,280000.0,Ferme,Ville de Béziers,43.3475518983,3.23081153874,GE,19.384892009780618,43.3922196149,3.40027116486,102020
202020CVD02700,Marché,Fournitures,Pelles mécaniques,09/10/2020,280000.0,Révisable,DEPARTEMENT DES ALPES DE HAUTE PROVENC,44.0904434342,6.23557275155,PME,128.80589718759072,43.4500011794,5.26335968091,102020
202020CVD02900,Marché,Fournitures,Systèmes de positionnement à capacité globale (GPS ou équivalent),09/10/2020,280000.0,Révisable,DEPARTEMENT DES ALPES DE HAUTE PROVENC,44.0904434342,6.23557275155,PME,682.9680639365346,48.8625262113,2.33630086089,102020
202020S0229L0200,Marché,Services,Logiciels de CAO,07/10/2020,280000.0,Révisable,Conseil Départemental AM - BP,43.7123384529,7.23750191149,PME,785.4348785644016,48.8292048923,2.3267445538,102020
2019BIjApkQ3oJ00,Marché,Fournitures,Produits en béton,02/10/2020,280000.0,Ferme,Ville de Béziers,43.3475518983,3.23081153874,GE,19.384892009780618,43.3922196149,3.40027116486,102020
20202020F0895700,Marché,Fournitures,Mobilier urbain,28/10/2020,280000.0,Révisable,Mairie de Suresnes,48.8699520558,2.21968010802,PME,25.280773746683362,48.8631652232,2.4482059517,102020
202035500,Marché,Fournitures,Appareils extincteurs,16/10/2020,280000.0,Révisable,SDIS DU NORD - BUDGET PRINCIPA,50.6317671102,3.04699299406,PME,214.17792733533665,48.8963161116,2.20694242609,102020
20202007800,Marché,Travaux,Travaux de construction de conduites d'eau et de canalisations d'eaux usées à grande distance,26/10/2020,2800000.0,Révisable,COMMUNE DE SAINT PAUL PES MARCHE,-21.0446108504,55.3222448792,PME,13.902367404157978,-21.2492112938,55.366954369,102020
2018I5EiFCR2SV00,Marché,Services,Services d'assurances accidents et maladie,29/10/2020,2800000.0,Ferme et actualisable,GIP SAMUSOCIAL DE PARIS,48.8123578699,2.3878497256,ETI,119.95875260830312,47.8889135244,1.82765256194,102020
2020151027286500,Marché,Services,Services d'assistance technique,07/10/2020,28017.0,Ferme et actualisable,"Ministère de la Transition Écologique, Ministère de la Cohésion des Territoires, Ministère de la Mer - Direction Interdépartementale des Routes Nord-Ouest",49.4415068863,1.09373273216,ETI,381.84043718453955,47.2321613301,-1.54797539458,102020
2020100014423700,Marché,Fournitures,Systèmes de détection d'incendie,30/10/2020,28040.26,Ferme et actualisable,Ministère de l'Intérieur - Préfecture du Var,43.1364847512,5.93276630299,PME,80.16054510489082,43.4686351237,6.5769352524,102020
20195unfrg-Bwj00,Marché,Travaux,Travaux d'installation de chaudières,05/10/2020,280420.0,Ferme,Territoire Habitat 90,47.6463850599,6.84549855352,ETI,132.22265084305818,48.6518313707,6.19871166784,102020
2020kZc6veapCp00,Marché,Travaux,Réparation et entretien d'équipements,01/10/2020,2807261.52,Révisable,Grand Port Maritime du Havre,49.4965847516,0.140273146733,PME,39.128029609392655,49.5754782582,0.485106509106,102020
2018q259Bd8s2r00,Marché,Services,Services d'architecture,16/10/2020,280782.0,Ferme et actualisable,Commune de Briançon,44.8996168364,6.64897322193,PME,225.13921559974418,43.3654982005,5.31265000369,102020
202024bTRNOObW00,Marché,Services,Réalisation et entretien d'espaces verts,22/10/2020,28080.0,Révisable,Collectivité de SAINT-BARTHELEMY,,,NC,,,,102020
2020zUkeAS1_5l00,Marché,Travaux,Revêtement de sols et de murs,08/10/2020,28092.0,Révisable,CC du Grand Pic Saint Loup,43.769526913,3.8699877137,PME,72.65803616555068,43.3132182361,3.39927687189,102020
2020M9D0150DM00,Marché,Services,Services de réparation et d'entretien,26/10/2020,281136.0,Révisable,BUDGET PRINCIPAL,43.6131750772,3.86941278925,NC,0.0,43.6131750772,3.86941278925,102020
2020151027860400,Marché,Travaux,Entretien des routes nationales,05/10/2020,281462.43,Ferme et actualisable,"Ministère de la Transition Écologique, Ministère de la Cohésion des Territoires, Ministère de la Mer - Direction Interdépartementale des Routes Sud-Ouest",43.5959710776,1.43229743595,NC,79.38963729088053,43.0767299785,1.92470146001,102020
2020e39YGWqjMN00,Marché,Services,Services d'installation de matériel électrique,27/10/2020,28176.0,Révisable,Mairie de Brioude,45.2960757491,3.38503924808,ETI,62.05970766113219,45.7859001722,3.11559551839,102020
20190zVFI5_rO-00,Marché,Travaux,Travaux de façade,21/10/2020,2818991.0,Ferme,GIE GRAND PARIS HABITAT,48.8282706469,2.362358986,PME,22.679095811330996,48.6784059712,2.22329218787,102020
2019_Tno8j0yC400,Marché,Travaux,Travaux de construction d'immeubles collectifs et de maisons individuelles,23/10/2020,2818991.0,Ferme,GIE GRAND PARIS HABITAT,48.8282706469,2.362358986,PME,22.679095811330996,48.6784059712,2.22329218787,102020
2020F0257MPAOC00,Marché,Fournitures,Pneus pour charges légères et lourdes,28/10/2020,282558.71,Révisable,SM EAUX ASSAINISSEMENT ALSACE MOSELLE,48.6117085666,7.74585158102,GE,559.2312932684563,49.3671245751,2.74577447993,102020
20202020S2182000,Marché,Services,"Recherche, surveillance et réhabilitation de la pollution",15/10/2020,28285.0,Ferme,Agence De l'Environnement et de la Maitrise de l'Energie,47.4766284713,-0.556089456786,GE,239.57827063122454,49.4853046112,0.2218691706,102020
2019RKnY-s_Ns400,Marché,Travaux,Travaux de restructuration,27/10/2020,28289.5,Ferme,Commune d'Ezanville,49.0385997432,2.36297947386,PME,19.672069118229466,48.9691551178,2.19936288395,102020
2019ITEypV6DMX00,Marché,Services,Services d'installation de matériel de laboratoire,13/10/2020,283052.67,Ferme,Institut des maladies génétiques Imagine,48.840040811,2.29268840406,PME,47.57981637185569,48.830615363,2.72287301087,102020
2020zLzDqRgmBd00,Marché,Travaux,Travaux de démolition,26/10/2020,28327.18,Ferme,Centre Hospitalier Avranches Granville,48.8327939183,-1.5661139044,PME,24.53075834528827,48.6999446657,-1.38908103782,102020
20202020S1740100,Marché,Services,Services sylvicoles,05/10/2020,28337.0,Ferme,Ministère de l'agriculture et de l'alimentation - Direction territoriale Centre Ouest Aquitaine,47.9321365141,2.01838531803,NC,567.7390847598356,44.0201119949,-1.27654719765,102020
20202020S1613500,Marché,Services,Services d'assurance responsabilité civile,15/10/2020,28340.0,Révisable,"Etablissements et organismes de l'enseignement supérieur, de la recherche et de l'innovation - UNIVERSITE DE POITIERS",46.5834165499,0.359436087058,NC,342.16846928611074,48.9296428406,2.35946866986,102020
20202020M06500,Marché,Travaux,Travaux d'assainissement,09/10/2020,283413.9,Ferme,SILA,45.8900209706,6.12570413482,PME,17.779879332459245,45.7585872509,6.03329201547,102020
20202020F2055000,Marché,Fournitures,Systèmes de positionnement à capacité globale (GPS ou équivalent),27/10/2020,28360.0,Ferme,"Etablissements et organismes de l'enseignement supérieur, de la recherche et de l'innovation - UNIVERSITE DE REIMS CHAMPAGNE-ARDENNE",49.2517771432,4.03968745396,NC,213.82451035783876,48.7002680837,2.18715224978,102020
2020jC9Yqa93x600,Marché,Fournitures,Équipements de protection,27/10/2020,28400.0,Révisable,DLMG,48.8491121687,2.33284677548,PME,19.107587196147325,48.7732937592,2.48790854128,102020
20202020F2314400,Marché,Fournitures,Systèmes d'enregistrement et appareils d'exploration,29/10/2020,28404.03,Ferme,"Etablissements et organismes de l'enseignement supérieur, de la recherche et de l'innovation - UNIVERSITE CLERMONT AUVERGNE",45.7859001722,3.11559551839,PME,314.68261583707465,48.5219457322,2.38801518861,102020
2020151028818100,Marché,Fournitures,Livres de bibliothèque,09/10/2020,2843.6,Ferme,"Ministère de l'éducation nationale et de la jeunesse et Ministère de l'enseignement supérieur, de la recherche et de l'innovation - Rectorat Académie AIX - MARSEILLE",43.5360639608,5.39837823449,PME,68.94611745098219,44.0592303477,5.06125312911,102020
2020151028818400,Marché,Fournitures,Livres de bibliothèque,16/10/2020,2843.6,Ferme,"Ministère de l'éducation nationale et de la jeunesse et Ministère de l'enseignement supérieur, de la recherche et de l'innovation - Rectorat Académie AIX - MARSEILLE",43.5360639608,5.39837823449,PME,204.3176757192212,43.7123384529,7.23750191149,102020
2020151028826200,Marché,Fournitures,Livres de bibliothèque,09/10/2020,2843.6,Ferme,"Ministère de l'éducation nationale et de la jeunesse et Ministère de l'enseignement supérieur, de la recherche et de l'innovation - Rectorat Académie AIX - MARSEILLE",43.5360639608,5.39837823449,PME,166.01001947636587,44.5805398611,6.47535715478,102020
2020151032045500,Marché,Fournitures,Livres de bibliothèque,21/10/2020,2843.6,Ferme,"Ministère de l'éducation nationale et de la jeunesse et Ministère de l'enseignement supérieur, de la recherche et de l'innovation - Rectorat Académie AIX - MARSEILLE",43.5360639608,5.39837823449,PME,76.51887572215571,43.3993323129,6.07663333823,102020
2020151029105900,Marché,Fournitures,Livres de bibliothèque,19/10/2020,2843.6,Ferme,"Ministère de l'éducation nationale et de la jeunesse et Ministère de l'enseignement supérieur, de la recherche et de l'innovation - Rectorat Académie AIX - MARSEILLE",43.5360639608,5.39837823449,PME,38.04971550732704,43.8792387371,5.38850102897,102020
2019kXEzLYLHIx00,Marché,Fournitures,Fournitures pour l'angioplastie,16/10/2020,28436.0,Ferme,Centre Hospitalier de Beauvais,49.4363296139,2.08715087996,NC,,,,102020
20201400010007,Marché,Services,Services de centres de vacances,02/10/2020,2844039.96,Révisable,VILLE DE PARIS BUDGET PRINCIPAL,48.8542874923,2.35759608215,PME,3.360590558540868,48.8769868607,2.33753841595,102020
20202020T05411,Marché,Travaux,"Travaux d'installation de clôtures, de garde-corps et de dispositifs de sécurité",09/10/2020,284425.5,Ferme et actualisable,VILLE DE PARIS BUDGET PRINCIPAL,48.8542874923,2.35759608215,PME,573.5765083711525,48.4099230329,-2.81030555475,102020
2020ZxGMlylPaE00,Marché,Fournitures,Aménagements intérieurs de bâtiment,09/10/2020,2847346.0,Ferme et actualisable,GIE GRAND PARIS HABITAT,48.8282706469,2.362358986,PME,12.670192303853156,48.8511697506,2.47460350341,102020
20212021003L1000,Marché,Fournitures,Aliments en conserve,23/10/2020,285000.0,Révisable,CCAS DE CAGNES MER,43.671853349,7.1522919117,NC,255.02706925884627,43.9686088405,4.86537589634,102020
2020BATLO0007103,Marché,Travaux,Travaux de restructuration,05/10/2020,285000.0,Révisable,Budget principal,46.5622744929,3.32725048972,PME,57.32072362994904,46.0657049463,3.46754924549,102020
20204300,Marché,Travaux,Travaux d'assainissement,16/10/2020,285029.0,Ferme et actualisable,COMMUNAUTE DE COMMUNES SEZANNE SUD OUE,48.5875507068,3.81757319173,PME,361.68752866336337,47.4298130146,0.760935742418,102020
2020CkXoSi8ISd00,Marché,Travaux,Travaux de construction,22/10/2020,2852.0,Ferme,SAS SAINTE BARBE,49.152566268,6.79805595789,PME,6.188307719393339,49.1436321125,6.85329607509,102020
2020jcucQbkvBJ00,Marché,Services,Réalisation et entretien d'espaces verts,12/10/2020,28522.74,Révisable,Le Toit Vosgien,48.2968400138,6.93787860009,PME,12.389957453862284,48.1847531056,6.94046120936,102020
2020DV8geIvTge00,Marché,Fournitures,Aménagements intérieurs de bâtiment,14/10/2020,28575.0,Ferme,Mairie de Fos sur Mer,43.4556743263,4.90422543761,PME,0.0,43.4556743263,4.90422543761,102020
2019kVlILB4m9H00,Marché,Travaux,Travaux de peinture,19/10/2020,28611.27,Ferme,Territoire Habitat 90,47.6463850599,6.84549855352,PME,0.0,47.6463850599,6.84549855352,102020
20202020F1510000,Marché,Fournitures,"Matériels médicaux, pharmaceutiques et produits de soins personnnels",01/10/2020,28619.0,Révisable,CHD VENDEE,46.6676055556,-1.4078581699,PME,812.959316007817,43.8792387371,5.38850102897,102020
20202021F0860300,Marché,Services,Serveurs informatiques,20/10/2020,28622.0,Ferme,Ministère des armées - Musée national de la Marine,48.8604673342,2.26190318372,GE,6.240547641099644,48.8426287239,2.20839539221,102020
2020Ft4dPp1wAk00,Marché,Services,Services de réparation et d'entretien de pompes,23/10/2020,28630.92,Ferme et actualisable,Mairie de Maisons-Alfort,48.8060849119,2.43798340413,PME,45.929180976081376,48.8961839233,2.03262969592,102020
2020SOXBRf7ndI00,Marché,Travaux,Travaux de construction,21/10/2020,286839.68,Ferme et actualisable,SEMDAS,46.1619512738,-1.1749922971,NC,159.51428163921466,45.7167180504,0.19621019901,102020
2020bJpatF4KBM00,Marché,Travaux,Travaux de peinture,29/10/2020,28684.4,Ferme,Cellule Marchés,48.8282706469,2.362358986,ETI,31.776472909886344,48.6918752913,2.61487236964,102020
2019Zftwc05Fwd00,Marché,Services,Services d'assurance,29/10/2020,2869.0,Ferme,GIP SAMUSOCIAL DE PARIS,48.8123578699,2.3878497256,ETI,438.43855429232786,45.7338821165,4.86899471975,102020
20202020F1764300,Marché,Fournitures,Réactifs de groupage sanguin,29/10/2020,2870.0,Révisable,Ministères sociaux,43.2924013477,5.39786536432,PME,677.9878384221711,49.2517771432,4.03968745396,102020
2019QjWiphlCj000,Marché,Travaux,Travaux de peinture,22/10/2020,28703.27,Ferme et actualisable,MANCHE HABITAT,49.1097135871,-1.07754504719,PME,83.25004776342196,49.598373813,-1.64759438929,102020
20202020S0597600,Marché,Services,"Études de faisabilité, service de conseil, analyse",01/10/2020,28725.0,Révisable,Etablissement public territorial Plaine Commune,48.9296428406,2.35946866986,NC,6.338921244792913,48.8769868607,2.33753841595,102020
20202020S1675600,Marché,Services,Logiciels et systèmes d'information,09/10/2020,288000.0,Révisable,ASSISTANCE PUBLIQUE DES HOPITAUX DE MARSEILLE,43.2924013477,5.39786536432,PME,27.004962005125854,43.5360639608,5.39837823449,102020
2020vZpbyI60gC00,Marché,Services,Services d'analyses de sang,06/10/2020,288856.0,Révisable,CENTRE HOSPITALIER DE MACON,46.320613267,4.81834086547,PME,87.17873211052934,46.0450564645,4.08007309055,102020
2020nCDQMfm5rU00,Marché,Travaux,Remise en état de bâtiments dégradés,21/10/2020,288942.0,Révisable,Communauté d'agglomération du Val de Fensch,49.3315592832,6.06608414569,NC,21.708043965613854,49.1984374198,6.21023696167,102020
20202020S1562800,Marché,Services,"Services de technologies de l'information, conseil, développement de logiciels, internet et appui",08/10/2020,28900.0,Ferme,CHU ROUEN,49.4415068863,1.09373273216,PME,0.0,49.4415068863,1.09373273216,102020
20202020S1726900,Marché,Services,Services de gestion de projets autres que pour les travaux de construction,19/10/2020,28950.0,Ferme,"Ministère de l'immigration, de l'intégration, de l'asile et du développement solidaire - OFFICE FRANCAIS DE L'IMMIGRATION ET DE L'INTEGRATION",48.840040811,2.29268840406,PME,0.0,48.840040811,2.29268840406,102020
2020DvyPZgKyLr00,Marché,Fournitures,Produits alimentaires divers,14/10/2020,289738.0,Révisable,GROUPEMENT DE COOPERATION SANITAIRE GROUPEMENT REGIONAL D'ACHATS MULTI SEGMENTS  - GCS GRAM,49.4363296139,2.08715087996,GE,281.289611106121,47.8934713822,0.0722391016482,102020
20180143cc200100,Marché,Services,Services de réparation et d'entretien de matériel de restauration,20/10/2020,29.5,Ferme,Commune VIERZON,47.2370821272,2.07892537933,PME,28.825076379307987,47.1698787883,2.33068767079,102020
20202020S1634100,Marché,Services,Services de prestations,08/10/2020,29000.0,Ferme,"Ministère de la Transition Écologique, Ministère de la Cohésion des Territoires, Ministère de la Mer - Direction territoriale Bassin de la Seine",48.8282706469,2.362358986,PME,467.4525864043318,47.2321613301,-1.54797539458,102020
2019gQ-bgthzqV00,Marché,Fournitures,Colis alimentaires,07/10/2020,29000.0,Ferme,Mairie de Mons en Baroeul,50.6427234653,3.10704546553,PME,679.1410958818576,44.8094514328,1.29333984213,102020
2020WWxyqyT69I00,Marché,Travaux,Travaux de construction de centres de secours des sapeurs-pompiers,02/10/2020,29000.0,Révisable,SDIS 08 Ardennes,49.7485363282,4.68592124661,PME,15.323716889223968,49.7318604246,4.82348111909,102020
2020130015837700,Marché,Services,Services de réparation et d'entretien du matériel de sécurité,15/10/2020,290000.0,Révisable,Ministère des armées - Etablissement du service d'infrastructure de la défense de Lyon - ESID Lyon,,,NC,,43.2883854261,5.48366970686,102020
20202020S0710300,Marché,Services,Services d'architecture,16/10/2020,290000.0,Ferme,SOLIDEO - Société de livraison des ouvrages olympiques,48.8769868607,2.33753841595,PME,0.0,48.8769868607,2.33753841595,102020
2020151033456100,Marché,Travaux,Travaux de parachèvement de bâtiment,27/10/2020,29034.52,Ferme,Ministère de la Justice  - Direction interrégionale des services pénitentiaires de Strasbourg,48.5716343863,7.76783353204,PME,158.17964028943334,48.17389065,6.3938167808,102020
2020D9_HMRXynS00,Marché,Travaux,Travaux de construction,08/10/2020,29037.56,Ferme et actualisable,Commune VIERZON,47.2370821272,2.07892537933,PME,0.0,47.2370821272,2.07892537933,102020
20202020 Lot502,Marché,Travaux,Travaux de couverture,19/10/2020,290785.38,Ferme et actualisable,COMMUNAUTE DE COMMUNES CAYRES PR,44.892146662,3.84238188091,PME,30.773760865993196,45.0778013219,4.04897834341,102020
20202020F1710200,Marché,Fournitures,Équipement audiovisuel,20/10/2020,29090.68,Ferme,"Etablissements et organismes de l'enseignement supérieur, de la recherche et de l'innovation - UNIVERSITE DE PAU ET DU PAYS DE L'ADOUR",43.3201640732,-0.3496692279,NC,130.32756981606605,43.491201999,-1.51566656435,102020
2020wsBEfYODdu00,Marché,Services,"Services d'architecture, services de construction, services d'ingénierie et services d'inspection",05/10/2020,29095.0,Révisable,Tours Métropole Val de Loire,47.3980773574,0.696151819266,NC,232.46936776730215,48.7498603402,2.29906093692,102020
2020151024111300,Marché,Services,Services de conseil en protection et contrôle en matière d'incendie et d'explosion,30/10/2020,2910.0,Ferme et actualisable,Ministère des armées - Etablissement du service d'infrastructure de la défense de Metz - ESID Metz,,,PME,,48.5145891605,-2.7620558547,102020
2020110005154000,Marché,Fournitures,Panneaux indicateurs à messages variables,01/10/2020,291005.0,Révisable,"Ministère de la Transition Écologique, Ministère de la Cohésion des Territoires, Ministère de la Mer - Direction Interdépartementale des Routes Massif Central",45.7859001722,3.11559551839,NC,501.6192021416577,43.7848826685,7.18412298071,102020
20201060000593,Marché,Services,Services de conception de mobilier,09/10/2020,29104.0,Ferme,VILLE DE PARIS BUDGET PRINCIPAL,48.8542874923,2.35759608215,PME,8.133908569425216,48.7987242503,2.30977129909,102020
20202020T1546200,Marché,Travaux,Travaux de menuiserie,05/10/2020,29117.47,Ferme,Chambres de Commerce et d'Industrie,49.4415068863,1.09373273216,PME,10.666171625282754,49.3476730731,1.07413309601,102020
2020SkV-GdlL4l00,Marché,Services,Services de réparation et d'entretien d'installations mécaniques de bâtiment,29/10/2020,2915027.76,Ferme,3F-DGRDI EES,48.8282706469,2.362358986,NC,11.279714859560194,48.9296428406,2.35946866986,102020
20202020TROP0900,Marché,Travaux,Entretien des routes nationales,06/10/2020,2915199.84,Ferme,VILLE CAPESTERRE B-EAU,16.0551130044,-61.6118604364,PME,0.0,16.0551130044,-61.6118604364,102020
202010602,Marché,Travaux,Travaux de menuiserie et de charpenterie,21/10/2020,291608.46,Ferme,COMMUNE DE WISSOUS,48.729938105,2.32968167157,PME,12.786939447399135,48.6458423553,2.40853022618,102020
20202021S0117700,Marché,Services,Services de promotion,05/10/2020,29166.67,Ferme,Conseil Régional d'Ile-de-France,48.8562037309,2.3121193117,PME,0.0,48.8562037309,2.3121193117,102020
20202020F1519600,Marché,Fournitures,Matériel biomédical,01/10/2020,29200.02,Révisable,CHRU CAEN,49.1850685346,-0.370026383608,PME,813.580878710913,45.2214311039,5.81565516978,102020
20201400010012,Marché,Services,Services de centres de vacances,09/10/2020,2920039.96,Révisable,VILLE DE PARIS BUDGET PRINCIPAL,48.8542874923,2.35759608215,PME,481.0077790187246,44.9069320963,4.14152584606,102020
20202020T0005500,Marché,Travaux,"Travaux d'installation de matériel de chauffage, de ventilation et de climatisation",16/10/2020,29240.98,Ferme et actualisable,Commune de Chalon-sur-Saône,46.7898307141,4.85243666689,NC,,,,102020
2020x0TaCerYRY00,Marché,Services,Services d'architecte pour les bâtiments,13/10/2020,29250.0,Révisable,HABITAT 08,49.7750868481,4.71731702738,NC,94.80944305692913,49.2517771432,4.03968745396,102020
2020151027888200,Marché,Services,,05/10/2020,29276.14,Ferme et actualisable,Ministère de la Culture - Direction Régionale des Affaires Culturelles Nouvelle-Aquitaine,44.8578964782,-0.57357535767,NC,135.70155970882743,45.1606431064,0.615219732363,102020
202014/AOO00,Marché,Travaux,Travaux de cloisonnement,20/10/2020,292915.34,Ferme et actualisable,MAIRIE D'ORCIERES,44.6838344792,6.34871056074,NC,15.617750960557915,44.5431823447,6.33680098892,102020
2020TVXPENTES02,Marché,Travaux,Travaux de revêtement de routes,12/10/2020,292958.4,Ferme et actualisable,BREHAL,48.8971511325,-1.53067522665,ETI,30.109579746847363,48.6889710585,-1.35674833511,102020
2020Dus7uR1ThX00,Marché,Fournitures,Produits alimentaires divers,14/10/2020,293120.0,Révisable,GROUPEMENT DE COOPERATION SANITAIRE GROUPEMENT REGIONAL D'ACHATS MULTI SEGMENTS  - GCS GRAM,49.4363296139,2.08715087996,NC,117.9825943517144,49.9098497986,1.13247782686,102020
20202020T0600500,Marché,Travaux,Installation de structures en métal,02/10/2020,293619.0,Ferme et actualisable,Ville de Neuilly-sur-Seine,48.8855642403,2.26624582625,NC,,,,102020
