2020170010185100,Marché,Services,Services d'enseignement et de formation,17/08/2020,50000.0,Révisable,Ministère de la Justice  - Mission Achat,48.8625262113,2.33630086089,PME,3.0904753957638476,48.8760781984,2.36069992794,082020
2020M140100,Marché,Fournitures,"Pièces de rechanges pour poids lourds, camionnettes et automobiles",05/08/2020,50000.0,Révisable,14 Ville 2020,45.7041579754,4.88121408321,GE,0.0,45.7041579754,4.88121408321,082020
2020170010202000,Marché,Fournitures,Matériel informatique,10/08/2020,50000.0,Révisable,"Ministère de la Transition Écologique et Solidaire, Ministère de la Cohésion des Territoires - Secrétariat Général",48.8836186061,2.23810959636,PME,36.53402015958602,48.8360445933,2.56502268278,082020
2019id1ZoqRZaQ00,Marché,Services,Services de formation professionnelle,24/08/2020,50000.0,Ferme,OPCO MOBILITES,48.8365394869,2.2389245247,ETI,9.398203232102167,48.8873739998,2.30681348993,082020
2019rhenG6fhaO00,Marché,Services,Services de formation professionnelle,24/08/2020,50000.0,Ferme,OPCO MOBILITES,48.8365394869,2.2389245247,ETI,9.398203232102167,48.8873739998,2.30681348993,082020
2020120100,Marché,Fournitures,Cartes pour l'achat de carburant,27/08/2020,50000.0,Révisable,MAIRIE DE RIOM,45.8941119385,3.1326472398,PME,341.6103044162968,48.8625262113,2.33630086089,082020
20202020S0535900,Marché,Services,Services liés aux déchets et aux ordures,27/08/2020,50000.0,Révisable,Etablissement public territorial Plaine Commune,48.9296428406,2.35946866986,PME,15.83526018914253,48.8231210367,2.26445901319,082020
2020L2439A00,Marché,Services,Services d'impression,04/08/2020,50000.0,Révisable,Ville de Lyon,45.7700265344,4.82839245881,PME,387.61563617522535,45.8410253867,1.32375368922,082020
2019fk-B1A95N900,Marché,Services,Services de formation professionnelle,24/08/2020,50000.0,Ferme,OPCO MOBILITES,48.8365394869,2.2389245247,ETI,189.30717655371114,50.4372553549,2.82129881832,082020
20194vJn9L8msk00,Marché,Services,Services d'enseignement supérieur,24/08/2020,50000.0,Ferme,OPCO MOBILITES,48.8365394869,2.2389245247,NC,355.67722880435207,47.2856858419,5.05293981105,082020
2019LIlIljKPJC00,Marché,Services,Services d'enseignement et de formation,24/08/2020,50000.0,Ferme,OPCO MOBILITES,48.8365394869,2.2389245247,ETI,9.398203232102167,48.8873739998,2.30681348993,082020
2019zmoz8p6lDQ00,Marché,Services,Services d'enseignement et de formation,24/08/2020,50000.0,Ferme,OPCO MOBILITES,48.8365394869,2.2389245247,ETI,9.745001449779556,48.8292048923,2.3267445538,082020
2019Ee8TYfgWmJ00,Marché,Services,Services d'enseignement supérieur,24/08/2020,50000.0,Ferme,OPCO MOBILITES,48.8365394869,2.2389245247,NC,14.165443475297856,48.8760781984,2.36069992794,082020
2019EtGJExWmUf00,Marché,Services,Services de conseil et d'évaluation,17/08/2020,50000.0,Révisable,SDIS 87 Haute Vienne,45.8544262114,1.24894834225,PME,390.0127288912097,47.7339143764,-1.72786179572,082020
2019H7L0OA7XCL00,Marché,Services,Services de conception graphique,17/08/2020,50000.0,Révisable,Commune de Bougival,48.8636644704,2.13752713445,PME,13.757592661556966,48.8604673342,2.26190318372,082020
2019193101A101,Marché,Fournitures,Produits de nettoyage et produits à polir,07/08/2020,50000.0,Ferme,VILLE DE BERRE L ETANG,43.5037365336,5.16075006144,PME,80.99379324769573,43.2775902275,5.85722907785,082020
2019goGDzPht6300,Marché,Services,Services de formation professionnelle,24/08/2020,50000.0,Ferme,OPCO MOBILITES,48.8365394869,2.2389245247,ETI,9.398203232102167,48.8873739998,2.30681348993,082020
20197wo5FwPryo00,Marché,Services,Services de formation professionnelle,24/08/2020,50000.0,Ferme,OPCO MOBILITES,48.8365394869,2.2389245247,ETI,9.398203232102167,48.8873739998,2.30681348993,082020
2019-uO-aUHgw_00,Marché,Services,Services de formation professionnelle,24/08/2020,50000.0,Ferme,OPCO MOBILITES,48.8365394869,2.2389245247,ETI,189.30717655371114,50.4372553549,2.82129881832,082020
2020bNEjq5vZlr00,Marché,Fournitures,Clés,06/08/2020,50000.0,Révisable,Mairie de Herblay,49.0006773606,2.14983544498,NC,30.056186652338216,48.7501956584,2.25176088201,082020
2020TX00100,Marché,Travaux,Travaux de marquage routier,26/08/2020,50000.0,Révisable,COMMUNAUTE COMMUNES DU SEIGNANX,43.5325506298,-1.38817136141,NC,11.624551644014117,43.6343096826,-1.36444071077,082020
2019rF74nPAlQc00,Marché,Services,Services de formation professionnelle,24/08/2020,50000.0,Ferme,OPCO MOBILITES,48.8365394869,2.2389245247,ETI,9.398203232102167,48.8873739998,2.30681348993,082020
20202tFGK6p-9O00,Marché,Travaux,Travaux d'installation d'ascenseurs,03/08/2020,50000.0,Ferme,Mairie de Choisy Le Roi,48.7647201734,2.4168982905,ETI,18.688699341024815,48.5968549847,2.424435968,082020
2019JnBuhs4lT000,Marché,Services,Services de formation professionnelle,24/08/2020,50000.0,Ferme,OPCO MOBILITES,48.8365394869,2.2389245247,ETI,9.398203232102167,48.8873739998,2.30681348993,082020
2019_S2-8WmZFC00,Marché,Services,Services de formation professionnelle,24/08/2020,50000.0,Ferme,OPCO MOBILITES,48.8365394869,2.2389245247,ETI,9.398203232102167,48.8873739998,2.30681348993,082020
2020vwxotRSBCF00,Marché,Fournitures,Matériaux de bâtiment,10/08/2020,50000.0,Révisable,SEM PAYS DE MEAUX HABITAT,48.9569889049,2.89982507271,GE,65.9490210358592,48.9038810507,2.30581093912,082020
2020vAiplD60QK00,Marché,Services,Services de formation professionnelle,24/08/2020,50000.0,Ferme,OPCO MOBILITES,48.8365394869,2.2389245247,PME,466.37136028401926,46.7762050023,-1.43372348586,082020
2019SuBYM8DQwp00,Marché,Services,Services de formation professionnelle,24/08/2020,50000.0,Ferme,OPCO MOBILITES,48.8365394869,2.2389245247,ETI,9.398203232102167,48.8873739998,2.30681348993,082020
202020000430100,Marché,Services,Services de compostage,28/08/2020,50000.0,Ferme et actualisable,COMMUNAUTE PARIS SACLAY,48.7002680837,2.18715224978,ETI,451.9383211413301,45.7016140067,4.94900275462,082020
20202020S1253500,Marché,Services,Services de réparation et d'entretien,19/08/2020,50000.0,Révisable,CHR ORLEANS,47.8824665066,1.91660961834,NC,521.4424031318097,43.6131750772,3.86941278925,082020
2019UAVf8dinlM00,Marché,Services,Services de formation professionnelle,24/08/2020,50000.0,Ferme,OPCO MOBILITES,48.8365394869,2.2389245247,ETI,9.398203232102167,48.8873739998,2.30681348993,082020
2020pWKYOOWPRB00,Marché,Services,Services de réalisation d'enquêtes,26/08/2020,50000.0,Révisable,OISE HABITAT,49.2530176025,2.48395578599,PME,42.82941037069919,48.8924795867,2.34788399022,082020
2019nGUtLbfvcr00,Marché,Services,Services de formation professionnelle,24/08/2020,50000.0,Ferme,OPCO MOBILITES,48.8365394869,2.2389245247,ETI,9.398203232102167,48.8873739998,2.30681348993,082020
2019rgYI-eeJuH00,Marché,Services,Services d'enseignement supérieur,24/08/2020,50000.0,Ferme,OPCO MOBILITES,48.8365394869,2.2389245247,ETI,9.398203232102167,48.8873739998,2.30681348993,082020
2020mIfEvNWeoQ00,Marché,Services,Services d'appui dans le domaine des transports routiers,12/08/2020,500000.0,Révisable,DEL - Direction de l éducation et des lycées,45.7480493184,4.82567584415,ETI,439.918278190561,48.8292048923,2.3267445538,082020
2020170010216100,Marché,Services,Services de crèches et garderies d'enfants,13/08/2020,500000.0,Ferme,Ministère de l'Intérieur - Grand Est,48.5716343863,7.76783353204,ETI,377.29008307300285,48.9641633923,4.37882582203,082020
2020J2n6wJ2dxH00,Marché,Services,Services d'appui dans le domaine des transports routiers,12/08/2020,500000.0,Révisable,DEL - Direction de l éducation et des lycées,45.7480493184,4.82567584415,GE,434.59050492903003,48.8631652232,2.4482059517,082020
2020BUfYnW5bYF00,Marché,Travaux,"Travaux de construction, de fondation et de revêtement d'autoroutes, de routes",04/08/2020,500000.0,Révisable,Mairie de Labégude,44.6420384166,4.35699083982,NC,5.541625815266338,44.6103105442,4.39568379495,082020
20202020S1236700,Marché,Services,Services de réparation et d'entretien,18/08/2020,500000.0,Révisable,CHRU MONTPELLIER,43.6131750772,3.86941278925,GE,596.792956456887,48.7498603402,2.29906093692,082020
2019M0801,Marché,Travaux,Travaux de débroussaillage,20/08/2020,500000.0,Ferme,EXERCICE BUDGETAIRE ASSAINISSE,43.5360639608,5.39837823449,PME,12.935763427750985,43.4527920234,5.48035081509,082020
20202020F1182100,Marché,Fournitures,Instruments de mesure de grandeurs électriques,27/08/2020,500000.0,,Ministère des armées - Direction Interarmées des Réseaux d'Infrastructure et des Systèmes d' Information - Toulon,,,PME,,48.6811729227,2.1853558178,082020
20202020F1181900,Marché,Fournitures,Instruments de mesure de grandeurs électriques,31/08/2020,500000.0,,Ministère des armées - Direction Interarmées des Réseaux d'Infrastructure et des Systèmes d' Information - Toulon,,,GE,,48.8152248222,2.31722185184,082020
202020PB070100,Marché,Travaux,Travaux de construction complète ou partielle et travaux de génie civil,25/08/2020,500000.0,Révisable,VILLE DE GRIGNY,45.6083483392,4.78678285072,NC,26.605903932908998,45.820656077,4.8987353728,082020
20202000003500,Marché,Fournitures,"Barres, tiges, fils et profilés pour la construction",13/08/2020,500000.0,Révisable,Ville de Nimes,43.8445331544,4.34760475323,NC,0.0,43.8445331544,4.34760475323,082020
20202020S1241700,Marché,Travaux,Travaux d'équipement du bâtiment,07/08/2020,500000.0,Révisable,"Ministère de la Transition Écologique et Solidaire, Ministère de la Cohésion des Territoires - Météo France",48.8410208466,2.41853928643,PME,593.644174610393,43.5959710776,1.43229743595,082020
2020170010215100,Marché,Services,Services de crèches et garderies d'enfants,12/08/2020,500000.0,Ferme,Ministère de l'Intérieur - Grand Est,48.5716343863,7.76783353204,ETI,605.1322596627937,48.9038810507,2.30581093912,082020
20202020F1181700,Marché,Fournitures,Instruments de mesure de grandeurs électriques,28/08/2020,500000.0,,Ministère des armées - Direction Interarmées des Réseaux d'Infrastructure et des Systèmes d' Information - Toulon,,,ETI,,48.8039815916,2.22696813508,082020
20202020S0710000,Marché,Services,Études techniques,05/08/2020,500000.0,Révisable,CD77 - Conseil départemental de Seine-et-Marne,48.5447982823,2.65777855027,PME,235.9915780984272,50.6317671102,3.04699299406,082020
2019zwxAbaEr4Z00,Marché,Services,Mise en état d'exploitation d'installations de chauffage,21/08/2020,500000.0,Ferme et actualisable,VILLE DE VERNOUILLET,,,GE,,49.4965847516,0.140273146733,082020
20202020S1219800,Marché,Services,Services de désinfection et de désinfestation,17/08/2020,5000000.0,,Ministère des armées - Direction du service de soutien de la flotte de Toulon - DSSF Toulon,,,PME,,45.4301960415,4.37808697748,082020
20202020S1220000,Marché,Services,Services de désinfection et de désinfestation,14/08/2020,5000000.0,,Ministère des armées - Direction du service de soutien de la flotte de Toulon - DSSF Toulon,,,GE,,47.5360825822,6.89438387385,082020
20202020T1351600,Marché,Travaux,Travaux de resurfaçage de chaussées,06/08/2020,5000000.0,Révisable,Chambres de Commerce et d'Industrie,41.9349194014,8.70135284615,PME,14.992619962404639,41.9357121396,8.83690758694,082020
2020cy158iqEWz00,Marché,Travaux,Travaux routiers,17/08/2020,5000000.0,Révisable,Commune de Bougival,48.8636644704,2.13752713445,GE,9.602922808729108,48.9412040612,2.09935987202,082020
2020cB9HGhMfeq00,Marché,Fournitures,Système de surveillance vidéo,26/08/2020,5000000.0,Révisable,Ville de Saint-Louis,47.6022882653,7.54028126665,NC,34.11786779944307,47.8107034161,7.31248086177,082020
2019yqKdScEG_l00,Marché,Services,Services d'assistance technique,14/08/2020,50017.5,Ferme,Institut des maladies génétiques Imagine,48.840040811,2.29268840406,PME,7.814348399098434,48.8282706469,2.362358986,082020
2018201810-L1200,Marché,Travaux,,17/08/2020,50018.96,Révisable,COM COM Pays du Mont-Blanc BUDGET PRIN,45.9539749422,6.73985281708,PME,31.145982942147775,46.1454516495,6.53330225799,082020
2019qiqwIG93iC00,Marché,Fournitures,Fournitures orthopédiques,11/08/2020,5005.0,Ferme et actualisable,Centre hospitalier de Boulogne sur mer Service Economique,50.7270459478,1.60607177999,ETI,217.4920847143602,48.8855642403,2.26624582625,082020
2020100014741500,Marché,Fournitures,Pièces pour autres véhicules,19/08/2020,5009.33,Ferme,Ministère des armées - Structure Spécialisée d'achat et de Mandatement 33 504,,,ETI,,46.5326117026,-0.22941034612,082020
2020L238001,Marché,Travaux,Travaux de menuiserie,17/08/2020,50185.81,Révisable,Ville de Lyon,45.7700265344,4.82839245881,PME,24.34988729100668,45.9784721326,4.75938953528,082020
20202020T1511900,Marché,Travaux,Travaux de façade,03/08/2020,50217.25,Ferme et actualisable,"Ministère de la Transition Écologique, Ministère de la Cohésion des Territoires, Ministère de la Mer - VOIES NAVIGABLES DE FRANCE",45.7566434898,4.80314551427,PME,14.052638736262493,45.7860240236,4.92675965549,082020
2019M0y196PoNi00,Marché,Travaux,Travaux de construction d'immeubles collectifs,21/08/2020,502287.25,Ferme,Société OZANAM,14.6460950766,-61.100358959,NC,15.257536053287229,14.5778958668,-60.9674898168,082020
2020AcOa45KWVx00,Marché,Services,Services de conception de sites WWW (World Wide Web),18/08/2020,50256.0,Révisable,UEM METZ,49.1081027833,6.19595351042,PME,183.66428917004865,48.5716343863,7.76783353204,082020
2019bPo3jBCozO00,Marché,Services,Services de réseaux informatiques,25/08/2020,503328.0,Révisable,Informatique ICDC,48.8053725236,2.33400842575,GE,14.105979434414529,48.9296428406,2.35946866986,082020
2019Ruon55ytg900,Marché,Fournitures,Fournitures orthopédiques,11/08/2020,5034.0,Ferme et actualisable,Centre hospitalier de Boulogne sur mer Service Economique,50.7270459478,1.60607177999,ETI,681.4217529608951,47.5277670454,6.8656911608,082020
202020023_100,Marché,Fournitures,Chocolat,28/08/2020,50400.0,Ferme,COMMUNE DE CARCASSONNE,43.2093616677,2.34379884342,PME,444.720675675537,45.5733895286,5.59018111805,082020
2020151017810700,Marché,Services,Évaluation de l'impact sur l'environnement autre que pour la construction,03/08/2020,50425.0,Ferme,Ministère de l'Intérieur - Centre Val-de-Loire,47.8824665066,1.91660961834,PME,485.2638818252268,43.5390131127,1.52156442051,082020
20202020T1201900,Marché,Travaux,Travaux de cloisonnement,11/08/2020,50427.0,Ferme et actualisable,CHRU NANCY,48.6900671002,6.17594832427,PME,117.99773903817157,48.779706488,5.11270208565,082020
20202020T0519800,Marché,Fournitures,Réseaux,05/08/2020,504279.6,Ferme,Ville de Cergy,49.0400551805,2.05074797264,ETI,28.124163853727687,49.008557005,2.30310904276,082020
202004lot400,Marché,Travaux,Travaux de menuiserie,25/08/2020,50455.8,Ferme et actualisable,VILLE DE NOGENT,48.0373038788,5.3649223305,PME,72.22118708585668,48.6084750752,5.05084879069,082020
2018CAMARGUE0400,Marché,Travaux,Travaux de construction de bâtiments,20/08/2020,5049.66,Ferme et actualisable,UN TOIT POUR TOUS,43.8445331544,4.34760475323,PME,135.27053739602232,43.3475518983,3.23081153874,082020
2019ENxt2BYKbG00,Marché,Fournitures,Fournitures orthopédiques,11/08/2020,5053.0,Ferme et actualisable,Centre hospitalier de Boulogne sur mer Service Economique,50.7270459478,1.60607177999,PME,630.6683765541449,45.9722435435,4.71913168899,082020
20201320010645,Marché,Travaux,Travaux d'installation d'échafaudages,07/08/2020,505497.9,Ferme et actualisable,VILLE DE PARIS BUDGET PRINCIPAL,48.8542874923,2.35759608215,NC,18.15816430950896,48.946227127,2.49329631847,082020
2020FTIC2100,Marché,Services,Services de maintenance et de réparation de logiciels,06/08/2020,50557.5,Ferme,SICTIAM,43.6276961423,7.02943470458,NC,,,,082020
2020AZRWZzHjZX00,Marché,Travaux,Travaux de construction de canalisations d'eaux usées,31/08/2020,505675.0,Révisable,Mairie de Brioude,45.2960757491,3.38503924808,PME,0.0,45.2960757491,3.38503924808,082020
202020A041H03,Marché,Travaux,"Travaux d'installation de matériel de chauffage, de ventilation et de climatisation",21/08/2020,50667.29,Ferme et actualisable,BUDGET PRINCIPAL,48.8039815916,2.22696813508,PME,11.792809171002787,48.7727101883,2.12506457263,082020
201934wCuhvlrd00,Marché,Fournitures,Matériel de sécurité,19/08/2020,50794.0,Révisable,CAF MARSEILLE,43.344864211,5.39338098888,NC,3.710498617307701,43.3595190014,5.36321282428,082020
2018-00100,Marché,Services,,12/08/2020,50869.0,Révisable,COMMUNAUTE DE COMMUNES COTE OUEST CENT,49.2850930851,-1.53851142861,PME,294.4885230813595,49.4744089013,1.11792062882,082020
20202020S1240100,Marché,Fournitures,"Équipements de laboratoire, d'optique et de précision (excepté les lunettes)",18/08/2020,50871.61,Ferme,Institut Français de Recherche pour l’Exploitation de la MER,48.8231210367,2.26445901319,NC,,,,082020
202019A057B01,Marché,Travaux,Travaux de construction d'installations sportives,24/08/2020,508830.19,Ferme,BUDGET PRINCIPAL,48.8039815916,2.22696813508,PME,12.04710817713838,48.695957442,2.23477492911,082020
20191902012L1000,Marché,Travaux,Travaux de plomberie et de pose de conduits d'évacuation,24/08/2020,50895.01,Ferme,COLLECTIVITE DE SAINT-MARTIN,,,PME,,16.2727026732,-61.5016988194,082020
2020GZLQtNzSlV00,Marché,Travaux,Travaux de restructuration,26/08/2020,5097.17,Ferme,Centre Hospitalier Avranches Granville,48.8327939183,-1.5661139044,PME,60.83454078844813,48.572390619,-1.08238535359,082020
202004PERISEL01,Marché,Travaux,Travaux de construction de foyers et de structures d'accueil à caractère social,17/08/2020,50999.9,Ferme,CC PLAINE DU RHIN,48.8546753586,8.09094429393,PME,54.26891438920131,48.5468801922,7.70805573748,082020
202084MO00,Marché,Services,"Services d'architecture, d'ingénierie et de métrage",19/08/2020,51000.0,Ferme,COMMUNAUTE DE COMMUNES DE L ERNEE,48.3039564834,-0.93621225568,PME,29.06021246668099,48.486793455,-1.12382672993,082020
2019ZtXAl2Lh1c00,Marché,Services,Réalisation et entretien d'espaces verts,24/08/2020,51000.0,Révisable,VILLE SAINTES,45.7423034662,-0.649840149818,PME,0.0,45.7423034662,-0.649840149818,082020
20200414174800,Marché,Services,Études techniques,05/08/2020,51000.0,Ferme,BUDGET PRINCIPAL,47.2801589313,-2.25106183059,ETI,0.0,47.2801589313,-2.25106183059,082020
20202020S1243500,Marché,Fournitures,Stands d'exposition,05/08/2020,510000.0,,"Ministère de la Transition Écologique et Solidaire, Ministère de la Cohésion des Territoires - Office Français de la Biodiversité",48.8472864945,2.43799511731,NC,,,,082020
2018wlD4sjjOH700,Marché,Travaux,Travaux de couverture,05/08/2020,51005.0,Ferme,BATIPLAINE,48.9296428406,2.35946866986,PME,22.691198100765835,48.7321607291,2.41097949757,082020
2020000000741500,Marché,Services,Services de transport routier public,04/08/2020,510119.04,Révisable,Région Centre-Val de Loire,47.8824665066,1.91660961834,GE,82.90300829703621,48.462300485,1.44580258966,082020
2020100014747200,Marché,Fournitures,Bouées de marquage,21/08/2020,51030.0,Ferme,"Ministère de la Transition Écologique et Solidaire, Ministère de la Cohésion des Territoires - Direction Interrégionale de la Mer - Nord Atlantique et Manche Ouest",51.030563712,2.33703738753,NC,,,,082020
20202020F1281300,Marché,Fournitures,Produits pharmaceutiques,25/08/2020,511300.0,Révisable,CHRU MONTPELLIER,43.6131750772,3.86941278925,NC,,,,082020
2020170010138500,Marché,Fournitures,Aéronefs sans pilote,03/08/2020,51312.0,Ferme,"Ministère de la Transition Écologique et Solidaire, Ministère de la Cohésion des Territoires - Direction Générale des Infrastructures, des Transports et de la Mer",48.8836186061,2.23810959636,ETI,600.0229542643006,43.5439301138,1.47732357418,082020
2020000100,Marché,Travaux,Travaux de chantier,18/08/2020,51348.0,Ferme,COMMUNE MARVILLE MOUTIERS BRULE,48.6746925298,1.37885106433,PME,9.685075499364233,48.5881280903,1.3698287446,082020
2020L247500,Marché,Services,Services d'architecture,18/08/2020,51349.0,Révisable,Ville de Lyon,45.7700265344,4.82839245881,PME,49.080408265522344,45.4701835364,4.50207645577,082020
2019v_MdLRkrdO00,Marché,Fournitures,Fournitures orthopédiques,11/08/2020,5137.0,Ferme et actualisable,Centre hospitalier de Boulogne sur mer Service Economique,50.7270459478,1.60607177999,ETI,768.4888848331066,45.2214311039,5.81565516978,082020
2019n_gpbzqFjS00,Marché,Travaux,Travaux de resurfaçage de chaussées,13/08/2020,514155.0,Ferme et actualisable,OFFICE PUBLIC DE L'HABITAT de l'AISNE,49.5679878475,3.62136068206,PME,17.48078429326316,49.556415271,3.7790168649,082020
2019gQnungT6Mf00,Marché,Services,Services d'ingénierie,04/08/2020,51459.31,Révisable,Mairie Sucy-en-Brie,48.7656350255,2.53363576939,PME,33.943433157623645,48.695957442,2.23477492911,082020
20202020S1331200,Marché,Services,Services d'études,17/08/2020,51475.0,Ferme,Agence De l'Environnement et de la Maitrise de l'Energie,47.4766284713,-0.556089456786,PME,588.9355602439751,48.2339720063,4.71521262766,082020
2020529100,Marché,Services,Services d'études,26/08/2020,51475.0,Révisable,REGION-BUDGET REGIONAL,-20.9331856391,55.4471055195,ETI,8539.905178237876,48.8983675206,2.25515424076,082020
20202019-015-100,Marché,Services,Étude de faisabilité,26/08/2020,51480.0,Ferme,épad ouest provence,43.5504760835,4.95071072272,PME,44.973285794217205,43.3654982005,5.31265000369,082020
202003407,Marché,Services,Services de transport routier public,07/08/2020,514850.1,Révisable,Réseau Transisère,45.1821782198,5.72099089704,ETI,6.8682259899394795,45.2322012816,5.68429450533,082020
20202B010Trv0100,Marché,Travaux,Travaux de construction de passerelles pour piétons,25/08/2020,514910.0,Ferme et actualisable,Commune de MARIPA-SOULA,2.96743529098,-53.7582580953,PME,201.01644437684678,4.83156937433,-52.3435470866,082020
