2021236510000,Marché,Services,Services d'agences de rédaction,26/02/2021,150000.0,Révisable,Budget principal,48.6293513055,2.44049035394,PME,26.410113121611666,48.8591103086,2.38017728226,022021
20191APpStDTBN00,Marché,Travaux,Travaux de remise en état et de remise à neuf,10/02/2021,150000.0,Révisable,Deux-Sèvres Habitat,46.9826658707,-0.199743223762,PME,55.22857024304084,46.8221166139,-0.67233957083,022021
202013 LOT 100,Marché,Services,Services d'études,15/02/2021,150000.0,Révisable,CABS,50.108437905,1.83210392383,PME,0.0,50.108437905,1.83210392383,022021
202000018700,Marché,Services,Services de conseil en gestion financière,02/02/2021,150000.0,Ferme,BUDGET PRINCIPAL,50.2899236486,2.76642705397,PME,164.94170712645075,48.8628851439,2.35993164253,022021
2020A-mkWQVcg600,Marché,Fournitures,Colis alimentaires,15/02/2021,150000.0,Ferme,Commune de Brunoy - CCAS,48.6962376754,2.5037010956,PME,452.6685013822041,44.8094514328,1.29333984213,022021
2021202021000500,Marché,Services,"Services de technologies de l'information, conseil, développement de logiciels, internet et appui",19/02/2021,150000.0,Révisable,Département de la Vendée,46.6676055556,-1.4078581699,PME,64.70751987197976,47.2321613301,-1.54797539458,022021
2021M048100,Marché,Fournitures,Équipements de protection,09/02/2021,150000.0,Révisable,Toulouse Métropole,43.5959710776,1.43229743595,PME,620.0516197578321,49.0606938423,2.53436931298,022021
2020Anbwt6gkNf00,Marché,Travaux,Travaux de câblage et d'installations électriques,08/02/2021,150000.0,Ferme et actualisable,Mairie Sucy-en-Brie,48.7656350255,2.53363576939,PME,15.781474624676136,48.6779195836,2.42144950536,022021
202120200470000,Marché,Travaux,Travaux de câblage électrique,18/02/2021,150000.0,Révisable,Ville d'Alençon,48.4315335696,0.0917701886296,PME,0.0,48.4315335696,0.0917701886296,022021
2020025600,Marché,Fournitures,Photocopieurs et appareils de thermocopie,01/02/2021,150000.0,Révisable,Région Normandie,49.1850685346,-0.370026383608,NC,247.3800245535041,47.3030353752,-1.56014129347,022021
2021130016274700,Marché,Services,Services de manutention et d'entreposage de cargaisons,22/02/2021,150000.0,Ferme,Ministère de l'Intérieur - de Corse,41.9349194014,8.70135284615,PME,12.007516634399629,41.9839501986,8.79834460109,022021
202120S2801,Marché,Services,Services d'élagage,04/02/2021,150000.0,Révisable,VILLE DE CREPY-EN-VALOIS,49.2360959151,2.8967119259,PME,74.58000955730905,48.7884475501,2.3944741313,022021
20212021S0302500,Marché,Services,Services d'enseignement et de formation,22/02/2021,150000.0,Révisable,CHU ROUEN,49.4415068863,1.09373273216,PME,571.4161604368797,45.8983113865,4.83789538633,022021
202120M02000,Marché,Services,Services de prestations,11/02/2021,150000.0,Ferme et actualisable,SPL VAL DE SEINE AMENAGEMENT,48.8365394869,2.2389245247,ETI,455.2187300059442,47.2321613301,-1.54797539458,022021
20212021F0072700,Marché,Fournitures,Réfrigérateurs et congélateurs,16/02/2021,1500000.0,Révisable,RESEAUX DES ACHETEURS HOSPITALIERS,48.8591103086,2.38017728226,PME,412.8579052376697,47.0458179875,-0.877097655444,022021
20212021F0076500,Marché,Fournitures,Matériel et fournitures informatiques,18/02/2021,1500000.0,Ferme,RESEAUX DES ACHETEURS HOSPITALIERS,48.8591103086,2.38017728226,NC,155.46070907721813,49.4744089013,1.11792062882,022021
202176430500,Marché,Services,"Services de réparation et d'entretien de pompes, de vannes, de robinets, de conteneurs en métal et de machines",02/02/2021,1500000.0,Révisable,Logis Cévenols OPH Alès,44.1254048703,4.08883549513,PME,0.0,44.1254048703,4.08883549513,022021
2021930000017900,Marché,Fournitures,Matériel et fournitures informatiques,05/02/2021,1500000.0,Ferme,Département de la Seine-Saint-Denis,48.9073106793,2.44007227598,GE,22.487190435486678,48.8836186061,2.23810959636,022021
202021M0001700,Marché,Fournitures,Électricité,10/02/2021,1500000.0,Ferme et actualisable,ALES,44.1254048703,4.08883549513,GE,567.9217974488206,48.8983675206,2.25515424076,022021
2020WJEy9RIp0O00,Marché,Services,Services financiers et d'assurance,17/02/2021,1500000.0,Ferme,DAFS,48.8491121687,2.33284677548,NC,11.156670924655273,48.8836186061,2.23810959636,022021
2019Yrus4Epz0800,Marché,Services,Services de sécurité,05/02/2021,1500000.0,Ferme et actualisable,Université Toulouse 3 Paul Sabatier,43.5959710776,1.43229743595,ETI,8.179935677335914,43.6110430672,1.50470197314,022021
20212021F0147100,Marché,Fournitures,Stérilisateur,25/02/2021,1500000.0,Révisable,RESEAUX DES ACHETEURS HOSPITALIERS,48.8591103086,2.38017728226,PME,11.780601907103318,48.783689162,2.4549804713,022021
2021202100900,Marché,Travaux,Travaux de réfection,24/02/2021,150001.69,Ferme et actualisable,Les résidences de l'Orléanais - OPH d'Orléans Métropole,47.8824665066,1.91660961834,PME,26.000434201201152,48.0686578747,2.05872313592,022021
20212020T0027500,Marché,Travaux,Travaux d'installations électriques,01/02/2021,15029.0,Ferme et actualisable,COTES D'ARMOR HABITAT,48.487063217,-2.80840238288,PME,18.008509882448703,48.5028036804,-2.64631362442,022021
2020MFdP4zSgAE00,Marché,Fournitures,"Serrures, clés et charnières",23/02/2021,150349.79,Ferme,CROUS de Reims,49.2517771432,4.03968745396,PME,0.0,49.2517771432,4.03968745396,022021
2020_PA_0200,Marché,Services,"Services d'architecture, services de construction, services d'ingénierie et services d'inspection",07/02/2021,150390.0,Révisable,COMMUNAUTE COMMUNES TERRES TOULOISES,48.6799971519,5.84324026122,PME,40.24547077030467,48.7053283146,6.20628313233,022021
202020200070400,Marché,Travaux,Travaux de construction de bassins d'eaux pluviales,17/02/2021,150390.0,Ferme et actualisable,COMMUNE DE PIERRE BENITE,45.7020266839,4.82683638203,PME,67.92260365936342,45.4903436831,4.25050786682,022021
2019b0ZmwxYq6g00,Marché,Services,"Services d'installation de matériel radio, de télévision, audio et vidéo",05/02/2021,15047.0,Ferme et actualisable,Mairie de Bry sur Marne,48.8389114822,2.52357056079,PME,15.295324834425069,48.8123578699,2.3878497256,022021
202008261436F01,Marché,Fournitures,Peintures et revêtements muraux,09/02/2021,150477.94,Révisable,BUDGET PRINCIPAL,47.2801589313,-2.25106183059,PME,24.254419556949777,47.4334977763,-2.09512343941,022021
20180143b0500700,Marché,Services,Services de conseil en matériel informatique,11/02/2021,150480.0,Ferme,Groupe CDC Habitat  GIE SYSTEMES D'INFORMATION ET NUMERIQUE,43.6131750772,3.86941278925,NC,612.9968329177805,48.8836186061,2.23810959636,022021
2021tr20013700,Marché,Travaux,Travaux de construction de bâtiments scolaires,09/02/2021,1506484.0,Révisable,Commune de Petite-Ile,-21.3397027003,55.5689887011,PME,33.216680281880784,-21.0446108504,55.3222448792,022021
202143200700,Marché,Services,Services de nettoyage et d'hygiène,09/02/2021,150655.87,Révisable,ALTEAL,43.611577156,1.32726979619,ETI,22.951646281743606,43.5390131127,1.52156442051,022021
202143200300,Marché,Services,Services de nettoyage et d'hygiène,09/02/2021,1507431.84,Révisable,ALTEAL,43.611577156,1.32726979619,ETI,22.951646281743606,43.5390131127,1.52156442051,022021
20212020F2335800,Marché,Fournitures,Pansements,02/02/2021,150769.67,Révisable,CHU NANTES,47.2321613301,-1.54797539458,NC,129.9147605648091,46.1578937747,-1.08822293978,022021
2021200065000,Marché,Fournitures,Pièces détachées et accessoires pour véhicules et moteurs de véhicules,12/02/2021,1508.19,Révisable,Département de la Charente,45.6475513407,0.144999112457,ETI,888.7888985499367,48.421468028,7.6849051858,022021
2021000300,Marché,Services,Services de collecte et de collation de données,04/02/2021,150800.0,Révisable,Région Normandie,49.1850685346,-0.370026383608,PME,231.2336139927104,47.3980773574,0.696151819266,022021
2021202000860100,Marché,Fournitures,Enveloppes imprimées,09/02/2021,150990.0,Révisable,Caisse des dépôts et consignations,48.8562037309,2.3121193117,ETI,443.29481514307366,45.5804987071,0.0311567605737,022021
20212021F0371000,Marché,Fournitures,Pain,17/02/2021,151214.8,Révisable,CHD VENDEE,46.6676055556,-1.4078581699,PME,37.020373284167604,46.5194692005,-1.10809102642,022021
2021RO20A00400,Marché,Services,Services d'architecte pour les bâtiments,03/02/2021,151360.0,Ferme,Centre Hospitalier Sainte-Marie,44.3389018882,2.54700094526,NC,148.4052749633897,43.5959710776,1.43229743595,022021
20212010800,Marché,Fournitures,Équipement de péage,23/02/2021,151439.0,Ferme,VILLE DE BAYONNE,43.4922603626,-1.46624377766,GE,708.0201674190502,48.6070710384,2.34110784099,022021
202120PI02900,Marché,Services,Services d'ingénierie géotechnique,17/02/2021,151490.0,Ferme et actualisable,Grand Avignon,43.9352959178,4.84131733764,ETI,55.516610017534894,43.8445331544,4.34760475323,022021
2020PI02900,Marché,Services,Services d'ingénierie géotechnique,01/02/2021,151490.0,Révisable,GRAND AVIGNON,43.9352959178,4.84131733764,ETI,55.516610017534894,43.8445331544,4.34760475323,022021
2020-09-01102,Marché,Travaux,Travaux de construction,11/02/2021,151511.0,Ferme,BRIARE,47.6450211147,2.7451169236,PME,25.803010133439226,47.8625325618,2.66382107623,022021
2021100000000400,Marché,Travaux,Travaux de construction de bâtiments,12/02/2021,151523.42,Révisable,Ville de Châlons en Champagne,48.9641633923,4.37882582203,PME,70.96748344674675,48.7750345382,4.99189559421,022021
202116RL2100,Marché,Fournitures,Pièces pour machines agricoles et sylvicoles,17/02/2021,15164.0,Révisable,METROPOLE TOULON PROVENCE MEDITERRANEE,43.1364847512,5.93276630299,PME,17.966735786566325,43.1635876244,6.09295230135,022021
20212021F0290700,Marché,Fournitures,Instruments dentaires,05/02/2021,15167.0,Révisable,CHU REIMS,49.2517771432,4.03968745396,PME,175.28982204710104,48.817695916,2.51568784214,022021
2020SoADsE0XJr00,Marché,Services,Services de planification technique,26/02/2021,151780.0,Révisable,CITALLIOS,48.8963161116,2.20694242609,NC,26.931598428562634,48.8631652232,2.4482059517,022021
20202102CAF1200,Marché,Fournitures,Carburant diesel,01/02/2021,151800.0,Révisable,SDIS 82,44.0225624278,1.36375484401,ETI,554.2149339166072,48.9097290596,2.33319973974,022021
20212021S0128100,Marché,Services,Services sylvicoles,01/02/2021,15187.5,Ferme,Ministère de l'agriculture et de l'alimentation - Direction territoriale Bourgogne Franche Comté,47.2551269927,6.0192810348,NC,209.14929753036097,47.1696614874,4.12989134336,022021
2021120007199500,Marché,Fournitures,Bâtiments préfabriqués,05/02/2021,1518751.0,Ferme et actualisable,Ministère des armées - Etablissement du service d'infrastructure de la défense de BREST - ESID Brest,,,ETI,,46.710320812,-1.46293363973,022021
2021M21005M00,Marché,Travaux,Travaux d'équipement du bâtiment,26/02/2021,151954.0,Ferme et actualisable,LOGELIA CHARENTE,45.6475513407,0.144999112457,ETI,420.2023991838732,48.9890049642,1.91405725676,022021
20212021T0233400,Marché,Travaux,Travaux de pose de revêtement de sols et de murs et pose de papiers peints,23/02/2021,15200.74,Ferme,"Ministère de l'Économie, des Finances et de la Relance - CHAMBRE DE METIERS ET DE L'ARTISANAT DE REGION NOUVELLE-AQUITAINE",44.8578964782,-0.57357535767,NC,230.0365868428515,45.8544262114,1.24894834225,022021
2021210050100,Marché,Services,Services de réparation et d'entretien d'installations d'extinction d'incendie,01/02/2021,152000.0,Révisable,MAIRIE DE REZE,47.1765537278,-1.54989963253,PME,8.928185372111416,47.1602431078,-1.47084254473,022021
201801435bf00400,Marché,Services,Services de conseil en matériel informatique,11/02/2021,152000.0,Ferme,Groupe CDC Habitat  GIE SYSTEMES D'INFORMATION ET NUMERIQUE,43.6131750772,3.86941278925,GE,612.2888650569157,48.8855642403,2.26624582625,022021
2020Cdsv3NcJAT00,Marché,Services,Services d'assurances accidents et maladie,24/02/2021,1520000.0,Ferme,OPCO MOBILITES,48.8365394869,2.2389245247,PME,3.6797011155374393,48.8604673342,2.26190318372,022021
2020dCiSh6d7Zt00,Marché,Travaux,Travaux de façade,05/02/2021,1520035.0,Ferme,3F SEINE ET MARNE,48.8457093916,2.78688716029,PME,67.66998076592232,48.9118842497,2.17854217414,022021
202065gtUNDeki00,Marché,Travaux,Ouvrages d'art et de génie civil,01/02/2021,1521417.0,Ferme,Etablissement Public d'Aménagement Alzette-Belval,49.4584208683,5.95836136681,NC,22.453059407823613,49.2560088051,5.97074822993,022021
2020y-EKDgubqB00,Marché,Travaux,Travaux de construction,26/02/2021,15222.41,Ferme et actualisable,Brest Métropole Habitat,48.3999000994,-4.5027702561,PME,6.923524367459905,48.4191016946,-4.56234146173,022021
2021151046500700,Marché,Services,Services de musées et de préservation des sites historiques et des services connexes,09/02/2021,152320.0,Révisable,Ministère de la Culture - Direction Régionale des Affaires Culturelles - Ile de France,48.8769868607,2.33753841595,PME,2.931125987429594,48.8628851439,2.35993164253,022021
2020vyiW8pkzzA00,Marché,Fournitures,Pièces détachées et accessoires pour véhicules et moteurs de véhicules,12/02/2021,152334.0,Révisable,Régie des Transports Métropolitains,,,PME,,44.8889230081,-0.600409986888,022021
20212021S0355200,Marché,Services,Logiciels et systèmes d'information,26/02/2021,152640.0,Révisable,CHU DE LIMOGES,45.8544262114,1.24894834225,PME,241.7491789267202,44.7191173917,-0.614843701001,022021
20212021T0326300,Marché,Travaux,Travaux de charpente,02/02/2021,152700.0,Ferme,CHU ROUEN,49.4415068863,1.09373273216,PME,51.18051735263996,49.7397205203,1.44608084481,022021
20212021T0495100,Marché,Travaux,Travaux de démolition de bâtiments et travaux de terrassement,01/02/2021,1528669.0,Ferme,CHU ANGERS,47.4766284713,-0.556089456786,NC,138.3677327850666,46.3738858313,-1.13373830057,022021
2021AMO00130700,Marché,Travaux,Travaux de construction de bâtiments multifonctionnels,08/02/2021,152907.39,Révisable,SEMCODA,46.2047217001,5.24553216043,PME,19.88365850609038,46.3252057234,5.1123431249,022021
2020mi9_LAEgBy00,Marché,Travaux,Travaux de construction d'immeubles collectifs,25/02/2021,1.5293027E7,Ferme et actualisable,CIF - Direction Technique,48.783689162,2.4549804713,PME,93.38459740489975,49.4007391682,3.02788157191,022021
2020uOplzrT-0300,Marché,Services,Services d'études,24/02/2021,15300.0,Révisable,Conseil Départemental de la Charente-Maritime-cg17,46.1619512738,-1.1749922971,PME,74.52296137657511,45.7423034662,-0.649840149818,022021
20212020AO04401,Marché,Services,Réalisation et entretien d'espaces verts,03/02/2021,1530000.0,Révisable,Commune de Saint-Tropez,43.26214581,6.66343108724,NC,328.4458771640499,45.7299437905,5.01600256178,022021
20210140100,Marché,Travaux,"Travaux de construction d'ouvrages de génie civil, excepté ponts, tunnels, puits et passages souterrains",25/02/2021,1530394.0,Ferme et actualisable,COMMUNAUTE D AGGLOMERATION PAYS BASQUE,43.4922603626,-1.46624377766,GE,715.5369227477638,48.657035519,2.38747793366,022021
2021202002600,Marché,Services,Services d'abattage d'arbres,24/02/2021,153050.0,Révisable,Mairie ELBEUF SUR SEINE,49.2762670244,0.997187405783,PME,87.94411077084354,48.9943943417,1.74020742825,022021
2018QgI89UhEWy00,Marché,Services,Services d'urbanisme,03/02/2021,153252.0,Ferme,Communauté d'Agglomération Grand Paris Sud Seine-Essonne-Senart,48.6293513055,2.44049035394,PME,32.127596456829785,48.9128078947,2.38454842862,022021
2019rwB8s3FfYA00,Marché,Fournitures,"Équipements de laboratoire, d'optique et de précision (excepté les lunettes)",05/02/2021,1533.0,Ferme,Université Toulouse 3 Paul Sabatier,43.5959710776,1.43229743595,PME,13.431642991834215,43.598001463,1.55375109909,022021
2021S00330700,Marché,Fournitures,Vêtements professionnels,17/02/2021,15332.0,Révisable,Mairie de Villeneuve d'Ascq,50.6322610395,3.15284231203,GE,37.66347294051376,50.4701733019,2.8537438565,022021
20212021S0309300,Marché,Services,Services de conception graphique,22/02/2021,15360.0,Révisable,CHR ORLEANS,47.8824665066,1.91660961834,PME,4.310737462497047,47.854897242,1.88921777468,022021
202191118200,Marché,Services,Prestations de services pour la collectivité,17/02/2021,153600.0,Ferme,BUDGET PRINCIPAL,47.2551269927,6.0192810348,PME,0.0,47.2551269927,6.0192810348,022021
2019JE8G54XymW00,Marché,Fournitures,"Équipements de laboratoire, d'optique et de précision (excepté les lunettes)",05/02/2021,15365.0,Ferme,Université Toulouse 3 Paul Sabatier,43.5959710776,1.43229743595,PME,13.431642991834215,43.598001463,1.55375109909,022021
201923102,Marché,Travaux,Travaux de construction de bâtiments,23/02/2021,153659.0,Révisable,BUDGET PRINCIPAL,48.7640654352,5.16324051275,PME,168.7162938259137,48.0565739327,6.5144129662,022021
2021202100902,Marché,Services,Services de maintenance préventive,23/02/2021,153750.0,Révisable,Communauté d'Agglomération Béziers Méditerranée,43.3475518983,3.23081153874,NC,265.14132487813634,45.0095640627,4.95247926526,022021
2021100000002000,Marché,Travaux,Travaux d'entretien routier,18/02/2021,153904.28,Révisable,Ville de Châlons en Champagne,48.9641633923,4.37882582203,NC,4.3346988685871155,48.9547049297,4.41685816506,022021
2021833700,Marché,Travaux,Travaux d'installation de ventilation,19/02/2021,153930.0,Révisable,REGION CENTRE VAL DE LOIRE,47.8824665066,1.91660961834,ETI,181.26536188880215,49.2776383917,1.070524639,022021
2018013d01300400,Marché,Services,Services juridiques,12/02/2021,1540.0,Ferme,Service Achats Magasins(AM),47.2321613301,-1.54797539458,PME,9.745626833594962,47.2120401446,-1.46219731001,022021
2020DIREX0001911,Marché,Travaux,Déblai-remblai,05/02/2021,154015.0,Ferme et actualisable,Budget principal,46.5622744929,3.32725048972,PME,67.70201500944829,46.3072214426,2.77126603793,022021
20212020F2029300,Marché,Fournitures,Produits pharmaceutiques,03/02/2021,154150.0,Révisable,CENTRE HOSPITALIER BRETAGNE ATLANTIQUE,47.6599029362,-2.75681901002,GE,568.8547968964083,48.8836186061,2.23810959636,022021
20212021F0371100,Marché,Fournitures,Pain,17/02/2021,154450.4,Révisable,CHD VENDEE,46.6676055556,-1.4078581699,PME,37.020373284167604,46.5194692005,-1.10809102642,022021
2018XlZXY4ACBM00,Marché,Travaux,Travaux de construction de bâtiments scolaires,03/02/2021,154549.0,Révisable,Communauté d'Agglomération Grand Paris Sud Seine-Essonne-Senart,48.6293513055,2.44049035394,PME,21.562920253891367,48.5715553693,2.62663000627,022021
2020M2039100,Marché,Fournitures,Véhicules utilitaires,09/02/2021,154565.53,Ferme,ORLEANS METROPOLE,47.8824665066,1.91660961834,ETI,252.1819107775297,49.7317350875,0.598603540874,022021
2021MP21900200,Marché,Travaux,Travaux d'équipement électrique,16/02/2021,1545840.3,Révisable,CENTRE HOSPITALIER LUCIEN HUSSEL,45.5208328002,4.88070755449,NC,33.480148861474106,45.8185058503,4.93093438203,022021
2021130016243700,Marché,Fournitures,Sel de déneigement,11/02/2021,15485.0,Révisable,"Ministère de la Transition Écologique, Ministère de la Cohésion des Territoires, Ministère de la Mer - Direction Interdépartementale des Routes Sud-Ouest",43.5959710776,1.43229743595,PME,399.45419912164965,43.8505844003,5.03563866158,022021
2020t7iCZypA1300,Marché,Fournitures,Livres de bibliothèque,02/02/2021,15500.0,Ferme,Mairie de Coueron,47.2305431151,-1.7303481837,PME,20.166708853610974,47.2321613301,-1.54797539458,022021
2020rygYYLcbtN00,Marché,Fournitures,Simulateurs de formation,24/02/2021,155000.0,Révisable,Université Toulouse 3 Paul Sabatier,43.5959710776,1.43229743595,ETI,584.2128315627785,48.8022788923,2.11716530117,022021
202120SF400100,Marché,Services,Services d'assurance dommages ou pertes,10/02/2021,155000.0,Révisable,SDIS DE L OISE,49.4363296139,2.08715087996,PME,174.74508669673187,50.6743724709,3.06034609721,022021
2020M2020_0800,Marché,Travaux,Construction de murs de rive,12/02/2021,155000.0,Ferme,SYNDICAT MIXTE DU BASSIN DES SORGUES,43.995554072,4.93274816859,NC,37.117600096886434,43.8241093685,5.22103473205,022021
2020OPT4lqhDHA00,Marché,Services,Réalisation et entretien d'espaces verts,26/02/2021,155024.0,Révisable,SEMINOR,49.7526272499,0.39606397889,PME,12.958784579050441,49.7395351159,0.512515720507,022021
2020F2MAPjAYL700,Marché,Travaux,Travaux de construction,25/02/2021,155043.2,Ferme et actualisable,COM - Direction de la communication et du marketing,45.7480493184,4.82567584415,NC,15.255830290843749,45.7719596188,4.9615343054,022021
201901465b200100,Marché,Fournitures,Papier d'impression,12/02/2021,1551.7,Ferme,Mairie de Saint Orens de Gameville,43.5592722725,1.53506473617,ETI,384.56895092836834,43.9281862792,4.99304878863,022021
2021009781905100,Marché,Travaux,Travaux de remise en état et de remise à neuf,19/02/2021,15530.0,Révisable,OPH 65,43.2347953943,0.0657136709174,PME,0.0,43.2347953943,0.0657136709174,022021
20191DE3ZOYu6100,Marché,Travaux,Travaux de construction,10/02/2021,1554415.31,Ferme et actualisable,Angers Loire habitat,47.4766284713,-0.556089456786,GE,0.0,47.4766284713,-0.556089456786,022021
2019KkEXuScFCu00,Marché,Fournitures,Machines et appareils à usage spécifique,05/02/2021,15547.0,Ferme,Université Toulouse 3 Paul Sabatier,43.5959710776,1.43229743595,PME,572.2076543204041,48.6784059712,2.22329218787,022021
20212021F0815200,Marché,Fournitures,Appareils de purification de l'eau,10/02/2021,15549.08,Ferme,"Etablissements et organismes de l'enseignement supérieur, de la recherche et de l'innovation - IRD DELEGATION REGIONALE ILE DE FRANCE",48.902321262,2.48360567737,NC,47.31085337375587,48.7728906673,2.07603849225,022021
2020n5CE6M41OO00,Marché,Travaux,Travaux de construction de routes,17/02/2021,1555415.0,Révisable,ETABLISSEMENT PUBLIC D'AMENAGEMENT DE BORDEAUX - EURATLANTIQUE,44.8578964782,-0.57357535767,GE,12.331911084172813,44.8323242505,-0.682089528902,022021
2021151051922900,Marché,Services,Services de conseil en matière de santé et de sécurité,22/02/2021,1558.0,Ferme,Ministère de la Justice  - Antenne régionale de l'équipement de Toulouse,43.5959710776,1.43229743595,GE,429.84713767365724,43.3654982005,5.31265000369,022021
202130039301,Marché,Travaux,"Travaux d'installation de clôtures, de garde-corps et de dispositifs de sécurité",17/02/2021,155833.75,Ferme et actualisable,Département du Doubs,47.2551269927,6.0192810348,PME,34.7139554303535,46.9573754652,6.11777108989,022021
