202020026200,Marché,Services,Services de transport routier public,30/10/2020,3060000.0,Révisable,BUDGET PRINCIPAL,43.3127155398,5.36343891881,GE,216.0303457327355,45.204410391,5.83712484674,102020
2018014410800100,Marché,Services,Services de réparation et d'entretien de matériel de restauration,20/10/2020,307.41,Ferme,Commune VIERZON,47.2370821272,2.07892537933,PME,28.825076379307987,47.1698787883,2.33068767079,102020
2020B_rSHzQu_O00,Marché,Fournitures,Tondeuses à gazon,07/10/2020,30700.0,Ferme,Mairie de Wittenheim,47.8107034161,7.31248086177,ETI,34.856664960550575,48.0237883177,7.5450722313,102020
2019ou1h0KzNoC00,Marché,Travaux,Installation de lignes téléphoniques,28/10/2020,30704.71,Révisable,DEL - Direction de l éducation et des lycées,45.7480493184,4.82567584415,NC,114.9196697838177,45.6011215242,5.85439623369,102020
20191210000486,Marché,Services,Autres services,02/10/2020,30772.0,Révisable,VILLE DE PARIS BUDGET PRINCIPAL,48.8542874923,2.35759608215,NC,0.0,48.8542874923,2.35759608215,102020
2020151030491400,Marché,Services,"Services d'architecture, services de construction, services d'ingénierie et services d'inspection",09/10/2020,30800.0,Ferme et actualisable,Ministère de la Justice  - Direction interrégionale des services pénitentiaires de Toulouse,43.5959710776,1.43229743595,NC,190.54694815503734,42.6966171788,2.89890986886,102020
2020dCtvKpz_qu00,Marché,Fournitures,Écrans,14/10/2020,30800.0,Ferme,SYNDICAT DES MOBILITES DE TOURAINE,47.3980773574,0.696151819266,PME,212.84120983469978,48.758778972,2.04882028884,102020
20202020S03904,Marché,Services,Études techniques,16/10/2020,30850.0,Révisable,VILLE DE PARIS BUDGET PRINCIPAL,48.8542874923,2.35759608215,PME,211.83974935992018,50.6317671102,3.04699299406,102020
2020100014865000,Marché,Travaux,Travaux de revêtement de routes,09/10/2020,308666.3,Ferme et actualisable,"Ministère de la Transition Écologique, Ministère de la Cohésion des Territoires, Ministère de la Mer - Direction Régionale et Interdépartementale Equipement et Aménagement Ile-de-France",48.840040811,2.29268840406,PME,17.25888760499738,48.695957442,2.23477492911,102020
20202020T2383800,Marché,Travaux,Travaux de construction,20/10/2020,30871.01,Ferme et actualisable,"Institut national de recherche pour l’agriculture, l’alimentation et l’environnement",48.8562037309,2.3121193117,PME,563.0582380589018,48.5437115561,-2.77025232868,102020
20202020T0674200,Marché,Travaux,Travaux de revêtement de rues,28/10/2020,308929.16,Révisable,La Ville d'Antony,48.7498603402,2.29906093692,NC,21.04407557593736,48.7732937592,2.48790854128,102020
2020C2007900,Marché,Services,Services de curage des égouts,29/10/2020,309090.88,Révisable,AGGLOMERATION DU CHOLETAIS,47.0458179875,-0.877097655444,NC,0.0,47.0458179875,-0.877097655444,102020
2020846 101,Marché,Travaux,Travaux de fondation de rues,01/10/2020,309415.5,Ferme,COMMUNE NEUILLY-SUR-MARNE,48.8626509058,2.54022465394,NC,6.471801186081903,48.9077497585,2.50323627609,102020
2021000000837100,Marché,Fournitures,Machines d'entretien des sols,05/10/2020,309448.0,Révisable,REGION CENTRE-VAL DE LOIRE,47.8824665066,1.91660961834,ETI,97.09615334836096,48.695957442,2.23477492911,102020
2020F_mNsXjGQG00,Marché,Travaux,Travaux de construction d'immeubles collectifs,30/10/2020,30946.0,Ferme et actualisable,Sarépa - Direction Technique,48.783689162,2.4549804713,PME,78.77213061811764,49.0078005848,1.77921952719,102020
20202020T1588800,Marché,Travaux,Travaux de désamiantage,14/10/2020,309825.37,Révisable,"Etablissements et organismes de l'enseignement supérieur, de la recherche et de l'innovation - Université Clermont Auvergne - Direction de l'Immobilier",45.7859001722,3.11559551839,ETI,226.5837928625017,44.5538701101,4.74888787641,102020
20212020M06600,Marché,Travaux,Travaux d'assainissement,09/10/2020,309850.7,Ferme,SILA,45.8900209706,6.12570413482,NC,14.674218845394364,45.8155767221,6.01591104276,102020
2020151028459400,Marché,Services,Services d'ingénierie aéroportuaire,13/10/2020,31000.0,Ferme et actualisable,Ministère des armées - Etablissement du service d'infrastructure de la défense de BREST - ESID Brest,,,NC,,47.6974514811,-2.83117278171,102020
2020ofIo4xYrXv00,Marché,Travaux,Travaux de construction,19/10/2020,310000.0,Révisable,APAEI du Bocage Virois et de la Suisse Normande,49.1850685346,-0.370026383608,PME,73.78668827633777,49.0544113144,-1.02423903087,102020
20202020S1635700,Marché,Services,Logiciels et systèmes d'information,15/10/2020,31017.5,Ferme,CH DE LA COTE BASQUE,43.4922603626,-1.46624377766,PME,730.197843677147,48.8727847696,2.31253091684,102020
2019jaTNkWDX5D00,Marché,Travaux,"Pose de menuiseries métalliques, excepté portes et fenêtres",19/10/2020,310495.92,Ferme,Territoire Habitat 90,47.6463850599,6.84549855352,PME,19.18095121697129,47.4910471082,6.7682064721,102020
20202020S05864,Marché,Services,Services de conception des systèmes de chauffage,30/10/2020,31050.0,Révisable,VILLE DE PARIS BUDGET PRINCIPAL,48.8542874923,2.35759608215,PME,783.9824022905476,43.8090140438,7.3240342391,102020
2019SrBrhvT4lb00,Marché,Travaux,Travaux d'étanchéification,19/10/2020,31096.64,Ferme,Territoire Habitat 90,47.6463850599,6.84549855352,NC,12.182461801120567,47.570128856,6.76596745921,102020
20202020F0810400,Marché,Travaux,Travaux d'aménagement paysager d'espaces verts,29/10/2020,31100.0,Ferme et actualisable,Ville de Neuilly-sur-Seine,48.8855642403,2.26624582625,ETI,107.09056315788496,49.8413842833,2.38263504965,102020
20202020S0622800,Marché,Fournitures,Panneaux de signalisation routière,13/10/2020,31120.0,Ferme,CD77 - Conseil départemental de Seine-et-Marne,48.5447982823,2.65777855027,PME,86.83258785510873,49.0400551805,2.05074797264,102020
160346102130700,Marché,Fournitures,,23/10/2020,31140.0,Révisable,Conseil Départemental de l'Aveyron,44.358571606,2.56667306391,PME,15.003603988798869,44.4816694258,2.62221008392,102020
20202020F1641400,Marché,Fournitures,"Articles de papeterie imprimés, excepté les formulaires",21/10/2020,311403.0,Révisable,CHU REIMS,49.2517771432,4.03968745396,NC,175.51370492644992,50.4089953313,2.95931366552,102020
2020100014866800,Marché,Travaux,Travaux de construction de bâtiments et d'installations militaires,15/10/2020,311699.43,Révisable,Ministère des armées - Etablissement du service d'infrastructure de la défense de Bordeaux - ESID Bordeaux,,,PME,,44.0225624278,1.36375484401,102020
2019-08-TR-0201,Marché,Travaux,,27/10/2020,311906.72,Ferme et actualisable,CCPDA ZAEC,,,NC,,45.3440873298,4.80893485558,102020
20202020F1572700,Marché,Fournitures,Fournitures pour l'angiographie,12/10/2020,3120.0,Révisable,HOPITAL NORD FRANCHE COMTE,47.5660972912,6.86905506773,ETI,549.2099952992628,48.758778972,2.04882028884,102020
2019HAq4puOrVi00,Marché,Fournitures,Radiateurs,19/10/2020,31209.0,Ferme,Territoire Habitat 90,47.6463850599,6.84549855352,PME,24.047234593749547,47.4421009121,6.7707441417,102020
2020TX00600,Marché,Travaux,,01/10/2020,312952.16,Ferme et actualisable,ZA LABRANERE ONDRES,,,PME,,43.5325506298,-1.38817136141,102020
202020.09001,Marché,Travaux,Travaux de construction de conduites d'eau et de canalisations d'eaux usées à grande distance,16/10/2020,313602.0,Ferme et actualisable,Vendée Eau,46.6676055556,-1.4078581699,GE,72.68939687646046,47.3030353752,-1.56014129347,102020
20202020S0671600,Marché,Fournitures,Infrastructures de télécommunications,27/10/2020,31369.31,Révisable,RESEAUX DES ACHETEURS HOSPITALIERS,48.8591103086,2.38017728226,NC,18.706906352842275,48.7273690549,2.27501219877,102020
2020oN-W6d304R00,Marché,Fournitures,Graisses et lubrifiants,12/10/2020,31396.0,Ferme,SA HLM QUEVILLY HABITAT,49.4094883554,1.03952520974,PME,25.171433000959034,49.2614673745,1.21163851421,102020
20202020S0638800,Marché,Services,Services d'accompagnement professionnel,16/10/2020,31400.0,Ferme,RESEAUX DES ACHETEURS HOSPITALIERS,48.8591103086,2.38017728226,NC,,,,102020
2020831000040104,Marché,Travaux,Travaux de terrassement,23/10/2020,314062.0,Ferme,MAIRE DE PUGET VILLE,43.2764147918,6.14882217861,NC,19.825354020165292,43.1019824736,6.18958692395,102020
2020RwJiV5luwN00,Marché,Travaux,Travaux de façade,30/10/2020,31446.41,Ferme et actualisable,MANCHE HABITAT,49.1097135871,-1.07754504719,PME,59.66156473244066,48.6125481973,-1.27932441573,102020
2019jd5BVjV40U00,Marché,Fournitures,Conduites de chauffage,07/10/2020,314779.0,Révisable,Mairie de Mons en Baroeul,50.6427234653,3.10704546553,NC,5.195921522255864,50.6322610395,3.15284231203,102020
2019013603900100,Marché,Services,Système de contrôle informatique,22/10/2020,31499.0,Ferme,Autorité des marchés financiers,48.8682182328,2.34268958704,ETI,10.24378903086164,48.8983675206,2.25515424076,102020
20202020T0622000,Marché,Travaux,Travaux de plomberie,13/10/2020,315.8,Ferme,Commune d'Andrésy,48.9810967257,2.0494918641,PME,34.43604056682458,48.8924795867,2.34788399022,102020
20202013 Lot800,Marché,Travaux,Travaux de menuiserie,14/10/2020,315060.74,Ferme et actualisable,COMMUNAUTE DE COMMUNES CAYRES PR,44.892146662,3.84238188091,PME,31.59801505780844,45.0788927098,3.62683680118,102020
20202020T0647100,Marché,Fournitures,Conduites et raccords en béton,20/10/2020,3151342.0,Révisable,Syndicat des Eaux d'Ile de France - SEDIF,48.8491121687,2.33284677548,NC,17.232075157540898,48.8745436228,2.48657191747,102020
202074089500,Marché,Travaux,Travaux de réfection,09/10/2020,31530.0,Ferme,MAIRIE LONGEVILLE LES ST AVOLD,49.1191694002,6.64927495383,PME,0.0,49.1191694002,6.64927495383,102020
20202020S1556700,Marché,Services,Services de maintenance préventive,02/10/2020,31537.0,Ferme,Ministères sociaux,45.8391553925,4.99733131758,GE,7.270698309204035,45.7908704388,5.04180920984,102020
2019v00XeOrEoK00,Marché,Services,Services d'audit informatique,20/10/2020,31550.0,Ferme,Territoire Habitat 90,47.6463850599,6.84549855352,PME,516.8542838669356,48.8769868607,2.33753841595,102020
20202_cWrMda9700,Marché,Travaux,Travaux de construction d'immeubles collectifs,21/10/2020,315722.9,Ferme,Société OZANAM,14.6460950766,-61.100358959,NC,15.257536053287229,14.5778958668,-60.9674898168,102020
20202020S05649,Marché,Services,Services de réparation et d'entretien de matériel médical,02/10/2020,31591.95,Révisable,VILLE DE PARIS BUDGET PRINCIPAL,48.8542874923,2.35759608215,NC,10.320511067755458,48.9157198373,2.28764873642,102020
201953-pQIiSjj00,Marché,Travaux,Travaux de construction,07/10/2020,31591.97,Ferme,Société Immobilière de la Réunion-SIDR,-20.9331856391,55.4471055195,PME,21.917261958218198,-21.2492112938,55.366954369,102020
2018XKZbz6C_fp00,Marché,Services,Services de conseil en matière d'ingénierie et de construction,07/10/2020,31600.0,Ferme et actualisable,Mairie de Mons en Baroeul,50.6427234653,3.10704546553,PME,25.31051370827086,50.4150500174,3.10352912451,102020
20202020050301,Marché,Travaux,Travaux de gros œuvre en béton,08/10/2020,316000.0,Ferme,CC OCEAN MARAIS DE MONTS,46.8019300259,-2.04818708471,PME,14.938311230714888,46.7952396084,-1.91325898653,102020
2020130015658000,Marché,Services,Services de crèches et garderies d'enfants,28/10/2020,316000.0,Ferme,Ministère de l'Intérieur - Hauts de France,50.6317671102,3.04699299406,ETI,208.88728093997486,48.9038810507,2.30581093912,102020
202074088400,Marché,Fournitures,Équipement d'éclairage public,09/10/2020,31608.0,Ferme,MAIRIE LONGEVILLE LES ST AVOLD,49.1191694002,6.64927495383,PME,64.0922610807875,49.3758482446,6.12970624329,102020
2020oVZFyWLuLD00,Marché,Travaux,Travaux de bardage,22/10/2020,31616.18,Ferme et actualisable,Communauté d'agglomération ARCHE Agglo,45.0289889617,4.81934000613,PME,31.60451607135763,45.2779129574,4.95841955438,102020
2020151032458100,Marché,Travaux,Autres travaux d'installation électrique,19/10/2020,31652.7,Ferme et actualisable,Ministère de la Justice  - Direction interrégionale des services pénitentiaires de Toulouse,43.5959710776,1.43229743595,GE,249.19557493099921,44.5293451476,3.48107867578,102020
20198n69oiBicF00,Marché,Services,Services d'études,08/10/2020,31670.0,Ferme,CPAM MACON,46.320613267,4.81834086547,PME,0.0,46.320613267,4.81834086547,102020
2020151030763300,Marché,Fournitures,Installations de sécurité,19/10/2020,31725.0,Ferme et actualisable,Ministère des armées - Etablissement du Service d'infrastructure de la défense d'Ile de France - ESID Ile de France,,,PME,,48.8745436228,2.48657191747,102020
2020151026720100,Marché,Fournitures,"Ascenseurs, skips, monte-charges, escaliers mécaniques et trottoirs roulants",05/10/2020,31770.0,Ferme et actualisable,"Ministère de l'Économie, des Finances et de la Relance - Direction départementale des Hauts-de-Seine",48.8963161116,2.20694242609,PME,33.94796181986561,48.7732937592,2.48790854128,102020
20202020T1753500,Marché,Travaux,Travaux de façade,02/10/2020,317911.58,Révisable,Ministère des armées - Accord-Cadre Mandat de Maîtrise d'Ouvrage au profit du SID,48.8282706469,2.362358986,PME,116.18626033205709,47.8824665066,1.91660961834,102020
2020M14200,Marché,Travaux,Travaux d'assainissement,02/10/2020,317975.0,Ferme,BUDGET DEPARTEMENTAL,45.7859001722,3.11559551839,PME,29.479901244591677,45.6673308332,2.87712924653,102020
20201310038300,Marché,Services,Services d'analyses médicales,09/10/2020,3181619.99,Révisable,VILLE DE PARIS BUDGET PRINCIPAL,48.8542874923,2.35759608215,ETI,10.603648763799466,48.8604673342,2.26190318372,102020
2019eowAO2PtDl00,Marché,Travaux,Carrelages,05/10/2020,3184.04,Ferme,Territoire Habitat 90,47.6463850599,6.84549855352,PME,12.182461801120567,47.570128856,6.76596745921,102020
2019014303100100,Marché,Services,Services de réparation et d'entretien de camions,01/10/2020,319.0,Ferme,SMICTOM - d'Alsace Centrale,48.2953439936,7.41576501016,PME,36.12249603762481,48.5144548516,7.6584023712,102020
20202020F2197600,Marché,Fournitures,Machines de production et d'utilisation de la puissance mécanique,14/10/2020,31921.8,Ferme,"Etablissements et organismes de l'enseignement supérieur, de la recherche et de l'innovation - Direction des achats",48.6900671002,6.17594832427,PME,423.2489310205299,45.3845659823,4.26051514148,102020
20202020F1928000,Marché,Fournitures,Réactifs pour analyses de sang,28/10/2020,31968.0,Révisable,Ministères sociaux,47.2551269927,6.0192810348,PME,468.670748505422,43.6131750772,3.86941278925,102020
20202020S0661100,Marché,Services,Services de nettoyage et d'hygiène,22/10/2020,32000.0,Révisable,VILLE D'ALFORTVILLE,48.7960818608,2.42143357065,ETI,43.330993333940015,48.7796502574,2.02991602442,102020
20202020F1636800,Marché,Fournitures,"Matériels médicaux, pharmaceutiques et produits de soins personnnels",17/10/2020,32000.0,Révisable,CHU ANGERS,47.4766284713,-0.556089456786,NC,616.8123494872478,45.8310057435,4.77089761479,102020
2020Arnt2FvhxC00,Marché,Services,Services d'évacuation des boues,06/10/2020,32000.0,Révisable,EPTB Seine Grands Lacs,48.8348302792,2.42102904428,PME,223.47395978846492,47.4822122598,3.91630076237,102020
2020bZ6gvNG3-l00,Marché,Services,Services de réparation et d'entretien de voitures,14/10/2020,32000.0,Ferme et actualisable,Toulon Habitat Méditerranée,43.1364847512,5.93276630299,ETI,304.3728059861046,45.7016140067,4.94900275462,102020
202022200,Marché,Travaux,Travaux de façade,12/10/2020,32000.0,Révisable,INOLYA,49.1850685346,-0.370026383608,PME,66.23015351042771,49.4965847516,0.140273146733,102020
2020130015644800,Marché,Services,Services de crèches et garderies d'enfants,28/10/2020,32000.0,Ferme,Ministère de l'Intérieur - Hauts de France,50.6317671102,3.04699299406,ETI,208.88728093997486,48.9038810507,2.30581093912,102020
20202020S1774200,Marché,Services,Services de maintenance préventive,29/10/2020,32000.0,Ferme,CH VALENCIENNES,50.3591232468,3.51599087764,PME,558.3559655940976,45.403678983,4.36878621893,102020
2020170010307000,Marché,Fournitures,Matériaux et structures de construction; produits auxiliaires pour la construction (à l'exception des appareils électriques),08/10/2020,32000.0,Révisable,"Ministère de la Transition Écologique, Ministère de la Cohésion des Territoires, Ministère de la Mer - Direction Interdépartementale des Routes Centre-Ouest",45.8544262114,1.24894834225,ETI,177.19675263019369,47.3326814781,0.654069551082,102020
2019HtSS-ZWeLz00,Marché,Services,Services de voyages,13/10/2020,32000.0,Ferme,Mairie de Pierrelaye,49.0190794714,2.1606870483,NC,53.54417157289048,48.9401779111,1.6830073805,102020
20202021S0025100,Marché,Services,Services d'impression et services connexes,07/10/2020,32000.0,Ferme,"Etablissements et organismes de l'enseignement supérieur, de la recherche et de l'innovation - UNIVERSITE CLERMONT AUVERGNE",45.7859001722,3.11559551839,PME,52.534527987871414,45.6732466106,3.57699825456,102020
20202020S1435400,Marché,Services,Services de prestations,02/10/2020,32000.0,Ferme,CHU ROUEN,49.4415068863,1.09373273216,PME,253.3384963020022,50.6317671102,3.04699299406,102020
20202020F1524500,Marché,Fournitures,Machines de métallurgie et pièces associées,01/10/2020,320000.0,Ferme,"Etablissements et organismes de l'enseignement supérieur, de la recherche et de l'innovation - Université de technologie Belfort-Montbéliard",47.5895885473,6.8703423258,PME,502.76797636228696,48.9595327185,2.53641870202,102020
20207jFpaC02PT00,Marché,Fournitures,Matériel de signalisation,16/10/2020,320000.0,Révisable,Syndicat Mixte Parc Routier de la Réunion,-20.9331856391,55.4471055195,ETI,15.832045552568957,-20.9441421191,55.3050347414,102020
2020dI33-ut1ag00,Marché,Services,Location de camions avec chauffeur,01/10/2020,320000.0,Ferme,Service de la Commande Publique,-21.3061462696,55.6419447038,PME,0.0,-21.3061462696,55.6419447038,102020
2021229410200,Marché,Services,Services d'impression et services connexes,05/10/2020,320000.0,Révisable,Budget principal,48.6293513055,2.44049035394,PME,768.1820439751926,48.3999000994,-4.5027702561,102020
201964thk8P5g000,Marché,Services,Services de réglementation des marchés financiers,22/10/2020,320000.0,Ferme,Autorité des marchés financiers,48.8682182328,2.34268958704,ETI,10.24378903086164,48.8983675206,2.25515424076,102020
2020130015872300,Marché,Services,"Services de réparation et d'entretien d'appareils de mesure, d'essai et de contrôle",09/10/2020,320000.0,Révisable,Ministère de l'Intérieur - SGAMI SUD - Marseille - BMP- DAFJ,43.344864211,5.39338098888,ETI,700.0007508484779,48.840040811,2.29268840406,102020
20199n4gscRchl00,Marché,Fournitures,Produits en béton,02/10/2020,320000.0,Ferme,Ville de Béziers,43.3475518983,3.23081153874,PME,0.0,43.3475518983,3.23081153874,102020
2019AOO2019-A100,Marché,Fournitures,Conteneurs à déchets,27/10/2020,320000.0,Révisable,COMMUNAUTE DE COMMUNES DE LA VALLEE DU,43.1909136268,6.06355075163,NC,4.44093859945734,43.1635876244,6.09295230135,102020
2020130015900200,Marché,Services,Services de réseaux informatiques,16/10/2020,320000.0,Révisable,"Ministère de la Transition Écologique, Ministère de la Cohésion des Territoires, Ministère de la Mer - Direction Interdépartementale des Routes Ouest",48.111571436,-1.68168588816,ETI,98.8243893189535,47.2246985502,-1.63426478543,102020
2020AC400E00,Marché,Travaux,Travaux d'aménagement du terrain,19/10/2020,3200000.0,Ferme,14 BUDGET PRINCIPAL,45.7860240236,4.92675965549,NC,11.665059730178237,45.7299437905,5.01600256178,102020
202019N0166-0001,Marché,Fournitures,Câblage de réseau,08/10/2020,3200000.0,Révisable,METROPOLE NICE COTE D'AZUR,43.7123384529,7.23750191149,PME,9.952032738850468,43.7848826685,7.18412298071,102020
2020UPbpoTWM7o00,Marché,Travaux,Travaux de couverture et de peinture de toiture,27/10/2020,3200000.0,Révisable,Mairie Saint-Maur-des-Fossés,48.7987986059,2.49441281984,NC,,,,102020
2020130015855800,Marché,Services,"Études de faisabilité, service de conseil, analyse",13/10/2020,3200000.0,Révisable,Ministère des armées - Etablissement du service d'infrastructure de la défense de Toulon - ESID Toulon,,,PME,,43.088993223,5.87078606863,102020
2020kebQ_bIJHO00,Marché,Services,"Services de propreté et d'hygiénisation en milieu urbain ou rural, et services connexes",05/10/2020,3200000.0,Ferme,Ville de Béziers,43.3475518983,3.23081153874,NC,28.37568436126118,43.3094309363,3.48454776797,102020
202060111901,Marché,Services,Services d'ingénierie géotechnique,30/10/2020,3201090.0,Ferme et actualisable,REGION-BUDGET REGIONAL,-20.9331856391,55.4471055195,PME,22.13700497150955,-21.2232456927,55.5586013062,102020
2019fEv4LQAW5I00,Marché,Services,Services d'architecte pour les bâtiments,07/10/2020,320500.0,Révisable,Mairie de Mons en Baroeul,50.6427234653,3.10704546553,PME,5.195921522255864,50.6322610395,3.15284231203,102020
20202020F1722100,Marché,Fournitures,Fournitures jetables pour restauration,28/10/2020,320560.0,Révisable,ASSISTANCE PUBLIQUE DES HOPITAUX DE MARSEILLE,43.2924013477,5.39786536432,PME,271.6790943432036,45.7016140067,4.94900275462,102020
2020100014885500,Marché,Services,Services d'assistance dans le domaine de l'ingénierie,28/10/2020,32075.0,Ferme et actualisable,"Ministère de la Transition Écologique, Ministère de la Cohésion des Territoires, Ministère de la Mer - Direction de l'Environnement de l'Aménagement et du Logement de la Réunion",-20.9331856391,55.4471055195,PME,0.0,-20.9331856391,55.4471055195,102020
2019V8F57913GF04,Marché,Travaux,"Travaux d'installation de matériel de chauffage, de ventilation et de climatisation",23/10/2020,320758.56,Révisable,BUDGET PRINCIPAL EXERCICE 2019,45.8544262114,1.24894834225,NC,0.0,45.8544262114,1.24894834225,102020
2020151030767100,Marché,Travaux,Travaux d'installation de chauffage électrique et d'autres équipements électriques de bâtiment,23/10/2020,32090.0,Ferme,"Ministère de l'Économie, des Finances et de la Relance - Direction départementale de Paris",48.8682182328,2.34268958704,PME,2.7589652206625073,48.8924795867,2.34788399022,102020
2018mCnkJEgcSX00,Marché,Services,Services d'assurance,22/10/2020,3212.62,Ferme et actualisable,Mairie d'Aubigny Sur Nere,47.4860698554,2.42075473503,ETI,344.1049376675317,46.3286026496,-0.464927924553,102020
2020151029085600,Marché,Travaux,Entretien des routes nationales,07/10/2020,321444.0,Révisable,"Ministère de la Transition Écologique, Ministère de la Cohésion des Territoires, Ministère de la Mer - Direction Interdépartementale des Routes Atlantique",44.8578964782,-0.57357535767,NC,6.395023194060009,44.8336874273,-0.521126433343,102020
2020pjM6ZEeCrx00,Marché,Travaux,Travaux de menuiserie,20/10/2020,32150.0,Ferme,ETBT du Château de Versailles,48.8022788923,2.11716530117,PME,448.5238231730468,45.782504698,4.8089966572,102020
20202021F0026100,Marché,Fournitures,"Équipements de laboratoire, d'optique et de précision (excepté les lunettes)",15/10/2020,32151.17,Ferme,"Institut national de recherche pour l’agriculture, l’alimentation et l’environnement",48.8562037309,2.3121193117,ETI,455.87986490734863,45.7016140067,4.94900275462,102020
202022600,Marché,Fournitures,Peintures,12/10/2020,32152.0,Révisable,INOLYA,49.1850685346,-0.370026383608,PME,5.038986552292138,49.207357405,-0.330362469163,102020
