2020wo7cEEPwuS00,Marché,Travaux,Travaux de menuiserie,01/09/2020,18473.0,Ferme,SEMINOR,49.7526272499,0.39606397889,NC,,,,092020
2020CUepwA-xuR00,Marché,Travaux,Travaux de menuiserie,10/09/2020,185000.0,Ferme,Université Paris-Saclay,48.7149937413,2.13911306427,PME,482.1041069964961,45.2769402194,4.79895120573,092020
2020M2022303,Marché,Travaux,Travaux de démolition,01/09/2020,185345.0,Révisable,ORLEANS METROPOLE,47.8824665066,1.91660961834,PME,25.1301790018349,48.1082237657,1.92392289186,092020
202020PA030101,Marché,Travaux,Travaux de construction de centres de secours des sapeurs-pompiers,25/09/2020,185360.75,Révisable,SDIS DES ARDENNES,49.7485363282,4.68592124661,PME,27.57616889759349,49.6969172776,4.92985871355,092020
2020BATLO0001505,Marché,Travaux,Travaux de construction,29/09/2020,185379.2,Ferme et actualisable,Budget principal,46.5622744929,3.32725048972,NC,79.72056580472648,46.4586224071,2.61387255567,092020
2020OO2kcdkeEm00,Marché,Services,Services spécialisés de transport routier de passagers,09/09/2020,18540.0,Révisable,DM - Direction des mobilités,45.7480493184,4.82567584415,PME,279.0307676622581,44.9245183348,2.4417949992,092020
2019l4mSsfP4-E00,Marché,Travaux,Travaux de construction,23/09/2020,18549.26,Ferme,Mairie de Saint Pierre D'Oleron,45.9395446749,-1.30528218812,PME,92.94235368776961,45.8071435076,-0.475375472609,092020
2019L5X61XbbQs00,Marché,Travaux,Travaux de construction,23/09/2020,18555.81,Ferme,Mairie de Saint Pierre D'Oleron,45.9395446749,-1.30528218812,PME,46.47435013965732,45.6345268167,-1.01823546885,092020
20202020S1342700,Marché,Services,"Services d'architecture, services de construction, services d'ingénierie et services d'inspection",03/09/2020,185640.0,Révisable,"Ministère de la Transition Écologique, Ministère de la Cohésion des Territoires, Ministère de la Mer - VOIES NAVIGABLES DE FRANCE",50.5291112881,2.64320584341,PME,184.84587673546895,48.8869811827,2.38492060382,092020
20202020T1505200,Marché,Travaux,Travaux de pose de sols,03/09/2020,185760.85,Ferme,CHU DIJON,47.3230744087,5.03738286925,PME,151.43108590939678,48.2968506353,4.07801333034,092020
202090qnhIAHMe00,Marché,Services,Services spécialisés de transport routier de passagers,09/09/2020,18585.0,Révisable,DM - Direction des mobilités,45.7480493184,4.82567584415,PME,279.0307676622581,44.9245183348,2.4417949992,092020
20202020F1221600,Marché,Services,,11/09/2020,185884.0,,Ministère des armées - Service d'Infrastructure de la Défense - DCSID,,,PME,,43.1364847512,5.93276630299,092020
20202020T1338600,Marché,Travaux,Travaux de menuiserie,01/09/2020,185955.0,Ferme et actualisable,CHI TOULON LA SEYNE,43.1364847512,5.93276630299,PME,8.658333871138355,43.1388519901,5.85450715581,092020
20202020F2249200,Marché,Fournitures,Prothèses vasculaires,28/09/2020,18600.0,Ferme,CHRU TOURS,47.3314668694,0.715972131571,PME,238.47464404003819,48.8231210367,2.26445901319,092020
202120023300,Marché,Services,Services d'analyse de données,10/09/2020,186000.0,Ferme,BUDGET PRINCIPAL CD65,43.2347953943,0.0657136709174,PME,0.0,43.2347953943,0.0657136709174,092020
2019oUmhWw3f8j00,Marché,Fournitures,"Matériel d'imagerie à usages médical, dentaire et vétérinaire",08/09/2020,186044.0,Révisable,CPAM du Rhône,45.7708803723,4.88922582274,PME,5.6201967774285295,45.820656077,4.8987353728,092020
20202020S1331400,Marché,Services,Services sylvicoles,02/09/2020,18605.0,Ferme,Ministère de l'agriculture et de l'alimentation - Direction régionale de La Réunion,-20.9331856391,55.4471055195,NC,22.13700497150955,-21.2232456927,55.5586013062,092020
2020I732-100,Marché,Fournitures,Eau potable,22/09/2020,186102.0,Ferme et actualisable,VILLE DE GOSIER,16.2250869819,-61.4693509551,GE,29.401806679413763,16.0453168325,-61.7188998823,092020
2020S01-202000,Marché,Services,Services de transport routier public,14/09/2020,186197.22,Révisable,VAL DE BRIEY,49.2560088051,5.97074822993,NC,29.804541842480774,49.1081027833,6.19595351042,092020
2019V9D0012AI03,Marché,Travaux,Travaux d'installation de systèmes d'alarme et d'antennes,10/09/2020,1862781.8,Révisable,EXERCICE 2020,43.6131750772,3.86941278925,NC,15.118146198193664,43.5930787077,4.00463218238,092020
20202021F0101200,Marché,Fournitures,Prothèses vasculaires,25/09/2020,186760.0,Ferme,CHRU TOURS,47.3314668694,0.715972131571,PME,214.0463566311254,48.7759550031,1.99412790053,092020
2019Ikd68thH0G00,Marché,Travaux,Installations mécaniques,23/09/2020,18700.0,Ferme,I RA CAO,45.7333494426,4.83733100241,PME,99.43375572166129,45.8636019563,3.9476907709,092020
2020802020700,Marché,Services,Services de maintenance préventive,09/09/2020,187110.0,Révisable,Ville de Fos-sur-Mer,43.4556743263,4.90422543761,ETI,670.0451610233989,48.9296428406,2.35946866986,092020
2020zDwjs5uoMI00,Marché,Services,Services de maintenance préventive,09/09/2020,187110.0,Révisable,Mairie de Fos sur Mer,43.4556743263,4.90422543761,ETI,670.0451610233989,48.9296428406,2.35946866986,092020
2019OkSQ23ZUWH00,Marché,Services,Services d'assurance dommages ou pertes,14/09/2020,187414.0,Révisable,SDE 03,46.563721028,3.38024682344,ETI,128.36617146578496,47.1607460183,2.38661400781,092020
202073416200,Marché,Travaux,Réparation et entretien d'équipements,08/09/2020,187422.0,Ferme et actualisable,EVOLEA,46.5622744929,3.32725048972,ETI,201.37367135195876,45.8391553925,4.99733131758,092020
20202020F1403300,Marché,Fournitures,Spectromètre de masse,02/09/2020,187427.39,Ferme,"Etablissements et organismes de l'enseignement supérieur, de la recherche et de l'innovation - UNIVERSITE DE PAU ET DU PAYS DE L'ADOUR",43.3201640732,-0.3496692279,ETI,659.2245621011052,48.6811729227,2.1853558178,092020
202020010501,Marché,Travaux,Travaux d'isolation thermique,17/09/2020,187456.2,Ferme,CC TOURAINE EST VALLEES,47.3826049148,0.841034598009,PME,55.63519925266127,47.8270323239,1.07130836243,092020
2020130015819800,Marché,Services,Services de réparation et d'entretien d'installations de bâtiments,23/09/2020,187496.2,Révisable,Ministère des armées - Etablissement du service d'infrastructure de la défense de Lyon - ESID Lyon,,,GE,,43.5959710776,1.43229743595,092020
20202020T1461600,Marché,Travaux,Travaux de maçonnerie et de briquetage,11/09/2020,18752.31,Ferme,CHU ANGERS,47.4766284713,-0.556089456786,GE,120.1216738838593,47.2744152089,-1.62319145717,092020
2020fyrewPefj700,Marché,Travaux,Travaux de construction,28/09/2020,18753.0,Révisable,Service Responsable d'Affaires-Responsable de la Conservation du Patrimoine (RA-RCP),47.2321613301,-1.54797539458,NC,9.577530771797647,47.2246985502,-1.63426478543,092020
2020pRPE1YlQ-c00,Marché,Travaux,Travaux de construction,29/09/2020,18760.0,Ferme,VOSGELIS,48.162954598,6.47953209434,PME,26.338846835322464,48.3461560636,6.63170696202,092020
20202020S1404200,Marché,Services,Services d'abonnement,14/09/2020,1876838.91,Ferme,"Etablissements et organismes de l'enseignement supérieur, de la recherche et de l'innovation - UNIVERSITE CLAUDE BERNARD LYON 1",45.7708803723,4.88922582274,NC,,,,092020
20202020T1920000,Marché,Travaux,Travaux de pose de revêtements de sols,23/09/2020,18769.6,Ferme,Institut National de la Recherche Agronomique,48.8562037309,2.3121193117,PME,204.9262320734679,48.2968506353,4.07801333034,092020
202005602,Marché,Travaux,Travaux de construction complète ou partielle et travaux de génie civil,29/09/2020,187880.0,Révisable,BUDGET PRINCIPAL,43.3201640732,-0.3496692279,ETI,93.4984457050604,43.1875987634,-1.18464257697,092020
202013B454L05D00,Marché,Services,Services de transport routier public,28/09/2020,188000.0,Révisable,Mauges Communauté,,,ETI,,47.126127203,-0.998170983295,092020
202013B454L02D00,Marché,Services,Services de transport routier public,28/09/2020,188000.0,Révisable,Mauges Communauté,,,ETI,,47.126127203,-0.998170983295,092020
202013B454L03D00,Marché,Services,Services de transport routier public,28/09/2020,188000.0,Révisable,Mauges Communauté,,,ETI,,47.4738755133,-0.48580477673,092020
202013B454L01D00,Marché,Services,Services de transport routier public,28/09/2020,188000.0,Révisable,Mauges Communauté,,,ETI,,47.4738755133,-0.48580477673,092020
202013B454L04D00,Marché,Services,Services de transport routier public,28/09/2020,188000.0,Révisable,Mauges Communauté,,,ETI,,47.1204424809,-0.635884056496,092020
2019tJp4SUmm9m00,Marché,Travaux,Travaux de façade,15/09/2020,188365.0,Ferme et actualisable,Grand Paris Sud Est Avenir,48.783689162,2.4549804713,PME,4.676092199804481,48.742053977,2.44909554798,092020
2020151023645400,Marché,Services,"Services récréatifs, culturels et sportifs",18/09/2020,18860.0,Révisable,Ministère de l'Intérieur -  Pays de la Loire,47.2321613301,-1.54797539458,PME,6.1916202251865275,47.1765537278,-1.54989963253,092020
2020100014787200,Marché,Services,Services de conseil en matière de santé et de sécurité,07/09/2020,1887.5,Révisable,Ministère des armées - Etablissement du service d'infrastructure de la défense de Metz - ESID Metz,,,NC,,,,092020
2020Ymr7wD26jV00,Marché,Travaux,Travaux d'installations électriques,09/09/2020,18873.0,Ferme,Direction de la Maintenance,48.8348302792,2.42102904428,PME,14.109100275202113,48.9566497407,2.38543561127,092020
20201Jrjd4NMEy00,Marché,Travaux,Travaux de construction de maisons,28/09/2020,18875.7,Ferme et actualisable,Sèvre Loire Habitat,47.0458179875,-0.877097655444,PME,36.64307002269011,46.8726513804,-0.595262509605,092020
159903096860500,Marché,Travaux,Travaux de construction de bâtiments,02/09/2020,18879.0,Ferme,Rodez Agglomération,44.358571606,2.56667306391,PME,37.731102440422504,44.3078724765,2.22928263195,092020
20206ZAtctBlqj00,Marché,Fournitures,Machines agricoles,29/09/2020,18900.0,Ferme,ETBT du Château de Versailles,48.8022788923,2.11716530117,ETI,137.01008213395588,48.571690185,3.33432475308,092020
202010cUX-oVE-00,Marché,Travaux,Travaux de gros œuvre,29/09/2020,18919.45,Ferme et actualisable,Conseil Départemental de la Corrèze,45.273427808,1.76345249153,PME,51.85335513315545,45.2533125641,1.29494709575,092020
2020S2CD9V4rDN00,Marché,Services,Services d'assurance dommages ou pertes,11/09/2020,18925.0,Révisable,SDIS 90 Territoire de Belfort,47.6463850599,6.84549855352,GE,735.8385380884463,47.9889433531,0.20002401353,092020
20202019TX030200,Marché,Travaux,Travaux de construction de maisons de retraite,07/09/2020,1893400.0,Révisable,EHPAD MELLET MANDARD,45.4903436831,4.25050786682,PME,22.161278752279127,45.6220762846,4.09994178018,092020
20202019TX030201,Marché,Travaux,Travaux de construction de maisons de retraite,11/09/2020,1893400.0,Révisable,EHPAD MELLET MANDARD,45.4903436831,4.25050786682,PME,22.161278752279127,45.6220762846,4.09994178018,092020
2019lwSJIS56Oh00,Marché,Travaux,Travaux de construction complète ou partielle et travaux de génie civil,03/09/2020,18939.0,Ferme,CDA SAINTES - COMMUNAUTE AGGLOMERATION,45.7423034662,-0.649840149818,PME,26.59122415302418,45.6328376389,-0.863590382715,092020
2020M7b7Et3M_N00,Marché,Services,"Services de technologies de l'information, conseil, développement de logiciels, internet et appui",18/09/2020,189480.0,Ferme,ATMB - DSTI - Direction des systèmes et technologie de l'information,46.0739029681,6.40835573143,GE,554.3530173801602,48.7839097374,2.19723411662,092020
2020AO0010201,Marché,Fournitures,Véhicules à moteur,17/09/2020,189515.4,Ferme et actualisable,SDIS DU PAS DE CALAIS BUDGET PRINCIPAL,50.3081347422,2.81107875678,ETI,5.336521434629204,50.2899236486,2.76642705397,092020
20202020F2243700,Marché,Fournitures,Prothèses vasculaires,28/09/2020,189600.0,Ferme,CHRU TOURS,47.3314668694,0.715972131571,ETI,512.0656065881248,45.7541566032,5.06691649154,092020
2020130015778300,Marché,Services,"Services de technologies de l'information, conseil, développement de logiciels, internet et appui",01/09/2020,1897689.88,Ferme,Ministère de l'Europe et des Affaires étrangères -,48.8562037309,2.3121193117,GE,472.64181258426,47.2246985502,-1.63426478543,092020
2020i9pZkeZgH900,Marché,Travaux,Travaux de construction de maisons,28/09/2020,18989.74,Ferme et actualisable,Sèvre Loire Habitat,47.0458179875,-0.877097655444,PME,26.461218698079595,47.0059352266,-0.641182697402,092020
2020529502,Marché,Travaux,Travaux de rénovation de ponts,23/09/2020,189913.09,Ferme,REGION-BUDGET REGIONAL,-20.9331856391,55.4471055195,NC,8538.282220338879,48.7839097374,2.19723411662,092020
2020202000601,Marché,Services,Services d'assistance dans le domaine de l'ingénierie,08/09/2020,189988.75,Révisable,LE PUY EN VELAY,45.02773512,3.89608931701,NC,73.86490956672083,45.4946738952,4.37188069146,092020
20202020T1481900,Marché,Travaux,Travaux de construction,22/09/2020,189997.0,Ferme et actualisable,Chambres de Commerce et d'Industrie,43.7123384529,7.23750191149,NC,10.430592738420065,43.671853349,7.1522919117,092020
20202020S1547300,Marché,Services,Services de débardage,25/09/2020,1900.0,Ferme,Ministère de l'agriculture et de l'alimentation - Direction territoriale Centre Ouest Aquitaine,47.9321365141,2.01838531803,PME,211.69254245589235,46.1545548847,2.70258695892,092020
2020gmPd2xPev400,Marché,Services,Services divers d'ingénierie,23/09/2020,19000.0,Ferme et actualisable,SIAEPA du Crevon,49.4525406881,1.29375600217,NC,19.59469354214063,49.4744089013,1.11792062882,092020
2020O-w6mAri6-00,Marché,Travaux,Travaux de construction,23/09/2020,19000.0,Révisable,Mairie de St  Herblain,47.2246985502,-1.63426478543,GE,232.28522224243974,46.5485986157,0.353146336261,092020
20202020T1537700,Marché,Travaux,Travaux de peinture,14/09/2020,19000.0,Révisable,Ministères sociaux,50.6089544032,3.02026471497,PME,85.10458856126792,50.9822230822,2.3483630668,092020
20202020S1366300,Marché,Services,Services de photogrammétrie,11/09/2020,19000.0,Ferme,Ministère de l'agriculture et de l'alimentation - Direction territoriale Grand Est,48.5716343863,7.76783353204,PME,437.7634893859512,45.1821782198,5.72099089704,092020
2019CHj3XMBeFX00,Marché,Travaux,"Travaux d'installation de matériel de chauffage, de ventilation et de climatisation",04/09/2020,190000.0,Révisable,Ardèche Habitat,45.2462974654,4.65115146795,PME,0.0,45.2462974654,4.65115146795,092020
2020CINEHTL1300,Marché,Travaux,Travaux de construction de cinémas,15/09/2020,190000.0,Ferme,COMMUNAUTE DE COMMUNES VALS DE SAINTON,45.9430620119,-0.520275049856,NC,452.87994196213333,48.8873739998,2.30681348993,092020
2019kIh0__bfzN00,Marché,Travaux,Travaux de plomberie,04/09/2020,190000.0,Révisable,Ardèche Habitat,45.2462974654,4.65115146795,NC,58.53079819806876,44.7218752388,4.59409820072,092020
202011B457L00D00,Marché,Travaux,Équipement de station d'épuration,03/09/2020,190205.0,Ferme et actualisable,Mauges Communauté,,,NC,,43.3127155398,5.36343891881,092020
2020202007700,Marché,Travaux,Travaux de menuiserie,29/09/2020,190727.4,Ferme,REMIREMONT COMMUNE,48.0014591284,6.58149912599,PME,17.353512462615463,47.9698395822,6.42779930705,092020
2020151024115800,Marché,Fournitures,Véhicules utilitaires,18/09/2020,19089.67,Ferme,"Ministère de l'Économie, des Finances et de la Relance - DI ANTILLES GUYANE",14.6408734458,-61.069176472,ETI,8.472233380404282,14.6246455763,-60.9935529523,092020
2018-iSIbyxgHt00,Marché,Travaux,Travaux d'installation d'ascenseurs,04/09/2020,19100.0,Révisable,Ardèche Habitat,45.2462974654,4.65115146795,NC,477.640084052501,48.7839097374,2.19723411662,092020
2020V4xqsMfFNB00,Marché,Fournitures,Matériel audiovisuel,04/09/2020,19115.28,Ferme,SPL OCCITANIE EVENTS,43.5613907247,3.95247446918,PME,159.9152028330574,43.5360639608,5.39837823449,092020
2020TC01L200,Marché,Services,Services de nettoyage de bâtiments,14/09/2020,191309.61,Ferme,AGGLOMERATION D AGEN,44.2024640047,0.625844587118,PME,0.0,44.2024640047,0.625844587118,092020
2019lok8ONuLRd00,Marché,Travaux,Travaux de remise en état,25/09/2020,19135.0,Révisable,Mairie Saint-Maur-des-Fossés,48.7987986059,2.49441281984,PME,16.995138962074186,48.7242545788,2.36024590799,092020
2020151021640300,Marché,Travaux,Travaux d'amélioration de l'environnement,15/09/2020,191378.76,Révisable,"Ministère de la Transition Écologique, Ministère de la Cohésion des Territoires, Ministère de la Mer - Direction Régionale Environnement, Aménagement et Logement Occitanie",43.5959710776,1.43229743595,NC,430.9864661442663,43.5707734297,5.32977413895,092020
20202020TRX00500,Marché,Travaux,Travaux de transformation de bâtiments,21/09/2020,191530.0,Ferme et actualisable,Ville de St Laurent du MARONI,4.94626572703,-53.9779657738,PME,0.0,4.94626572703,-53.9779657738,092020
20202020F2247500,Marché,Fournitures,Prothèses vasculaires,25/09/2020,191547.84,Ferme,CHRU TOURS,47.3314668694,0.715972131571,NC,237.50692349282122,48.8365394869,2.2389245247,092020
2020Zcm3E9zH4d00,Marché,Fournitures,"Vêtements professionnels, vêtements de travail spéciaux et accessoires",22/09/2020,19184.29,Révisable,CROUS de Lyon,45.7333494426,4.83733100241,PME,14.493404559848422,45.6651181529,4.94910837514,092020
2020SWDN6Cv-X500,Marché,Services,Services spécialisés de transport routier de passagers,04/09/2020,19200.0,Révisable,DM - Direction des mobilités,45.7480493184,4.82567584415,ETI,132.74658673752432,44.5538701101,4.74888787641,092020
20202020S1414900,Marché,Services,Services d'exploitation forestière,23/09/2020,19200.0,Révisable,Ministère de l'agriculture et de l'alimentation - Direction territoriale Grand Est,48.5716343863,7.76783353204,PME,28.099392950175332,48.7650321647,7.60250566865,092020
2020rW08e2OwSz00,Marché,Services,Réalisation et entretien d'espaces verts,07/09/2020,19200.0,Révisable,HAUTE CORREZE COMMUNAUTE,45.5501002764,2.30483831309,PME,22.315529116799997,45.4306367599,2.46697614288,092020
202020N0022-0001,Marché,Services,Services de formation du personnel,09/09/2020,192000.0,Révisable,METROPOLE NICE COTE D'AZUR,43.7123384529,7.23750191149,NC,10.430592738420065,43.671853349,7.1522919117,092020
20202020F2250400,Marché,Fournitures,Prothèses vasculaires,25/09/2020,192000.0,Ferme,CHRU TOURS,47.3314668694,0.715972131571,NC,250.0491375681111,48.8223214828,2.40796998952,092020
20202020F2252200,Marché,Fournitures,Prothèses vasculaires,28/09/2020,1920000.0,Ferme,CHRU TOURS,47.3314668694,0.715972131571,ETI,219.8806848020314,48.7728906673,2.07603849225,092020
20202020S1331300,Marché,Services,Services sylvicoles,02/09/2020,19220.0,Ferme,Ministère de l'agriculture et de l'alimentation - Direction régionale de La Réunion,-20.9331856391,55.4471055195,NC,22.13700497150955,-21.2232456927,55.5586013062,092020
2020151022484700,Marché,Travaux,Travaux de couverture métallique,04/09/2020,19238.34,Ferme et actualisable,Ministère des armées - Direction d'infrastructure de la défense de Saint-Denis - DID Saint Denis,,,PME,,-20.9441421191,55.3050347414,092020
20202020F2249400,Marché,Fournitures,Prothèses vasculaires,25/09/2020,19246.25,Ferme,CHRU TOURS,47.3314668694,0.715972131571,NC,250.0491375681111,48.8223214828,2.40796998952,092020
20206H-ifPmaO400,Marché,Travaux,Travaux de gros œuvre,29/09/2020,19246.66,Ferme et actualisable,Conseil Départemental de la Corrèze,45.273427808,1.76345249153,PME,30.662407520816092,45.1433810866,1.51897708197,092020
20202020F1490100,Marché,Fournitures,Équipement de restauration,25/09/2020,19249.0,,CHRU NANCY,48.6900671002,6.17594832427,PME,20.775572031833896,48.834239592,6.05565993435,092020
20202020F2254100,Marché,Fournitures,Prothèses vasculaires,29/09/2020,19250.0,Ferme,CHRU TOURS,47.3314668694,0.715972131571,ETI,238.43346028984377,48.7571298891,2.32570690794,092020
20202020S0607700,Marché,Services,Services de développement de logiciels comptables,17/09/2020,192600.0,Ferme,CD95 - Conseil départemental du Val d'Oise,49.0400551805,2.05074797264,ETI,27.555292214208695,48.8983675206,2.25515424076,092020
2020151024667500,Marché,Travaux,Réparation de toiture,17/09/2020,193101.0,Ferme et actualisable,Ministère de la Justice  - Antenne régionale de l'équipement de Toulouse,43.5959710776,1.43229743595,PME,33.48592623186969,43.7593774994,1.68659283376,092020
202019N0843-0102,Marché,Travaux,Installation de panneaux de signalisation,14/09/2020,193342.9,Ferme,METROPOLE NICE COTE D'AZUR,43.7123384529,7.23750191149,PME,243.7082583496948,44.0592303477,5.06125312911,092020
20202020T1346600,Marché,Travaux,Travaux de charpente,03/09/2020,193366.0,Ferme,ANDRA - Agence Nationale pour la gestion des Déchets Radioactifs,48.7682137464,2.26375687994,ETI,55.13670545368131,48.5243486755,2.69789080689,092020
20202020T1537900,Marché,Travaux,Travaux de plomberie,14/09/2020,193383.0,Révisable,Ministères sociaux,50.6089544032,3.02026471497,PME,88.97281720322026,50.7572781706,2.22958579254,092020
2020cLrGWzkxK700,Marché,Travaux,Travaux d'installation de menuiseries non métalliques,08/09/2020,19345.16,Révisable,Mairie d'Annonay,45.2462974654,4.65115146795,PME,51.927240415606384,45.4903436831,4.25050786682,092020
20202020S1463700,Marché,Services,Réalisation et entretien d'espaces verts,25/09/2020,193562.0,Ferme et actualisable,"Ministère de la Transition Écologique, Ministère de la Cohésion des Territoires, Ministère de la Mer - Centre en Route de la Navigation Aérienne Ouest",48.3840609678,-4.31390588983,NC,20.958641763585025,48.3999000994,-4.5027702561,092020
20202020T2356800,Marché,Travaux,Travaux de revêtement,16/09/2020,19364.0,Ferme et actualisable,Ministères sociaux,47.2551269927,6.0192810348,PME,86.83738507335325,47.4910471082,6.7682064721,092020
20202020T2392000,Marché,Travaux,Travaux de couverture et travaux d'autres corps de métier spécialisés,16/09/2020,194000.0,Ferme,"Ministère de la Transition Écologique, Ministère de la Cohésion des Territoires, Ministère de la Mer - Centre d'Etudes et d'Expertise sur les Risques, l'Environnement, la Mobilité et l'Aménagement",45.7345274274,4.91192378092,NC,592.1188355489537,44.872035748,-0.372192330388,092020
201813800,Marché,Fournitures,Réseau de communications,09/09/2020,194000.0,Ferme,VILLE DE VANVES,48.8215811431,2.28726066648,NC,18.387914692829145,48.8631652232,2.4482059517,092020
