20202020F1972100,Marché,Fournitures,Ordinateurs portables,30/06/2020,54912.0,Ferme,"Ministère de la Transition Écologique, Ministère de la Cohésion des Territoires, Ministère de la Mer - Agence Nationale pour la Garantie des Droits des Mineurs",48.8591103086,2.38017728226,PME,71.91962413509735,49.4363296139,2.08715087996,062020
2020CCPV14000,Marché,Travaux,Travaux d'entretien routier,30/06/2020,549261.36,Révisable,CCPV,49.6661774903,1.9349485908,ETI,44.536301812448244,49.9170178098,1.62108036825,062020
2020sd9LNyuLJl00,Marché,Fournitures,Équipement de cuisine,16/06/2020,54932.0,Ferme,CROUS de Lyon,45.7333494426,4.83733100241,PME,17.254756532248035,45.579478328,4.81446848749,062020
20202020S0909100,Marché,Services,"Études de faisabilité, service de conseil, analyse",08/06/2020,54960.0,Ferme,"Institut national de recherche pour l’agriculture, l’alimentation et l’environnement",48.8562037309,2.3121193117,GE,565.277449590335,47.6989621985,-2.66560895074,062020
20202020T0979600,Marché,Travaux,Travaux d'étanchéification,26/06/2020,54981.87,Révisable,"Etablissements et organismes de l'enseignement supérieur, de la recherche et de l'innovation - Université Clermont Auvergne - Direction de l'Immobilier",45.7859001722,3.11559551839,NC,6.357182326473382,45.8281778597,3.15431364597,062020
2020WTOx1nHbRI00,Marché,Fournitures,Produits de nettoyage et produits à polir,08/06/2020,5500.0,Révisable,Mairie de l'Etang-Sale,-21.2492112938,55.366954369,ETI,20.549851426281833,-20.9441421191,55.3050347414,062020
2019TITOQW0z8Y00,Marché,Services,Services d'animation pour enfants,16/06/2020,5500.0,Ferme,Mairie de Calais,50.9500555648,1.87591279453,PME,0.0,50.9500555648,1.87591279453,062020
2019z_HhkPErSN00,Marché,Travaux,Travaux de terrassement,05/06/2020,5500.0,Ferme et actualisable,Communauté de communes Baugeois Vallée,47.5453879308,-0.0992597718373,PME,23.364855990028396,47.5073593583,0.108547626079,062020
20202021S0001000,Marché,Services,Location d'autobus et d'autocars avec chauffeur,09/06/2020,55000.0,Révisable,VILLE DE SAINT-MALO,48.6397466972,-1.98082436999,NC,67.43582586423433,48.111571436,-1.68168588816,062020
20202020F0924000,Marché,Fournitures,Réactifs de laboratoire,24/06/2020,550000.0,Ferme,CHRU NANCY,48.6900671002,6.17594832427,NC,421.9887824514867,48.8282706469,2.362358986,062020
2020202002L100,Marché,Services,Services d'agences de rédaction,22/06/2020,550000.0,Révisable,ANCV,48.9903286771,2.38130895683,ETI,18.91737763215002,48.8223214828,2.40796998952,062020
2020BAT200700400,Marché,Fournitures,Serrurerie,22/06/2020,55104.0,Révisable,COMMUNE DE LE PONT DE CLAIX,45.1256913332,5.70166045833,NC,8.946897878398774,45.1752846004,5.76552012882,062020
2020151006123600,Marché,Fournitures,Produits chimiques variés,05/06/2020,5513.25,Ferme,Ministère des armées - Structure Spécialisée d'achat et de Mandatement 33 504,,,PME,,44.7934650068,-0.819175449287,062020
20202020F1178700,Marché,Fournitures,Livres scolaires,29/06/2020,5520.0,Révisable,"Ministère de l'éducation nationale et de la jeunesse et Ministère de l'enseignement supérieur, de la recherche et de l'innovation - Centre national d'enseignement à distance",46.6518315191,0.362203052781,GE,327.52500088543604,48.8491121687,2.33284677548,062020
2020M02600,Marché,Services,"Services d'architecture, d'ingénierie et de métrage",05/06/2020,55200.0,Ferme,BUDGET DEPARTEMENTAL,45.7859001722,3.11559551839,PME,91.26740441259714,46.563721028,3.38024682344,062020
20182140040500,Marché,Travaux,Travaux de construction de bâtiments,27/06/2020,55263.4,Révisable,COMMUNE DE VAY,47.5448484731,-1.70770267947,PME,244.66660517132786,46.6318389647,0.305088627554,062020
20202020.009L200,Marché,Fournitures,Peinture de marquage routier,23/06/2020,55299.54,Révisable,VILLE DU LAMENTIN - 21972213900017,14.6246455763,-60.9935529523,NC,8.472233380404282,14.6408734458,-61.069176472,062020
20202020F2004700,Marché,Fournitures,Analyseurs de gaz,10/06/2020,55317.27,Ferme,"Institut national de recherche pour l’agriculture, l’alimentation et l’environnement",48.8562037309,2.3121193117,NC,,,,062020
2019fj1YRzZ7z800,Marché,Travaux,Travaux de façade,02/06/2020,5537.0,Ferme,IN'LI GRAND EST,48.5716343863,7.76783353204,GE,610.6869034992063,48.8983675206,2.25515424076,062020
202018N0667-0004,Marché,Travaux,Travaux d'assainissement,22/06/2020,5540000.0,Révisable,METROPOLE NICE COTE D'AZUR,43.7123384529,7.23750191149,GE,0.0,43.7123384529,7.23750191149,062020
2019-11-0302,Marché,Travaux,Travaux de construction de gymnases,22/06/2020,554782.74,Révisable,COMMUNAUTE DE COMMUNES COEUR DE GARONN,43.2212248881,1.09319110133,PME,206.29877335697864,44.358571606,2.56667306391,062020
20202020T1021500,Marché,Travaux,Réparation et entretien de toiture,15/06/2020,5548000.0,Révisable,CHRU TOURS,47.3314668694,0.715972131571,NC,7.731610813372015,47.3980773574,0.696151819266,062020
20202020T1021600,Marché,Travaux,Réparation et entretien de toiture,12/06/2020,5548000.0,Révisable,CHRU TOURS,47.3314668694,0.715972131571,PME,12.652283161068434,47.3373769629,0.60170367658,062020
20202020F1104500,Marché,Fournitures,Équipement d'ophthalmologie,22/06/2020,55500.0,Ferme,CHRU TOURS,47.3314668694,0.715972131571,PME,478.4047270491569,45.8310057435,4.77089761479,062020
20202020F1023500,Marché,Fournitures,"Fournitures électroniques, électromécaniques et électrotechniques",05/06/2020,55535.0,Révisable,CHRU TOURS,47.3314668694,0.715972131571,PME,217.00466224068467,48.9479265922,1.81350083131,062020
2020_femlN6eaz00,Marché,Services,Services de nettoyage de bureaux,25/06/2020,55578.0,Révisable,SIREDOM,48.5968549847,2.424435968,PME,13.03532960397512,48.632290703,2.31206815278,062020
2020M16061-0203,Marché,Travaux,Station de traitement des eaux usées,18/06/2020,556246.75,Ferme et actualisable,SYDEC,43.8994418261,-0.490443107618,PME,18.403711942212794,43.9876294775,-0.349660934428,062020
20202020S2397700,Marché,Services,Services de contrôle légal des comptes,15/06/2020,55800.0,Ferme et actualisable,Chambres de Commerce et d'Industrie,43.64120757,1.38004602326,GE,592.8760415658683,48.8983675206,2.25515424076,062020
20202020F0936400,Marché,Fournitures,Matériel informatique,19/06/2020,55825.0,Ferme,"Etablissements et organismes de l'enseignement supérieur, de la recherche et de l'innovation - UNIVERSITE DE REIMS CHAMPAGNE-ARDENNE",49.2517771432,4.03968745396,PME,706.4804910054293,44.8578964782,-0.57357535767,062020
20202020S0873300,Marché,Services,Services de conseil et d'évaluation,10/06/2020,55850.0,Ferme,"Ministère de la Transition Écologique et Solidaire, Ministère de la Cohésion des Territoires - Agence de l'Eau Loire Bretagne",47.8824665066,1.91660961834,ETI,4.310737462497047,47.854897242,1.88921777468,062020
20202020S1611700,Marché,Services,Services d'études,23/06/2020,55900.0,Ferme,Ministères sociaux,45.7533230296,4.86924368009,PME,439.9240605224393,48.8282706469,2.362358986,062020
2020NXzehdWYjg00,Marché,Travaux,Travaux d'entretien routier,22/06/2020,55907.0,Ferme et actualisable,COMMUNE DE SAINT ANGEL,45.4943755953,2.23176026559,PME,32.05599575587532,45.2187973874,2.3165802982,062020
20202019EAUTr400,Marché,Travaux,Travaux de remise à neuf de conduites d'eau,08/06/2020,55915.9,Ferme,ST HONORE EAU,46.8997995504,3.85354207794,ETI,141.434449327911,45.9271841249,4.67968298625,062020
2019FSmKcuEdue00,Marché,Travaux,Travaux de restructuration,02/06/2020,56000.0,Révisable,SDIS 33 Gironde,44.8578964782,-0.57357535767,PME,14.270996307948138,44.760310031,-0.657279122002,062020
20202020S0386900,Marché,Services,"Services d'architecture, services de construction, services d'ingénierie et services d'inspection",29/06/2020,56000.0,Révisable,VILLE D'ALFORTVILLE,48.7960818608,2.42143357065,PME,4.309861221302591,48.8348302792,2.42102904428,062020
20202020F0812900,Marché,Fournitures,Réfrigérateurs à gaz,10/06/2020,56000.0,Ferme,"Etablissements et organismes de l'enseignement supérieur, de la recherche et de l'innovation - CONSERVATOIRE NATIONAL DES ARTS ET METIERS",48.8628851439,2.35993164253,NC,40.9575195656133,48.9780883265,2.008127528,062020
20202020S0964400,Marché,Services,Services liés à la production agricole,22/06/2020,56000.0,Ferme,"Etablissements et organismes de l'enseignement supérieur, de la recherche et de l'innovation - UNIVERSITE DE BORDEAUX",44.8578964782,-0.57357535767,NC,13.495829544413743,44.791939845,-0.675986855592,062020
202020A0010200,Marché,Fournitures,Disques numériques polyvalents (DVD),25/06/2020,56000.0,Ferme,COMMUNE DE FRANCHEVILLE,45.7375568707,4.7558574611,PME,453.519642047826,48.971575438,2.25336384763,062020
20200ALdeaDruu00,Marché,Fournitures,Tracteurs d'occasion,05/06/2020,56000.0,Ferme,SEGAPAL MAPA-OcPVCMR,45.7860240236,4.92675965549,PME,33.58256453296359,45.5896332782,4.69564332028,062020
202030177700,Marché,Fournitures,Médicaments du système génito-urinaire et hormones sexuelles,10/06/2020,56000.0,Révisable,BUDGET PRINCIPAL,-20.9331856391,55.4471055195,ETI,6.715825774837828,-20.9945145041,55.3978899478,062020
202019V1850-0001,Marché,Fournitures,Machines à coudre,03/06/2020,56000.0,Révisable,MAIRIE DE NICE,43.7123384529,7.23750191149,PME,0.0,43.7123384529,7.23750191149,062020
2020003-202000,Marché,Services,Prestations de services pour la collectivité,03/06/2020,56000.0,Ferme et actualisable,VILLE DE BLOIS,47.5814306941,1.30596722868,PME,68.67753428768697,47.9475616949,1.8059625162,062020
2020MVEHIC20400,Marché,Fournitures,Véhicules à moteur,16/06/2020,56000.0,Révisable,SYDEC,43.8994418261,-0.490443107618,ETI,5.029651916262229,43.8706525231,-0.525501123323,062020
2020010900,Marché,Fournitures,Mobilier,26/06/2020,560000.0,Ferme,Région Normandie,49.1850685346,-0.370026383608,PME,0.0,49.1850685346,-0.370026383608,062020
20202019150202,Marché,Services,Services de téléphonie et de transmission de données,11/06/2020,560000.0,Ferme,DEPARTEMENT DU VAR,43.1364847512,5.93276630299,GE,750.2967822328669,48.840040811,2.29268840406,062020
2019EdhRsXCwDn00,Marché,Services,Services d'impression et services connexes,09/06/2020,560000.0,Révisable,Mairie de Valenton,48.7529618253,2.46164979002,PME,14.707649518304697,48.8129348783,2.34310649123,062020
20202020S0933800,Marché,Services,Services internet,24/06/2020,560000.0,Révisable,Office National d'Information sur les Enseignements et les Professions,48.8339644354,2.63428680138,ETI,39.39367755922757,48.9157198373,2.28764873642,062020
2018NFoayK7K0x00,Marché,Services,Services de télécommunications,03/06/2020,5600000.0,Révisable,Agence de services et de paiement - ASP,45.8544262114,1.24894834225,GE,349.4011849335389,48.8365394869,2.2389245247,062020
20199L6EyBO2Zd00,Marché,Services,Services d'impression et de livraison,18/06/2020,560487.0,Révisable,UCANSS,48.8635257742,2.40121168869,ETI,173.12663935748012,47.4025964667,2.94243562953,062020
2020151013098000,Marché,Services,,29/06/2020,56052.88,Ferme et actualisable,Ministère de la Justice  - Direction interrégionale des services pénitentiaires de Toulouse,43.5959710776,1.43229743595,GE,429.84713767365724,43.3654982005,5.31265000369,062020
2019LC4rdfVM4F00,Marché,Services,Logiciels et systèmes d'information,18/06/2020,56083.0,Révisable,Mairie de Ville d'Avray,48.8214636663,2.17554880347,PME,444.5384162366171,47.2029731421,-1.49984554901,062020
201910Lot1200,Marché,Fournitures,Revêtement métallique,15/06/2020,56139.2,Ferme,MESANGER,47.4286596386,-1.2256504678,PME,48.05656475394895,47.0542979661,-1.00909493711,062020
20202020T1636300,Marché,Travaux,"Travaux d'installation de matériel de chauffage, de ventilation et de climatisation",02/06/2020,562469.0,Ferme,"Etablissements et organismes de l'enseignement supérieur, de la recherche et de l'innovation - UNIVERSITE LE HAVRE NORMANDIE",49.4965847516,0.140273146733,NC,101.9774679372791,49.4244508808,1.05966183652,062020
159221041489400,Marché,Travaux,Travaux de charpente et de couverture et travaux connexes,26/06/2020,56271.0,Ferme et actualisable,SDIS 34,43.663798664,3.72843489659,ETI,161.2277369464123,43.2093616677,2.34379884342,062020
2019E_zruCysWK00,Marché,Fournitures,Arbre de Noël,11/06/2020,56299.0,Ferme,Mairie de Calais,50.9500555648,1.87591279453,PME,876.2186331309942,43.8792387371,5.38850102897,062020
20190133fe500400,Marché,Services,Services de colonies de vacances,08/06/2020,56400.0,Révisable,ville de Houilles,48.9267335299,2.18659874733,PME,17.58367910909164,48.8769868607,2.33753841595,062020
2019IcqpTludYR00,Marché,Travaux,Travaux d'installation d'ascenseurs,30/06/2020,56400.0,Ferme,CDC Habitat Social DIR Sud-Ouest,44.8889230081,-0.600409986888,NC,11.011945308034658,44.8323242505,-0.682089528902,062020
2020ENDUISAGE301,Marché,Fournitures,Enduit superficiel,30/06/2020,56415.0,Ferme,COMMUNAUTE DE COMMUNES SEZANNE SUD OUE,48.5875507068,3.81757319173,PME,59.982649044161114,48.5453132006,3.27679204051,062020
20202020-5703,Marché,Fournitures,Bardeaux,18/06/2020,56428.27,Ferme,DEPARTEMENT DE LA MARNE,48.9641633923,4.37882582203,ETI,53.446411738683615,49.2495894753,3.98962014487,062020
2019TRVRD1906100,Marché,Travaux,Travaux de construction de routes,09/06/2020,564310.0,Ferme,COMMUNE SCIONZIER BUDGET VILLE,46.0482394759,6.54705715843,PME,140.7648092303153,46.1683985181,5.27985816801,062020
2018m-dTDr-tD000,Marché,Services,Services de nettoyage,30/06/2020,56462.12,Révisable,OPH DE L'ANGOUMOIS,45.6475513407,0.144999112457,NC,427.9796166305829,48.8129348783,2.34310649123,062020
2019s-7GLOwCDI00,Marché,Travaux,Travaux de construction,26/06/2020,56485.0,Ferme et actualisable,SEMDAS,46.1619512738,-1.1749922971,PME,162.4107794539999,46.5318133793,0.245823551565,062020
2019201924400101,Marché,Travaux,Travaux relatifs aux conduites d'alimentation en eau,03/06/2020,564979.41,Ferme et actualisable,SYNDICAT DES EAUX OUEST ESSONNE,48.620055591,2.0831695011,NC,205.53190484332055,47.2928273173,0.790564730924,062020
2019JXms2Tl-UY00,Marché,Travaux,Travaux d'installations électriques,08/06/2020,56502.0,Ferme et actualisable,MANCHE HABITAT,49.1097135871,-1.07754504719,PME,6.675564775540529,49.106037102,-1.01728700647,062020
20202020T0870400,Marché,Travaux,Réparation et entretien de toiture,17/06/2020,56545.51,Ferme,Institut Français de Recherche pour l’Exploitation de la MER,48.8231210367,2.26445901319,PME,745.5676289493293,43.1388519901,5.85450715581,062020
201910Lot1301,Marché,Fournitures,Électricité,15/06/2020,56579.24,Ferme,MESANGER,47.4286596386,-1.2256504678,PME,48.05656475394895,47.0542979661,-1.00909493711,062020
2020M9D0091ATE00,Marché,Services,"Services de propreté et d'hygiénisation en milieu urbain ou rural, et services connexes",12/06/2020,565835.4,Révisable,BUDGET PRINCIPAL,43.6131750772,3.86941278925,PME,58.78816290826456,43.8445331544,4.34760475323,062020
2020100014576500,Marché,Services,"Services d'architecture, services de construction, services d'ingénierie et services d'inspection",09/06/2020,565860.0,Révisable,Ministère des armées - Etablissement du service d'infrastructure de la défense de Lyon - ESID Lyon,,,PME,,43.1266832216,6.01911240277,062020
202020SIC010100,Marché,Services,Services de télécommunications,29/06/2020,565978.75,Révisable,COMMUNE DE BIOT,43.6280987504,7.0828436473,GE,784.0777378560239,48.840040811,2.29268840406,062020
2020/333300,Marché,Travaux,Travaux d'étanchéification,23/06/2020,56611.41,Révisable,COMMUNAUTE DE COMMUNES FAUCIGN,46.0739029681,6.40835573143,PME,212.67308408065807,45.8770278139,4.4953270676,062020
202071753100,Marché,Travaux,"Travaux de construction d'ouvrages de génie civil, excepté ponts, tunnels, puits et passages souterrains",08/06/2020,56676.0,Ferme et actualisable,Sisteron,44.2007645004,5.93069752054,PME,0.0,44.2007645004,5.93069752054,062020
2019VqCBycu8ft00,Marché,Travaux,Travaux de plomberie et de pose de conduits d'évacuation,23/06/2020,56750.0,Révisable,Etablissement Public Territorial,48.817695916,2.51568784214,ETI,65.66655531806533,48.7702309329,1.9237512348,062020
2019013147c00100,Marché,Fournitures,Éclairage public,04/06/2020,5680.0,Révisable,Mairie de Porto Vecchio,41.5929038931,9.25349975364,ETI,64.51872534734423,42.0014190034,8.83471318553,062020
20202020F0937000,Marché,Fournitures,Maquettes de bateaux,29/06/2020,56800.0,Révisable,"Ministère de la Transition Écologique, Ministère de la Cohésion des Territoires, Ministère de la Mer - Groupement d'Intérêts Economiques - Dragages Ports",49.4415068863,1.09373273216,PME,390.99381674645423,47.1267905275,-1.56599605488,062020
202020-0008400,Marché,Travaux,"Travaux d'installation de matériel de chauffage, de ventilation et de climatisation",29/06/2020,56819.22,Ferme,Ville de Saint-Denis,48.9296428406,2.35946866986,PME,14.912672693511029,48.946227127,2.49329631847,062020
201912408,Marché,Travaux,Travaux de construction,11/06/2020,568404.88,Révisable,BUDGET PRINCIPAL,43.3201640732,-0.3496692279,GE,632.4860636654465,45.6733570262,4.8577653898,062020
2020QfpqFfwXzx00,Marché,Fournitures,Photocopieurs,11/06/2020,56866.89,Ferme,COMMUNE DE MAUBEUGE,50.2843741775,3.96274549268,PME,0.0,50.2843741775,3.96274549268,062020
20200W-F6rdS-600,Marché,Services,Services de transport (à l'exclusion du transport des déchets),09/06/2020,569067.78,Révisable,Centre Hospitalier Avranches Granville,48.8327939183,-1.5661139044,PME,0.0,48.8327939183,-1.5661139044,062020
2020A180803E2900,Marché,Services,Services d'architecte pour les bâtiments,24/06/2020,569090.28,Révisable,Ville de BRAS PANON,-21.0234376113,55.6195811957,NC,8309.408241077685,43.5959710776,1.43229743595,062020
2020V9D0016EA100,Marché,Services,Transport non régulier de passagers,29/06/2020,569420.2,Révisable,EXERCICE 2020,43.6131750772,3.86941278925,PME,9.773171257752093,43.5258740747,3.8583538042,062020
20202020T0775400,Marché,Travaux,Travaux d'aménagement paysager,19/06/2020,56960.0,Ferme et actualisable,"Ministère de la Transition Écologique, Ministère de la Cohésion des Territoires, Ministère de la Mer - Conservatoire de l'Espace Littoral et des Rivages Lacustres",45.9425259054,-0.972397591834,PME,781.8961399666291,43.3436358549,5.59821231686,062020
202071875900,Marché,Services,Services de traitement d'opérations et services de compensation,12/06/2020,569600.0,Ferme,HAMARIS,48.0976298874,5.1398599496,GE,317.6746032199597,48.8282706469,2.362358986,062020
2020300972RE00,Marché,Services,Services de prévisions météorologiques,08/06/2020,56962.8,Révisable,BUDGET PRINCIPAL,43.9352959178,4.84131733764,ETI,607.2646394402092,48.8410208466,2.41853928643,062020
20191907510,Marché,Travaux,"Travaux de construction de pipelines, de lignes de communication et d'énergie, d'autoroutes, de routes, d'aérodromes et de voies ferrées; travaux de nivelage",18/06/2020,5698670.0,Révisable,Budget principal,47.9889433531,0.20002401353,NC,15.1988145322807,48.0162918355,0.334691759268,062020
202030105800,Marché,Services,"Études de faisabilité, service de conseil, analyse",12/06/2020,57022.0,Ferme,BUDGET ASSAINISSEMENT,,,PME,,47.2551269927,6.0192810348,062020
202020000,Marché,Travaux,Ouvrages d'art et de génie civil,08/06/2020,57023.8,Ferme,COMMUNE DE SEEBACH,48.964273429,7.99067069199,PME,73.5281619921934,48.5767427752,7.4497521795,062020
202030000,Marché,Travaux,Ouvrages d'art et de génie civil,09/06/2020,57023.8,Ferme,COMMUNE DE SEEBACH,48.964273429,7.99067069199,PME,73.5281619921934,48.5767427752,7.4497521795,062020
20191918103,Marché,Travaux,Travaux de construction de bâtiments scolaires,04/06/2020,570564.98,Ferme,CA HAGUENAU,48.8420959686,7.83005981715,PME,21.663951340115627,48.667562475,7.74021890802,062020
20202020T1528500,Marché,Fournitures,Serrurerie,04/06/2020,57065.0,Ferme et actualisable,"Ministère de la Transition Écologique, Ministère de la Cohésion des Territoires, Ministère de la Mer - Conservatoire de l'Espace Littoral et des Rivages Lacustres",45.9425259054,-0.972397591834,PME,609.023259040429,43.8587497858,4.12080238118,062020
2019-ld4fcyBRh00,Marché,Fournitures,Consommables médicaux,30/06/2020,57096.0,Révisable,CENTRE HOSPITALIER DE MACON,46.320613267,4.81834086547,PME,422.9146721076504,48.9238114722,2.02813940207,062020
2020PAPREC CT00,Marché,Services,Services de recyclage des ordures ménagères,04/06/2020,570970.3,Révisable,SYVALORM,47.924297609,0.746656772703,NC,127.33881297939308,47.6040241065,-0.35889932411,062020
2019jD7wL9YAZ500,Marché,Services,"Services d'architecture, services de construction, services d'ingénierie et services d'inspection",16/06/2020,571200.0,Ferme,Brest Métropole Habitat,48.3999000994,-4.5027702561,PME,187.6113303813584,48.487063217,-2.80840238288,062020
20202020F0820500,Marché,Fournitures,Réactifs de laboratoire,11/06/2020,572.0,Révisable,CH AVIGNON,43.9352959178,4.84131733764,PME,193.52630651692027,45.6776041395,4.75268296549,062020
20202020F0801000,Marché,Fournitures,Matériel d'imagerie à résonance magnétique,09/06/2020,57200.0,Révisable,"Etablissements et organismes de l'enseignement supérieur, de la recherche et de l'innovation - UNIVERSITE D'AIX MARSEILLE",43.2801495369,5.34144579658,NC,,,,062020
2020KcTwO4r_iA00,Marché,Travaux,Travaux de nivelage de pistes,19/06/2020,57200.0,Ferme,Syndicat mixte de défense et de valorisation forestière,43.9281862792,4.99304878863,PME,152.03771854246853,44.3722399604,6.29394286733,062020
2020MS1LOT0200,Marché,Travaux,Travaux d'entretien routier,25/06/2020,572234.05,Ferme,COMMUNE D HUEZ,45.0970834451,6.08462260529,NC,37.11659616030048,45.1334670409,5.75097030293,062020
2019V8D0051AJE02,Marché,Services,Services de conseils et de représentation juridiques,19/06/2020,572333.32,Révisable,EXERCICE 2019,43.6131750772,3.86941278925,PME,0.0,43.6131750772,3.86941278925,062020
20200624L4G00,Marché,Travaux,"Travaux d'installation de matériel de chauffage, de ventilation et de climatisation",29/06/2020,57244.0,Ferme,Office Public Habitat du Jura,46.6867240732,5.51948208724,PME,4.481231251773241,46.6748755197,5.55822712075,062020
20202020T0889400,Marché,Travaux,Travaux de peinture,22/06/2020,57248.35,Révisable,Ministère de la Culture - Opérateur du patrimoine et des projets immobiliers de la culture,48.8282706469,2.362358986,ETI,603.2856533129614,43.9467457769,4.75214648359,062020
159221032977500,Marché,Fournitures,Enrobés routiers,29/06/2020,57279.0,Ferme et actualisable,SDIS 34,43.663798664,3.72843489659,ETI,37.27422245629616,43.4924125506,3.4386544199,062020
2019nlImFj0-3m00,Marché,Services,Services d'assistance informatique,02/06/2020,573092.23,Ferme,Agence de services et de paiement - ASP,45.8544262114,1.24894834225,ETI,355.8329350211769,48.8727847696,2.31253091684,062020
