2020AO19190300,Marché,Services,Services d'assurance,03/03/2020,44737.9,Ferme,VILLE DE MILLAU,44.0974934004,3.11719423537,PME,732.3090512535043,50.64429422,2.39513141872,032020
2020M2009802,Marché,Fournitures,Instruments de comptage,30/03/2020,447500.0,Révisable,ORLEANS METROPOLE,47.8824665066,1.91660961834,PME,458.98959395878944,47.2551269927,6.0192810348,032020
2020151011502300,Marché,Travaux,Travaux d'équipement électrique,09/03/2020,44755.0,Ferme,"Ministères de l'Économie et des Finances, de l'Action et des Comptes publics - DI NORMANDIE",49.4415068863,1.09373273216,PME,96.52901656113248,49.4853046112,0.2218691706,032020
2020130015263400,Marché,Travaux,Réparation et entretien de toiture,03/03/2020,447668.0,Révisable,Ministère des armées - Etablissement du service d'infrastructure de la défense de BREST - ESID Br...,,,NC,,48.3999000994,-4.5027702561,032020
20202020F0384600,Marché,Fournitures,Incubateurs,02/03/2020,44792.77,Ferme,"Etablissements et organismes de l'enseignement supérieur, de la recherche et de l'innovation - CN...",45.7708803723,4.88922582274,ETI,195.02141748546828,45.7513918237,3.1257081208,032020
2019fYLXwZzncO00,Marché,Travaux,Travaux de construction,24/03/2020,4480.0,Ferme et actualisable,SERL marchés,45.7533230296,4.86924368009,PME,46.959019836579415,46.1254275873,4.66681125049,032020
20202020S0769400,Marché,Fournitures,Équipements médicaux,24/03/2020,448000.0,Révisable,ASSISTANCE PUBLIQUE DES HOPITAUX DE MARSEILLE,43.2924013477,5.39786536432,ETI,799.4782339437695,48.7359842554,0.671117380553,032020
20202019N080001,Marché,Services,Services de conception graphique,03/03/2020,44925.0,Ferme,MAIRIE ANNECY BUDGET PRINCIPAL,45.8900209706,6.12570413482,PME,0.0,45.8900209706,6.12570413482,032020
20182140040300,Marché,Travaux,Travaux de construction de bâtiments,04/03/2020,44926.0,Révisable,COMMUNE DE VAY,47.5448484731,-1.70770267947,PME,25.13475578803943,47.319310489,-1.72038331143,032020
20202020F0811100,Marché,Fournitures,Lait,05/03/2020,44928.0,Révisable,CHU NICE,43.7123384529,7.23750191149,NC,764.7609104548068,48.8462198182,2.61920248034,032020
20202020F0912100,Marché,Fournitures,Véhicules électriques,04/03/2020,44936.02,Ferme,ANDRA - Agence Nationale pour la gestion des Déchets Radioactifs,48.7682137464,2.26375687994,PME,349.0709974465867,49.1794326542,5.39336588671,032020
20202020F1327500,Marché,Fournitures,Consommables médicaux autres que chimiques à usage unique et consommables hématologiques,06/03/2020,4494.09,Révisable,CHRU CAEN,49.1850685346,-0.370026383608,PME,310.7818550531659,48.8694561887,2.42256669613,032020
20202020F1328000,Marché,Fournitures,Consommables médicaux autres que chimiques à usage unique et consommables hématologiques,06/03/2020,4494.09,Révisable,CHRU CAEN,49.1850685346,-0.370026383608,PME,310.7818550531659,48.8694561887,2.42256669613,032020
2020100014403600,Marché,Travaux,Travaux d'installation de ventilation,10/03/2020,4494.6,Ferme,Ministère de la Justice  - Direction interrégionale des services pénitentiaires de Toulouse,43.5959710776,1.43229743595,GE,443.59618452910803,45.6733570262,4.8577653898,032020
20202020T1252700,Marché,Travaux,Travaux de peinture,13/03/2020,4495.0,Révisable,Ministère de la Culture - CITE de la CERAMIQUE - Sèvres et Limoges,48.8212450479,2.20940635474,PME,29.512765261452163,48.8511697506,2.47460350341,032020
20201360000089,Marché,Services,Services d'urbanisme,27/03/2020,44975.06,Révisable,VILLE DE PARIS BUDGET PRINCIPAL,48.8542874923,2.35759608215,PME,7.350089741185372,48.840040811,2.29268840406,032020
2020130015271200,Marché,Services,Élagage des arbres et taille des haies,06/03/2020,44975.93,Révisable,Ministère de la Transition écologique et solidaire - Ministère de la Cohésion des Territoires - Direction Interdépartementale des Routes Nord-Ouest,49.4415068863,1.09373273216,PME,278.69046205956266,49.1240475995,-1.40631242642,032020
2019ASS150103,Marché,Travaux,Travaux relatifs aux conduites d'alimentation en eau,18/03/2020,449782.0,Ferme,LEFF ARMOR COMMUNAUTE (LAC),48.6338311165,-2.98924509604,ETI,11.534920111307105,48.5300729275,-2.98989779061,032020
2020150994489700,Marché,Services,Services topographiques,11/03/2020,450.0,Ferme,Ministère de la Justice  - SECRETARIAT GENERAL DU MINISTERE DE LA JUSTICE,47.3230744087,5.03738286925,PME,691.1743963160671,44.760310031,-0.657279122002,032020
202070376700,Marché,Fournitures,"Boissons, tabac et produits connexes",12/03/2020,4500.0,Révisable,VILLE DE PORNICHET,47.2619512895,-2.31411009833,PME,106.75446483122703,47.2810998196,-1.34885771287,032020
2019uSMmdQzT4100,Marché,Travaux,Travaux de menuiserie,13/03/2020,4500.0,Ferme,OPHEA,48.5716343863,7.76783353204,PME,0.0,48.5716343863,7.76783353204,032020
2019-3300,Marché,Services,Services de contrôle technique,27/03/2020,45000.0,Ferme,SMPBA,44.714274952,-0.943875340865,NC,52.71271792144872,44.8601301837,-0.490332476541,032020
2020ASSURL1CIG00,Marché,Services,,12/03/2020,45000.0,Ferme,MAIRIE,48.7904078193,1.90703785842,ETI,379.3014663654475,46.3286026496,-0.464927924553,032020
20202019S10503,Marché,Services,Services de télécommunications,10/03/2020,45000.0,Révisable,Ville de Saint-Tropez,43.26214581,6.66343108724,PME,57.191467358668724,43.6276961423,7.02943470458,032020
2019201911-0300,Marché,Services,Services de téléphonie et de transmission de données,25/03/2020,45000.0,Révisable,VILLE DE VILLENEUVE TOLOSANE,43.5261488406,1.34673571001,GE,602.0798058071822,48.8604673342,2.26190318372,032020
2019BAVeiSQzcc00,Marché,Fournitures,Mobilier,04/03/2020,45000.0,Ferme,Mairie de Provins,48.563393882,3.28780374308,PME,65.37524262103868,48.5243486755,2.69789080689,032020
2020200090100,Marché,Fournitures,Mobilier urbain,30/03/2020,45000.0,Révisable,MAIRIE DE MAUGUIO CARNON,43.5930787077,4.00463218238,PME,100.01436000798323,43.9352959178,4.84131733764,032020
2019WQgKc6DaFQ00,Marché,Services,Services immobiliers,24/03/2020,45000.0,Ferme,PARIS LA DEFENSE,48.8983675206,2.25515424076,PME,19.656169927846438,48.8348302792,2.42102904428,032020
20202020S0419100,Marché,Services,Services de maintenance préventive,16/03/2020,45000.0,Ferme et actualisable,CH DU MANS,47.9889433531,0.20002401353,PME,565.2212194237857,45.6776041395,4.75268296549,032020
20202020S0227700,Marché,Services,Services d'assistance technique,10/03/2020,45000.0,Révisable,CHU ROUEN,49.4415068863,1.09373273216,PME,3.1633084875285835,49.4671951226,1.08149158511,032020
2020ZmIRt-ya2O00,Marché,Fournitures,Papier d'impression,10/03/2020,45000.0,Révisable,Département de l Indre Direction des Routes des Transports du Patrimoine et de l Education,46.8031778361,1.69389403678,ETI,215.35481852996824,48.5862081061,2.452303526,032020
2019kojdjPQ1Jh00,Marché,Fournitures,Fournitures de bureau,09/03/2020,45000.0,Révisable,Mairie de Villeneuve le roi,48.7321607291,2.41097949757,ETI,477.730434495556,47.2246985502,-1.63426478543,032020
2019r2xqj4IixD00,Marché,Fournitures,Produits de nettoyage,04/03/2020,45000.0,Révisable,MAIRIE DE LENS,50.4372553549,2.82129881832,NC,42.86237932202601,50.7097105802,3.09556096808,032020
2019uc1lFUE4aQ00,Marché,Fournitures,Produits alimentaires divers,10/03/2020,45000.0,Révisable,Mairie de Maisons-Alfort,48.8060849119,2.43798340413,GE,93.5656037122245,48.0185110829,2.73568624779,032020
20202020S0476400,Marché,Services,"Services d'élimination de déchets toxiques, excepté déchets radioactifs et sols contaminés",31/03/2020,45000.0,Révisable,Université Sorbonne Paris Nord,48.9567644994,2.34523261958,ETI,15.942820263625215,48.8348302792,2.42102904428,032020
2020ASSURL2CIG00,Marché,Services,,17/03/2020,45000.0,Ferme,MAIRIE,48.7904078193,1.90703785842,ETI,379.3014663654475,46.3286026496,-0.464927924553,032020
2019MF00600,Marché,Services,Services d'assurance responsabilité civile,05/03/2020,45000.0,Révisable,BUDGET PRINCIPAL,48.6962376754,2.5037010956,ETI,420.9281561413416,46.3286026496,-0.464927924553,032020
20202020S0476300,Marché,Services,"Services d'élimination de déchets toxiques, excepté déchets radioactifs et sols contaminés",31/03/2020,45000.0,Révisable,Université Sorbonne Paris Nord,48.9567644994,2.34523261958,GE,67.03193015579397,48.9943943417,1.74020742825,032020
20202020S0446500,Marché,Services,Services de lutte contre les parasites,17/03/2020,45000.0,Révisable,Ministère de la Transition écologique et solidaire - Ministère de la Cohésion des Territoires - M...,48.8410208466,2.41853928643,NC,593.644174610393,43.5959710776,1.43229743595,032020
20202021S0002600,Marché,Services,Services de maintenance et de réparation de logiciels,26/03/2020,45000.0,Révisable,SPL EAU DU BASSIN RENNAIS,48.111571436,-1.68168588816,NC,0.0,48.111571436,-1.68168588816,032020
2019_juLCNTur000,Marché,Services,Services de conception graphique,05/03/2020,45000.0,Ferme,EPTB Seine Grands Lacs,48.8348302792,2.42102904428,NC,16.28997386384504,48.8951908356,2.28680331405,032020
2019sYWYObi8o702,Marché,Travaux,Travaux de maçonnerie,13/03/2020,45000.0,Révisable,Mairie de Drancy,48.9233704771,2.44422453567,PME,10.418806306389506,49.007813869,2.40343345123,032020
2019160900,Marché,Travaux,Travaux de construction,05/03/2020,45000.61,Ferme,COMMUNE D'ORGERES,47.9853918591,-1.6658397625,PME,10.05208801069945,48.0530085081,-1.60555615262,032020
2020130015185300,Marché,Travaux,Travaux d'étude géotechnique,09/03/2020,450000.0,Révisable,Ministère de la Transition écologique et solidaire - Ministère de la Cohésion des Territoires - D...,47.8824665066,1.91660961834,NC,409.7369817032304,47.2305431151,-1.7303481837,032020
2019M2019-39-100,Marché,Fournitures,Équipement de signalisation,02/03/2020,450000.0,Ferme et actualisable,CHATEAUNEUF LES MARTIGUES,43.3863609443,5.14736694288,PME,44.344417960324805,43.593220086,5.49060383444,032020
2019aJFraX07aH00,Marché,Fournitures,Machines et appareils d'essai et de mesure,04/03/2020,450000.0,Ferme et actualisable,Institut national des sciences appliquées de Rouen (INSA Rouen),49.3814379486,1.09001869647,NC,186.92402607614662,48.4027852907,2.4640480606,032020
2020130015174900,Marché,Travaux,Travaux d'étude géotechnique,09/03/2020,450000.0,Révisable,Ministère de la Transition écologique et solidaire - Ministère de la Cohésion des Territoires - D...,47.8824665066,1.91660961834,NC,409.7369817032304,47.2305431151,-1.7303481837,032020
2019Owbf6qr6W000,Marché,Services,Services de réparation et d'entretien de chauffage central,12/03/2020,450000.0,Révisable,77,48.8869811827,2.38492060382,GE,17.60296103514162,48.7968127045,2.25409308474,032020
20202020F0152700,Marché,Fournitures,Matériel informatique,13/03/2020,450000.0,Ferme,RESEAUX DES ACHETEURS HOSPITALIERS,48.8591103086,2.38017728226,PME,8.172342577941023,48.9296428406,2.35946866986,032020
20202020S0387000,Marché,Services,Services de gardiennage,12/03/2020,45038.4,Révisable,Institut National de l'Environnement Industriel et des Risques,49.2734299978,2.53417955279,GE,58.292067766430094,48.8231210367,2.26445901319,032020
201935IvsUkGte00,Marché,Services,,13/03/2020,4504.9,Ferme,OPHEA,48.5716343863,7.76783353204,PME,17.36169855173057,48.7206697781,7.71737161635,032020
202020200001301,Marché,Travaux,Travaux de construction de bâtiments liés à la santé,26/03/2020,45055.0,Ferme,MR Fontaine la Guyon,48.4754749543,1.29735575728,PME,0.0,48.4754749543,1.29735575728,032020
20191058601,Marché,Travaux,Travaux de démolition de bâtiments et travaux de terrassement,30/03/2020,45180.0,Ferme,BUDGET PRINCIPAL,50.2899236486,2.76642705397,PME,72.4862804333478,50.6917635957,2.25030626884,032020
20192WlbAaK38V00,Marché,Services,Services de réparation et d'entretien de matériel de restauration,16/03/2020,452380.0,Révisable,Centre Hospitalier Sud Francilien,48.603809105,2.46932274471,PME,0.0,48.603809105,2.46932274471,032020
202070630900,Marché,Services,Services d'architecture,25/03/2020,45297.0,Ferme et actualisable,EVOLEA,46.5622744929,3.32725048972,PME,0.0,46.5622744929,3.32725048972,032020
2020VI202000600,Marché,Services,Prestations de services pour la collectivité,25/03/2020,45331.0,Ferme,VILLE DE NARBONNE,43.1651014685,3.02005317318,PME,0.0,43.1651014685,3.02005317318,032020
20202020F0651800,Marché,Fournitures,Moniteurs,18/03/2020,4533333.0,Révisable,Union des Groupements d'Achats Publics - Département Services,48.8481450572,2.59605262949,ETI,9.632374959604523,48.8637518036,2.51036788744,032020
2020003200,Marché,Services,Services de conseil et d'évaluation,09/03/2020,45350.0,Ferme et actualisable,Région Normandie,49.1850685346,-0.370026383608,PME,306.25937327253973,48.8591103086,2.38017728226,032020
2019V58h2KaPeG00,Marché,Services,"Services d'architecture, services de construction, services d'ingénierie et services d'inspection",25/03/2020,45360.0,Ferme et actualisable,GIE GRAND PARIS HABITAT,48.8282706469,2.362358986,NC,27.26624815999557,48.8022788923,2.11716530117,032020
2020M010L0400,Marché,Travaux,Travaux d'installations électriques,03/03/2020,45367.83,Ferme,LAVAL AGGLOMERATION,48.0610922073,-0.766055300559,PME,0.0,48.0610922073,-0.766055300559,032020
2019496200,Marché,Fournitures,Pianos,10/03/2020,45400.0,Ferme,REGION-BUDGET REGIONAL,-20.9331856391,55.4471055195,PME,7910.564241013889,43.2868669832,5.38037571899,032020
20202020F0462800,Marché,Fournitures,Produits pharmaceutiques,05/03/2020,4544.4,Ferme et actualisable,CH DU MANS,47.9889433531,0.20002401353,ETI,147.76908509885837,49.207357405,-0.330362469163,032020
20202020T0256700,Marché,Travaux,Travaux de cloisonnement,10/03/2020,45500.0,Ferme,Chambres de Commerce et d'Industrie,46.5622744929,3.32725048972,PME,88.97172169681986,45.7729923571,3.19282477044,032020
20202020T0256900,Marché,Services,,10/03/2020,45500.0,Ferme,Chambres de Commerce et d'Industrie,46.5622744929,3.32725048972,PME,242.9227406836169,45.8544262114,1.24894834225,032020
2019o8qq9ZgXDx00,Marché,Travaux,Travaux de fondation,13/03/2020,455000.0,Ferme et actualisable,ETBT du Château de Versailles,48.8022788923,2.11716530117,ETI,0.0,48.8022788923,2.11716530117,032020
20202020F0445600,Marché,Fournitures,Appareils d'endoscopie et d'endochirurgie,09/03/2020,45550.0,Révisable,CHU NANTES,47.2321613301,-1.54797539458,ETI,432.4895499739692,48.758778972,2.04882028884,032020
201920700,Marché,Travaux,Travaux de gros œuvre,09/03/2020,45550.0,Ferme,INOLYA,49.1850685346,-0.370026383608,NC,6.7112995072974995,49.1694850575,-0.311394025769,032020
2019TN000300,Marché,Fournitures,Système de surveillance vidéo,09/03/2020,45555.56,Ferme et actualisable,VILLE DE SOULTZ,47.882534869,7.17900376399,NC,244.21955281936857,47.2856858419,5.05293981105,032020
20200200700,Marché,Services,Services de réinsertion,04/03/2020,45568.0,Ferme,COMMUNAUTE D AGGLOMERATION PAYS BASQUE,43.4922603626,-1.46624377766,NC,21.170951983897442,43.3942937232,-1.63037093445,032020
20202003500,Marché,Services,Services d'étude d'impact sur l'environnement (EIA) pour la construction,06/03/2020,45570.0,Ferme,CA HAGUENAU,48.8420959686,7.83005981715,PME,37.17229210356561,48.5198254221,7.7317552386,032020
20191207,Marché,Travaux,Travaux de construction de bâtiments de loisirs,06/03/2020,455999.95,Ferme et actualisable,COMMUNE LA CHEVROLIERE,47.0888225829,-1.59648931129,PME,87.2680318458547,46.8210507461,-0.854711620009,032020
202019S0365L0100,Marché,Fournitures,Électricité,24/03/2020,4560000.0,Ferme,Conseil Départemental AM - BP,43.7123384529,7.23750191149,GE,790.0198699192912,48.8727847696,2.31253091684,032020
2019J8niHwBUJn00,Marché,Travaux,"Travaux d'installation de matériel de chauffage, de ventilation et de climatisation",27/03/2020,45640.93,Ferme et actualisable,CPAM de la Manche,49.1097135871,-1.07754504719,PME,55.06130059228417,49.4978621599,-1.38630783772,032020
2019PHOTOCOP00,Marché,Fournitures,,09/03/2020,45645.7,Ferme,Communauté de communes Périgord-Limous,45.4291171646,0.913002211957,NC,211.94818728206207,43.5959710776,1.43229743595,032020
202020.00500,Marché,Services,Réalisation et entretien d'espaces verts,05/03/2020,45687.0,Révisable,Centre Morbihan Communauté,47.8802352503,-2.83771308086,PME,24.313941110208653,47.6616210266,-2.8432164767,032020
202070665500,Marché,Fournitures,Serrurerie,27/03/2020,45689.0,Ferme et actualisable,Préval Haut-Doubs,46.911819238,6.38871615294,PME,81.74569547207223,47.5013130404,6.83472521939,032020
20195ziAE4CcPR00,Marché,Travaux,Travaux de maçonnerie,17/03/2020,45716.0,Ferme et actualisable,Mairie de la Cadiere,43.2032661794,5.72523558251,PME,17.302268588973664,43.0866539393,5.82934646655,032020
2020M19001700400,Marché,Travaux,Installation de cloisons,04/03/2020,457162.0,Ferme,VILLE DE SUCY EN BRIE,48.7656350255,2.53363576939,PME,5.3611243279349825,48.7453553169,2.48965138414,032020
2019f2-o_79p4N00,Marché,Travaux,Travaux d'équipement du bâtiment,05/03/2020,45747.72,Révisable,Département de l Indre Direction des Routes des Transports du Patrimoine et de l Education,46.8031778361,1.69389403678,PME,68.26541535115095,46.63486232,1.10022127773,032020
2019c_R7AMRZki00,Marché,Travaux,Travaux d'équipement du bâtiment,05/03/2020,45747.72,Révisable,Département de l Indre Direction des Routes des Transports du Patrimoine et de l Education,46.8031778361,1.69389403678,PME,68.26541535115095,46.63486232,1.10022127773,032020
20202020S0528000,Marché,Services,Services de certification,12/03/2020,45784.0,Ferme,Chambre de Commerce et d'Industrie de région Auvergne-Rhône-Alpes,45.7480493184,4.82567584415,ETI,446.43128545914556,48.9296428406,2.35946866986,032020
2018uJPE6nE3Jq00,Marché,Fournitures,Système de localisation de véhicules,06/03/2020,457900.0,Révisable,SMICTOM - d'Alsace Centrale,48.2953439936,7.41576501016,PME,49.746228417709354,48.7396991596,7.34122767406,032020
2019LruskTGlU300,Marché,Services,Services de conception graphique,03/03/2020,45800.0,Ferme,DBA,48.8491121687,2.33284677548,PME,77.00331907889675,48.3599096123,2.8256845162,032020
20195212VDD00,Marché,Travaux,Travaux de préparation de chantier,06/03/2020,45819.05,Ferme et actualisable,BUDGET PRINCIPAL,43.6131750772,3.86941278925,PME,20.143869666347186,43.5395272331,3.70294429421,032020
2018000300,Marché,Services,Services d'ingénierie,30/03/2020,45825.0,Ferme,CCBPD,45.9423868949,4.70816213909,PME,27.62005021797135,45.7708803723,4.88922582274,032020
20202020F0487200,Marché,Fournitures,Châssis,25/03/2020,45832.5,Ferme,Office national d'études et de recherches aérospatiales,48.8030644645,2.28639478919,PME,247.82687159148287,51.030563712,2.33703738753,032020
2019nRPZ_AdIW500,Marché,Fournitures,"Sièges, chaises et articles assimilés, et pièces connexes",19/03/2020,458333.0,Révisable,CAF PARIS,48.840040811,2.29268840406,PME,34.41972959467707,49.0110945823,2.03330227188,032020
2019xL3wxwxyz_00,Marché,Travaux,Travaux de construction d'immeubles collectifs,02/03/2020,458704.0,Ferme et actualisable,Vannes Golfe Habitat,47.6599029362,-2.75681901002,NC,11.587278507263838,47.7641050536,-2.75812007121,032020
2020190000011400,Marché,Fournitures,Mobilier et équipements divers,27/03/2020,45929.5,Ferme,CCVLV Budget général,44.51635363,1.13584257839,NC,107.54829579790409,43.5959710776,1.43229743595,032020
20202020F0388000,Marché,Fournitures,"Dispositifs de stérilisation, de désinfection et d'hygiène",01/03/2020,45931.64,Révisable,CHU SAINT ETIENNE,45.4301960415,4.37808697748,ETI,431.56049081763433,48.7495659946,2.35212808495,032020
20202020T0308000,Marché,Travaux,Travaux de menuiserie,23/03/2020,45943.07,Ferme,Chambres de Commerce et d'Industrie,49.4415068863,1.09373273216,PME,10.666171625282754,49.3476730731,1.07413309601,032020
20198B006AMO00,Marché,Services,Services de conseil en développement,16/03/2020,45960.0,Ferme,Commune de MARIPA-SOULA,2.96743529098,-53.7582580953,PME,7528.077135421709,48.8591103086,2.38017728226,032020
20182018ECOLE700,Marché,Travaux,Installation de cloisons,20/03/2020,45967.4,Ferme,COMMUNE DE MOUAIS,47.7050198432,-1.66532266207,PME,32.966275092734406,47.4470980854,-1.51864718131,032020
202019-12-0501,Marché,Fournitures,Réseaux,23/03/2020,459745.0,Révisable,Communauté d' Agglomération  Concarnea,47.8961667158,-3.90749863443,PME,23.8719844917649,47.9351265336,-3.69519403872,032020
2020239002001100,Marché,Travaux,Travaux de construction de routes,12/03/2020,459933.15,Révisable,CCCHR-Communauté de Communes du Centre,47.852998078,7.37286602013,PME,15.87997531829352,47.7985201575,7.23997699962,032020
20202020F0439200,Marché,Fournitures,"Matériels médicaux, pharmaceutiques et produits de soins personnnels",11/03/2020,4600.0,Révisable,CHU ANGERS,47.4766284713,-0.556089456786,ETI,650.6024496068915,45.7541566032,5.06691649154,032020
2018QhuPr7QGKx00,Marché,Services,Services de formation,30/03/2020,46000.0,Ferme,Grand Paris Sud Est Avenir,48.783689162,2.4549804713,NC,7.517772261009835,48.7321607291,2.41097949757,032020
2020130015251200,Marché,Services,Services d'assistance relative aux systèmes,04/03/2020,4600000.0,Révisable,"Ministère de l'éducation nationale et de la jeunesse et Ministère de l'enseignement supérieur, de...",48.8562037309,2.3121193117,NC,10.335323764039952,48.8699520558,2.21968010802,032020
2020-01-0100,Marché,Services,,31/03/2020,46006.46,Ferme,MAIRIE DE FONTENILLES,43.5551543484,1.1969220417,PME,44.57078720608772,43.3814640925,0.833728326458,032020
20202020S0355600,Marché,Services,Services d'ingénierie,12/03/2020,46100.0,Ferme et actualisable,"Etablissements et organismes de l'enseignement supérieur, de la recherche et de l'innovation - Ce...",50.6317671102,3.04699299406,PME,13.774849159308038,50.5876380348,3.16339877343,032020
20202020T1080100,Marché,Travaux,Travaux de réfection,05/03/2020,461577.17,Ferme et actualisable,CH VALENCIENNES,50.3591232468,3.51599087764,PME,10.637420905981692,50.3253955328,3.60602194086,032020
