20209RO89HYnex00,Marché,Fournitures,Véhicules à moteur,31/08/2020,20023.0,Ferme,UEM METZ,49.1081027833,6.19595351042,GE,0.0,49.1081027833,6.19595351042,082020
2020jKPYzpdaaA00,Marché,Fournitures,Véhicules à moteur,31/08/2020,20023.0,Ferme,UEM METZ,49.1081027833,6.19595351042,GE,0.0,49.1081027833,6.19595351042,082020
202078yMWHhL8900,Marché,Travaux,Travaux de plomberie,17/08/2020,20059.69,Ferme et actualisable,Sèvre Loire Habitat,47.0458179875,-0.877097655444,PME,48.84292881729072,46.8544563524,-0.479596254844,082020
2020151019505400,Marché,Services,Évaluation des risque et dangers pour la construction,13/08/2020,20060.0,Révisable,Ministère des armées - Etablissement du service d'infrastructure de la défense de BREST - ESID Brest,,,NC,,47.4298130146,0.760935742418,082020
20202020S1253700,Marché,Services,Services de nettoyage,31/08/2020,20066.67,Révisable,"Ministère de la Transition Écologique, Ministère de la Cohésion des Territoires, Ministère de la Mer - Météo France",48.8410208466,2.41853928643,PME,620.7835279056529,43.3918010648,3.64662263951,082020
20202020S1180600,Marché,Services,Maintenance de logiciels de technologies de l'information,06/08/2020,200791.0,Révisable,CHRU CAEN,49.1850685346,-0.370026383608,PME,269.18177539771955,48.7796502574,2.02991602442,082020
2019dDD_F67_n000,Marché,Travaux,Travaux de bardage,18/08/2020,200953.0,Ferme et actualisable,OFFICE PUBLIC DE L'HABITAT de l'AISNE,49.5679878475,3.62136068206,PME,114.71095970368691,49.7733700049,4.63801315095,082020
2020e7HgWqfXY700,Marché,Travaux,Travaux de façade,06/08/2020,200985.0,Ferme,Cellule Marchés,48.8282706469,2.362358986,PME,39.4169029253829,49.0779312553,2.1093880821,082020
20202020T1364200,Marché,Travaux,Travaux de démolition,27/08/2020,201140.0,Révisable,"Etablissements et organismes de l'enseignement supérieur, de la recherche et de l'innovation - UNIVERSITE CLAUDE BERNARD LYON 1",45.7708803723,4.88922582274,PME,12.96505880572804,45.7774291546,5.00628498239,082020
202019A09300,Marché,Services,Services de conception de sites WWW (World Wide Web),31/08/2020,201150.0,Révisable,BUDGET PRINCIPAL,48.8039815916,2.22696813508,PME,577.6484024388254,43.6692162286,1.45471819581,082020
20202020F1422700,Marché,Fournitures,"Vêtements, articles chaussants, bagages et accessoires",26/08/2020,2013856.0,Révisable,Union des Groupements d'Achats Publics - Département Assistanat Achat,48.8481450572,2.59605262949,NC,569.9795611908897,43.7580419687,2.00123611529,082020
2020/LOT8ALSH02,Marché,Travaux,Travaux de construction de centres de loisirs,17/08/2020,201438.94,Ferme,COMMUNE PONT-DU-CHATEAU,45.7981463108,3.23991199443,PME,17.426209219062798,45.8541622742,3.09272163757,082020
201918N0417-0204,Marché,Fournitures,Système de surveillance vidéo,03/08/2020,201465.86,Révisable,METROPOLE NICE COTE D'AZUR,43.7123384529,7.23750191149,NC,31.921764901868507,43.6185321116,6.96448871259,082020
20202020S1253900,Marché,Services,Services de nettoyage,31/08/2020,20150.0,Révisable,"Ministère de la Transition Écologique, Ministère de la Cohésion des Territoires, Ministère de la Mer - Météo France",48.8410208466,2.41853928643,PME,620.7835279056529,43.3918010648,3.64662263951,082020
20202020F1584900,Marché,Fournitures,Matériels de radiodiagnostic,04/08/2020,20240.0,Révisable,CHU NICE,43.7123384529,7.23750191149,PME,700.0601813183997,47.2478993311,1.99341688903,082020
20188TJCZGYmC700,Marché,Services,Services de traitement et d'élimination des ordures ménagères et des déchets non dangereux,15/08/2020,202400.0,Ferme,Communauté d' Agglomération de Lens Lievin,50.4372553549,2.82129881832,GE,182.85141901646261,48.8727847696,2.31253091684,082020
20202020013-0101,Marché,Services,Services de nettoyage et d'hygiène,19/08/2020,202442.0,Ferme,COM  AGGL  LA RIVIERA DU LEVANT,16.2250869819,-61.4693509551,NC,13.766237703052376,16.2515819199,-61.5922344723,082020
2019vnRxYeEah200,Marché,Travaux,Travaux de restructuration,06/08/2020,202948.0,Révisable,SOLOREM,48.6900671002,6.17594832427,PME,43.22867643224563,48.3305126031,6.32875539979,082020
20202020S1174500,Marché,Services,Services d'abattage d'arbres,04/08/2020,203350.0,Ferme et actualisable,Ministère de l'agriculture et de l'alimentation - DT Seine Nord,48.4064551427,2.68102008933,NC,255.34014151426675,48.4898997264,0.373348638456,082020
2020110005103000,Marché,Services,Services d'ingénierie,07/08/2020,203350.0,Révisable,"Ministère de la Transition Écologique et Solidaire, Ministère de la Cohésion des Territoires - Direction Régionale Environnement, Aménagement et Logement Grand Est",49.1081027833,6.19595351042,NC,183.66428917004865,48.5716343863,7.76783353204,082020
2019zjvjqZiWM800,Marché,Services,Services sociaux pour les personnes handicapées,06/08/2020,203550.0,Révisable,AGEFIPH,48.7987242503,2.30977129909,PME,551.6494032431684,44.8323242505,-0.682089528902,082020
2020IPmDLwsS8o00,Marché,Travaux,Travaux de façade,28/08/2020,203580.8,Ferme,CDC Habitat Social DIR Sud-Ouest,44.8889230081,-0.600409986888,NC,484.67763266564094,43.3094309363,3.48454776797,082020
2020zdVeO9UEh-00,Marché,Travaux,Travaux de construction,17/08/2020,20376.0,Ferme et actualisable,Commune de Viry-Chatillon,48.6699707249,2.37370903358,PME,419.802481860523,45.4992030823,4.43785373821,082020
159835211932100,Marché,Fournitures,Panneaux de signalisation et articles connexes,25/08/2020,203808.0,Révisable,Conseil Départemental de l'Aveyron,44.358571606,2.56667306391,PME,2.782917623690478,44.3826731465,2.55990190943,082020
201901426f200100,Marché,Services,Services de réparation et d'entretien de camions,21/08/2020,2039.19,Ferme,SMICTOM - d'Alsace Centrale,48.2953439936,7.41576501016,PME,36.12249603762481,48.5144548516,7.6584023712,082020
20209022700,Marché,Services,Services de transport routier public,17/08/2020,2043266.94,Révisable,Budget principal,48.111571436,-1.68168588816,NC,0.0,48.111571436,-1.68168588816,082020
2019TIdJSvwM_Y00,Marché,Travaux,Travaux d'aménagement paysager,27/08/2020,20434.0,Ferme,Ville de Saint-Louis,47.6022882653,7.54028126665,PME,5.032176399811098,47.6042426188,7.49482144119,082020
2020151014766200,Marché,Services,Services techniques,05/08/2020,2046.9,Ferme,Ministère des armées - Structure Spécialisée d'achat et de Mandatement 33 504,,,PME,,44.8792319263,-0.648147734074,082020
2019E0oLt-Xbtk00,Marché,Services,"Services d'architecture, d'ingénierie et de planification",17/08/2020,204800.0,Ferme et actualisable,Commune de Bougival,48.8636644704,2.13752713445,PME,130.00681702885944,49.4621811652,1.12778105018,082020
2019-14PXxi8Eg00,Marché,Travaux,Travaux de plomberie,14/08/2020,205000.0,Ferme et actualisable,OFFICE PUBLIC DE L'HABITAT de l'AISNE,49.5679878475,3.62136068206,PME,15.066655608004952,49.4789115395,3.51862529309,082020
20202020S1209900,Marché,Services,Services sylvicoles,12/08/2020,20510.0,Ferme,Ministère de l'agriculture et de l'alimentation - Direction régionale de La Réunion,-20.9331856391,55.4471055195,PME,15.591879774643358,-21.0446108504,55.3222448792,082020
202008030200,Marché,Fournitures,Véhicules à moteur,10/08/2020,205233.0,Ferme,Office Public Habitat du Jura,46.6867240732,5.51948208724,GE,404.5816076004797,48.8360445933,2.56502268278,082020
20202020S1174700,Marché,Services,Services d'abattage d'arbres,04/08/2020,205250.0,Ferme et actualisable,Ministère de l'agriculture et de l'alimentation - DT Seine Nord,48.4064551427,2.68102008933,PME,324.7956954966956,48.3044990712,-0.254520639998,082020
159766918715700,Marché,Travaux,Travaux de charpente,17/08/2020,205269.0,Ferme et actualisable,RODEZ,44.358571606,2.56667306391,PME,59.230109467907724,44.3498674573,2.03109428991,082020
201911104,Marché,Travaux,"Travaux de construction, de fondation et de revêtement d'autoroutes, de routes",05/08/2020,2053110.0,Révisable,COMMUNE DE SAINT PAUL PES MARCHE,-21.0446108504,55.3222448792,PME,7.802508017714393,-21.1659546177,55.333466602,082020
20200100,Marché,Travaux,Travaux de construction,06/08/2020,205376.71,Ferme,SYNDICAT DES SPORTS,47.9005948618,0.625413527681,NC,13.66355553161767,47.924297609,0.746656772703,082020
2020130015757100,Marché,Fournitures,Pièces détachées et accessoires pour véhicules et moteurs de véhicules,24/08/2020,205389.0,Révisable,Ministère de l'Intérieur - SGAMI EST - Metz - DAGF- Marchés Publics,48.8348302792,2.42102904428,ETI,334.51395685711077,47.3230744087,5.03738286925,082020
2019tDaz7Gd08A00,Marché,Services,,21/08/2020,20549.45,Ferme,VILLE DE VERNOUILLET,,,NC,,48.8481450572,2.59605262949,082020
20202020T1245000,Marché,Services,"Études de faisabilité, service de conseil, analyse",25/08/2020,20550.0,Ferme,ASSISTANCE PUBLIQUE - HOPITAUX DE PARIS,48.8542874923,2.35759608215,PME,21.405803609750794,48.8025299573,2.17114450433,082020
2019331901,Marché,Services,Services d'ingénierie,05/08/2020,205790.0,Révisable,COLLECTIVITE TERRITORIALE SPM,,,PME,,,,082020
20202020VO-00100,Marché,Travaux,Travaux de construction d'intersections de routes,10/08/2020,205848.0,Ferme et actualisable,COMMUNAUTE DE COMMUNES DU FRONTONNAIS,43.7956101203,1.41808408112,PME,9.641818732031957,43.716465754,1.38260678149,082020
202030015402,Marché,Travaux,Ouvrages d'art et de génie civil,05/08/2020,206294.98,Ferme et actualisable,Département du Doubs,47.2551269927,6.0192810348,PME,1027.3487407874575,47.8562099527,-3.25181735196,082020
20202020S1599300,Marché,Services,Services de réparation et d'entretien de matériel médical et de matériel de précision,01/08/2020,2065.0,Révisable,CTRE HOSPITALIER INTERCOM ALPES DU SUD,44.580393647,6.06471167343,NC,208.9542571815244,45.4301960415,4.37808697748,082020
2020V9D0016EA00,Marché,Services,Transport non régulier de passagers,19/08/2020,2069082.04,Révisable,EXERCICE 2020,43.6131750772,3.86941278925,GE,5.484382748718405,43.6377664504,3.91242194098,082020
20202020T1274600,Marché,Travaux,Travaux de terrassement,24/08/2020,206911.0,Ferme et actualisable,CHRU NANCY,48.6900671002,6.17594832427,PME,68.83382126122754,48.7464202124,5.55606495567,082020
2019MbakYJ7mVD00,Marché,Travaux,Travaux de construction d'immeubles collectifs,21/08/2020,20697.0,Ferme,Société OZANAM,14.6460950766,-61.100358959,PME,21.782190282069628,14.6063466524,-60.9058337849,082020
20202021S0624900,Marché,Services,"Services d'organisation d'expositions, de foires et de congrès",14/08/2020,207.5,Ferme,Conseil Régional d'Ile-de-France,48.8562037309,2.3121193117,GE,2.8015276154530535,48.840040811,2.29268840406,082020
20202020T0544400,Marché,Travaux,Travaux de désamiantage,11/08/2020,20708.0,Ferme et actualisable,CD95 - Conseil départemental du Val d'Oise,49.0400551805,2.05074797264,NC,,,,082020
20198bRWvS80M800,Marché,Travaux,Installation de meubles encastrés,14/08/2020,207163.0,Ferme et actualisable,OFFICE PUBLIC DE L'HABITAT de l'AISNE,49.5679878475,3.62136068206,PME,19.741087459701227,49.5400484161,3.7976652889,082020
20202019-3-1700,Marché,Travaux,Travaux de terrassement,07/08/2020,207189.25,Ferme et actualisable,EHPAD LA CONSOLATION,48.5096715165,-1.94121966489,NC,22.259771898489294,48.5363895762,-1.74171438144,082020
2020ZI0CTlQkkD00,Marché,Travaux,Travaux de menuiserie,13/08/2020,20719.0,Ferme et actualisable,Conseil Départemental de la Corrèze,45.273427808,1.76345249153,PME,30.662407520816092,45.1433810866,1.51897708197,082020
2020A3corgswXE00,Marché,Services,Services de contrôle technique de bâtiments,24/08/2020,207298.0,Révisable,SOLEAM (Société Locale d'Equipement et d'Aménagement de l'aire Métropolitaine),43.3127155398,5.36343891881,NC,8.327763560844746,43.238566824,5.37561344061,082020
2021LOT1PENTRE00,Marché,Fournitures,Produits de nettoyage,14/08/2020,207384.44,Ferme,VILLE CAPESTERRE B-EAU,16.0551130044,-61.6118604364,PME,10.655517348136843,16.2515819199,-61.5922344723,082020
2020MPARKSPD102,Marché,Travaux,Travaux de terrassement,05/08/2020,207807.8,Ferme et actualisable,SYDEC,43.8994418261,-0.490443107618,NC,67.51578747318284,43.7462418032,-1.08123783346,082020
2020pL8x_5vUtU00,Marché,Fournitures,Matériel et fournitures informatiques,24/08/2020,208000.0,Révisable,Ville de Chevigny-Saint-Sauveur,47.2997934853,5.13692576009,PME,16.978608575716365,47.2790771133,4.98480022988,082020
2020DSI00900,Marché,Services,Services informatiques,20/08/2020,208000.0,Révisable,Budget principal,45.1821782198,5.72099089704,PME,112.77602700570888,45.7708803723,4.88922582274,082020
20200JPMHIF0cw00,Marché,Fournitures,Matériaux de bâtiment,31/08/2020,208000.0,Révisable,Ville de Macon,46.320613267,4.81834086547,NC,0.0,46.320613267,4.81834086547,082020
2020M5600,Marché,Fournitures,"Équipement de lutte contre l'incendie, de sauvetage et de sécurité",12/08/2020,208000.0,Révisable,COMMUNE VILLEPINTE BUDGET PRIN,48.9595327185,2.53641870202,GE,37.104522942483584,48.8963161116,2.20694242609,082020
20202020F1153400,Marché,Fournitures,Mobilier médical,05/08/2020,208076.0,Révisable,HOSPICES CIVILS DE LYON,45.7480493184,4.82567584415,PME,571.7901764133676,48.0756879888,0.214655933289,082020
202073155500,Marché,Travaux,Travaux de plomberie,21/08/2020,208216.0,Ferme,Commune Les Angles,43.9467457769,4.75214648359,PME,19.872728075962474,44.1027508731,4.66384250597,082020
159169450779900,Marché,Fournitures,Hottes d'aspiration,05/08/2020,20833.0,Révisable,SDIS 34,43.663798664,3.72843489659,GE,31.535573517509512,43.5930787077,4.00463218238,082020
20202020S1273800,Marché,Services,Services de cartographie numérique,20/08/2020,208333.0,Révisable,"Ministère de la Transition Écologique et Solidaire, Ministère de la Cohésion des Territoires - Agence de l'Eau Loire Bretagne",47.8824665066,1.91660961834,ETI,4.310737462497047,47.854897242,1.88921777468,082020
202020140L0100,Marché,Travaux,Travaux de construction de canalisations d'eaux usées,24/08/2020,2087027.71,Révisable,CINOR,-20.9331856391,55.4471055195,GE,0.0,-20.9331856391,55.4471055195,082020
159782786965000,Marché,Services,Services de nettoyage,19/08/2020,20884.0,Révisable,Rodez Agglomération,44.358571606,2.56667306391,ETI,2.782917623690478,44.3826731465,2.55990190943,082020
20202020T0006000,Marché,Travaux,"Travaux de construction, de fondation et de revêtement d'autoroutes, de routes",17/08/2020,208915.0,Révisable,Département du Morbihan,47.6599029362,-2.75681901002,ETI,59.12918696302909,47.8074054749,-3.27057807852,082020
2020nRioW6unyF00,Marché,Fournitures,Systèmes d'alarme,25/08/2020,208999.0,Ferme et actualisable,"DAEC-Direction de l'aménagement, de l'environnement et de la construction",47.6022882653,7.54028126665,NC,58.62752112534308,48.1100979739,7.3849252282,082020
2019jeWL9KlFtF00,Marché,Fournitures,Bouches d'incendie,27/08/2020,208999.99,Révisable,Ville de Saint-Louis,47.6022882653,7.54028126665,NC,71.80662736303528,48.2481301221,7.4620559695,082020
2019kITNZa0NtH00,Marché,Fournitures,,27/08/2020,208999.99,Ferme,Ville de Saint-Louis,47.6022882653,7.54028126665,PME,13.740304693151835,47.6738280091,7.43860437,082020
2019dx05eQzDOU00,Marché,Travaux,Réparation et entretien de toiture,27/08/2020,208999.99,Révisable,Ville de Saint-Louis,47.6022882653,7.54028126665,PME,58.62752112534308,48.1100979739,7.3849252282,082020
2020lot no106,Marché,Travaux,,28/08/2020,209192.65,Ferme et actualisable,COMMUNE TREMBLAY,48.5881280903,1.3698287446,NC,29.537127106851315,48.8505180788,1.41003773224,082020
2019WbOzu8V7Lx00,Marché,Fournitures,Fournitures orthopédiques,11/08/2020,20977.0,Ferme et actualisable,Centre hospitalier de Boulogne sur mer Service Economique,50.7270459478,1.60607177999,NC,462.8212583503516,48.1582843043,-1.68533502046,082020
2019T4E9MpuwyC00,Marché,Travaux,Travaux de construction,13/08/2020,209852.0,Ferme et actualisable,Communauté de Communes Rives de Moselle,49.2081956345,6.15700583856,NC,15.727179100879603,49.0661568455,6.15306595989,082020
2019RxO2xt4AET00,Marché,Travaux,Travaux d'installation d'ascenseurs,27/08/2020,209980.0,Ferme,SOGIMA,,,NC,,43.3079059302,5.43964465576,082020
20192019DSP0701,Marché,Travaux,Travaux de pose de conduites,27/08/2020,209983.95,Ferme et actualisable,CCPR DSP EAU,,,NC,,45.4373788628,5.59868657405,082020
20202020S1183500,Marché,Services,Services de réparation et d'entretien du matériel de sécurité,06/08/2020,2100.0,Révisable,"Etablissements et organismes de l'enseignement supérieur, de la recherche et de l'innovation - CNRS Délégation Alsace",48.5716343863,7.76783353204,NC,13.647719478145133,48.5144548516,7.6584023712,082020
20202020S2127000,Marché,Services,Services de santé,20/08/2020,21000.0,Ferme et actualisable,"Ministère de l'immigration, de l'intégration, de l'asile et du développement solidaire - OFFICE FRANCAIS DE L'IMMIGRATION ET DE L'INTEGRATION",48.840040811,2.29268840406,ETI,551.0461461797775,44.8695763722,-0.684564339398,082020
202072916800,Marché,Travaux,Travaux d'isolation thermique,05/08/2020,21000.0,Ferme et actualisable,EVOLEA,46.5622744929,3.32725048972,PME,0.0,46.5622744929,3.32725048972,082020
2020DPM001100,Marché,Services,Services d'abonnement,07/08/2020,210000.0,Ferme,Budget principal,45.1821782198,5.72099089704,PME,551.7107040414617,48.8152248222,2.31722185184,082020
202030134200,Marché,Services,Maintenance de logiciels de technologies de l'information,13/08/2020,210000.0,Ferme,BUDGET PRINCIPAL,47.2551269927,6.0192810348,ETI,452.0983305679374,48.8604673342,2.26190318372,082020
20202020S1352400,Marché,Services,Services de formation,07/08/2020,210000.0,Révisable,"Ministère de la Transition Écologique, Ministère de la Cohésion des Territoires, Ministère de la Mer - Centre d'Etudes et d'Expertise sur les Risques, l'Environnement, la Mobilité et l'Aménagement",45.7345274274,4.91192378092,PME,448.7528008239014,48.8760781984,2.36069992794,082020
2020DM03001,Marché,Services,"Services de comptabilité, services d'audit et services fiscaux",17/08/2020,210000.0,Révisable,Budget principal,45.1821782198,5.72099089704,PME,556.7522439543256,48.8727847696,2.31253091684,082020
2020k8wZaHz1Gr00,Marché,Services,Services d'enquête téléphonique,28/08/2020,210000.0,Ferme,CAISSE CENTRALE MSA,48.9073106793,2.44007227598,PME,712.6029177549141,43.2343813418,5.45258699132,082020
2020872020701,Marché,Fournitures,Volaille fraîche,27/08/2020,210000.0,Révisable,Ville de Fos-sur-Mer,43.4556743263,4.90422543761,NC,751.3137190342468,47.4766284713,-0.556089456786,082020
2020DLIM1400,Marché,Services,Services d'études,21/08/2020,210000.0,Révisable,Martinique Transport,14.6408734458,-61.069176472,PME,7619.39672066968,48.8769868607,2.33753841595,082020
20206YN6d7dNIT00,Marché,Services,Services de formation professionnelle,24/08/2020,210000.0,Ferme,OPCO MOBILITES,48.8365394869,2.2389245247,NC,398.0438932292246,47.0458179875,-0.877097655444,082020
2020922020701,Marché,Fournitures,Produits surgelés,26/08/2020,210000.0,Révisable,Ville de Fos-sur-Mer,43.4556743263,4.90422543761,NC,38.91167395464505,43.524051997,5.24935836259,082020
202030134100,Marché,Services,Services de gestion des installations informatiques,14/08/2020,210000.0,Ferme,BUDGET PRINCIPAL,47.2551269927,6.0192810348,PME,0.0,47.2551269927,6.0192810348,082020
2020G2000200,Marché,Services,Services de restauration scolaire,14/08/2020,2100000.0,Révisable,CIAS DU CHOLETAIS,47.0458179875,-0.877097655444,GE,378.91979218047817,48.7728906673,2.07603849225,082020
20202020S1209700,Marché,Services,Services sylvicoles,12/08/2020,21040.0,Ferme,Ministère de l'agriculture et de l'alimentation - Direction régionale de La Réunion,-20.9331856391,55.4471055195,PME,15.591879774643358,-21.0446108504,55.3222448792,082020
20202020F1152400,Marché,Fournitures,Mobilier médical,05/08/2020,210572.0,Révisable,HOSPICES CIVILS DE LYON,45.7480493184,4.82567584415,ETI,896.1799040557253,47.7826309879,-3.01634101761,082020
20195RKcgkEnQ100,Marché,Fournitures,Fournitures orthopédiques,11/08/2020,2106.0,Ferme et actualisable,Centre hospitalier de Boulogne sur mer Service Economique,50.7270459478,1.60607177999,ETI,672.1461570291419,45.7541566032,5.06691649154,082020
2020014700,Marché,Travaux,Travaux de construction,27/08/2020,210896.0,Révisable,Région Normandie,49.1850685346,-0.370026383608,PME,119.4569097738499,49.0574199771,-1.44268684604,082020
2020.018700,Marché,Services,Logiciels de gestion de réseau,21/08/2020,211105.88,Révisable,Alpes Is�re Habitat,45.1821782198,5.72099089704,GE,551.1878534523358,48.6811729227,2.1853558178,082020
202073185600,Marché,Travaux,"Pose de menuiseries métalliques, excepté portes et fenêtres",25/08/2020,21122.0,Ferme,Commune Les Angles,43.9467457769,4.75214648359,PME,36.30432805371142,44.1234242643,5.02851096052,082020
2020c-hSwIrXXx00,Marché,Travaux,Travaux d'installation d'ascenseurs,27/08/2020,211455.0,Ferme,CENTRE HOSPITALIER DE MACON,46.320613267,4.81834086547,NC,519.5331640299819,50.675257141,3.10114805967,082020
20204ibj8Oo2yL00,Marché,Travaux,Travaux de peinture,03/08/2020,21178.0,Ferme et actualisable,Mairie La Queue en Brie,48.7774066504,2.58395193836,PME,24.29587193873766,48.8591103086,2.38017728226,082020
20202020F1327400,Marché,Fournitures,Véhicules à moteur,25/08/2020,21180.88,Ferme,Chambres de Commerce et d'Industrie,43.9352959178,4.84131733764,GE,614.8529633832109,48.8769868607,2.33753841595,082020
2020tlPBQGBCqc00,Marché,Services,Études techniques,21/08/2020,21200.0,Révisable,Mairie de St  Herblain,47.2246985502,-1.63426478543,PME,0.0,47.2246985502,-1.63426478543,082020
2020WyIyPSjBye00,Marché,Fournitures,Fourgons tôlés,31/08/2020,212000.0,Révisable,SDIS 44 Loire Atlantique,47.3030353752,-1.56014129347,PME,133.9397540671471,46.1619512738,-1.1749922971,082020
20203F66EKoLPY00,Marché,Services,Services divers d'entretien et de réparation,03/08/2020,212000.0,Révisable,Département de l Indre Direction des Routes des Transports du Patrimoine et de l Education,46.8031778361,1.69389403678,ETI,13.340724483238754,46.8292962154,1.81164493439,082020
2020n-5xD3Jpv200,Marché,Services,Services de contrôle technique,10/08/2020,21247.4,Révisable,Département de la Haute-Saône,47.631875925,6.15550489936,PME,36.73028786655736,47.8335905688,6.41928028979,082020
