2018x6xcc33WiO00,Marché,Travaux,Travaux de façade,25/04/2019,25872.0,Ferme,SECOMILE,49.019805962,1.14132572141,PME,30.380549687760837,49.2875159336,1.19500025574,042019
2019RTS01EA03,Marché,Services,Services d'assistance dans le domaine de l'ingénierie,24/04/2019,25912.5,Ferme et actualisable,COMMUNAUTE COMMUNES  RUMILLYTERE DE SA,,,PME,,48.8292048923,2.3267445538,042019
2019-PI-05/L500,Marché,Services,Services topographiques,16/04/2019,25931.0,Révisable,SM3A,46.0633605772,6.3723362559,PME,393.6839142262242,48.9920919296,4.35779662259,042019
2019170009236200,Marché,Services,Services de conseils et de représentation juridiques,01/04/2019,25950.0,Révisable,Ministère de l'Intérieur - SGAMI ILE DE FRANCE - Préfecture de Police Paris,48.8542874923,2.35759608215,PME,0.0,48.8542874923,2.35759608215,042019
2018hYZWYHJrvk00,Marché,Travaux,Travaux de plomberie,25/04/2019,259650.0,Ferme,SECOMILE,49.019805962,1.14132572141,PME,31.905999531110286,49.2822295022,1.02519116075,042019
20192019T0880800,Marché,Travaux,Revêtement de sols et de murs,15/04/2019,25973.61,Ferme et actualisable,"Etablissements et organismes de l'enseignement supérieur, de la recherche et de l'innovation - UN...",46.5834165499,0.359436087058,PME,6.854781305106579,46.5859101335,0.297494406027,042019
20192019S1081100,Marché,Services,Services d'impression et de livraison,17/04/2019,2600.0,Révisable,Ministère de la Culture - Bibliothèque publique d'information,48.8542874923,2.35759608215,PME,437.17779861998616,44.9245183348,2.4417949992,042019
20180IuyP7AHXF00,Marché,Fournitures,,05/04/2019,26000.0,Révisable,Mairie de Romainville,48.8845546351,2.43800840946,NC,204.5042281135967,50.6048306332,3.09232279652,042019
2018tQuzOXUwjF00,Marché,Services,Services zoologiques,04/04/2019,26000.0,Révisable,MAIRIE AULNAY SOUS BOIS,48.946227127,2.49329631847,NC,,,,042019
2019009600,Marché,Fournitures,Peintures,23/04/2019,26000.0,Révisable,Région Normandie,49.1850685346,-0.370026383608,PME,0.0,49.1850685346,-0.370026383608,042019
20192019S1657300,Marché,Services,Services de réparation et d'entretien du matériel de sécurité,12/04/2019,260000.0,Révisable,"Etablissements et organismes de l'enseignement supérieur, de la recherche et de l'innovation - UNIVERSITE RENNES  II  HAUTE BRETAGNE",48.111571436,-1.68168588816,ETI,456.69705061626314,48.8123578699,2.3878497256,042019
20192019S0785200,Marché,Services,Services de collecte et de collation de données,02/04/2019,260000.0,Révisable,"Etablissements et organismes de l'enseignement supérieur, de la recherche et de l'innovation - IR...",43.6131750772,3.86941278925,NC,8070.763750996028,-20.9331856391,55.4471055195,042019
20192019S1508000,Marché,Services,Services d'impression et services connexes,01/04/2019,260000.0,Révisable,"Etablissements et organismes de l'enseignement supérieur, de la recherche et de l'innovation - Éc...",48.8491121687,2.33284677548,ETI,320.1942702032891,48.8499074082,-0.562879238478,042019
2019130014325600,Marché,Travaux,Travaux d'assemblage d'ossatures métalliques,05/04/2019,2600000.0,Révisable,Ministère des armées - Service Parisien de Soutien de l'Administration Centrale - SPAC,,,ETI,,45.6776041395,4.75268296549,042019
20192019T1580000,Marché,Travaux,Travaux de menuiserie,16/04/2019,260084.0,Ferme et actualisable,Ministère des armées - Accord-Cadre Mandat de Maîtrise d'Ouvrage au profit du SID,48.8282706469,2.362358986,PME,228.69158560138325,50.7259486198,3.15990429501,042019
201920181500,Marché,Services,Services d'agences de rédaction,11/04/2019,260640.0,Ferme et actualisable,ANCV,48.9903286771,2.38130895683,PME,14.106317214636647,48.8873739998,2.30681348993,042019
20186Da0g-oGWt00,Marché,Travaux,Travaux de charpente,25/04/2019,26089.3,Ferme,SECOMILE,49.019805962,1.14132572141,ETI,19.99888973279119,48.9027848753,1.27857943375,042019
20192019S1606200,Marché,Services,Services relatifs à la construction,23/04/2019,261000.0,Révisable,CHRU TOURS,47.3314668694,0.715972131571,PME,289.5368420488182,44.9954858794,-0.435575421994,042019
20192019F0861700,Marché,Fournitures,Distributeurs de boissons,15/04/2019,26102.52,Ferme,CHRU CAEN,49.1850685346,-0.370026383608,NC,5.038986552292138,49.207357405,-0.330362469163,042019
2019VDN19022300,Marché,Services,Services d'animation pour enfants,18/04/2019,26124.15,Ferme,MAIRIE DE NICE,43.7123384529,7.23750191149,NC,0.0,43.7123384529,7.23750191149,042019
20192019T0007500,Marché,Travaux,Travaux de peinture,25/04/2019,26143.32,Révisable,Département du Morbihan,47.6599029362,-2.75681901002,PME,26.583676895771376,47.5575811437,-2.53954418246,042019
2019180005454000,Marché,Travaux,Travaux d'étude géotechnique,26/04/2019,26145.33,Ferme,Ministère des armées - Etablissement du service d'infrastructure de la défense de Metz - ESID Metz,,,NC,,48.9156889243,2.26738167747,042019
2019150935397900,Marché,Travaux,Travaux de vitrerie,15/04/2019,26185.0,Ferme et actualisable,Ministère de l'Intérieur - SGAMI EST - Metz - DAGF- Marchés Publics,49.1081027833,6.19595351042,PME,238.20017899759716,47.2856858419,5.05293981105,042019
2019130014393200,Marché,Services,Réalisation et entretien d'espaces verts,26/04/2019,261850.0,Révisable,Ministère de la Transition écologique et solidaire - Ministère de la Cohésion des Territoires - Direction Interdépartementale des Routes Ouest,48.111571436,-1.68168588816,NC,60.447245674728315,48.048244302,-1.13875082884,042019
20192019F0798400,Marché,Fournitures,Réactifs de laboratoire,02/04/2019,262.0,Révisable,CHU NIMES,43.8445331544,4.34760475323,GE,216.19794029483654,45.6395492264,5.108702258,042019
2019O9S3ovhQAA00,Marché,Services,"Services d'architecture, services de construction, services d'ingénierie et services d'inspection",06/04/2019,26220.0,Ferme,MANCHE HABITAT,49.1097135871,-1.07754504719,NC,0.0,49.1097135871,-1.07754504719,042019
20183WC4e9_iEw00,Marché,Services,Services de maintenance et de réparation de logiciels,02/04/2019,26250.0,Révisable,INFOCOM94-March�s Publics,,,PME,,48.8231210367,2.26445901319,042019
20192019T1939500,Marché,Travaux,Travaux de réfection,16/04/2019,26253.5,Ferme,"Etablissements et organismes de l'enseignement supérieur, de la recherche et de l'innovation - UN...",48.9296428406,2.35946866986,PME,16.23305749665426,48.8030644645,2.28639478919,042019
2018kXkCINzYu200,Marché,Services,Services d'assistance technique,10/04/2019,26259.0,Ferme,Ville de Fontenay sous Bois,48.8511697506,2.47460350341,GE,29.451588554032238,48.8426287239,2.20839539221,042019
20192019F1085200,Marché,Fournitures,Centrifugeuse de laboratoire et accessoires,25/04/2019,26296.36,Ferme,"Etablissements et organismes de l'enseignement supérieur, de la recherche et de l'innovation - CN...",48.5716343863,7.76783353204,NC,1050.3852621098654,47.2246985502,-1.63426478543,042019
20192019S0955200,Marché,Services,Services de réparation et d'entretien de matériel de précision,26/04/2019,262966.0,Révisable,"Etablissements et organismes de l'enseignement supérieur, de la recherche et de l'innovation - CN...",43.6131750772,3.86941278925,ETI,616.0848244861731,48.8655699938,2.09174463815,042019
20191403800,Marché,Fournitures,Consommables médicaux autres que chimiques à usage unique et consommables hématologiques,29/04/2019,263000.0,Révisable,ASSISTANCE PUBLIQUE DES HOPITAUX DE MARSEILLE,43.2924013477,5.39786536432,PME,705.2210231375249,48.8231210367,2.26445901319,042019
2019130014342000,Marché,Services,Services de réparation et d'entretien,09/04/2019,263000.0,Révisable,Ministère de la Transition écologique et solidaire - Ministère de la Cohésion des Territoires - D...,45.7859001722,3.11559551839,PME,215.59808197318313,44.9305339297,4.86588379454,042019
2019-PI-05/L100,Marché,Services,Services topographiques,16/04/2019,263275.8,Révisable,SM3A,46.0633605772,6.3723362559,PME,8.264604985649598,46.0437305067,6.30022971427,042019
20192020F0102400,Marché,Fournitures,Machines spécialisées à usage agricole ou sylvicole,02/04/2019,263500.0,Ferme,Ministère de l'agriculture et de l'alimentation - Direction territoriale Centre Ouest Aquitaine,47.9321365141,2.01838531803,PME,327.71618768479703,50.6955784111,3.04755809523,042019
20192019F0862100,Marché,Fournitures,"Café, thé et produits connexes",15/04/2019,26352.0,Révisable,CHRU CAEN,49.1850685346,-0.370026383608,ETI,295.9496477487251,48.9346127594,2.29454165622,042019
20192019F0939000,Marché,Fournitures,Pain,18/04/2019,26382.0,Révisable,CHU NANTES,47.2321613301,-1.54797539458,PME,33.4468698890037,47.3554947318,-1.2721354757,042019
20191432800,Marché,Services,Services de nettoyage,02/04/2019,264000.0,Révisable,"Etablissements et organismes de l'enseignement supérieur, de la recherche et de l'innovation - UN...",45.7333494426,4.83733100241,PME,7.089604187415273,45.7708803723,4.88922582274,042019
20191451100,Marché,Fournitures,Consommables médicaux autres que chimiques à usage unique et consommables hématologiques,25/04/2019,264762.8,Révisable,ASSISTANCE PUBLIQUE DES HOPITAUX DE MARSEILLE,43.2924013477,5.39786536432,PME,720.7924080957341,48.9907177266,2.27755595285,042019
2019150939061600,Marché,Services,Services d'audit informatique et services d'essai informatique,12/04/2019,26500.0,Ferme et actualisable,Services du Premier ministre - Cour des Comptes,48.8625262113,2.33630086089,ETI,8.159253326188486,48.8855642403,2.26624582625,042019
2019150933897000,Marché,Services,,01/04/2019,26500.0,Révisable,Ministère de la Justice  - Direction interrégionale des services pénitentiaires de Lyon,45.7533230296,4.86924368009,NC,123.1149349273564,45.204410391,5.83712484674,042019
2018611404,Marché,Travaux,Travaux routiers,25/04/2019,265000.0,Ferme,BUDGET PRINCIPAL,50.2899236486,2.76642705397,NC,4.3891235342954,50.2582331244,2.79009311526,042019
2019120006141000,Marché,Services,Services de traitement et d'élimination des ordures ménagères et des déchets non dangereux,12/04/2019,26505.5,Révisable,Ministère de l'Intérieur - SGAMI EST - Metz - DAGF- Marchés Publics,48.8348302792,2.42102904428,NC,352.74112044737404,46.8174322083,4.8844509685,042019
20192019T2150500,Marché,Travaux,Travaux d'équipement électrique,29/04/2019,26530.4,Ferme,CHU SAINT ETIENNE,45.4301960415,4.37808697748,PME,0.0,45.4301960415,4.37808697748,042019
2019MAPA11200,Marché,Fournitures,Arbres,12/04/2019,26532.0,Ferme,1-BUDGET PRINCIPAL,44.8833318393,-0.784280122922,NC,458.46691536920815,47.8251852838,2.11790861248,042019
2018030500,Marché,Travaux,Travaux d'installation d'ascenseurs,29/04/2019,26555.0,Ferme et actualisable,Ville de Plessis Pâté,48.6070710384,2.34110784099,NC,24.60259042005034,48.7732937592,2.48790854128,042019
20192019S0965900,Marché,Services,Services de formation du personnel,23/04/2019,26600.0,Révisable,"Etablissements et organismes de l'enseignement supérieur, de la recherche et de l'innovation - Di...",45.1752846004,5.76552012882,PME,12.173387890880726,45.2850635435,5.76020391568,042019
20192019F0908900,Marché,Fournitures,Matériel biomédical,24/04/2019,26606.25,Ferme,CHU TOULOUSE,43.5959710776,1.43229743595,PME,11.730579040350976,43.5390131127,1.52156442051,042019
2019160005184100,Marché,Travaux,Travaux de cloisonnement,17/04/2019,266226.13,Ferme,Ministère de l'agriculture et de l'alimentation - Bureau de la commande publique et des achats,48.8562037309,2.3121193117,GE,593.2809110828608,43.5959710776,1.43229743595,042019
20192019S0911400,Marché,Services,"Services de technologies de l'information, conseil, développement de logiciels, internet et appui",15/04/2019,266256.0,Révisable,Chambres de Commerce et d'Industrie,43.3201640732,-0.3496692279,PME,686.4777735510987,48.9228776124,2.24687029827,042019
20192019S1228800,Marché,Services,"Études de faisabilité, service de conseil, analyse",29/04/2019,26650.0,Ferme,CHU ANGERS,47.4766284713,-0.556089456786,PME,94.8692943079457,47.1718581475,0.24514174955,042019
201919F0501,Marché,Fournitures,"Équipement de lutte contre l'incendie, de sauvetage et de sécurité",02/04/2019,266666.64,Ferme,EXERCICE BUDGETAIRE,43.8445331544,4.34760475323,PME,219.052373493721,45.7979962913,4.63122851388,042019
2018M2294700,Marché,Travaux,Travaux de construction de bâtiments,17/04/2019,26679.0,Ferme et actualisable,Val Touraine Habitat,47.3980773574,0.696151819266,PME,4.621159022898979,47.3882708034,0.736761442481,042019
2019110004584100,Marché,Fournitures,Ordinateur de bureau,03/04/2019,2668000.0,Ferme et actualisable,Ministère des armées - Direction Interarmées des Réseaux d'Infrastructure et des Systèmes d'Information de la défense,,,ETI,,48.8963161116,2.20694242609,042019
20192019S0860300,Marché,Services,Services de transport de colis,15/04/2019,26703.76,Ferme,"Etablissements et organismes de l'enseignement supérieur, de la recherche et de l'innovation - Ce...",48.6987447202,2.12716826038,GE,28.09097330195661,48.8951908356,2.28680331405,042019
2019100013603600,Marché,Services,Services de réalisation d'enquêtes,24/04/2019,267520.0,Ferme et actualisable,"Ministère de la Transition Écologique et Solidaire, Ministère de la Cohésion des Territoires - Direction Régionale Environnement, Aménagement et Logement Auvergne-Rhône-Alpes",45.7731043316,4.85202749669,NC,439.071246600953,48.8152248222,2.31722185184,042019
2018MjFhKl70yV00,Marché,Travaux,Travaux de cloisonnement,04/04/2019,267996.0,Révisable,COMMUNAUTE DE COMMUNES ILE DE RE,46.1990801961,-1.36630018466,PME,21.553642960272064,46.1619512738,-1.1749922971,042019
2019170009285300,Marché,Services,Services de formation dans le domaine de la sécurité,18/04/2019,268000.0,Révisable,Ministère des armées - Plate forme achats finances Centre Ouest,,,GE,,48.9784393812,2.55500199053,042019
20192019T0872200,Marché,Travaux,Travaux d'installations électriques,08/04/2019,26817.0,Ferme et actualisable,"Etablissements et organismes de l'enseignement supérieur, de la recherche et de l'innovation - UN...",50.2899236486,2.76642705397,PME,81.74093596603663,50.3660295071,2.03117432224,042019
20192019T1032400,Marché,Travaux,Travaux de construction de maisons de retraite,02/04/2019,268263.0,Ferme et actualisable,CHRU CAEN,49.1850685346,-0.370026383608,PME,10.522511966332358,49.1637379492,-0.462734244826,042019
2018_OtaoCWajC00,Marché,Services,"Services de propreté et d'hygiénisation en milieu urbain ou rural, et services connexes",10/04/2019,26829.0,Ferme,Ville de Fontenay sous Bois,48.8511697506,2.47460350341,PME,570.1406947189739,44.3115993656,0.0844030891761,042019
20192019S0908200,Marché,Services,Services de maintenance et de réparation de logiciels,17/04/2019,26848.0,Ferme,Ministère de la Transition écologique et solidaire - Ministère de la Cohésion des Territoires - V...,50.5291112881,2.64320584341,PME,494.6462883712006,49.1281091029,6.88986595396,042019
2019M1904201,Marché,Fournitures,Produits en béton,10/04/2019,26850.0,Révisable,ORLEANS METROPOLE,47.8824665066,1.91660961834,NC,11.065665951899243,47.9166659171,1.82263859318,042019
2019150918667900,Marché,Travaux,Travaux de transformation de bâtiments,29/04/2019,26861.0,Ferme et actualisable,Ministère des armées - Etablissement du service d'infrastructure de la défense de Metz - ESID Metz,,,PME,,50.6546146137,3.06940961222,042019
2018PAT010400,Marché,Services,Services de sécurité,03/04/2019,26867.7,Révisable,SEMCODA,46.2047217001,5.24553216043,PME,70.22456291031929,45.6680469522,4.9083713349,042019
2019192300,Marché,Services,Services de gardiennage,25/04/2019,26891.0,Ferme,VILLE DE BOUGUENAIS,47.170656178,-1.61651705517,PME,48.473720945710866,47.1223182517,-2.05218747345,042019
2019C2600,Marché,Fournitures,Plates-formes informatiques,24/04/2019,26900.0,Ferme,COMMUNE VILLEPINTE BUDGET PRIN,48.9595327185,2.53641870202,PME,30.04945492042688,48.840040811,2.29268840406,042019
20192019T2807100,Marché,Travaux,Travaux de gros œuvre,30/04/2019,2692.5,Ferme,"Etablissements et organismes de l'enseignement supérieur, de la recherche et de l'innovation - UN...",49.2517771432,4.03968745396,PME,116.70512718656012,48.2016518452,4.08277688852,042019
2018V1803100,Marché,Fournitures,Mobilier divers,12/04/2019,2696.1,Ferme,Ville de Gap,44.580393647,6.06471167343,PME,0.0,44.580393647,6.06471167343,042019
20192019T1033700,Marché,Travaux,Travaux de construction de maisons de retraite,01/04/2019,269640.0,Ferme et actualisable,CHRU CAEN,49.1850685346,-0.370026383608,PME,277.3822417301654,46.7876431781,-1.05446376754,042019
2019130014359300,Marché,Fournitures,Groupes électrogènes,30/04/2019,2697.36,Révisable,Ministère de l'Intérieur - SGAMI EST - Metz - DAGF- Marchés Publics,49.1081027833,6.19595351042,GE,643.5116460696648,43.3654982005,5.31265000369,042019
20192019F0877100,Marché,Fournitures,Réactifs de laboratoire,17/04/2019,2698.0,Révisable,CHU NIMES,43.8445331544,4.34760475323,ETI,638.6442396730388,48.5198254221,7.7317552386,042019
20192019S0856300,Marché,Services,Services ambulanciers,09/04/2019,269889.0,Révisable,CHRU NANCY,48.6900671002,6.17594832427,PME,3.8429183058534373,48.6573087563,6.16442957921,042019
20192019S0865100,Marché,Services,Services de contrôle technique de bâtiments,16/04/2019,26990.0,Révisable,"Etablissements et organismes de l'enseignement supérieur, de la recherche et de l'innovation - Un...",45.7859001722,3.11559551839,NC,9.124316082237929,45.7434742148,3.18623551965,042019
20192019F0796500,Marché,Fournitures,Réactifs de laboratoire,02/04/2019,270.0,Révisable,CHU NIMES,43.8445331544,4.34760475323,GE,216.19794029483654,45.6395492264,5.108702258,042019
2018yfFnqhl51d00,Marché,Services,Services de réparation et d'entretien de voitures,04/04/2019,2700.0,Révisable,SDIS 42 Loire,45.4301960415,4.37808697748,NC,,,,042019
20192019S0781100,Marché,Services,Services de maintenance et de réparation de logiciels,08/04/2019,27000.0,Ferme,Ministère des armées - Musée de l'Air et de l'Espace,48.9360708295,2.42709736911,NC,338.62998624031843,46.6937505372,0.356788934881,042019
2019180005411000,Marché,Services,Services informatiques,01/04/2019,27000.0,Ferme,Ministère de la Culture - CENTRE DE RECHERCHE ET DE RESTAURATION DES MUSÉES DE FRANCE,48.8625262113,2.33630086089,PME,4.866539732067665,48.8591103086,2.38017728226,042019
20192019F0755500,Marché,Fournitures,Produits surgelés,01/04/2019,2.703025256E7,Révisable,ASSISTANCE PUBLIQUE - HOPITAUX DE PARIS,48.8542874923,2.35759608215,NC,2.941278150356849,48.8282706469,2.362358986,042019
20192019T0815800,Marché,Travaux,Travaux de construction de bâtiments,02/04/2019,272.0,Ferme et actualisable,HOSPICES CIVILS DE LYON,45.7480493184,4.82567584415,NC,29.913378468990345,45.5134383216,4.95908822851,042019
2019130014350400,Marché,Services,Services de réparation et d'entretien,10/04/2019,2730.0,Révisable,Ministère de l'Intérieur - PREFECTURE DU DEP DES BOUCHES DU RHONE,43.2868669832,5.38037571899,PME,36.484380605128564,43.2809446283,5.71024500507,042019
20192019F1007400,Marché,Fournitures,Machines et appareils à usage spécifique,02/04/2019,27300.0,Ferme,"Etablissements et organismes de l'enseignement supérieur, de la recherche et de l'innovation - UN...",48.783689162,2.4549804713,ETI,7.812378943986331,48.8511697506,2.47460350341,042019
20192019T0814200,Marché,Travaux,Travaux de construction,11/04/2019,27316.71,Ferme et actualisable,Chambres de Commerce et d'Industrie,49.4415068863,1.09373273216,PME,14.548793175311744,49.5692501318,1.06582689324,042019
2019180005421400,Marché,Services,Services de réception,01/04/2019,273188.46,Révisable,Ministère de l'agriculture et de l'alimentation - Bureau de la commande publique et des achats,48.8562037309,2.3121193117,NC,8.383940268732315,48.8365394869,2.2389245247,042019
2019WRD1ZHaxVL00,Marché,Services,Services de surveillance,05/04/2019,27324.0,Ferme,SPL CULTURE ET PATRIMOINE,43.8445331544,4.34760475323,PME,58.78816290826456,43.6131750772,3.86941278925,042019
2018-Nwlj7f8YK00,Marché,Services,Logiciels et systèmes d'information,04/04/2019,27500.0,Révisable,COMMUNAUTE DE COMMUNES CUR ET COTEAUX DU COMMINGES,43.1196289339,0.726755999181,NC,94.32439256929023,43.5959710776,1.43229743595,042019
2019130014314000,Marché,Services,Services d'établissement de listes d'adresses et services d'envoi,19/04/2019,275000.0,Révisable,Bourgogne Franche-Comté,47.3230744087,5.03738286925,PME,257.13601458057104,47.9691186626,7.27086994961,042019
2019150940836800,Marché,Services,Services de conseil en ingénierie de la construction,29/04/2019,2756.25,Ferme et actualisable,Ministère de la Justice  - Direction interrégionale des services pénitentiaires de Lyon,45.7533230296,4.86924368009,GE,269.27101424340145,43.3654982005,5.31265000369,042019
20192019S0898100,Marché,Services,Logiciels de gestion des temps de travail et des ressources humaines,16/04/2019,275600.0,Ferme et actualisable,"Etablissements et organismes de l'enseignement supérieur, de la recherche et de l'innovation - UN...",44.8578964782,-0.57357535767,NC,550.6278109666564,48.8682182328,2.34268958704,042019
20182900,Marché,Services,Services d'animation pour enfants,03/04/2019,27650.0,Ferme,Ville de Bandol,43.1478384677,5.74751336915,PME,20.524889153058215,43.1364847512,5.93276630299,042019
20190001803,Marché,Travaux,Travaux d'étanchéification,03/04/2019,276584.0,Révisable,VILLE DE MONTIGNY LE BRETONNEUX,48.7796502574,2.02991602442,NC,63.692103478220524,48.8837873385,2.59631331192,042019
201818Do-5g9Tw00,Marché,Travaux,Travaux de construction,02/04/2019,276644.0,Ferme,SAS SAINTE BARBE,49.152566268,6.79805595789,PME,14.328919934576644,49.2091741149,6.68149900611,042019
20192020T0001400,Marché,Travaux,Travaux de construction de conduites d'eaux d'égouts,18/04/2019,277208.75,Ferme et actualisable,QUIMPER BRETAGNE OCCIDENTALE,47.9968866318,-4.09100301844,PME,152.82372619205836,47.6984708271,-2.74188827179,042019
201919220200,Marché,Fournitures,Équipements de protection,25/04/2019,27730.0,Ferme et actualisable,VILLE DE BOUGUENAIS,47.170656178,-1.61651705517,NC,11.171921803472673,47.1417952235,-1.5197470717,042019
20192019S0862900,Marché,Services,Services d'ingénierie mécanique,15/04/2019,27761.0,Ferme,"Etablissements et organismes de l'enseignement supérieur, de la recherche et de l'innovation - CN...",48.8604673342,2.26190318372,ETI,13.229376887186989,48.7922472037,2.35990671258,042019
2018hyNS65f3cO00,Marché,Fournitures,Bains ultrasoniques,04/04/2019,27840.0,Révisable,SDIS 42 Loire,45.4301960415,4.37808697748,PME,723.1158826239317,48.0530085081,-1.60555615262,042019
2018pPJkigKYMn00,Marché,Fournitures,Matériel de jardinage divers,02/04/2019,27850.0,Ferme,Mairie de Bras Panon,-21.0234376113,55.6195811957,NC,35.376488039282805,-20.9441421191,55.3050347414,042019
20192019F0940300,Marché,Fournitures,Cartes électroniques,30/04/2019,27864.1,Ferme,"Etablissements et organismes de l'enseignement supérieur, de la recherche et de l'innovation - CN...",48.8604673342,2.26190318372,PME,21.665843269421206,48.6811729227,2.1853558178,042019
2019000018M06601,Marché,Travaux,Travaux de construction,30/04/2019,27872.77,Ferme,SDMIS,45.7533230296,4.86924368009,PME,100.4878549142437,45.2201436723,4.13476472617,042019
2019150935690900,Marché,Travaux,Maçonnerie de pierres,10/04/2019,27885.0,Révisable,Ministère de la Culture - Direction Régionale des Affaires Culturelles - Ile de France,48.8769868607,2.33753841595,PME,333.4873576319665,49.1720055241,5.33876316914,042019
20192019F0851000,Marché,Fournitures,Cellules,11/04/2019,27900.0,Ferme,"Etablissements et organismes de l'enseignement supérieur, de la recherche et de l'innovation - CN...",43.6276961423,7.02943470458,NC,774.7577411783018,48.7148263602,2.22875253896,042019
