20202020M04500,Marché,Travaux,Travaux d'assainissement,14/09/2020,483101.19,Ferme,SILA,45.8900209706,6.12570413482,NC,0.0,45.8900209706,6.12570413482,092020
2020130015790300,Marché,Fournitures,Robots industriels,18/09/2020,4834528.0,Ferme,"Ministère de l'éducation nationale et de la jeunesse et Ministère de l'enseignement supérieur, de la recherche et de l'innovation - SAAM- Mission des achats",48.8562037309,2.3121193117,PME,443.2702963991037,45.7480493184,4.82567584415,092020
2020BATLO0002502,Marché,Travaux,Travaux de restructuration,03/09/2020,48375.4,Ferme et actualisable,Budget principal,46.5622744929,3.32725048972,PME,83.76433388444696,46.3390435424,2.60374091714,092020
202020-0020300,Marché,Services,Services d'études,16/09/2020,48400.0,Ferme,EPT Plaine Commune,48.9296428406,2.35946866986,ETI,606.3388784718879,43.8445331544,4.34760475323,092020
20202020T1583300,Marché,Travaux,Travaux de menuiserie,10/09/2020,48409.16,Ferme et actualisable,Ministère de la Culture - Musée du quai Branly,48.8562037309,2.3121193117,PME,341.6345078009665,45.8941119385,3.1326472398,092020
2020cD1FLb13xo00,Marché,Services,Services spécialisés de transport routier de passagers,09/09/2020,48410.0,Révisable,DM - Direction des mobilités,45.7480493184,4.82567584415,PME,279.0307676622581,44.9245183348,2.4417949992,092020
2020GgM2mvsdiZ00,Marché,Services,Réalisation et entretien d'espaces verts,30/09/2020,4844.0,Révisable,Mairie de Saint Jean,43.662968552,1.50091500983,PME,241.79705742614857,43.4623303655,-0.676472641069,092020
2020MAIRIELOT602,Marché,Travaux,Travaux de transformation de bâtiments,16/09/2020,48457.49,Ferme,VAL DE BONNIEURE,45.8369750074,0.273057912674,PME,21.208201711897242,45.6792389437,0.165490996541,092020
20191GMWIIezpa00,Marché,Travaux,Travaux de construction,11/09/2020,48500.0,Ferme,CONTRATS PRIVÉS,45.8900209706,6.12570413482,PME,57.479662238558184,46.0011621357,6.63343628986,092020
20202020T0001801,Marché,Travaux,Travaux de démolition,18/09/2020,48517.0,Ferme et actualisable,Etablissement public foncier de Bretagne,48.111571436,-1.68168588816,PME,273.61064630725235,47.9358115788,-4.14975177559,092020
2019057-45701,Marché,Travaux,Travaux de construction de canalisations d'eaux usées,04/09/2020,48600.0,Révisable,MAUGES COMMUNAUTE ASSAICOL,,,PME,,47.3500105413,-0.7733709473,092020
2019vtHdg9Zcb000,Marché,Travaux,Travaux de maçonnerie et de briquetage,15/09/2020,486135.0,Ferme et actualisable,Grand Paris Sud Est Avenir,48.783689162,2.4549804713,PME,13.515621382873642,48.8062253343,2.57508931375,092020
20202021T0020700,Marché,Fournitures,Mobilier,21/09/2020,48626.46,Révisable,Ville de Pierrefitte-sur-Seine,48.9602089765,2.36360854927,NC,54.65176953855684,48.5134326179,2.56939739997,092020
20191ge7mkykCD00,Marché,Travaux,Travaux de maçonnerie et de briquetage,15/09/2020,486350.0,Ferme et actualisable,Grand Paris Sud Est Avenir,48.783689162,2.4549804713,ETI,20.4169379982859,48.6918752913,2.61487236964,092020
2020009-2020S00,Marché,Travaux,Travaux de chantier,14/09/2020,48697.0,Ferme et actualisable,VILLE DE BLOIS,47.5814306941,1.30596722868,PME,31.848626360393983,47.7253412852,1.5549305755,092020
20201FwFoWjU6000,Marché,Services,Services spécialisés de transport routier de passagers,09/09/2020,48719.0,Révisable,DM - Direction des mobilités,45.7480493184,4.82567584415,PME,279.0307676622581,44.9245183348,2.4417949992,092020
2020f0CbwFVeyJ00,Marché,Fournitures,Serrurerie,10/09/2020,48752.01,Ferme et actualisable,DEL - Direction de l éducation et des lycées,45.7480493184,4.82567584415,PME,20.54493045889687,45.9230318699,4.88658397062,092020
20202020F1230000,Marché,Fournitures,Réactifs de laboratoire,01/09/2020,488042.78,Révisable,CHU SAINT ETIENNE,45.4301960415,4.37808697748,NC,431.56049081763433,48.7495659946,2.35212808495,092020
2020301015RE01,Marché,Travaux,Travaux de réparation de routes,03/09/2020,488426.0,Révisable,BUDGET PRINCIPAL,43.9352959178,4.84131733764,NC,23.45268213283306,43.8505844003,5.03563866158,092020
2020M9B0119TE02,Marché,Travaux,Travaux de construction de bâtiments agricoles,04/09/2020,48880.0,Ferme,BUDGET PRINCIPAL,43.6131750772,3.86941278925,NC,131.89849832222694,44.0338905553,4.98494540657,092020
2020mwvydbPrW-00,Marché,Services,Services de téléphonie et de transmission de données,04/09/2020,48894.0,Révisable,Service Départemental Incendie et  Secours Eure et Loir - SDIS 28,48.4470919696,1.50577061537,GE,97.3793030917251,48.840040811,2.29268840406,092020
20202020T1420600,Marché,Travaux,Travaux de menuiserie,15/09/2020,48917.5,Ferme et actualisable,"Etablissements et organismes de l'enseignement supérieur, de la recherche et de l'innovation - UNIVERSITE DE POITIERS",46.5834165499,0.359436087058,PME,0.0,46.5834165499,0.359436087058,092020
2020U8fnXQVfDV00,Marché,Services,Services spécialisés de transport routier de passagers,09/09/2020,48930.0,Révisable,DM - Direction des mobilités,45.7480493184,4.82567584415,PME,208.628531103098,45.0286242677,3.08281527911,092020
202020M009000,Marché,Fournitures,"Dispositifs de stérilisation, de désinfection et d'hygiène",07/09/2020,48933.75,Ferme,MAIRIE D'AUBERVILLIERS,48.9128078947,2.38454842862,PME,25.19067316888018,48.7839097374,2.19723411662,092020
2020WNm0kbzrOc00,Marché,Services,,01/09/2020,4894.51,Ferme,SEMINOR,49.7526272499,0.39606397889,PME,23.40192955878349,49.6567705875,0.584423514325,092020
2019MXZTQwLT8200,Marché,Travaux,Travaux de menuiserie,04/09/2020,489735.0,Révisable,Ardèche Habitat,45.2462974654,4.65115146795,PME,5.792108924957978,45.2552743138,4.70274983005,092020
2020pReNfeFyc600,Marché,Travaux,Travaux de couverture,30/09/2020,48980.5,Ferme,CAF CHAMBERY,45.5837038917,5.90877548323,ETI,536.4602020546586,48.6811729227,2.1853558178,092020
2020130015822400,Marché,Services,Services de réparation et d'entretien d'installations de bâtiments,23/09/2020,489956.0,Révisable,Ministère des armées - Etablissement du service d'infrastructure de la défense de Lyon - ESID Lyon,,,GE,,43.5959710776,1.43229743595,092020
20202020037800,Marché,Services,Services de contrôle technique,11/09/2020,49000.0,Ferme,DEPARTEMENT DU VAR,43.1364847512,5.93276630299,PME,8.658333871138355,43.1388519901,5.85450715581,092020
202030023000,Marché,Fournitures,Onduleurs,04/09/2020,49000.0,Révisable,Département du Doubs,47.2551269927,6.0192810348,GE,435.19519064151535,48.7607713786,2.38552283395,092020
2020M200052101,Marché,Travaux,Ouvrages de régularisation des cours d'eau et de maîtrise des crues,18/09/2020,490000.0,Révisable,DEPARTEMENT DES PYRENEES ORIENTALES,42.6966171788,2.89890986886,NC,147.95543342700677,43.6131750772,3.86941278925,092020
20202020T2316100,Marché,Travaux,Travaux de pose de revêtements de sols,17/09/2020,490000.0,,CHU DU HAVRE,49.4965847516,0.140273146733,PME,0.0,49.4965847516,0.140273146733,092020
20202020T2316000,Marché,Travaux,Travaux de pose de revêtements de sols,21/09/2020,490000.0,,CHU DU HAVRE,49.4965847516,0.140273146733,PME,6.525261649209252,49.5135576191,0.196757656264,092020
2020TXRO-L1L0100,Marché,Travaux,Travaux d'aménagement du terrain,09/09/2020,490000.0,Révisable,AMENAGEMENT SUD ROUANS,,,ETI,,47.2252225216,-2.0662861909,092020
20202020T2316200,Marché,Travaux,Travaux de pose de revêtements de sols,22/09/2020,490000.0,,CHU DU HAVRE,49.4965847516,0.140273146733,NC,0.0,49.4965847516,0.140273146733,092020
2019cu5UhYrJHQ00,Marché,Travaux,Travaux d'étanchéification,07/09/2020,490000.0,Ferme et actualisable,DM - Direction des mobilités,45.7480493184,4.82567584415,PME,26.685599417153103,45.7541566032,5.06691649154,092020
2020130015789900,Marché,Fournitures,Articles d'habillement,16/09/2020,490147.0,Révisable,Ministère de l'Intérieur - Sous Direction de l'achat - Bureau des marchés publics,48.8348302792,2.42102904428,PME,592.6348220363079,43.5088733532,2.2668478235,092020
201831eV5BVAjV00,Marché,Services,Services de réparation et d'entretien,04/09/2020,49079.3,Révisable,Ardèche Habitat,45.2462974654,4.65115146795,GE,69.34988593431895,45.820656077,4.8987353728,092020
20206Yz3FjQ1WP00,Marché,Travaux,Travaux de plomberie,23/09/2020,49084.27,Ferme et actualisable,COMMUNAUTE DE COMMUNES DE VENTADOUR-EGLETONS-MONEDIERES,45.297421852,2.15927228555,PME,19.333998840347817,45.4212451696,2.03657954031,092020
201906-2019-CC00,Marché,Services,"Études de faisabilité, service de conseil, analyse",24/09/2020,49125.0,Ferme,COMMUNAUTE DE COMMUNES DE PETITE TERRE,-12.796911236,45.2842595971,PME,10.055841502058108,-12.7898335897,45.1939159334,092020
20202020F1449000,Marché,Fournitures,Système de dépôt,18/09/2020,491566.0,Ferme,"Etablissements et organismes de l'enseignement supérieur, de la recherche et de l'innovation - Université de technologie de Troyes",48.2968506353,4.07801333034,PME,349.9833555165913,45.8900209706,6.12570413482,092020
202020PA080300,Marché,Travaux,Travaux de construction de centres de secours des sapeurs-pompiers,25/09/2020,49169.25,Révisable,SDIS DES ARDENNES,49.7485363282,4.68592124661,PME,24.55755049795911,49.7167213473,4.90569128189,092020
2020151018911700,Marché,Fournitures,Équipement de plomberie,08/09/2020,49196.78,Révisable,"Ministère de l'Économie, des Finances et de la Relance - DGFIP 013 Bouches du Rhône",43.238566824,5.37561344061,PME,260.60639994746884,43.1651014685,3.02005317318,092020
20202020F1549200,Marché,Fournitures,Instruments dentaires,04/09/2020,4924.8,Révisable,CHRU NANCY,48.6900671002,6.17594832427,PME,217.5149425209866,46.744951163,5.8982450479,092020
2019KG0gTWNIcq00,Marché,Services,Services de transport de colis,21/09/2020,49249.2,Ferme et actualisable,CPAM CLERMONT-FERRAND,45.7859001722,3.11559551839,PME,361.70175662054936,48.9346127594,2.29454165622,092020
2020U609dyXgHV00,Marché,Services,Services de conseil en ingénierie de l'environnement,03/09/2020,493114.0,Ferme,La Ciotat Shipyards,43.1924821857,5.61223397006,PME,13.986181922537654,43.2768636927,5.51816955046,092020
20202019-08 L400,Marché,Fournitures,"Produits alimentaires, boissons, tabac et produits connexes",01/09/2020,49316.0,Ferme,VILLE DE BAILLIF,16.0453168325,-61.7188998823,NC,17.852405984396263,16.2515819199,-61.5922344723,092020
20182018G00101,Marché,Services,Services de conseil en matière d'ingénierie et de construction,11/09/2020,49396.0,Révisable,Ville de Versailles,48.8022788923,2.11716530117,PME,26.334309353089605,48.7667116171,2.35261812092,092020
2019TI8RCt-xSQ00,Marché,Travaux,Travaux de construction,11/09/2020,493977.0,Ferme,CONTRATS PRIVÉS,45.8900209706,6.12570413482,PME,50.47589353209241,46.0885156588,6.53666656578,092020
20202020F1375000,Marché,Fournitures,Équipement de restauration,07/09/2020,49400.0,Ferme et actualisable,CHU GRENOBLE,45.2097006413,5.74400008015,PME,6.448485570813971,45.1516639844,5.74860326307,092020
2020b71n-50ClK00,Marché,Services,Services spécialisés de transport routier de passagers,09/09/2020,49412.0,Révisable,DM - Direction des mobilités,45.7480493184,4.82567584415,PME,279.0307676622581,44.9245183348,2.4417949992,092020
2020170010189300,Marché,Services,Analyse des indicateurs environnementaux autres que pour la construction,03/09/2020,49425.0,Ferme,Ministère de l'Intérieur - 44 - Direction départementale des territoires et de la mer,47.2321613301,-1.54797539458,PME,113.0021243587881,47.4766284713,-0.556089456786,092020
2020V9C0017AIA01,Marché,Services,Services de conseil en matière de santé et de sécurité,18/09/2020,494572.8,Révisable,EXERCICE 2020,43.6131750772,3.86941278925,PME,133.0359376301269,43.3799827921,5.04949160777,092020
2020C10200,Marché,Travaux,Travaux de restructuration,10/09/2020,49499.52,Ferme,BUDGET PRINCIPAL,43.9256996046,2.14745941954,PME,35.922300969661826,43.6156093545,2.23815569342,092020
2020GN20A0200,Marché,Travaux,Travaux d'assainissement,28/09/2020,49515.0,Ferme et actualisable,GRAND NARBONNE COMMUNAUTE AGGLOMERATIO,43.1651014685,3.02005317318,PME,183.4357206346088,43.5288972686,1.40201144987,092020
202020201400,Marché,Travaux,Travaux d'installation électrique de transformateurs,08/09/2020,49590.0,Ferme et actualisable,VILLE DE CHATEAUBRIANT,47.7220962122,-1.38697766124,NC,47.7272320057298,47.3015616292,-1.47168011724,092020
2019gUlM2YbgB000,Marché,Travaux,Installations mécaniques,23/09/2020,49600.0,Ferme,I RA CAO,45.7333494426,4.83733100241,NC,12.840803490325323,45.7016140067,4.94900275462,092020
20201400010006,Marché,Services,Services de centres de vacances,18/09/2020,496039.96,Révisable,VILLE DE PARIS BUDGET PRINCIPAL,48.8542874923,2.35759608215,NC,32.42337129764896,48.7728906673,2.07603849225,092020
202006002000,Marché,Travaux,Travaux de charpente et de couverture et travaux connexes,08/09/2020,49611.0,Ferme,Office Public Habitat du Jura,46.6867240732,5.51948208724,PME,43.11682465936033,47.075389408,5.50082462705,092020
2020000002171300,Marché,Services,Services de contrôle technique de bâtiments,23/09/2020,49680.0,Révisable,Collectivité Territoriale de Guyane,5.03107464278,-52.5193923736,ETI,7311.910557772938,48.7839097374,2.19723411662,092020
2020001-0900,Marché,Travaux,Travaux de plomberie et de pose de conduits d'évacuation,15/09/2020,49799.98,Révisable,CENTRE CULTUREL MAURICE TERMEAU,48.1871235863,-0.13220937892,NC,44.98808962295911,48.0421282223,0.247561575201,092020
2020oR_56huOOl00,Marché,Fournitures,Conteneurs et poubelles de déchets,14/09/2020,49800.0,Révisable,Communauté de Communes de Parthenay Gâtine,46.6455153878,-0.233850430433,PME,216.08049543953584,44.7934650068,-0.819175449287,092020
2020_fDbHwFxRz00,Marché,Travaux,Travaux de construction,08/09/2020,49812.36,Ferme et actualisable,Brest Métropole Habitat,48.3999000994,-4.5027702561,PME,24.421506088560598,48.3510268971,-4.71810268106,092020
2020008lot901,Marché,Fournitures,Électricité,17/09/2020,49830.13,Révisable,COMMUNAUTE DE COMMUNES COTE OUEST CENT,49.2850930851,-1.53851142861,PME,53.80576018046542,49.6629354151,-1.84217324699,092020
2019ceRQL24HnJ00,Marché,Travaux,Travaux d'installations électriques,04/09/2020,49865.45,Révisable,Ardèche Habitat,45.2462974654,4.65115146795,PME,77.57970630593759,44.5538701101,4.74888787641,092020
2020001700,Marché,Travaux,Entretien de digues,24/09/2020,4987199.61,Révisable,SMIAGE MARALPIN,43.7123384529,7.23750191149,NC,5.353504011499674,43.7587318211,7.22347092028,092020
20202020S0567000,Marché,Services,Services de traitement de données,22/09/2020,49875.0,Ferme et actualisable,Ville d' Épinay-sur-Seine,48.9551865804,2.31432500723,GE,9.096838536055827,48.8983675206,2.25515424076,092020
20202020S1407700,Marché,Services,Services divers aux entreprises et services connexes,09/09/2020,49875.0,Ferme,Agence De l'Environnement et de la Maitrise de l'Energie,47.4766284713,-0.556089456786,PME,808.9040894775133,43.3079059302,5.43964465576,092020
20201400010003,Marché,Services,Services de centres de vacances,18/09/2020,4988039.96,Révisable,VILLE DE PARIS BUDGET PRINCIPAL,48.8542874923,2.35759608215,PME,205.95419077673537,50.590934562,3.00501944224,092020
2019eGf6N7_5zO00,Marché,Travaux,Travaux de désamiantage,24/09/2020,49887.0,Ferme,OFFICE PUBLIC DE L'HABITAT 05,44.580393647,6.06471167343,PME,45.41227060001052,44.5805398611,6.47535715478,092020
2020M200049500,Marché,Travaux,Travaux d'installation de chaudières,18/09/2020,49891.0,Ferme et actualisable,DEPARTEMENT DES PYRENEES ORIENTALES,42.6966171788,2.89890986886,NC,147.95543342700677,43.6131750772,3.86941278925,092020
2020151023857000,Marché,Travaux,Travaux de pose de plaques de plâtre,14/09/2020,49899.5,Ferme et actualisable,"Ministère de l'Économie, des Finances et de la Relance - Antenne de Strasbourg",48.5716343863,7.76783353204,PME,297.7200303775709,48.8069670797,5.08599829845,092020
2020TRAV-2L0200,Marché,Travaux,Travaux de remise à neuf de conduites d'eau,10/09/2020,49930.0,Ferme et actualisable,EAU SENNECEY-LE-GRAND,46.6367642722,4.89006004053,PME,39.265119701323826,46.2829812984,4.8775923215,092020
202030144700,Marché,Services,Services d'audit,18/09/2020,49950.0,Ferme,BUDGET PRINCIPAL,47.2551269927,6.0192810348,PME,425.78008756154577,48.7987986059,2.49441281984,092020
2020000002178800,Marché,Services,Services d'études,07/09/2020,49950.0,Ferme,Collectivité Territoriale de Guyane,5.03107464278,-52.5193923736,PME,7359.466477027285,50.7789927647,1.61418668348,092020
2019SPORT_Tx0500,Marché,Travaux,Travaux de plâtrerie,10/09/2020,49969.7,Ferme et actualisable,MAUZAC,43.3759683247,1.3022314958,PME,48.36268032959169,43.0583465736,1.60075318103,092020
20196mq0RYPd1Q00,Marché,Services,"Études de faisabilité, service de conseil, analyse",14/09/2020,49974.0,Ferme,SDE 03,46.563721028,3.38024682344,ETI,91.26740441259714,45.7859001722,3.11559551839,092020
2020MS6LOT0200,Marché,Travaux,Travaux d'entretien routier,21/09/2020,499893.0,Ferme,COMMUNE D HUEZ,45.0970834451,6.08462260529,NC,37.11659616030048,45.1334670409,5.75097030293,092020
2020130015215100,Marché,Services,Services d'hygiénisation d'installations,10/09/2020,500.0,Ferme et actualisable,"Ministère de la Transition écologique et solidaire - Ministère de la Cohésion des Territoires - Direction Régionale Environnement, Aménagement et Logement Occitanie",43.5959710776,1.43229743595,GE,284.44113606663166,43.5930787077,4.00463218238,092020
20202020S1389300,Marché,Services,Services de création et d'interprétation d'œuvres artistiques et littéraires,09/09/2020,5000.0,Révisable,"Etablissements et organismes de l'enseignement supérieur, de la recherche et de l'innovation - Université Clermont Auvergne - Direction des achats",45.7859001722,3.11559551839,PME,5.204831051574254,45.8320510656,3.10764104665,092020
2020130015847600,Marché,Services,Services de réparation et d'entretien d'installations électriques de bâtiment,25/09/2020,5000.0,Révisable,Ministère de l'Intérieur - SGAMI SUD EST -  Lyon - DAGF et DIM,45.7533230296,4.86924368009,NC,5.159595640401376,45.7345274274,4.91192378092,092020
2020130015848300,Marché,Services,Services de réparation et d'entretien d'installations électriques de bâtiment,23/09/2020,5000.0,Révisable,Ministère de l'Intérieur - SGAMI SUD EST -  Lyon - DAGF et DIM,45.7533230296,4.86924368009,NC,5.159595640401376,45.7345274274,4.91192378092,092020
20202020S0015800,Marché,Services,Services de finition de livres,11/09/2020,5000.0,Ferme,Conseil départemental de Côte d'Or,47.3230744087,5.03738286925,PME,13.218030522938971,47.4139704323,5.11471412779,092020
20202020F0010000,Marché,Fournitures,"Granulés, gravillons, sable fin, cailloux, gravier, pierraille et pierre concassée, mélanges de pierres, de grave et autres agrégats",28/09/2020,5000.0,Révisable,GUINGAMP-PAIMPOL AGGLOMERATION,48.5607392309,-3.15328149995,NC,,,,092020
2020130015850400,Marché,Services,Services de réparation et d'entretien d'installations électriques de bâtiment,23/09/2020,5000.0,Révisable,Ministère de l'Intérieur - SGAMI SUD EST -  Lyon - DAGF et DIM,45.7533230296,4.86924368009,GE,2.945363556998541,45.7708803723,4.88922582274,092020
20202020F0010100,Marché,Fournitures,"Granulés, gravillons, sable fin, cailloux, gravier, pierraille et pierre concassée, mélanges de pierres, de grave et autres agrégats",28/09/2020,5000.0,Révisable,GUINGAMP-PAIMPOL AGGLOMERATION,48.5607392309,-3.15328149995,ETI,84.72901485638886,48.3555711959,-2.4153310073,092020
202020MP100100,Marché,Services,Services funéraires et services connexes,09/09/2020,5000.0,Révisable,POMPES FUNEBRES,43.6280987504,7.0828436473,NC,,,,092020
2020Gc71rh8Rnv00,Marché,Fournitures,Balais et brosses et autres produits de nettoyage ménager,30/09/2020,5000.0,Révisable,Mairie de Saint Jean,43.662968552,1.50091500983,PME,261.1234959052512,43.5258740747,3.8583538042,092020
20202020F1359000,Marché,Fournitures,Consommables médicaux,17/09/2020,5000.0,Ferme,CENTRE HOSPITALIER BRETAGNE ATLANTIQUE,47.6599029362,-2.75681901002,NC,561.8937781947492,48.7839097374,2.19723411662,092020
2020130015851100,Marché,Services,Services de réparation et d'entretien d'installations électriques de bâtiment,21/09/2020,5000.0,Révisable,Ministère de l'Intérieur - SGAMI SUD EST -  Lyon - DAGF et DIM,45.7533230296,4.86924368009,PME,197.89265149565372,45.8921688886,3.08509107456,092020
2020170010262300,Marché,Services,Services de conseil en rendement énergétique,18/09/2020,5000.0,Ferme,Ministère de l'Intérieur - Préfecture du Lot et Garonne,44.2024640047,0.625844587118,NC,158.19978432026014,44.791939845,-0.675986855592,092020
20202020S0544200,Marché,Services,Services d'animalerie,02/09/2020,5000.0,Ferme et actualisable,Ville d' Épinay-sur-Seine,48.9551865804,2.31432500723,NC,26.738527493747135,48.9784393812,2.55500199053,092020
20202020F1361000,Marché,Fournitures,Consommables médicaux,16/09/2020,5000.0,Ferme,CENTRE HOSPITALIER BRETAGNE ATLANTIQUE,47.6599029362,-2.75681901002,NC,553.3397256908884,49.0400551805,2.05074797264,092020
2019_gtCDMut3e00,Marché,Travaux,,04/09/2020,5000.0,Révisable,Ardèche Habitat,45.2462974654,4.65115146795,PME,65.61146812977152,44.657600446,4.70735139424,092020
2020130015816700,Marché,Fournitures,Mobilier de maison,07/09/2020,5000.0,Révisable,Ministère des armées -  Ministère des Armées direction du commissariat d'outre-mer aux Antilles,,,ETI,,16.2727026732,-61.5016988194,092020
202000007VVIL100,Marché,Services,Services d'entretien de terrains,10/09/2020,50000.0,Révisable,Chambre Agriculture Pays de la Loire,47.4766284713,-0.556089456786,PME,89.69043010253462,47.0969805229,-1.27155483808,092020
20202020T1409800,Marché,Travaux,Travaux de couverture,15/09/2020,50000.0,Ferme,"Etablissements et organismes de l'enseignement supérieur, de la recherche et de l'innovation - ECOLE NATIONALE D'INGENIEURS DE SAINT-ETIENNE",45.4301960415,4.37808697748,PME,11.402297668857107,45.3789368606,4.28873007335,092020
2020Zzwz0JwmEr00,Marché,Fournitures,Produits en fonte,10/09/2020,50000.0,Ferme et actualisable,Communauté d'Agglomération du Niortais,46.3286026496,-0.464927924553,PME,375.7837947515382,43.4488413897,1.30864273595,092020
20202020F1431800,Marché,Fournitures,Instruments de mesure,16/09/2020,50000.0,Ferme,"Etablissements et organismes de l'enseignement supérieur, de la recherche et de l'innovation - SIGMA Clermont",45.7513918237,3.1257081208,PME,207.84080900886318,45.8544262114,1.24894834225,092020
20189HaJd_f8Op00,Marché,Services,,17/09/2020,50000.0,Révisable,CAVIMAC,48.8951908356,2.28680331405,PME,9.028326558671269,48.8444087298,2.35049826183,092020
202055578700,Marché,Travaux,Installations de chauffage,14/09/2020,50000.0,Ferme,BUDGET PRINCIPAL,47.2551269927,6.0192810348,PME,13.532567279819014,47.1856717195,5.91858850082,092020
