20212021S0655000,Marché,Services,Élimination et traitement des ordures,06/05/2021,75000.0,Ferme,Ministères sociaux,48.8123578699,2.3878497256,NC,,,,052021
20212021S0903300,Marché,Fournitures,"Machines de levage, manutention, chargement ou déchargement",06/05/2021,75000.0,Révisable,Chambres de Commerce et d'Industrie,41.9349194014,8.70135284615,PME,0.0,41.9349194014,8.70135284615,052021
2021030800,Marché,Fournitures,Peintures,27/05/2021,75000.0,Révisable,AGGLOMERATION DU PAYS DE DREUX,48.7484981606,1.35989876416,PME,0.0,48.7484981606,1.35989876416,052021
2020vYsPsjHdLO00,Marché,Fournitures,Menuiserie pour la construction,17/05/2021,75000.0,Ferme et actualisable,Commune de Bessancourt,49.0375068483,2.19893002443,PME,22.498865600735797,48.9566497407,2.38543561127,052021
202121CG012100,Marché,Services,Services de désherbage,26/05/2021,75000.0,Révisable,COMMUNE DE CUSSET,46.1372347828,3.48311311787,NC,12.650495050184007,46.1931582447,3.38346444363,052021
202121CG012101,Marché,Services,Services de désherbage,28/05/2021,75000.0,Révisable,COMMUNE DE CUSSET,46.1372347828,3.48311311787,NC,12.650495050184007,46.1931582447,3.38346444363,052021
2021pv1u98_Zhk00,Marché,Services,"Services d'architecture, services de construction, services d'ingénierie et services d'inspection",25/05/2021,75000.0,Révisable,OISE HABITAT,49.2530176025,2.48395578599,NC,170.25633253526374,50.6322610395,3.15284231203,052021
20212021S0471900,Marché,Services,"Services d'architecture, services de construction, services d'ingénierie et services d'inspection",03/05/2021,75000.0,Révisable,RESEAUX DES ACHETEURS HOSPITALIERS,48.8591103086,2.38017728226,PME,2.3771864005009316,48.8635257742,2.40121168869,052021
202121VH00900700,Marché,Services,Réalisation et entretien d'espaces verts,26/05/2021,75000.0,Révisable,VILLE DES HERBIERS,46.8666986649,-1.02208373864,NC,0.0,46.8666986649,-1.02208373864,052021
20202013801,Marché,Services,Services de réparation et d'entretien d'installations d'extinction d'incendie,10/05/2021,750000.0,Révisable,Budget principal,47.9889433531,0.20002401353,PME,17.317336447026932,48.1386473936,0.157440446504,052021
2020XUTcTVsKDN00,Marché,Fournitures,Réactifs de laboratoire,07/05/2021,7501.8,Révisable,Centre Hospitalier Avranches Granville,48.8327939183,-1.5661139044,PME,829.1606237530262,47.2970080153,5.77167336131,052021
2021M21000025200,Marché,Travaux,Installation de matériel d'éclairage public,10/05/2021,750128.0,Ferme,VILLE  DE  SAINT-DENIS,-20.9331856391,55.4471055195,PME,24.63204152377558,-21.0919233439,55.6492211102,052021
2020J_QOeDLyMH00,Marché,Services,Services de voirie,12/05/2021,75032.26,Révisable,SPL Paris & Métropole aménagement,48.8869811827,2.38492060382,ETI,18.504436078960584,48.729938105,2.32968167157,052021
2020wiwKbW6fmg00,Marché,Services,Services de nettoyage et d'hygiène,11/05/2021,750456.0,Révisable,Direction de la Maintenance,48.8348302792,2.42102904428,PME,52.51605572478432,48.8125956765,1.94662384182,052021
2019Za1OBSis1700,Marché,Travaux,Travaux de construction d'immeubles collectifs et de maisons individuelles,12/05/2021,75074.0,Ferme,Emeraude Habitation,48.6397466972,-1.98082436999,PME,34.862225641273234,48.3562692142,-2.11521252071,052021
2021202040400,Marché,Travaux,Travaux de construction de bâtiments,12/05/2021,751145.0,Ferme et actualisable,NEOTOA,48.111571436,-1.68168588816,PME,36.547186039986926,47.8049534709,-1.80019997335,052021
20212021T0796200,Marché,Travaux,Travaux de pose de revêtements de sols souples,10/05/2021,75128.86,Révisable,ASSISTANCE PUBLIQUE - HOPITAUX DE PARIS,48.8542874923,2.35759608215,PME,743.5528098447065,43.4382630012,-1.5795649936,052021
20212020 3100,Marché,Fournitures,,27/05/2021,75131.25,Révisable,QUIMPERLE COMMUNAUTÉ,47.8563869619,-3.55581087717,NC,909.7332657198638,43.5673078679,3.44891288988,052021
2020000101,Marché,Services,Services de conseil en télécommunications,27/05/2021,75150.0,Ferme,BUDGET PRINCIPAL,-20.9331856391,55.4471055195,PME,8519.883569202864,48.8472864945,2.43799511731,052021
2020STjiQr1rD500,Marché,Travaux,Travaux de construction,28/05/2021,75150.34,Révisable,DEL - Direction de l éducation et des lycées,45.7480493184,4.82567584415,ETI,67.2009076296811,46.1084791068,4.33731993599,052021
2018GoVGp5f42d00,Marché,Travaux,"Travaux d'installation de matériel de chauffage, de ventilation et de climatisation",03/05/2021,752165.32,Ferme et actualisable,Troyes Habitat,48.2968506353,4.07801333034,PME,0.0,48.2968506353,4.07801333034,052021
20212021S0818200,Marché,Services,Services de conseil en matière de santé et de sécurité,17/05/2021,7524.0,Révisable,"Etablissements et organismes de l'enseignement supérieur, de la recherche et de l'innovation - Université Clermont Auvergne - Direction de l'Immobilier",45.7859001722,3.11559551839,NC,0.0,45.7859001722,3.11559551839,052021
2021130016466800,Marché,Fournitures,,07/05/2021,752400.0,Révisable,Services du Premier ministre - Direction des Services Administratifs et Financiers,48.8562037309,2.3121193117,PME,10.914979031597841,48.7667116171,2.35261812092,052021
2021130016392500,Marché,Services,Services de nettoyage,05/05/2021,752974.0,Révisable,Ministère de l'Intérieur - SECRETARIAT GENERAL COMMUN DEPARTEMENTAL AIN,46.2047217001,5.24553216043,PME,69.0644508533586,45.7333494426,4.83733100241,052021
2021PAA21-0100,Marché,Services,,11/05/2021,75330.0,Ferme,COMMUNE DE PLOUARZEL,48.4389776203,-4.72025933609,ETI,10.743680692540162,48.4258947716,-4.62399409096,052021
202130187500,Marché,Services,Services de conduite des travaux,10/05/2021,75330.0,Ferme,BUDGET PRINCIPAL,47.2551269927,6.0192810348,PME,60.69169418191521,47.075389408,5.50082462705,052021
2019Al2FdBBNx800,Marché,Services,"Services d'architecture, services de construction, services d'ingénierie et services d'inspection",06/05/2021,753600.0,Révisable,SOLEAM (Société Locale d'Equipement et d'Aménagement de l'aire Métropolitaine),43.3127155398,5.36343891881,PME,3.4227943864964465,43.2868669832,5.38037571899,052021
2021MOE51300,Marché,Services,"Services d'architecture, d'ingénierie et de métrage",27/05/2021,75365.0,Révisable,SIAH,48.9660729815,2.43480854616,NC,615.7552965915171,43.6131750772,3.86941278925,052021
2020JK0LPz6Em400,Marché,Travaux,Travaux de construction,10/05/2021,75390.0,Révisable,Département de la Haute-Saône,47.631875925,6.15550489936,PME,175.17558388468694,48.5383870829,7.45477344199,052021
2020BCeXpNGcg600,Marché,Services,"Services d'architecture, services de construction, services d'ingénierie et services d'inspection",31/05/2021,75486.0,Révisable,Communauté de communes Jura nord,47.1650421499,5.74232401714,ETI,79.89861782796598,47.3230744087,5.03738286925,052021
2019VuCqp4UPKc00,Marché,Fournitures,Matériel de sonorisation,18/05/2021,75528.0,Ferme,Mairie d'Ermont,48.9881282104,2.25640594696,PME,24.361501200039267,48.8123578699,2.3878497256,052021
2021902300,Marché,Fournitures,Autoclaves,07/05/2021,75543.0,Ferme et actualisable,CENTRE HOSPITALIER LUCIEN HUSSEL,45.5208328002,4.88070755449,PME,20.33422913877712,45.7041579754,4.88121408321,052021
2020JOLIO200100,Marché,Travaux,Travaux de construction d'écoles primaires,10/05/2021,75560.16,Ferme,VILLE DE STAINS,48.9566497407,2.38543561127,NC,4.8772393261754114,48.9128078947,2.38454842862,052021
2020203166L0100,Marché,Travaux,Travaux de désamiantage,10/05/2021,75611.18,Ferme et actualisable,3-Ville de Romans sur Isère,45.0548916374,5.03806972257,NC,102.54207993770963,44.2240945728,4.63143437565,052021
20212021-09 L100,Marché,Travaux,"Travaux de démolition, travaux de préparation et de dégagement de chantier",26/05/2021,75615.0,Ferme,CC LES SORGUES DU COMTAT,44.0338905553,4.98494540657,PME,8.893910585824914,44.0592303477,5.06125312911,052021
2020ZE7ZQOplHp00,Marché,Travaux,Travaux de câblage et d'installations électriques,21/05/2021,75624.0,Ferme,Communauté de Communes du Pays de Lunel,43.6820622826,4.13604052571,NC,3.94282036801749,43.6559815672,4.11184245296,052021
2020PB020600,Marché,Travaux,Travaux de pose de plaques de plâtre,19/05/2021,75729.0,Révisable,VILLE DE GRIGNY,45.6083483392,4.78678285072,PME,30.673842744863986,45.7774291546,5.00628498239,052021
2021151066191300,Marché,Travaux,Entretien des routes nationales,12/05/2021,758089.5,Révisable,"Ministère de la Transition Écologique, Ministère de la Cohésion des Territoires, Ministère de la Mer - Direction Interdépartementale des Routes Est",48.6900671002,6.17594832427,NC,,,,052021
2021PA43102600,Marché,Fournitures,Auvents,17/05/2021,75850.0,Ferme et actualisable,Département du Loir-et-Cher,45.4793825623,4.84406655469,PME,0.0,45.4793825623,4.84406655469,052021
2020/23/DST/TX00,Marché,Travaux,"Travaux d'installation de matériel de chauffage, de ventilation et de climatisation",28/05/2021,75850.0,Révisable,COMMUNAUTE DE COMMUNES DE LA VEYLE,46.2634666729,4.88222174868,PME,9.49120768332154,46.320613267,4.81834086547,052021
202121005_100,Marché,Fournitures,Équipement de péage,04/05/2021,758606.9,Révisable,COMMUNE DE CARCASSONNE,43.2093616677,2.34379884342,PME,652.4948386111355,49.0685093141,2.06328992944,052021
2019-OzkOPbTIv00,Marché,Services,"Services d'architecture, services de construction, services d'ingénierie et services d'inspection",06/05/2021,759500.0,Révisable,SOLEAM (Société Locale d'Equipement et d'Aménagement de l'aire Métropolitaine),43.3127155398,5.36343891881,PME,4.422948363918772,43.2924013477,5.39786536432,052021
20212021005_1400,Marché,Fournitures,Électricité,31/05/2021,759776.03,Révisable,LE PUY EN VELAY,,,NC,,45.046430608,3.92488857329,052021
20212021F0934300,Marché,Fournitures,Machines et appareils d'essai et de mesure,31/05/2021,7598.0,Ferme,Institut Français de Recherche pour l’Exploitation de la MER,48.8231210367,2.26445901319,PME,6.427673033038426,48.8562037309,2.3121193117,052021
20212021F0714300,Marché,Fournitures,Boissons sans alcool,17/05/2021,76000.0,Révisable,Chambres de Commerce et d'Industrie,49.4415068863,1.09373273216,PME,10.666171625282754,49.3476730731,1.07413309601,052021
20212021S00960,Marché,Services,Services d'architecture,14/05/2021,76000.0,Révisable,VILLE DE PARIS BUDGET PRINCIPAL,48.8542874923,2.35759608215,NC,216.7904254701125,50.6743724709,3.06034609721,052021
2021M21000025500,Marché,Fournitures,Vêtements professionnels,20/05/2021,76000.0,Révisable,VILLE  DE  SAINT-DENIS,-20.9331856391,55.4471055195,PME,0.0,-20.9331856391,55.4471055195,052021
2021RML075YJjO00,Marché,Fournitures,Produits chimiques,04/05/2021,76000.0,Révisable,FLERS AGGLO,48.7400079375,-0.562173805455,ETI,696.1389664510423,45.7380869696,4.96241516988,052021
202103080200,Marché,Fournitures,Vêtements à usage industriel,03/05/2021,76000.0,Ferme et actualisable,Ville de Frontignan,43.4481344822,3.74933658978,ETI,79.46188944989413,43.8445331544,4.34760475323,052021
20212021F0528900,Marché,Fournitures,Consommables médicaux,20/05/2021,76024.0,Ferme,CH DU MANS,47.9889433531,0.20002401353,ETI,592.7451108099257,45.7541566032,5.06691649154,052021
2021M2012L0300,Marché,Travaux,Travaux de charpente,07/05/2021,76026.38,Révisable,COMMUNE DE BEAUPREAU EN MAUGES,47.2127102218,-0.983417331698,PME,28.65867289595863,47.2130320509,-0.724237826321,052021
2021209200,Marché,Fournitures,Éclairage public,26/05/2021,76027.41,Ferme et actualisable,CDC DES SOURCES DE L ORNE,48.60429341,0.169948521871,PME,0.0,48.60429341,0.169948521871,052021
2021kshoUmARc-00,Marché,Services,Services des eaux usées,25/05/2021,760640.0,Révisable,Commune de Montesson,48.9172863598,2.13951942246,GE,24.385492307827075,48.9460723314,1.92089722084,052021
2019_vFyOqE3P000,Marché,Services,Services de nettoyage de bâtiments,03/05/2021,76069.8,Révisable,Troyes Habitat,48.2968506353,4.07801333034,GE,178.78386773898956,48.7471775627,2.52583826559,052021
2021MUSEELOT101,Marché,Travaux,Travaux de construction de salle de conférences,03/05/2021,76075.86,Ferme,COMMUNAUTE DE COMMUNES COEUR DE BEAUCE,48.2008164517,1.88946852571,PME,45.5109380897515,48.0399983863,1.5110347339,052021
2021M006600,Marché,Fournitures,Châssis-cabines,07/05/2021,76082.93,Ferme,BUDGET PRINCIPAL CD15,44.9245183348,2.4417949992,PME,61.65979217970088,44.3826731465,2.55990190943,052021
2020Px01mK0kbk00,Marché,Fournitures,Fenêtres,18/05/2021,76181.0,Ferme,Direction d'Etablissement Nord & Atlantique,50.6317671102,3.04699299406,ETI,517.6122748222771,48.018369081,6.92551863367,052021
2021202040800,Marché,Travaux,Travaux de construction de bâtiments,12/05/2021,76182.0,Ferme et actualisable,NEOTOA,48.111571436,-1.68168588816,PME,13.569749213180279,48.2124043822,-1.75071247399,052021
2021AMO000100,Marché,Services,Services d'architecture,04/05/2021,76185.2,Révisable,SEMCODA,46.2047217001,5.24553216043,NC,65.09216486183156,45.7533230296,4.86924368009,052021
20212021F0721100,Marché,Fournitures,Prothèses,01/05/2021,76191.4,Ferme et actualisable,CHR ORLEANS,47.8824665066,1.91660961834,ETI,114.66772669994243,48.8292048923,2.3267445538,052021
2020JQNBliUwyO00,Marché,Travaux,Travaux de désamiantage,17/05/2021,76224.88,Révisable,THEMELIA,43.9256996046,2.14745941954,PME,24.684073824565193,43.7580419687,2.00123611529,052021
2021000000024800,Marché,Services,"Services d'organisation d'expositions, de foires et de congrès",18/05/2021,76350.0,Ferme,COMMUNAUTE URBAINE DUNKERQUE,51.030563712,2.33703738753,PME,91.13654745744657,50.6546146137,3.06940961222,052021
2021015100,Marché,Services,"Études de faisabilité, service de conseil, analyse",21/05/2021,76370.0,Ferme et actualisable,REDON AGGLOMERATION AG,47.6613041495,-2.08022201303,PME,75.78649289801865,47.2321613301,-1.54797539458,052021
2021-MP0100,Marché,Travaux,Travaux de réfection,20/05/2021,76400.01,Ferme et actualisable,LEVIS SAINT NOM,48.7270304132,1.9355392681,PME,32.031489421443275,49.0108767149,1.88708246878,052021
2021130016471000,Marché,Travaux,Travaux de marquage routier,05/05/2021,764571.87,Révisable,"Ministère de la Transition Écologique, Ministère de la Cohésion des Territoires, Ministère de la Mer - Direction Interdépartementale des Routes Nord-Ouest",49.4415068863,1.09373273216,NC,147.4062789087703,48.9373520183,2.32651350176,052021
2021151064642200,Marché,Services,Services de contrôle technique de bâtiments,07/05/2021,7650.0,Révisable,Ministère des armées - Etablissement du service d'infrastructure de la défense de Metz - ESID Metz,,,NC,,45.8121035165,4.74687461998,052021
2020TtfkOQvDlw00,Marché,Services,,11/05/2021,76500.0,Ferme,CDC Habitat Social DIR Sud-Ouest,44.8889230081,-0.600409986888,PME,283.09973296938915,43.4821525472,1.5325568297,052021
2021160006229000,Marché,Services,"Services d'architecture, services de construction, services d'ingénierie et services d'inspection",28/05/2021,76515.13,Révisable,Ministère de l'Intérieur - SGAMI EST - Metz - DAGF- Marchés Publics,48.8348302792,2.42102904428,PME,591.9893470994512,48.5716343863,7.76783353204,052021
202150889608,Marché,Travaux,Travaux de couverture et travaux d'autres corps de métier spécialisés,28/05/2021,765179.2,Révisable,Budget principal,50.6317671102,3.04699299406,NC,11.898256913711018,50.5661643687,3.13201595891,052021
20207ga31ewqsZ00,Marché,Fournitures,Mobilier et équipements divers,21/05/2021,76520.0,Ferme,Ville de Puteaux,48.8836186061,2.23810959636,PME,34.156038975238296,48.5770276155,2.22104672403,052021
20212021F0833600,Marché,Fournitures,Consommables médicaux autres que chimiques à usage unique et consommables hématologiques,07/05/2021,76567.5,Ferme,CHU RENNES,48.111571436,-1.68168588816,ETI,451.6544321976434,48.7495659946,2.35212808495,052021
2021XuTT4MHeHL00,Marché,Travaux,Travaux d'entretien de toiture,17/05/2021,76570.49,Ferme et actualisable,MANCHE HABITAT,49.1097135871,-1.07754504719,PME,41.877588706607995,49.2609280566,-0.730752418397,052021
2021SH-0700,Marché,Travaux,Travaux de marquage routier,25/05/2021,76657.92,Ferme et actualisable,CC LES SORGUES DU COMTAT,44.0338905553,4.98494540657,NC,612.1878924607594,48.9393045402,2.46120831875,052021
20212021F0913400,Marché,Fournitures,Véhicules utilitaires,31/05/2021,76664.0,Ferme,Ministère de l'agriculture et de l'alimentation - DT Seine Nord,48.4064551427,2.68102008933,ETI,5.782221296274364,48.4131864593,2.73287159417,052021
2021160006228100,Marché,Travaux,Travaux de couverture,06/05/2021,76687.99,Ferme et actualisable,Ministère de la Justice  - Direction interrégionale des services pénitentiaires de Toulouse,43.5959710776,1.43229743595,PME,153.5560758916135,42.8184369989,0.285152270757,052021
2021213002L0000,Marché,Travaux,Travaux de câblage et d'installations électriques,05/05/2021,766975.0,Ferme et actualisable,6-Ville de Valence (Investissement),44.9223144503,4.91311704006,PME,85.36397874627401,45.2695466998,5.60212547771,052021
20212100,Marché,Fournitures,Pompes à eau,10/05/2021,76713.0,Ferme et actualisable,CA DU PAYS DE SAINT-OMER,50.7359367805,2.24525665933,NC,10.064257863471074,50.7134437493,2.3334160321,052021
20212021T0825400,Marché,Travaux,Travaux de restructuration,06/05/2021,7672.0,Ferme,CHU NICE,43.7123384529,7.23750191149,PME,10.430592738420065,43.671853349,7.1522919117,052021
20212021S0003600,Marché,Services,Services liés aux déchets et aux ordures,01/05/2021,76768.0,Révisable,Centre Hospitalier de l'agglomération de Nevers,46.9881806141,3.15706769674,NC,8.055906630435794,47.0168574783,3.09016043766,052021
20212021T0843300,Marché,Travaux,Travaux d'installations électriques,18/05/2021,76801.6,Révisable,"Etablissements et organismes de l'enseignement supérieur, de la recherche et de l'innovation - UNIVERSITE CLAUDE BERNARD LYON 1",45.7708803723,4.88922582274,PME,11.288944721370607,45.7361351731,4.79327311532,052021
202120200330100,Marché,Travaux,Travaux d'aménagement paysager,10/05/2021,76804.0,Révisable,Ville d'Alençon,48.4315335696,0.0917701886296,NC,0.0,48.4315335696,0.0917701886296,052021
20212021-04302,Marché,Services,Services d'entretien de terrains,19/05/2021,768250.0,Révisable,COMMUNE DE DIVONNE-LES-BAINS,46.3759935452,6.11546340805,NC,0.0,46.3759935452,6.11546340805,052021
2021V04400,Marché,Services,Services de nettoyage de bâtiments,17/05/2021,7683.2,Révisable,Ville d'Ajaccio,41.9349194014,8.70135284615,NC,0.0,41.9349194014,8.70135284615,052021
2020LVLUQ2DTnr00,Marché,Travaux,Travaux de construction d'immeubles collectifs,20/05/2021,76833.44,Ferme et actualisable,Toulon Habitat Méditerranée,43.1364847512,5.93276630299,PME,80.16054510489082,43.4686351237,6.5769352524,052021
2021K2012300,Marché,Services,Services de contrôle technique,26/05/2021,76970.0,Révisable,BUDGET PRINCIPAL,49.6330980885,-1.63358524312,GE,436.1623200724015,48.8836186061,2.23810959636,052021
20210121041303,Marché,Travaux,Travaux de construction,27/05/2021,76987.0,Ferme,VILLE DE TROYES,48.2968506353,4.07801333034,GE,3.8250159092873868,48.2782654212,4.04888937878,052021
202121A02400,Marché,Services,Services d'études,06/05/2021,7700.0,Ferme et actualisable,CA PAU BEARN PYRENEES,43.3201640732,-0.3496692279,PME,664.593875501945,47.9968866318,-4.09100301844,052021
2019ssIG1jkHJy00,Marché,Services,Réalisation et entretien d'espaces verts,06/05/2021,77000.0,Révisable,CARSAT NORD PICARDIE,50.6322610395,3.15284231203,PME,0.0,50.6322610395,3.15284231203,052021
20200EDOmxewK800,Marché,Travaux,Travaux de construction de logements-foyers,12/05/2021,77003.0,Ferme,Direction d'Etablissement Nord & Atlantique,50.6317671102,3.04699299406,PME,257.54287720130793,49.4244508808,1.05966183652,052021
20201sjUCq198E00,Marché,Travaux,Travaux de construction de logements-foyers,12/05/2021,77009.0,Ferme,Direction d'Etablissement Nord & Atlantique,50.6317671102,3.04699299406,PME,253.81480854476598,49.2614673745,1.21163851421,052021
2021AC2021002A00,Marché,Services,Services de contrôle technique de bâtiments,07/05/2021,7708.89,Ferme,TERRE D'OPALE HABITAT - OFFICE PUBLIC DE L'HABITAT,50.9500555648,1.87591279453,NC,0.0,50.9500555648,1.87591279453,052021
2021151063183600,Marché,Services,Services de conseil en matière de santé et de sécurité,07/05/2021,7715.0,Révisable,Ministère des armées - Etablissement du service d'infrastructure de la défense de Metz - ESID Metz,,,NC,,48.5356176619,7.63380107856,052021
2020O8At0ot_ky00,Marché,Travaux,Travaux de construction,31/05/2021,7721.41,Ferme et actualisable,Brest Métropole Habitat,48.3999000994,-4.5027702561,PME,17.472219779479584,48.5289645866,-4.59326739258,052021
20211-1002,Marché,Travaux,Travaux de plomberie,05/05/2021,77232.31,Révisable,COMMUNE ST DENIS DE GASTINES,48.3464647779,-0.869188634411,ETI,27.66560960799959,48.1076823048,-0.799735963393,052021
2021CA1200,Marché,Travaux,Travaux de désamiantage,11/05/2021,77298.0,Ferme et actualisable,Communauté d'Agglomération du Grand Villeneuvois,44.4480990803,0.622538683662,PME,53.4153218197403,44.8310165322,0.331402888526,052021
2021201812002100,Marché,Travaux,Travaux de réparation de routes,07/05/2021,774835.0,Ferme et actualisable,BUDGET PRINCIPAL,42.9653610948,1.61016305727,NC,36.92173658420651,43.0767299785,1.92470146001,052021
162210976988500,Marché,Services,,27/05/2021,7755.0,Ferme,COMMUNE DE PORTET SUR GARONNE,43.5288972686,1.40201144987,ETI,55.10127501053457,44.0225624278,1.36375484401,052021
2021hodqqreZtt00,Marché,Travaux,Travaux de pose de revêtements de sols souples,20/05/2021,77556.2,Ferme et actualisable,OPHEOR,46.0450564645,4.08007309055,ETI,29.304919017876514,46.1084791068,4.33731993599,052021
2020005100,Marché,Travaux,Travaux de préparation de chantier,10/05/2021,775752.55,Révisable,BUDGET PRINCIPAL,48.9346127594,2.29454165622,PME,25.948534601711994,49.0779312553,2.1093880821,052021
2019CeSU7jUfea00,Marché,Services,Services de réparation et d'entretien de chauffage central,03/05/2021,775827.45,Révisable,Troyes Habitat,48.2968506353,4.07801333034,NC,106.1217434561709,49.2517771432,4.03968745396,052021
2020iOQtoPIE9D00,Marché,Travaux,Travaux d'isolation de toiture,07/05/2021,77585.47,Ferme,Agence de Caen Littoral,48.8282706469,2.362358986,PME,308.837327328745,49.2892377911,-0.391853258658,052021
