202120210070100,Marché,Travaux,Travaux d'assainissement,30/06/2021,236915.5,Ferme,COMMUNAUTE DE COMMUNES AUNIS SUD,46.1041982355,-0.753923005919,NC,35.90513875926363,46.1841193221,-1.06851365338,062021
2021D6KsLs-Vzf00,Marché,Travaux,Travaux de terrassement,08/06/2021,237011.0,Révisable,Communauté de communes Baugeois Vallée,47.5453879308,-0.0992597718373,PME,40.91100310970408,47.2414492987,-0.30725809749,062021
20212113800,Marché,Services,Services spécialisés de transport routier de passagers,24/06/2021,237079.44,Révisable,BUDGET PRINCIPAL DEPT SARTHE,47.9889433531,0.20002401353,PME,258.51075696498606,48.8760781984,2.36069992794,062021
162264585655500,Marché,Travaux,Travaux de désamiantage,02/06/2021,23709.0,Ferme et actualisable,COMMUNE DE COMPIEGNE,,,ETI,,48.9884685976,2.30132987585,062021
2021k4ErhKWdY500,Marché,Services,Services de réparation et d'entretien d'installations mécaniques de bâtiment,14/06/2021,237112.0,Ferme et actualisable,Direction de la Maintenance,48.8348302792,2.42102904428,PME,21.658348608513474,49.0063195602,2.51384011982,062021
20203ZbTK_dRTf00,Marché,Travaux,Travaux de couverture et travaux d'autres corps de métier spécialisés,01/06/2021,23725.0,Ferme,Le Toit Vosgien,48.2968400138,6.93787860009,PME,10.742408938158485,48.2850316103,7.03429602646,062021
162445480644200,Marché,Travaux,Travaux de revêtement de routes,23/06/2021,237280.0,Révisable,CONSEIL DEPARTEMENTAL DE L'AVEYRON,44.358571606,2.56667306391,PME,282.66963468774065,45.6776041395,4.75268296549,062021
2020yV-gS8UMyE00,Marché,Services,Services de formation professionnelle,28/06/2021,23730.0,Révisable,CPCAM Bouches du Rhone,43.2343813418,5.45258699132,PME,5.333830346938354,43.2753571972,5.42728465241,062021
20212021F0451000,Marché,Fournitures,"Équipements de laboratoire, d'optique et de précision (excepté les lunettes)",21/06/2021,237511.0,Révisable,RESEAUX DES ACHETEURS HOSPITALIERS,48.8591103086,2.38017728226,NC,,,,062021
20210307PA00,Marché,Travaux,Travaux de construction de centres de secours des sapeurs-pompiers,30/06/2021,237600.0,Révisable,SDIS 91,48.6293513055,2.44049035394,PME,17.769060481024276,48.499927866,2.53471510547,062021
2021120007466200,Marché,Services,Services de gardiennage,02/06/2021,237850.38,Révisable,Ministère de la Justice  - CA Dijon - Service administratif régional,47.3230744087,5.03738286925,PME,164.29571276926924,48.4969774269,5.94491714835,062021
2021iJ7v_GNr1_00,Marché,Services,Services de nettoyage de bureaux,10/06/2021,237921.6,Ferme et actualisable,CAF HERAULT,43.6131750772,3.86941278925,NC,6.616673295365614,43.5635286669,3.9024872849,062021
20212021F0985100,Marché,Fournitures,Produits pharmaceutiques,01/06/2021,238.32,Ferme,CHU RENNES,48.111571436,-1.68168588816,PME,1015.3793680606254,47.6364363729,7.48825511443,062021
2019t0upW7mJDT00,Marché,Travaux,Travaux de construction d'immeubles collectifs,09/06/2021,23800.0,Ferme,Société OZANAM,14.6460950766,-61.100358959,PME,3.4860872021874987,14.6408734458,-61.069176472,062021
202065CblH_tU_00,Marché,Services,Services de nettoyage,18/06/2021,2382232.0,Ferme,Siège,48.8282706469,2.362358986,NC,594.75113928264,48.5198254221,7.7317552386,062021
2020lLq2wcYngw00,Marché,Services,Services de nettoyage,18/06/2021,2383411.0,Ferme,Siège,48.8282706469,2.362358986,NC,432.84913044783326,49.3761182329,6.23786587577,062021
2021WgR6fu_W7x00,Marché,Fournitures,Matériel et fournitures informatiques,29/06/2021,238515.0,Ferme,Commune de Thonon-les-Bains,46.3713202371,6.48296533168,PME,486.90277539635565,48.5447982823,2.65777855027,062021
2019VYGor85YFK00,Marché,Services,,03/06/2021,23900.0,Ferme et actualisable,"Valophis Habitat, Office Public de l'Habitat du Val de Marne",48.783689162,2.4549804713,PME,546.6103207389293,47.2801589313,-2.25106183059,062021
2021NMxAmU4FAQ00,Marché,Travaux,Travaux de construction,29/06/2021,2390000.0,Ferme et actualisable,COOP LOGIS,48.0610922073,-0.766055300559,PME,35.175709253005806,48.3615613063,-0.667511746691,062021
20195lN021c1Dt00,Marché,Fournitures,Systèmes d'alarme incendie,09/06/2021,23912.0,Révisable,CPAM VAUCLUSE,43.9352959178,4.84131733764,NC,75.8566190156684,43.5360639608,5.39837823449,062021
2020aH98MGr67T00,Marché,Travaux,Travaux d'étanchéification,02/06/2021,239258.0,Révisable,3F-DGP,48.8282706469,2.362358986,PME,14.005067602567806,48.9346127594,2.29454165622,062021
2020BATLO0002203,Marché,Travaux,Travaux de construction de monuments historiques ou de mémoriaux,11/06/2021,239261.09,Révisable,Budget principal,46.5622744929,3.32725048972,PME,5.862437037465689,46.563721028,3.38024682344,062021
2020DW9le5UTZG00,Marché,Travaux,Travaux de construction de bâtiments,18/06/2021,23927.25,Révisable,Conseil Départemental de la Charente-Maritime-cg17,46.1619512738,-1.1749922971,NC,16.84880718218756,46.0771289591,-1.04878309527,062021
2021bof_FJF23100,Marché,Services,Étude de faisabilité,04/06/2021,23940.0,Ferme et actualisable,Commune VIERZON,47.2370821272,2.07892537933,NC,0.0,47.2370821272,2.07892537933,062021
2021SGPUSTB3902,Marché,Travaux,Travaux d'installations électriques,10/06/2021,239471.63,Révisable,SGPU,48.5145891605,-2.7620558547,ETI,9.608460819420428,48.5245538986,-2.84837013308,062021
2021100015409300,Marché,Travaux,Travaux de démolition,02/06/2021,239880.0,Ferme,"Ministère de la Transition Écologique, Ministère de la Cohésion des Territoires, Ministère de la Mer - Direction de l'environnement, de l'aménagement et du logement de Mayotte",-12.7898335897,45.1939159334,GE,0.0,-12.7898335897,45.1939159334,062021
20212021S0011300,Marché,Services,Services de maintenance préventive,24/06/2021,23995.0,Révisable,Conseil départemental de Côte d'Or,47.3230744087,5.03738286925,NC,0.0,47.3230744087,5.03738286925,062021
20212021S0011500,Marché,Services,Services de contrôle technique de bâtiments,09/06/2021,2400.0,Révisable,SEMBREIZH,48.1205469701,-1.59697171557,NC,162.09248801703748,47.6674184229,-2.99019865229,062021
201601234c400300,Marché,Services,Services de contrôle technique de bâtiments,08/06/2021,2400.0,Ferme,Mairie d'Asnières sur Seine,48.9157198373,2.28764873642,PME,12.013703227755146,48.8591103086,2.38017728226,062021
20200i5uAtvxbc00,Marché,Fournitures,Matériaux de bâtiment,10/06/2021,24000.0,Révisable,Mairie de Foix,42.9653610948,1.61016305727,PME,0.0,42.9653610948,1.61016305727,062021
2020tFHnDI6ht300,Marché,Travaux,Travaux d'installation d'ascenseurs,04/06/2021,24000.0,Ferme,Direction d'Etablissement Nord & Atlantique,50.6317671102,3.04699299406,GE,525.4292862929514,47.4738755133,-0.48580477673,062021
2020z3tPg-Uw7b00,Marché,Fournitures,"Produits alimentaires, boissons, tabac et produits connexes",25/06/2021,24000.0,Révisable,UGECAM CENTRE,47.8824665066,1.91660961834,NC,104.8276736483694,47.0747420182,2.40492134914,062021
2021S12Dyme_wu00,Marché,Travaux,Travaux de construction de bâtiments,22/06/2021,240000.0,Révisable,Mairie de Salon de Provence,43.6463117052,5.0679949909,PME,9.097095318016583,43.5841914495,5.01426408284,062021
2021SISARC055200,Marché,Travaux,Travaux de débroussaillage,14/06/2021,240000.0,Révisable,SISARC,45.6681611919,6.40403320604,NC,11.949800552073615,45.7723034522,6.43272396939,062021
202161000,Marché,Services,Services de distribution de courrier,29/06/2021,240000.0,Révisable,Budget principal M52,43.6131750772,3.86941278925,PME,299.58335258769046,43.4232496383,1.16687093133,062021
2021S2100190100,Marché,Travaux,Travaux de peinture,11/06/2021,240000.0,Révisable,MONTELIMAR - AGGLOMERATION,44.5538701101,4.74888787641,NC,44.723542343089456,44.9223144503,4.91311704006,062021
2021_QdnhdhG0900,Marché,Travaux,Travaux de réparation de routes,10/06/2021,240000.0,Révisable,UEM METZ,49.1081027833,6.19595351042,GE,7.4525715141417885,49.1634622968,6.15758879329,062021
20211Fu16b7NKC00,Marché,Travaux,Travaux de construction de bâtiments,22/06/2021,240000.0,Révisable,Mairie de Salon de Provence,43.6463117052,5.0679949909,NC,50.39370906557257,43.4527920234,5.48035081509,062021
202150902000,Marché,Services,Services de centres de vacances,23/06/2021,240000.0,Révisable,Budget principal,50.6317671102,3.04699299406,ETI,49.060090935995,50.2899236486,2.76642705397,062021
2020uH5q6rmf_h00,Marché,Services,"Services récréatifs, culturels et sportifs",23/06/2021,240000.0,Révisable,MAIRIE DE LENS,50.4372553549,2.82129881832,PME,42.59112886718601,50.6322610395,3.15284231203,062021
202120210038L300,Marché,Fournitures,Mobilier divers,30/06/2021,240000.0,Révisable,VILLE DE NARBONNE,43.1651014685,3.02005317318,PME,647.0465305298928,48.9172863598,2.13951942246,062021
2021B07000,Marché,Services,Services de formation du personnel,15/06/2021,240000.0,Ferme,VILLE DE DUNKERQUE - PRINCIPAL,51.030563712,2.33703738753,NC,5.3879502869228215,51.0164886059,2.29041352699,062021
2021ADA25300,Marché,Fournitures,Poisson congelé,03/06/2021,240000.0,Révisable,1-BUDGET PRINCIPAL,44.8833318393,-0.784280122922,GE,222.3204808243728,46.8666986649,-1.02208373864,062021
2021XP2ID0Pi6l00,Marché,Fournitures,Fournitures scolaires,28/06/2021,240000.0,Révisable,Mairie Saint Pierre des Corps,47.3882708034,0.736761442481,PME,144.44905500744193,47.9385808606,1.91988453844,062021
2021ADA25400,Marché,Fournitures,"Fruits, légumes et produits connexes",03/06/2021,240000.0,Révisable,1-BUDGET PRINCIPAL,44.8833318393,-0.784280122922,ETI,564.8203646753929,48.8348302792,2.42102904428,062021
2021ADA25600,Marché,Fournitures,Plats préparés,03/06/2021,240000.0,Révisable,1-BUDGET PRINCIPAL,44.8833318393,-0.784280122922,NC,256.11507588594696,44.0225624278,1.36375484401,062021
20202020027-0200,Marché,Fournitures,Boissons sans alcool,15/06/2021,240000.0,Ferme,COM  AGGL  LA RIVIERA DU LEVANT,16.2250869819,-61.4693509551,PME,46.62870881690627,16.3114570341,-61.052978658,062021
2021170010757100,Marché,Travaux,Travaux de désamiantage,03/06/2021,240000.0,Ferme,Ministère de la Culture - ARCHIVES NATIONALES,48.9602089765,2.36360854927,PME,25.8855714969935,48.729938105,2.32968167157,062021
202130201200,Marché,Services,Services de collecte des ordures,15/06/2021,240000.0,Ferme,BA DECHETS,,,PME,,47.2970080153,5.77167336131,062021
202120M29L0100,Marché,Fournitures,Arbres,15/06/2021,240000.0,Révisable,Ville de Cesson-Sévigné,48.1205469701,-1.59697171557,NC,70.42718885068375,48.3491585827,-1.0030665221,062021
20212021061100,Marché,Services,Logiciels et systèmes informatiques divers,21/06/2021,240000.0,Ferme,DEPARTEMENT DU VAR,43.1364847512,5.93276630299,PME,318.6918557108571,45.820656077,4.8987353728,062021
2021M01900,Marché,Fournitures,Livres de bibliothèque,30/06/2021,240000.0,Révisable,Ville de Courbevoie,48.8983675206,2.25515424076,PME,0.0,48.8983675206,2.25515424076,062021
202007130916F00,Marché,Fournitures,Pompes,29/06/2021,240000.0,Révisable,Budget Principal,47.2801589313,-2.25106183059,PME,838.1230307570831,44.5540912718,4.81518255372,062021
2021rnYQLODDox00,Marché,Services,Élimination et traitement des ordures,16/06/2021,240000.0,Révisable,Mairie de Villeneuve le roi,48.7321607291,2.41097949757,NC,29.961421932122985,48.8695044166,2.17789004853,062021
2020p2IDACp9Kg00,Marché,Fournitures,Panneaux de signalisation et articles connexes,01/06/2021,240000.0,Révisable,Mairie de Salon de Provence,43.6463117052,5.0679949909,ETI,341.3916462790483,46.5565421982,6.082313342,062021
2021u_2gpyU8jB00,Marché,Services,Services de transport des boues,08/06/2021,240000.0,Révisable,Conseil Départemental de la Charente-Maritime-cg17,46.1619512738,-1.1749922971,PME,68.67551805876259,46.0826048834,-0.559070557203,062021
2019ilzL283_qG00,Marché,Services,Services de conseil en systèmes informatiques et conseils techniques,11/06/2021,2400000.0,Révisable,GIP MDS,48.8292048923,2.3267445538,PME,1.8779648836418985,48.8152248222,2.31722185184,062021
2020kBEyhYTNRT00,Marché,Travaux,Travaux de construction complète ou partielle et travaux de génie civil,11/06/2021,2400000.0,Révisable,UEM METZ,49.1081027833,6.19595351042,NC,0.0,49.1081027833,6.19595351042,062021
20211400010003,Marché,Services,Services d'animation pour enfants,04/06/2021,2400000.0,Révisable,VILLE DE PARIS BUDGET PRINCIPAL,48.8542874923,2.35759608215,NC,13.269896794597603,48.8365394869,2.2389245247,062021
20212021S0404500,Marché,Services,Services d'incendie et de secours,19/06/2021,2401292.4,Révisable,Conseil Régional d'Ile-de-France,48.8562037309,2.3121193117,PME,5.572916273896129,48.8604673342,2.26190318372,062021
2021BoSgJhln9u00,Marché,Travaux,Travaux de réfection,30/06/2021,240290.0,Ferme et actualisable,Mairie de Tarascon,43.7941219042,4.68611607169,ETI,41.705586805773166,43.7892766546,4.30899812613,062021
2018KwKsfKi97F00,Marché,Travaux,Travaux d'aménagement paysager d'espaces verts,03/06/2021,240426.0,Ferme et actualisable,"Valophis Habitat, Office Public de l'Habitat du Val de Marne",48.783689162,2.4549804713,PME,53.391484591777406,48.4217696926,2.13780260625,062021
2021211500100,Marché,Travaux,Travaux d'aménagement du terrain,30/06/2021,240900.0,Révisable,CONNANTRE,48.7380798,3.91159892486,NC,35.254363424098685,49.0553036512,3.92314354208,062021
202050814600,Marché,Services,Services de formation professionnelle,23/06/2021,241000.0,Révisable,Budget principal,50.6317671102,3.04699299406,PME,3.894399678375069,50.6089544032,3.02026471497,062021
2021TVX00100,Marché,Travaux,Travaux d'assainissement,02/06/2021,241092.0,Ferme et actualisable,SIAEP ST AIGNAN SEIGY,47.2501334767,1.33399935691,PME,0.0,47.2501334767,1.33399935691,062021
2021083A000,Marché,Travaux,"Pose de menuiseries métalliques, excepté portes et fenêtres",21/06/2021,241240.0,Révisable,BUDGET PRINCIPAL,46.2047217001,5.24553216043,PME,33.041473584582874,46.1231310324,4.95815709961,062021
20212100804,Marché,Travaux,Travaux de construction de canalisations d'eaux pluviales,16/06/2021,241342.79,Révisable,14BUDGET PRINCIPAL,44.5942359011,-1.08418239052,GE,51.759908325276946,44.8323242505,-0.682089528902,062021
2020k0VzWA67qo00,Marché,Services,Services de courtage et services liés de titres et marchandises,29/06/2021,2.41583476E8,Révisable,UCANSS,48.8635257742,2.40121168869,GE,21.788960380976743,48.8963161116,2.20694242609,062021
20212021F0960600,Marché,Services,Services de transport (à l'exclusion du transport des déchets),04/06/2021,2416.0,Révisable,CHU ROUEN,49.4415068863,1.09373273216,PME,347.92769771601075,48.2966832948,4.02203916888,062021
20212103T0000,Marché,Travaux,Travaux de construction,16/06/2021,242114.5,Révisable,CC DES PAYSAGES DE LA CHAMPAGNE,49.0626301145,3.6465948093,NC,35.81141564925153,49.2540901675,3.9071552187,062021
20214OBa53960B00,Marché,Fournitures,Matériel de jardinage divers,18/06/2021,2422.0,Ferme,Mairie de Flers,48.7400079375,-0.562173805455,ETI,55.26774733325706,49.1694850575,-0.311394025769,062021
2021STEPTRX00,Marché,Travaux,Travaux de construction d'installations de déshydratation des boues,29/06/2021,242305.65,Ferme,CNE DE ROUFFIAC,43.6635950026,1.52598072933,NC,43.79011375711643,44.0225624278,1.36375484401,062021
2021wp5uHK6ztZ00,Marché,Travaux,Travaux de forage de reconnaissance,21/06/2021,242829.0,Ferme et actualisable,Communauté de communes Vallée de l'Hérault,43.6394764383,3.57361654937,PME,188.03302917771396,43.4500011794,5.26335968091,062021
2019_oOckr6DwT00,Marché,Travaux,Travaux d'installation de menuiseries non métalliques,01/06/2021,24314.0,Ferme,Le Toit Vosgien,48.2968400138,6.93787860009,PME,7.904487383033865,48.2500811999,6.88379274623,062021
202110-457-L0000,Marché,Services,Service de gestion du réseau d'assainissement,08/06/2021,243230.0,Ferme,MAUGES COMMUNAUTE ASSAICOL,,,GE,,50.2899236486,2.76642705397,062021
2020D9E96Nj5yD00,Marché,Services,Systèmes d'information et serveurs,02/06/2021,243349.0,Ferme et actualisable,MANCHE HABITAT,49.1097135871,-1.07754504719,ETI,0.0,49.1097135871,-1.07754504719,062021
2021S02203,Marché,Travaux,Travaux d'aménagement paysager d'espaces verts,07/06/2021,243400.0,Ferme,VILLE DE DUNKERQUE - PRINCIPAL,51.030563712,2.33703738753,PME,6.601656203970869,51.0179952209,2.39538584764,062021
2020ZgsssijPBF00,Marché,Travaux,Installation de matériel d'éclairage public,17/06/2021,243439.0,Révisable,SPL LA FABRIQUE DE BORDEAUX METROPOLE,44.8578964782,-0.57357535767,GE,599.0654871971575,43.7850969478,4.73556082363,062021
2021FJu9ITghux00,Marché,Travaux,Travaux de couverture et travaux d'autres corps de métier spécialisés,29/06/2021,24357.7,Ferme,Communauté d'Agglomération Montélimar-Agglomération,44.5538701101,4.74888787641,PME,22.472875087391053,44.3608701779,4.68719451567,062021
2021cdH1FJwSqZ00,Marché,Services,Services prestés par les laboratoires médicaux,30/06/2021,243668.0,Ferme,UGECAM CENTRE,47.8824665066,1.91660961834,ETI,146.23759814554452,47.3314668694,0.715972131571,062021
2021EE8IFxJnC000,Marché,Services,Services spécialisés de transport routier de passagers,30/06/2021,243759.4,Révisable,Département de l Indre Direction des Routes des Transports du Patrimoine et de l Education,46.8031778361,1.69389403678,PME,253.20997767510676,48.9202318556,2.5350599357,062021
2020QSG8dk3mGw00,Marché,Services,Logiciels d'analyse financière,02/06/2021,24400.0,Révisable,MANCHE HABITAT,49.1097135871,-1.07754504719,PME,367.9758295033336,48.8365394869,2.2389245247,062021
2021fYvyOtXErh00,Marché,Travaux,Travaux de construction,29/06/2021,2440000.0,Ferme et actualisable,COOP LOGIS,48.0610922073,-0.766055300559,PME,16.703933971551887,48.1424282611,-0.893008144136,062021
2020qzKWRqYUgW00,Marché,Travaux,Travaux de décontamination du sol,28/06/2021,244116.25,Révisable,SPL LA FABRIQUE DE BORDEAUX METROPOLE,44.8578964782,-0.57357535767,GE,625.4174958402488,45.7774291546,5.00628498239,062021
2021COVED C0501,Marché,Services,Services de collecte des ordures ménagères,08/06/2021,2444828.22,Révisable,SYVALORM,47.924297609,0.746656772703,NC,174.71630492773156,48.7728906673,2.07603849225,062021
2020-VV-RE-0100,Marché,Travaux,Travaux de démolition de bâtiments et travaux de terrassement,04/06/2021,244484.4,Ferme et actualisable,Commune de Veurey-Voroize,45.2695466998,5.60212547771,PME,20.869215912251466,45.1752846004,5.76552012882,062021
2021020101,Marché,Travaux,Travaux de démolition de bâtiments et travaux de terrassement,03/06/2021,244507.67,Ferme et actualisable,Commune de TINCHEBRAY BOCAGE,48.7332586806,-0.730484453871,PME,22.034793151471114,48.8506192378,-0.890964371806,062021
2021100015425100,Marché,Travaux,Travaux de remise en état et de remise à neuf,01/06/2021,244664.79,Ferme et actualisable,Ministère des armées - Etablissement du service d'infrastructure de la défense de Bordeaux - ESID Bordeaux,,,PME,,45.6475513407,0.144999112457,062021
2020r36ceUs9D-00,Marché,Services,Services agricoles,07/06/2021,244883.81,Ferme,Domaine national de Chambord,47.6160248602,1.54165880106,NC,298.3885188072929,45.6717837423,-0.316202181007,062021
2021YunaXGG2wT00,Marché,Services,Services de collecte du papier,02/06/2021,24500.0,Révisable,Conseil Départemental de la Charente-Maritime-cg17,46.1619512738,-1.1749922971,PME,39.88002074839358,45.9636315652,-0.87461395259,062021
2021NkOoDmFg_l00,Marché,Fournitures,Ventilateurs et appareils de conditionnement d'air,10/06/2021,24500.0,Ferme,UEM METZ,49.1081027833,6.19595351042,PME,13.499537546428408,49.1890611229,6.10465265299,062021
2021130016599600,Marché,Services,Services de transport routier,02/06/2021,245000.0,Révisable,Ministère de l'Intérieur - Bourgogne Franche-Comté,47.3230744087,5.03738286925,NC,341.28307656225513,48.8053725236,2.33400842575,062021
202006-LAFAURI00,Marché,Travaux,Travaux de réparation de routes,04/06/2021,245000.0,Ferme et actualisable,MAIRIE D'ALLASSAC,45.2558717749,1.46957189626,PME,12.823883109597414,45.1468962435,1.43186733391,062021
2021czxQZev6yv00,Marché,Services,Services de réparation et d'entretien d'installations mécaniques de bâtiment,14/06/2021,245621.0,Ferme et actualisable,Direction de la Maintenance,48.8348302792,2.42102904428,NC,3.871429802315066,48.8635257742,2.40121168869,062021
20212021092200,Marché,Services,Services de conseil en matière d'ingénierie et de construction,11/06/2021,246000.0,Révisable,DEPARTEMENT DU VAR,43.1364847512,5.93276630299,PME,0.0,43.1364847512,5.93276630299,062021
2020PcUVk4DhD200,Marché,Services,Services de nettoyage,02/06/2021,24653.0,Ferme,MANCHE HABITAT,49.1097135871,-1.07754504719,ETI,73.80798153004184,49.5537452405,-1.57335366919,062021
202100710000,Marché,Travaux,Travaux de menuiserie,18/06/2021,246617.2,Ferme et actualisable,Habitats de Haute-Alsace,48.1100979739,7.3849252282,PME,27.543895420148193,47.8736984317,7.30538178488,062021
2020BOM300,Marché,Fournitures,Châssis-cabines,17/06/2021,247050.0,Révisable,DECHETS MENAGERS ET ASSIMILES,,,NC,,43.1613315352,6.04281101303,062021
2020oRS9wzDx1p00,Marché,Travaux,Ouvrages pour le tramway,03/06/2021,247400.0,Ferme et actualisable,SEMITAG,45.1470636912,5.71546169286,PME,458.63110765135553,48.8424069604,7.59920542877,062021
2020CP007F00204,Marché,Services,Services spécialisés de transport routier de passagers,25/06/2021,2474000.0,Ferme,BUDGET PRINCIPAL CD40,43.8994418261,-0.490443107618,PME,115.1441903859625,43.5369142822,-1.46573688115,062021
20212111600,Marché,Travaux,Installation de matériel de signalisation,25/06/2021,247462.6,Révisable,BUDGET PRINCIPAL DEPT SARTHE,47.9889433531,0.20002401353,NC,199.24117095129242,48.1205469701,-1.59697171557,062021
